h i j ɑ s kʰ ɑ n t͡ʃʰ	h i j ɑ s kʰ ɑ n t͡ʃʰ
m ɑ ɾ t ə n t͡ʃʰ ɛ l	m ɑ ɾ t ə n t͡ʃʰ ɛ l
d͡z ə n ɑ ɡ ə n d i k	d͡z ə n ɑ ɡ ə n d i k
s ə ɾ ə ŋ kʰ ɑ m i s	s ə ɾ ə ŋ kʰ ɑ m i s
j ɛ ɾ k m ə t ɑ ŋ kʰ	j ɛ ɾ k m ə t ɑ ŋ kʰ
s ə n ə ŋ k ɑ n ɑ l	s ə n ə ŋ k ɑ n ɑ l
ʁ ə p t i j ɑ k ɑ n	ʁ ə p t i j ɑ k ɑ n
p ə t ə t ɑ h ɔ ʁ m	p ə t ə t ɑ h ɔ ʁ m
ʁ ə ɾ ʁ ə z ɑ k ɑ n	ʁ ə ɾ ʁ ə z ɑ k ɑ n
d ə ɾ ɑ m ɑ ɾ k ə ʁ	d ə ɾ ɑ m ɑ ɾ k ə ʁ
v ɔ kʰ ɛ ʃ ə n t͡ʃʰ ɛ l	v ɔ kʰ ɛ ʃ ə n t͡ʃʰ ɛ l
ʁ ə ɾ ʁ ə z s t ɑ n	ʁ ə ɾ ʁ ə z s t ɑ n
m ə t ɑ d ə ɾ v ɛ l	m ə t ɑ d ə ɾ v ɛ l
k ə ɾ ɔ n ɑ ɡ ɛ t	k ə ɾ ɔ n ɑ ɡ ɛ t
v ə k ɑ j ɑ k ɑ n	v ə k ɑ j ɑ k ɑ n
d i m ɑ n ə k ɑ ɾ	d i m ɑ n ə k ɑ ɾ
ɑ z d ɑ n ə ʃ ɑ n	ɑ z d ɑ n ə ʃ ɑ n
h ɑ ŋ ɡ ə ɾ v ɑ n	h ɑ ŋ ɡ ə ɾ v ɑ n
t ɔ m s ɑ ɾ k ə ʁ	t ɔ m s ɑ ɾ k ə ʁ
t ɑ r ɑ s ə χ ɑ l	t ɑ r ɑ s ə χ ɑ l
v ə n ɑ s ɑ k ɑ ɾ	v ə n ɑ s ɑ k ɑ ɾ
ɡ ə ɾ ɑ s ɛ ʁ ɑ n	ɡ ə ɾ ɑ s ɛ ʁ ɑ n
v ɔ s k ɛ d ɾ ɑ m	v ɔ s k ɛ d ɾ ɑ m
ɑ t ə ɾ t͡ʃ ɑ n ɑ k	ɑ t ə ɾ t͡ʃ ɑ n ɑ k
ɑ ɾ k ɑ d i j ɔ s	ɑ ɾ k ɑ d i j ɔ s
j ɛ v ɾ ɔ p ɑ t͡sʰ i	j ɛ v ɾ ɔ p ɑ t͡sʰ i
b ə n ɑ k ɑ ɾ ɑ n	b ə n ɑ k ɑ ɾ ɑ n
ɡ ə ɾ ɑ d ɑ ɾ ɑ n	ɡ ə ɾ ɑ d ɑ ɾ ɑ n
p ə n d ɑ k ɑ z m	p ə n d ɑ k ɑ z m
j ɛ ɾ v i n j ɑ n	j ɛ ɾ v i n j ɑ n
m ə n d͡ʒ k ɑ t ɑ k	m ə n d͡ʒ k ɑ t ɑ k
j ɛ ɾ k s ɑ j ɾ i	j ɛ ɾ k s ɑ j ɾ i
t ə p ɑ v ɔ ɾ ɛ l	t ə p ɑ v ɔ ɾ ɛ l
v ə t ɑ ŋ ɡ v ɛ l	v ə t ɑ ŋ ɡ v ɛ l
j ɛ ʁ i s ɑ b ɛ tʰ	j ɛ ʁ i s ɑ b ɛ tʰ
ə s t ɔ k h ɔ l m	ə s t ɔ k h ɔ l m
h ə ɾ v ɑ n d ɑ n	h ə ɾ v ɑ n d ɑ n
n ə m ɑ n ɑ t i p	n ə m ɑ n ɑ t i p
m ə n ɑ t͡sʰ ɑ k ɑ n	m ə n ɑ t͡sʰ ɑ k ɑ n
m ə χ i tʰ ɑ ɾ ɛ l	m ə χ i tʰ ɑ ɾ ɛ l
j ɛ ʁ ɛ ɾ ɑ k ɑ n	j ɛ ʁ ɛ ɾ ɑ k ɑ n
tʰ ɑ χ ɑ n d͡z ɛ l	tʰ ɑ χ ɑ n d͡z ɛ l
ɑ j ɡ ɛ s t ɑ n	ɑ j ɡ ɛ s t ɑ n
b ɑ ɾ k ɑ n ɑ l	b ɑ ɾ k ɑ n ɑ l
ɑ n ɛ z ɑ k ɑ n	ɑ n ɛ z ɑ k ɑ n
j ɛ r ɑ n d u n	j ɛ r ɑ n d u n
s ɑ kʰ s ɔ f ɔ n	s ɑ kʰ s ɔ f ɔ n
tʰ ɛ ɔ d ɔ s j ɑ	tʰ ɛ ɔ d ɔ s j ɑ
s m ɔ l ɛ n s k	s m ɔ l ɛ n s k
h ɑ m ɑ d͡z ɑ j n	h ɑ m ɑ d͡z ɑ j n
n ɛ ŋ ɡ ɑ v ɔ ɾ	n ɛ ŋ ɡ ɑ v ɔ ɾ
m ɑ s n ɑ k i t͡sʰ	m ɑ s n ɑ k i t͡sʰ
t͡ʃʰ i n ɑ s t ɑ n	t͡ʃʰ i n ɑ s t ɑ n
t͡s ɑ k ɔ t k ɛ n	t͡s ɑ k ɔ t k ɛ n
ʃ ə kʰ ɑ χ u m b	ʃ ə kʰ ɑ χ u m b
d ɑ l k ɑ d ɛ m	d ɑ l k ɑ d ɛ m
i s p ɑ n ɑ t͡sʰ i	i s p ɑ n ɑ t͡sʰ i
t ɑ r ɑ p ɑ ŋ kʰ	t ɑ r ɑ p ɑ ŋ kʰ
t i b ɛ ɾ i ɔ s	t i b ɛ ɾ i ɔ s
ʃ ɑ ɾ ʒ ɑ k ɑ n	ʃ ɑ ɾ ʒ ɑ k ɑ n
ɑ l ɑ v ɛ ɾ d i	ɑ l ɑ v ɛ ɾ d i
ɑ r ɑ t͡ʃʰ n ɔ ɾ tʰ	ɑ r ɑ t͡ʃʰ n ɔ ɾ tʰ
t͡sʰ ɑ ŋ k ɑ p ɑ t	t͡sʰ ɑ ŋ k ɑ p ɑ t
v l ɑ d i m i ɾ	v l ɑ d i m i ɾ
d ɛ m ɔ k ɾ ɑ t	d ɛ m ɔ k ɾ ɑ t
z ɑ ɾ m ɑ n ɑ l	z ɑ ɾ m ɑ n ɑ l
m ɛ ʁ ɾ ɑ m ɔ m	m ɛ ʁ ɾ ɑ m ɔ m
ɑ k ɔ ɾ d ɛ ɔ n	ɑ k ɔ ɾ tʰ ɛ ɔ n
tʰ ɑ ŋ ɡ ɑ ɾ ɑ n	tʰ ɑ ŋ ɡ ɑ ɾ ɑ n
k ɑ d ɾ ɑ j i n	k ɑ d ɾ ɑ j i n
m ɑ j i s j ɑ n	m ɑ j i s j ɑ n
ɑ m ɑ r ɑ n ɔ t͡sʰ	ɑ m ɑ r ɑ n ɔ t͡sʰ
t ɑ ɾ b ɛ ɾ ɛ l	t ɑ ɾ b ɛ ɾ ɛ l
h j u ɾ ɛ ɾ ə n	h j u ɾ ɛ ɾ ə n
s i m v ɔ l i k	s i m v ɔ l i k
ɑ ɾ tʰ n ɑ n ɑ l	ɑ ɾ tʰ n ɑ n ɑ l
ɑ ɾ t ɑ k ɑ ɾ kʰ	ɑ ɾ t ɑ k ɑ ɾ kʰ
h ɑ t͡sʰ h ɑ m ɛ m	h ɑ t͡sʰ h ɑ m ɛ m
i ŋ kʰ n ɑ ɡ i ɾ	i ŋ kʰ n ɑ ɡ i ɾ
ɡ ɛ ʁ ɑ m j ɑ n	ɡ ɛ ʁ ɑ m j ɑ n
z ɑ ɾ m ɑ t͡sʰ ɑ t͡s	z ɑ ɾ m ɑ t͡sʰ ɑ t͡s
s ɑ h m ɑ n ɛ l	s ɑ h m ɑ n ɛ l
d ɑ t ɑ ɾ k ɛ l	d ɑ t ɑ ɾ k ɛ l
k ɑ tʰ n ɑ ʃ ɔ r	k ɑ tʰ n ɑ ʃ ɔ r
ɑ ɾ ɛ v ɑ j i n	ɑ ɾ ɛ v ɑ j i n
i ɾ ɑ v i t͡ʃ ɑ k	i ɾ ɑ v i t͡ʃ ɑ k
n ɔ j ɛ m b ɛ ɾ	n ɔ j ɛ m b ɛ ɾ
k ə ɾ t͡ʃ ɑ t u m	k ə ɾ t͡ʃ ɑ t u m
h ɑ n d u ɡ ə n	h ɑ n d u ɡ ə n
ɑ t͡s ɑ n t͡sʰ j ɑ l	ɑ t͡s ɑ n t͡sʰ j ɑ l
ɑ f t ɔ p ɑ ɾ k	ɑ f t ɔ p ɑ ɾ k
pʰ ɑ h l ɛ v ɑ n	pʰ ɑ h l ɛ v ɑ n
j ɛ ɾ ɛ k u j tʰ	j ɛ ɾ ɛ k u j tʰ
tʰ ɛ l ɑ d ɾ i t͡ʃʰ	tʰ ɛ l ɑ d ɾ i t͡ʃʰ
p ɔ ɾ t ɑ p ɑ ɾ	p ɔ ɾ t ɑ p ɑ ɾ
m ɛ t ɑ kʰ s j ɑ	m ɛ t ɑ kʰ s j ɑ
j ɛ ɾ kʰ t͡ʃʰ u h i	j ɛ ɾ kʰ t͡ʃʰ u h i
ɑ ʃ χ ɑ t ɑ ŋ kʰ	ɑ ʃ χ ɑ t ɑ ŋ kʰ
h ə n d k ɑ t͡ʃʰ i n	h ə n d k ɑ t͡ʃʰ i n
s ɑ n ə ɾ v ɑ t͡s kʰ	s ɑ n ə ɾ v ɑ t͡s kʰ
ə s k ɑ v ɑ r ɑ k	ə s k ɑ v ɑ r ɑ k
s ɑ ɾ kʰ ə s j ɑ n	s ɑ ɾ kʰ ə s j ɑ n
m ə ɾ t͡sʰ ɑ v ɑ s kʰ	m ə ɾ t͡sʰ ɑ v ɑ s kʰ
j ɛ v ɾ ɔ p ɑ j i	j ɛ v ɾ ɔ p ɑ j i
v ɔ kʰ ɛ v ɔ ɾ ɛ l	v ɔ kʰ ɛ v ɔ ɾ ɛ l
ə s t ɑ n d ɑ ɾ t	ə s t ɑ n d ɑ ɾ t
f ɔ t ɔ χ ə t͡sʰ i k	f ɔ t ɔ χ ə t͡sʰ i k
ɑ k ə ŋ k ɑ l i kʰ	ɑ k ə ŋ k ɑ l i kʰ
j ɛ ɾ k n ɑ kʰ ɛ ɾ	j ɛ ɾ k n ɑ kʰ ɛ ɾ
t ɑ s n ə t͡ʃʰ ɔ ɾ s	t ɑ s n ə t͡ʃʰ ɔ ɾ s
tʰ ə ɾ tʰ ə n d͡ʒ u k	tʰ ə ɾ tʰ ə n d͡ʒ u k
d͡z ə m ɛ r ɑ j i n	d͡z ə m ɛ r ɑ j i n
kʰ ə v ɛ ɑ ɾ k ɔ ʁ	kʰ ə v ɛ ɑ ɾ k ɔ ʁ
h ə n d k ɑ k ɑ n	h ə n d k ɑ k ɑ n
tʰ ə m b k ɑ h ɑ ɾ	tʰ ə m b k ɑ h ɑ ɾ
k i l ɔ m ɛ t ə ɾ	k i l ɔ m ɛ t ə ɾ
z ə ɾ ɑ h ɑ k i ɾ	z ə ɾ ɑ h ɑ k i ɾ
ɑ s ɑ t ə ɾ j ɑ n	ɑ s ɑ t ə ɾ j ɑ n
k ə ʁ ɛ ɾ ɑ k ɑ n	k ə ʁ ɛ ɾ ɑ k ɑ n
n ə ʃ ɑ n ɑ b ɑ n	n ə ʃ ɑ n ɑ b ɑ n
ɑ n ʃ ə ɾ d͡ʒ ɛ l i	ɑ n ʃ ə ɾ d͡ʒ ɛ l i
n ɔ ɾ ɑ b ə n ɑ k	n ɔ ɾ ɑ b ə n ɑ k
b ɔ tʰ ə s v ɑ n ɑ	b ɔ tʰ ə s v ɑ n ɑ
m ɔ t ɔ t͡sʰ i k ə l	m ɔ t ɔ t͡sʰ i k ə l
v ɔ ɾ m n ɑ d i ɾ	v ɔ ɾ m n ɑ d i ɾ
χ ɑ ʁ ɑ s ə ɾ ɑ h	χ ɑ ʁ ɑ s ə ɾ ɑ h
j ɛ n tʰ ɑ ɾ k ɛ l	j ɛ n tʰ ɑ ɾ k ɛ l
h ɑ ʁ ɔ ɾ tʰ ɛ l	h ɑ ʁ ɔ ɾ tʰ ɛ l
ɔ t ɑ ɾ ɑ ɡ i ɾ	ɔ t ɑ ɾ ɑ ɡ i ɾ
ɑ m b ɑ ɾ t ɑ k	ɑ m b ɑ ɾ t ɑ k
p ɑ t v i ɾ ɑ n	p ɑ t v i ɾ ɑ n
t ɑ ɾ b ɛ ɾ ɑ k	t ɑ ɾ b ɛ ɾ ɑ k
v ɔ s p ɑ p u ɾ	v ɔ s p ɑ p u ɾ
ɔ s ɛ tʰ ɑ k ɑ n	ɔ s ɛ tʰ ɑ k ɑ n
m ɑ s n ɑ v ɔ ɾ	m ɑ s n ɑ v ɔ ɾ
ɑ s ɑ t͡sʰ v ɑ t͡s kʰ	ɑ s ɑ t͡sʰ v ɑ t͡s kʰ
k ɑ s k ɑ t͡s ɛ l	k ɑ s k ɑ t͡s ɛ l
ɡ ɛ ɾ m ɑ n j ɑ	ɡ ɛ ɾ m ɑ n j ɑ
t ɔ h m ɑ t͡s ɑ r	t ɔ h m ɑ t͡s ɑ r
s ɛ ɾ b ɑ k ɑ n	s ɛ ɾ b ɑ k ɑ n
i ŋ kʰ n ɑ tʰ i r	i ŋ kʰ n ɑ tʰ i r
ɑ k ɑ n ɑ v ɔ ɾ	ɑ k ɑ n ɑ v ɔ ɾ
n ɑ χ ɑ ɡ ə t͡s ɛ l	n ɑ χ ɑ ɡ ə t͡s ɛ l
v ɔ ɾ ɑ k ɑ k ɑ n	v ɔ ɾ ɑ k ɑ k ɑ n
v ə n ɑ s ɑ ɾ ɑ ɾ	v ə n ɑ s ɑ ɾ ɑ ɾ
t͡ʃʰ ə k ɑ j ɑ t͡sʰ ɑ t͡s	t͡ʃʰ ə k ɑ j ɑ t͡sʰ ɑ t͡s
ə s p ɑ ɾ ɑ p ɛ t	ə s p ɑ ɾ ɑ p ɛ t
kʰ ə ɾ t n ɑ d͡ʒ ɑ n	kʰ ə ɾ t n ɑ d͡ʒ ɑ n
s ə ɾ t͡ʃ ɑ s t ɑ n	s ə ɾ t͡ʃ ɑ s t ɑ n
l ə r ɛ l j ɑ j n	l ə r ɛ l j ɑ j n
ə ʃ t ɛ m ɑ ɾ ɑ n	ə ʃ t ɛ m ɑ ɾ ɑ n
h ɛ t ɑ d͡z ə kʰ ɛ l	h ɛ t ɑ d͡z ə kʰ ɛ l
kʰ ə n ɑ ɾ ɑ h ɑ v	kʰ ə n ɑ ɾ ɑ h ɑ v
v ə n ɑ s ɑ b ɛ ɾ	v ə n ɑ s ɑ b ɛ ɾ
j ɛ f s ɛ b j ɔ s	j ɛ f s ɛ b j ɔ s
ɑ ʃ ɑ k ɛ ɾ t u h i	ɑ ʃ ɑ k ɛ ɾ t u h i
k ɑ z m ɑ v ɔ ɾ u m	k ɑ z m ɑ v ɔ ɾ u m
d ɛ ɾ ɑ s ɑ n u h i	d ɛ ɾ ɑ s ɑ n u h i
ɡ ɛ ʁ ɑ ɡ ɑ ŋ ɡ u ɾ	ɡ ɛ ʁ ɑ ɡ ɑ ŋ ɡ u ɾ
ɑ p ɑ t͡sʰ u t͡sʰ ɑ n ɛ l	ɑ p ɑ t͡sʰ u t͡sʰ ɑ n ɛ l
k ə ɾ k n u tʰ j u n	k ə ɾ k n u tʰ j u n
ɑ ɾ ʃ ɑ k u n j ɑ t͡sʰ	ɑ ɾ ʃ ɑ k u n j ɑ t͡sʰ
ɡ ɔ ɾ t͡s ɑ r u j tʰ ə	ɡ ɔ ɾ t͡s ɑ r u j tʰ ə
f i l i p i n u h i	f i l i p i n u h i
k ɔ ʁ m n ɑ t͡sʰ u j t͡sʰ	k ɔ ʁ m n ɑ t͡sʰ u j t͡sʰ
v ə k ɑ j u tʰ j u n	v ə k ɑ j u tʰ j u n
t͡sʰ u t͡sʰ ɑ d ɾ ɑ k ɑ n	t͡sʰ u t͡sʰ ɑ d ɾ ɑ k ɑ n
s ɑ ɾ s ɑ pʰ ɑ z d u	s ɑ ɾ s ɑ pʰ ɑ z d u
h ɑ n d͡z n ɑ χ u m b	h ɑ n d͡z n ɑ χ u m b
ɛ v ɔ l j u t͡sʰ j ɔ n	ɛ v ɔ l j u t͡sʰ j ɔ n
ɑ t ɑ m n ɑ b u j ʒ	ɑ t ɑ m n ɑ b u j ʒ
h j u s i s ɑ j i n	h j u s i s ɑ j i n
χ ɔ ʃ ɔ ɾ ɑ t͡sʰ u j t͡sʰ	χ ɔ ʃ ɔ ɾ ɑ t͡sʰ u j t͡sʰ
f ɑ k u l t ɑ t i v	f ɑ k u l t ɑ t i v
pʰ ɔ ɾ tʰ u ɡ ɑ l j ɑ	pʰ ɔ ɾ tʰ u ɡ ɑ l j ɑ
t͡ʃ ɑ n ɑ p ɑ ɾ ɔ ɾ tʰ	t͡ʃ ɑ n ɑ p ɑ ɾ ɔ ɾ tʰ
p ɑ t k ɛ ɾ ɑ t͡sʰ u m	p ɑ t k ɛ ɾ ɑ t͡sʰ u m
z ɑ ŋ ɡ ɑ k ɑ t u n	z ɑ ŋ ɡ ɑ k ɑ t u n
h ɑ ɾ t͡sʰ ɑ z ɾ u j t͡sʰ	h ɑ ɾ t͡sʰ ɑ z ɾ u j t͡sʰ
ɡ j u ɾ d͡ʒ i n j ɑ n	ɡ j u ɾ d͡ʒ i n j ɑ n
ə z ɡ ɔ n u tʰ j u n	ə z ɡ ɔ n u tʰ j u n
ɑ n ɑ s n ɑ b u j ʒ	ɑ n ɑ s n ɑ b u j ʒ
t͡s ə χ ɑ t͡s ɑ t͡s k u j tʰ	t͡s ə χ ɑ t͡s ɑ t͡s k u j tʰ
j ɛ n tʰ ɑ k ɑ r u j t͡sʰ	j ɛ n tʰ ɑ k ɑ r u j t͡sʰ
t͡s ɑ χ k ɑ k ɑ ʁ ɑ m b	t͡s ɑ χ k ɑ k ɑ ʁ ɑ m b
kʰ ɑ n d ɑ k ɑ ɡ ɔ ɾ t͡s	kʰ ɑ n d ɑ k ɑ ɡ ɔ ɾ t͡s
d ɑ ʃ n ɑ k t͡sʰ ɑ k ɑ n	d ɑ ʃ n ɑ k t͡sʰ ɑ k ɑ n
h i p ɛ ɾ m ɑ ɾ k ɛ t	h i p ɛ ɾ m ɑ ɾ k ɛ t
m i t͡ʃʰ ɛ ɾ k ɾ ɑ k ɑ n	m i t͡ʃʰ ɛ ɾ k ɾ ɑ k ɑ n
ə n tʰ h ɑ n ɾ ɑ k ɑ n	ə n tʰ h ɑ n ɾ ɑ k ɑ n
v j ɛ t n ɑ m ɛ ɾ ɛ n	v j ɛ t n ɑ m ɛ ɾ ɛ n
t ɾ ɑ n s ɡ ɛ n d ɛ ɾ	t ɾ ɑ n s ɡ ɛ n d ɛ ɾ
h ɑ s ɑ ɾ ɑ k ɑ k ɑ n	h ɑ s ɑ ɾ ɑ k ɑ k ɑ n
h ɑ m ʃ ɛ n t͡sʰ i n ɛ ɾ	h ɑ m ʃ ɛ n t͡sʰ i n ɛ ɾ
m i l j ɑ ɾ tʰ ɑ t ɛ ɾ	m i l j ɑ ɾ tʰ ɑ t ɛ ɾ
n ɛ ɾ k ɑ j ɑ t͡sʰ u m	n ɛ ɾ k ɑ j ɑ t͡sʰ u m
i m u n i z ɑ t͡sʰ j ɑ	i m u n i z ɑ t͡sʰ j ɑ
d ɛ s p ɑ n ɑ t u n	d ɛ s p ɑ n ɑ t u n
b ɔ ʁ ɔ kʰ ɑ ɾ k u m	b ɔ ʁ ɔ kʰ ɑ ɾ k u m
b ɑ t͡sʰ ɑ k ɑ n t͡ʃʰ u m	b ɑ t͡sʰ ɑ k ɑ n t͡ʃʰ u m
t ə ɡ i t u tʰ j u n	t ə ɡ i t u tʰ j u n
b ɑ ɾ t͡sʰ ɾ ɑ ɡ u j n	b ɑ ɾ t͡sʰ ɾ ɑ ɡ u j n
ɔ ɾ ɑ ŋ ɡ u t ɑ ŋ ɡ	ɔ ɾ ɑ ŋ ɡ u t ɑ ŋ ɡ
d ɛ s t ɾ u k t i v	d ɛ s t ɾ u k t i v
b j u z ɑ n d ɑ t͡sʰ i	b j u z ɑ n d ɑ t͡sʰ i
ɑ s t v ɑ t͡s ɑ t u ɾ	ɑ s t v ɑ t͡s ɑ t u ɾ
b ɑ ɾ t͡sʰ u ŋ kʰ n ɛ ɾ	b ɑ ɾ t͡sʰ u ŋ kʰ n ɛ ɾ
i m ɑ s t u tʰ j ɑ n	i m ɑ s t u tʰ j ɑ n
k ɔ m s u tʰ j u n	k ɔ m s u tʰ j u n
h ɑ s t u tʰ j u n	h ɑ s t u tʰ j u n
m ɑ t n u tʰ j u n	m ɑ t n u tʰ j u n
p ɑ t m u tʰ j u n	p ɑ t m u tʰ j u n
i ɾ ɔ ʁ u tʰ j u n	i ɾ ɔ ʁ u tʰ j u n
u r u t͡sʰ kʰ ɑ b ɑ n	u r u t͡sʰ kʰ ɑ b ɑ n
ɑ t ɛ l u tʰ j u n	ɑ t ɛ l u tʰ j u n
t͡s ɑ n ɾ u tʰ j u n	t͡s ɑ n ɾ u tʰ j u n
d ɑ ʃ n u tʰ j u n	d ɑ ʃ n u tʰ j u n
ɑ r ɑ t u tʰ j u n	ɑ r ɑ t u tʰ j u n
i ŋ kʰ n u tʰ j u n	i ŋ kʰ n u tʰ j u n
p ɑ ɾ t u tʰ j u n	p ɑ ɾ t u tʰ j u n
ɑ ɾ ɑ ɡ u tʰ j u n	ɑ ɾ ɑ ɡ u tʰ j u n
ɑ ɡ ɑ h u tʰ j u n	ɑ ɡ ɑ h u tʰ j u n
b ɑ ɾ k u tʰ j u n	b ɑ ɾ k u tʰ j u n
b ɑ ɾ tʰ u tʰ j u n	b ɑ ɾ tʰ u tʰ j u n
ə n t ɾ u tʰ j u n	ə n t ɾ u tʰ j u n
m ɛ ɾ k u tʰ j u n	m ɛ ɾ k u tʰ j u n
m ɑ ŋ k u tʰ j u n	m ɑ ŋ k u tʰ j u n
j u ɾ ɑ h ɑ t u k	j u ɾ ɑ h ɑ t u k
h ɑ ɾ tʰ u tʰ j u n	h ɑ ɾ tʰ u tʰ j u n
u ɑ ɡ ɑ d u ɡ u	u ɑ ɡ ɑ d u ɡ u
s u l u ɡ u n i	s u l u ɡ u n i
u s u t͡sʰ t͡ʃʰ u h i	u s u t͡sʰ t͡ʃʰ u h i
t͡s u l u tʰ j u n	t͡s u l u tʰ j u n
u ʁː u tʰ j u n	u ʁː u tʰ j u n
r u s ɑ s t ɑ n t͡sʰ i	r u s ɑ s t ɑ n t͡sʰ i
l j u d ɔ v i k ɔ s	l j u d ɔ v i k ɔ s
v ɛ ɾ l u t͡s ɑ k ɑ n	v ɛ ɾ l u t͡s ɑ k ɑ n
u k ɾ ɑ i n ɛ ɾ ɛ n	u k ɾ ɑ i n ɛ ɾ ɛ n
s ɑ ɾ kʰ ɑ v ɔ ɾ u m	s ɑ ɾ kʰ ɑ v ɔ ɾ u m
b u l ʁ ɑ ɾ ɛ ɾ ɛ n	b u l ʁ ɑ ɾ ɛ ɾ ɛ n
u k ɾ ɑ i n ɑ k ɑ n	u k ɾ ɑ i n ɑ k ɑ n
d i ɾ kʰ ɔ ɾ ɔ ʃ u m	d i ɾ kʰ ɔ ɾ ɔ ʃ u m
pʰ ɔ χ h ɑ t u t͡sʰ ɛ l	pʰ ɔ χ h ɑ t u t͡sʰ ɛ l
v ə h ɑ t u tʰ j u n	v ə h ɑ t u tʰ j u n
ʃ n ɔ ɾ ɑ v ɔ ɾ ɛ l	ʃ n ɔ ɾ ɑ v ɔ ɾ ɛ l
ʃ ɑ h ɑ ɡ ɔ ɾ t͡s u m	ʃ ɑ h ɑ ɡ ɔ ɾ t͡s u m
b j u d͡ʒ ɛ t ɑ j i n	b j u d͡ʒ ɛ t ɑ j i n
k ɛ n t ɾ ɔ n ɑ k ɑ n	k ɛ n t ɾ ɔ n ɑ k ɑ n
ɡ ɛ ʁ ɑ ɾ kʰ u n i kʰ	ɡ ɛ ʁ ɑ ɾ kʰ u n i kʰ
h ɑ n ɾ ɑ χ ɑ n u tʰ	h ɑ n ɾ ɑ χ ɑ n u tʰ
h ɑ j t ɑ ɾ ɑ ɾ u m	h ɑ j t ɑ ɾ ɑ ɾ u m
h ɑ ɾ t͡sʰ ɑ kʰ ə nː u m	h ɑ ɾ t͡sʰ ɑ kʰ ə nː u m
ɑ ɡ u t͡sʰ ɑ h ɑ n ɛ l	ɑ ɡ u t͡sʰ ɑ h ɑ n ɛ l
χ ə r ɔ v u tʰ j u n	χ ə r ɔ v u tʰ j u n
i ŋ kʰ n u ɾ u j n	i ŋ kʰ n u ɾ u j n
t͡sʰ ɑ ŋ k u tʰ j u n	t͡sʰ ɑ ŋ k u tʰ j u n
pʰ ɔ ɾ t͡sʰ u tʰ j u n	pʰ ɔ ɾ t͡sʰ u tʰ j u n
ɑ z ɑ t u tʰ j u n	ɑ z ɑ t u tʰ j u n
b ɑ z m u tʰ j u n	b ɑ z m u tʰ j u n
h ɑ t k u tʰ j u n	h ɑ t k u tʰ j u n
h ɑ n d͡z n ɑ ɾ ɑ ɾ ɛ l	h ɑ n d͡z n ɑ ɾ ɑ ɾ ɛ l
m ə t ɑ h ɑ ʁ ɑ t͡sʰ u m	m ə t ɑ h ɑ ʁ ɑ t͡sʰ u m
m ɑ ŋ k ɑ s ɑ j l ɑ k	m ɑ ŋ k ɑ s ɑ j l ɑ k
n ɔ j ɛ m b ɛ ɾ j ɑ n	n ɔ j ɛ m b ɛ ɾ j ɑ n
t i p ɑ b ɑ n ɑ k ɑ n	t i p ɑ b ɑ n ɑ k ɑ n
ɡ j u ʁ ɑ t ə n t ɛ s	ɡ j u ʁ ɑ t ə n t ɛ s
kʰ ɑ l ɑ n tʰ ɑ ɾ j ɑ n	kʰ ɑ l ɑ n tʰ ɑ ɾ j ɑ n
m ɑ j ɾ ɑ p ɛ t j ɑ n	m ɑ j ɾ ɑ p ɛ t j ɑ n
k ɑ l ɑ n ɑ v ɔ ɾ ɛ l	k ɑ l ɑ n ɑ v ɔ ɾ ɛ l
i n d ɔ n ɛ z ɛ ɾ ɛ n	i n d ɔ n ɛ z ɛ ɾ ɛ n
ɑ ʃ χ ɑ ɾ h ɑ j ɑ t͡sʰ kʰ	ɑ ʃ χ ɑ ɾ ɑ j ɑ t͡sʰ kʰ
h ɑ m ɑ n ɑ χ ɑ ɡ ɑ h	h ɑ m ɑ n ɑ χ ɑ ɡ ɑ h
h ɑ j ɑ ɡ i t ɑ k ɑ n	h ɑ j ɑ ɡ i t ɑ k ɑ n
h ə ɾ u ʃ ɑ k ɛ ʁ ɛ n	h ə ɾ u ʃ ɑ k ɛ ʁ ɛ n
kʰ s ɛ n ɔ k ɾ ɑ t ɛ s	kʰ s ɛ n ɔ k ɾ ɑ t ɛ s
ɔ t ɑ ɾ ɛ ɾ k ɾ ɑ t͡sʰ i	ɔ t ɑ ɾ ɛ ɾ k ɾ ɑ t͡sʰ i
m ə ʃ ɑ k u tʰ ɑ j i n	m ə ʃ ɑ k u tʰ ɑ j i n
n ɑ v ɑ h ɑ ŋ ɡ i s t	n ɑ v ɑ h ɑ ŋ ɡ i s t
p ɑ ɾ t v ɔ ʁ ɑ k ɑ n	p ɑ ɾ t v ɔ ʁ ɑ k ɑ n
v ə h ɑ t ɛ t͡sʰ u t͡sʰ i t͡ʃʰ	v ə h ɑ t ɛ t͡sʰ u t͡sʰ i t͡ʃʰ
l ɔ tʰ ɑ ɾ i ŋ ɡ ɑ t͡sʰ i	l ɔ tʰ ɑ ɾ i ŋ ɡ ɑ t͡sʰ i
ə n t ɾ ɑ k ɑ ʃ ɑ r kʰ	ə n t ɾ ɑ k ɑ ʃ ɑ r kʰ
ə s t ə ɾ k u tʰ j u n	ə s t ə ɾ k u tʰ j u n
h ɑ j t ɑ ɾ ɑ ɾ v ɛ l	h ɑ j t ɑ ɾ ɑ ɾ v ɛ l
ɑ ɾ i s t ɔ pʰ ɑ n ɛ s	ɑ ɾ i s t ɔ pʰ ɑ n ɛ s
k ɑ ɾ t͡ʃ ɑ ʒ ɑ m k ɛ t	k ɑ ɾ t͡ʃ ɑ ʒ ɑ m k ɛ t
n ɛ ɾ ɡ ɔ ɾ t͡s ɑ k ɑ n	n ɛ ɾ ɡ ɔ ɾ t͡s ɑ k ɑ n
b ɑ ʁ d ɑ s ɑ ɾ j ɑ n	b ɑ ʁ d ɑ s ɑ ɾ j ɑ n
m ɑ n v ɑ t͡s kʰ ɑ j i n	m ɑ n v ɑ t͡s kʰ ɑ j i n
ɑ n d ɾ ɑ v ɑ ɾ t i kʰ	ɑ n d ɾ ɑ v ɑ ɾ t i kʰ
h ɑ ɾ tʰ ɑ kʰ ɑ n d ɑ k	h ɑ ɾ tʰ ɑ kʰ ɑ n d ɑ k
ɡ ɔ ɾ t͡s ɑ r n ɑ k ɑ n	ɡ ɔ ɾ t͡s ɑ r n ɑ k ɑ n
t͡ʃʰ i l i ŋ ɡ ɑ ɾ j ɑ n	t͡ʃʰ i l i ŋ ɡ ɑ ɾ j ɑ n
n ɛ j t ɾ ɔ n ɑ j i n	n ɛ j t ɾ ɔ n ɑ j i n
k ɑ z m ɑ k ɛ ɾ p i t͡ʃʰ	k ɑ z m ɑ k ɛ ɾ p i t͡ʃʰ
k ɑ j s ɛ ɾ ɑ p ɑ ʃ t	k ɑ j s ɛ ɾ ɑ p ɑ ʃ t
k ɛ n t ɾ ɔ n ɑ d͡z i kʰ	k ɛ n t ɾ ɔ n ɑ d͡z i kʰ
i ŋ kʰ n ɑ h ɑ v ɑ t kʰ	i ŋ kʰ n ɑ h ɑ v ɑ t kʰ
b ə r n ɑ z ɑ f tʰ u m	b ə r n ɑ z ɑ f tʰ u m
t͡sʰ ɑ n t͡sʰ ɑ tʰ ɑ ʁ ɑ n tʰ	t͡sʰ ɑ n t͡sʰ ɑ tʰ ɑ ʁ ɑ n tʰ
n ə k ɑ ɾ ɑ h ɑ n u m	n ə k ɑ ɾ ɑ h ɑ n u m
h ɛ ɾ t͡sʰ ɛ ɡ ɔ v i n ɑ	h ɛ ɾ t͡sʰ ɛ ɡ ɔ v i n ɑ
t ɛ s ɑ h ɔ l ɔ v ɑ k	t ɛ s ɑ h ɔ l ɔ v ɑ k
ɑ k n ɛ ɾ ɛ v ɑ b ɑ ɾ	ɑ k n ɛ ɾ ɛ v ɑ b ɑ ɾ
v ɑ ɾ s ɑ k ɑ ʃ i l ɑ	v ɑ ɾ s ɑ k ɑ ʃ i l ɑ
ʒ ɑ m ɑ n ɑ k ɑ ɡ i ɾ	ʒ ɑ m ɑ n ɑ k ɑ ɡ i ɾ
i ɾ ɑ d ɑ ɾ t͡sʰ ɑ j i n	i ɾ ɑ d ɑ ɾ t͡sʰ ɑ j i n
m ə k ə ɾ t u tʰ j u n	m ə k ə ɾ t u tʰ j u n
kʰ ə nː ɑ d ɑ t ɑ b ɑ ɾ	kʰ ə nː ɑ d ɑ t ɑ b ɑ ɾ
ɑ f s t ɾ ɑ l j ɑ t͡sʰ i	ɑ f s t ɾ ɑ l j ɑ t͡sʰ i
p ɾ ɔ f ɛ s i ɔ n ɑ l	p ɾ ɔ f ɛ s i ɔ n ɑ l
p ɑ t k ɛ ɾ ɑ t͡sʰ n ɛ l	p ɑ t k ɛ ɾ ɑ t͡sʰ n ɛ l
k ɑ ɾ t͡ʃ ɑ m ɛ t ɾ ɑ ʒ	k ɑ ɾ t͡ʃ ɑ m ɛ t ɾ ɑ ʒ
b ə ʒ ə ʃ k u tʰ j u n	b ə ʒ ə ʃ k u tʰ j u n
h ə n t͡ʃʰ j u n ɑ k ɑ n	h ə n t͡ʃʰ j u n ɑ k ɑ n
i n f ɔ ɡ ɾ ɑ f i k ɑ	i n f ɔ ɡ ɾ ɑ f i k ɑ
i n ʒ ɛ n ɛ ɾ ɑ k ɑ n	i n ʒ ɛ n ɛ ɾ ɑ k ɑ n
n ɛ ɾ kʰ n ɑ z ɡ ɛ s t	n ɛ ɾ kʰ n ɑ z ɡ ɛ s t
t͡s ɑ r ɑ j ɔ ʁ ɑ k ɑ n	t͡s ɑ r ɑ j ɔ ʁ ɑ k ɑ n
k i b ɛ r n ɛ t i k ɑ	k i b ɛ r n ɛ t i k ɑ
l i χ t ɛ n ʃ t ɛ j n	l i χ t ɛ n ʃ t ɛ j n
ɑ ɡ n ɔ s t i t͡sʰ i z m	ɑ ɡ n ɔ s t i t͡sʰ i z m
ʃ ɑ ɾ ʒ ɑ p ɑ t k ɛ ɾ	ʃ ɑ ɾ ʒ ɑ p ɑ t k ɛ ɾ
b ɑ ɾ t͡sʰ ɾ ɑ h ɑ s ɑ k	b ɑ ɾ t͡sʰ ɾ ɑ h ɑ s ɑ k
k ɑ ɾ ɛ k t͡sʰ ɑ ʃ ɑ ɾ ʒ	k ɑ ɾ ɛ k t͡sʰ ɑ ʃ ɑ ɾ ʒ
k ɑ z m ɑ k ɛ ɾ p ɛ l	k ɑ z m ɑ k ɛ ɾ p ɛ l
k ɑ p i t ɔ l i j u m	k ɑ p i t ɔ l i j u m
k ɑ n χ ɑ ɾ kʰ ɛ l i t͡ʃʰ	k ɑ n χ ɑ ɾ kʰ ɛ l i t͡ʃʰ
ɑ r ɑ v ɔ t ɑ k ɑ n t͡ʃʰ	ɑ r ɑ v ɔ t ɑ k ɑ n t͡ʃʰ
v l ɑ d i v ɔ s t ɔ k	v l ɑ d i v ɔ s t ɔ k
ɑ n b ɑ ɾ j ɑ t͡sʰ k ɑ m	ɑ n b ɑ ɾ j ɑ t͡sʰ k ɑ m
d͡ʒ ɛ ɾ m ɑ s t i t͡ʃ ɑ n	d͡ʒ ɛ ɾ m ɑ s t i t͡ʃ ɑ n
d͡ʒ ɑ n ɑ s i ɾ ɑ b ɑ ɾ	d͡ʒ ɑ n ɑ s i ɾ ɑ b ɑ ɾ
b ɑ ɾ ɛ k ɑ m ɑ k ɑ n	b ɑ ɾ ɛ k ɑ m ɑ k ɑ n
s ɑ ɾ s ɑ pʰ ɛ t͡sʰ n ɛ l	s ɑ ɾ s ɑ pʰ ɛ t͡sʰ n ɛ l
ɑ k n ɛ ɾ ɛ v ɑ p ɛ s	ɑ k n ɛ ɾ ɛ v ɑ p ɛ s
k ɛ n t ɾ ɔ n ɑ n ɑ l	k ɛ n t ɾ ɔ n ɑ n ɑ l
m i t͡ʃʰ n ɑ d ɑ ɾ j ɑ n	m i t͡ʃʰ n ɑ d ɑ ɾ j ɑ n
n ɔ v ɔ r ɔ s i j s k	n ɔ v ɔ r ɔ s i j s k
kʰ ɑ ɔ s ɑ j n ɔ ɾ ɛ n	kʰ ɑ ɔ s ɑ j n ɔ ɾ ɛ n
m ɑ k ɛ d ɔ n ɑ k ɑ n	m ɑ k ɛ d ɔ n ɑ k ɑ n
n ɔ v ɔ s i b i ɾ s k	n ɔ v ɔ s i b i ɾ s k
pʰ ɔ χ v ɑ ɾ t͡ʃʰ ɑ p ɛ t	pʰ ɔ χ v ɑ ɾ t͡ʃʰ ɑ p ɛ t
d ɑ t ɑ p ɑ ɾ t j ɑ l	d ɑ t ɑ p ɑ ɾ t j ɑ l
t ɛ s ɑ k ɑ n ɔ ɾ ɛ n	t ɛ s ɑ k ɑ n ɔ ɾ ɛ n
m ɑ tʰ ɛ m ɑ t i k ɔ s	m ɑ tʰ ɛ m ɑ t i k ɔ s
ɑ h ɑ b ɛ k t͡ʃʰ ɑ k ɑ n	ɑ h ɑ b ɛ k t͡ʃʰ ɑ k ɑ n
i m p ɛ ɾ j ɑ l i s t	i m p ɛ ɾ j ɑ l i s t
h ə n d k ə ŋ k u j z	h ə n d k ə ŋ k u j z
ɑ ɡ ɑ ɾ ɑ k ɑ t͡sʰ n ɛ l	ɑ ɡ ɑ ɾ ɑ k ɑ t͡sʰ n ɛ l
j ɛ ɾ k j u ʁ ɑ l i ɾ	j ɛ ɾ k j u ʁ ɑ l i ɾ
s ɑ ɾ s ɑ pʰ ɛ t͡sʰ n ɔ ʁ	s ɑ ɾ s ɑ pʰ ɛ t͡sʰ n ɔ ʁ
z ɑ ŋ ɡ v ɑ t͡s ɑ j i n	z ɑ ŋ ɡ v ɑ t͡s ɑ j i n
p ɑ t ɾ ɑ s t ɑ k ɑ m	p ɑ t ɾ ɑ s t ɑ k ɑ m
m ɑ ɾ t i ɾ ɔ s j ɑ n	m ɑ ɾ t i ɾ ɔ s j ɑ n
h ɔ kʰ ɛ b ɑ n ɑ k ɑ n	h ɔ kʰ ɛ b ɑ n ɑ k ɑ n
m ɑ k ɛ d ɔ n ɛ ɾ ɛ n	m ɑ k ɛ d ɔ n ɛ ɾ ɛ n
ɡ ɑ ʁ ɑ pʰ ɑ ɾ ɑ ɡ i ɾ	ɡ ɑ ʁ ɑ pʰ ɑ ɾ ɑ ɡ i ɾ
pʰ ɛ h l i v ɑ n j ɑ n	pʰ ɛ h l i v ɑ n j ɑ n
h ə n t͡ʃʰ j u n ɑ j i n	h ə n t͡ʃʰ j u n ɑ j i n
ɑ n ɑ t ɔ l j ɑ k ɑ n	ɑ n ɑ t ɔ l j ɑ k ɑ n
m ɑ ŋ k ɑ p ɑ ɾ t ɛ z	m ɑ ŋ k ɑ p ɑ ɾ t ɛ z
i d͡ʒ ɛ v ɑ n ɑ t ɛ ʁ i	i d͡ʒ ɛ v ɑ n ɑ t ɛ ʁ i
n ɑ χ ɑ ɡ ɑ h ɑ k ɑ n	n ɑ χ ɑ ɡ ɑ h ɑ k ɑ n
b ɑ t͡sʰ ɑ k ɑ n t͡ʃʰ ɛ l	b ɑ t͡sʰ ɑ k ɑ n t͡ʃʰ ɛ l
ɑ pʰ s t ɾ ɑ h v ɛ l	ɑ pʰ s t ɾ ɑ h v ɛ l
v ɑ h ɑ n ɑ ɡ ɛ ʁ d͡z	v ɑ h ɑ n ɑ ɡ ɛ ʁ d͡z
h ɑ j ɾ ɛ n ɑ k i t͡sʰ	h ɑ j ɾ ɛ n ɑ k i t͡sʰ
p ɑ k ɑ s ɛ t͡sʰ n ɛ l	p ɑ k ɑ s ɛ t͡sʰ n ɛ l
ə n t ɑ n j ɑ k ɑ n	ə n t ɑ n j ɑ k ɑ n
n ɑ h ɑ ŋ ɡ ɑ p ɛ t	n ɑ h ɑ ŋ ɡ ɑ p ɛ t
h ə ʁ i j u tʰ j u n	h ə ʁ i j u tʰ j u n
i d͡ʒ ɛ v ɑ n ɑ j i n	i d͡ʒ ɛ v ɑ n ɑ j i n
ɑ ɾ ɡ ɑ n d ɑ j i n	ɑ ɾ ɡ ɑ n d ɑ j i n
ə n tʰ ɑ ɾ m ɑ n ɑ l	ə n tʰ ɑ ɾ m ɑ n ɑ l
ɑ ɾ ɛ v ɛ l ɑ ɡ ɛ t	ɑ ɾ ɛ v ɛ l ɑ ɡ ɛ t
h ɑ m ɛ s t ɔ ɾ ɛ n	h ɑ m ɛ s t ɔ ɾ ɛ n
kʰ ɔ kʰ ɔ b ɛ l j ɑ n	kʰ ɔ kʰ ɔ b ɛ l j ɑ n
ɛ m p ɛ d ɔ k l ɛ s	ɛ m p ɛ d ɔ k l ɛ s
m ɑ h ɑ ɾ ɑ ʃ t ɾ ɑ	m ɑ h ɑ ɾ ɑ ʃ t ɾ ɑ
ɑ ɾ tʰ ɑ ɾ ɑ t͡sʰ n ɛ l	ɑ ɾ tʰ ɑ ɾ ɑ t͡sʰ n ɛ l
k ɑ χ ɑ ɾ d ɑ b ɑ ɾ	k ɑ χ ɑ ɾ d ɑ b ɑ ɾ
ɡ ɑ ŋ ɡ ɾ ɑ v ɑ ɾ s	ɡ ɑ ŋ ɡ ɾ ɑ v ɑ ɾ s
d ɑ tʰ ɑ ɾ ɛ t͡sʰ n ɛ l	d ɑ tʰ ɑ ɾ ɛ t͡sʰ n ɛ l
t͡s ɑ n ɔ tʰ ɑ t͡sʰ n ɛ l	t͡s ɑ n ɔ tʰ ɑ t͡sʰ n ɛ l
h ɑ m pʰ ɛ ɾ ɑ t ɑ ɾ	h ɑ m pʰ ɛ ɾ ɑ t ɑ ɾ
p ɑ j m ɑ n ɑ ɡ i ɾ	p ɑ j m ɑ n ɑ ɡ i ɾ
m i t͡ʃʰ ɑ z ɡ ɑ j i n	m i t͡ʃʰ ɑ z ɡ ɑ j i n
h ɑ j d ɑ ɾ ɑ b ɑ d	h ɑ j d ɑ ɾ ɑ b ɑ d
m ɑ ɾ ɡ ɑ ɡ ɛ t i n	m ɑ ɾ ɡ ɑ ɡ ɛ t i n
n ɛ ɾ ɡ ɑ χ tʰ j ɑ l	n ɛ ɾ ɡ ɑ χ tʰ j ɑ l
m ɑ k b ɑ j ɑ k ɑ n	m ɑ k b ɑ j ɑ k ɑ n
ɡ ɾ ɛ n l ɑ n d j ɑ	ɡ ɾ ɛ n l ɑ n d j ɑ
s ɔ v ɔ ɾ ɛ t͡sʰ n ɛ l	s ɔ v ɔ ɾ ɛ t͡sʰ n ɛ l
p ɑ t ɑ s χ ɑ n ɛ l	p ɑ t ɑ s χ ɑ n ɛ l
m ɑ k ɛ d ɔ n ɑ t͡sʰ i	m ɑ k ɛ d ɔ n ɑ t͡sʰ i
ɑ pʰ s t ɾ ɑ k t͡sʰ j ɑ	ɑ pʰ s t ɾ ɑ k t͡sʰ j ɑ
ɑ ɾ t ɑ s ɑ h m ɑ n	ɑ ɾ t ɑ s ɑ h m ɑ n
k ɑ ʃ k ɑ n d j ɑ l	k ɑ ʃ k ɑ n d j ɑ l
ɛ l ɛ k t ɾ ɔ l i z	ɛ l ɛ k t ɾ ɔ l i z
ɡ i t ɑ k t͡sʰ ɑ k ɑ n	ɡ i t ɑ k t͡sʰ ɑ k ɑ n
b ɛ l i s ɑ ɾ i ɔ s	b ɛ l i s ɑ ɾ i ɔ s
t͡ʃ ɑ ɾ ɑ h ɑ t j ɑ l	t͡ʃ ɑ ɾ ɑ h ɑ t j ɑ l
m ɔ l d ɔ v ɑ k ɑ n	m ɔ l d ɔ v ɑ k ɑ n
k ɑ ɾ ɛ k t͡sʰ ɑ k ɑ n	k ɑ ɾ ɛ k t͡sʰ ɑ k ɑ n
h ɑ m ɛ s t ɑ b ɑ ɾ	h ɑ m ɛ s t ɑ b ɑ ɾ
ɑ ɾ ɛ v ɑ t͡s ɑ ʁ i k	ɑ ɾ ɛ v ɑ t͡s ɑ ʁ i k
ɑ f t ɔ v ɑ ɾ ɔ ɾ tʰ	ɑ f t ɔ v ɑ ɾ ɔ ɾ tʰ
m ɑ n v ɑ t͡s ɑ p ɑ t	m ɑ n v ɑ t͡s ɑ p ɑ t
j ɛ ɾ k ɾ ɑ ɡ u n d	j ɛ ɾ k ɾ ɑ ɡ u n d
s ɑ ɾ s ɑ pʰ ɑ l i t͡sʰ	s ɑ ɾ s ɑ pʰ ɑ l i t͡sʰ
b ɑ t͡sʰ ɔ ɾ ɔ ʃ ɑ k i	b ɑ t͡sʰ ɔ ɾ ɔ ʃ ɑ k i
b ɑ n d͡ʒ ɑ ɾ ɛ ʁ ɛ n	b ɑ n d͡ʒ ɑ ɾ ɛ ʁ ɛ n
h j u ɾ ɑ s ə ɾ ɑ h	h j u ɾ ɑ s ə ɾ ɑ h
s ɑ ɾ s ɑ pʰ ɑ h ɑ ɾ	s ɑ ɾ s ɑ pʰ ɑ h ɑ ɾ
s l ɔ v ɛ n ɛ ɾ ɛ n	s l ɔ v ɛ n ɛ ɾ ɛ n
k ɑ p ɑ d ɔ f k j ɑ	k ɑ p ɑ d ɔ f k j ɑ
s i ɾ ɑ h ɑ ɾ v ɛ l	s i ɾ ɑ h ɑ ɾ v ɛ l
ɑ ʃ χ ɑ t ɑ v ɑ ɾ t͡sʰ	ɑ ʃ χ ɑ t ɑ v ɑ ɾ t͡sʰ
χ ɔ s ɑ k t͡sʰ ɑ k ɑ n	χ ɔ s ɑ k t͡sʰ ɑ k ɑ n
m ɑ l tʰ ɑ j ɛ ɾ ɛ n	m ɑ l tʰ ɑ j ɛ ɾ ɛ n
ɑ m ɛ ɾ i k ɑ k ɑ n	ɑ m ɛ ɾ i k ɑ k ɑ n
s ɑ h m ɑ n ɑ p ɑ h	s ɑ h m ɑ n ɑ p ɑ h
ɑ ɾ ɛ v ɛ l ɑ h ɑ j	ɑ ɾ ɛ v ɛ l ɑ h ɑ j
k ɑ ɾ ɑ p ɛ t j ɑ n	k ɑ ɾ ɑ p ɛ t j ɑ n
ɡ ɑ ŋ ɡ ɾ ɑ t͡sʰ n ɛ l	ɡ ɑ ŋ ɡ ɾ ɑ t͡sʰ n ɛ l
s l ɔ v ɑ k ɛ ɾ ɛ n	s l ɔ v ɑ k ɛ ɾ ɛ n
v ɛ ɾ n ɑ ʃ ɑ p i k	v ɛ ɾ n ɑ ʃ ɑ p i k
k ɑ ɾ kʰ ɑ v i t͡ʃ ɑ k	k ɑ ɾ kʰ ɑ v i t͡ʃ ɑ k
t ɛ ʁ ɛ k ɑ t͡sʰ n ɛ l	t ɛ ʁ ɛ k ɑ t͡sʰ n ɛ l
ɡ ɛ ɾ m ɑ n ɛ ɾ ɛ n	ɡ ɛ ɾ m ɑ n ɛ ɾ ɛ n
v ɔ χ t͡ʃʰ ɑ k i z u m	v ɔ χ t͡ʃʰ ɑ k i z u m
t͡s ɑ j ɾ ɑ kʰ ɑ ʁ ɑ kʰ	t͡s ɑ j ɾ ɑ kʰ ɑ ʁ ɑ kʰ
n ɑ χ ɑ t ɛ s v ɛ l	n ɑ χ ɑ t ɛ s v ɛ l
b ɛ ŋ ɡ ɑ l ɛ ɾ ɛ n	b ɛ ŋ ɡ ɑ l ɛ ɾ ɛ n
kʰ ɔ t͡ʃʰ v ɔ ɾ ɑ k ɑ n	kʰ ɔ t͡ʃʰ v ɔ ɾ ɑ k ɑ n
t͡sʰ ɑ t͡s ɾ ɑ h ɑ s ɑ k	t͡sʰ ɑ t͡s ɾ ɑ h ɑ s ɑ k
t ɛ χ n ɔ l ɔ ɡ j ɑ	t ɛ χ n ɔ l ɔ ɡ j ɑ
l ɑ j n ɑ t ɛ ɾ ɛ v	l ɑ j n ɑ t ɛ ɾ ɛ v
v ɑ r ɛ l ɑ pʰ ɑ j t	v ɑ r ɛ l ɑ pʰ ɑ j t
h ɾ ɑ p ɑ ɾ ɑ k ɑ v	h ə ɾ ɑ p ɑ ɾ ɑ k ɑ v
v ɛ ɾ t͡ʃʰ i v ɛ ɾ t͡ʃʰ ɔ	v ɛ ɾ t͡ʃʰ i v ɛ ɾ t͡ʃʰ ɔ
n ɑ m ɑ n ɑ v ɑ n d	n ɑ m ɑ n ɑ v ɑ n d
v ə r ɑ m ʃ ɑ p u h	v ə r ɑ m ʃ ɑ p u h
k ɑ ɾ ɛ k t͡sʰ ɑ b ɛ ɾ	k ɑ ɾ ɛ k t͡sʰ ɑ b ɛ ɾ
pʰ ə r j u ɡ ɑ k ɑ n	pʰ ə r j u ɡ ɑ k ɑ n
ɡ ɑ ɾ n ɑ n ɑ j i n	ɡ ɑ ɾ n ɑ n ɑ j i n
k ɑ t ɑ s t ɾ ɔ f ɑ	k ɑ t ɑ s t ɾ ɔ f ɑ
h ɑ m ɑ ɡ ɔ ɾ t͡s ɛ l	h ɑ m ɑ ɡ ɔ ɾ t͡s ɛ l
p ɔ r n ə k ɑ t u n	p ɔ r n ə k ɑ t u n
m ɑ h m ɛ d ɑ k ɑ n	m ɑ h m ɛ d ɑ k ɑ n
t ɑ χ t ɑ k ɑ m ɑ t͡s	t ɑ χ t ɑ k ɑ m ɑ t͡s
m ɔ l d ɑ v ɑ k ɑ n	m ɔ l d ɑ v ɑ k ɑ n
i d͡ʒ ɛ v ɑ n ɑ t ɛ ɾ	i d͡ʒ ɛ v ɑ n ɑ t ɛ ɾ
d i t ɔ ɾ tʰ ɑ k ɑ n	d i t ɔ ɾ tʰ ɑ k ɑ n
t ɛ ʁ ɑ ʃ ɑ ɾ ʒ ɛ l	t ɛ ʁ ɑ ʃ ɑ ɾ ʒ ɛ l
k ɛ ɾ ɑ k ɾ ɑ pʰ ɔ ʁ	k ɛ ɾ ɑ k ɾ ɑ pʰ ɔ ʁ
h ɑ m ɑ l s ɑ ɾ ɑ n	h ɑ m ɑ l s ɑ ɾ ɑ n
pʰ ɔ χ n ɑ χ ɑ ɾ ɑ ɾ	pʰ ɔ χ n ɑ χ ɑ ɾ ɑ ɾ
ɑ ɾ h ɛ s t ɑ v ɔ ɾ	ɑ ɾ h ɛ s t ɑ v ɔ ɾ
i s l ɑ m ɑ t͡sʰ n ɛ l	i s l ɑ m ɑ t͡sʰ n ɛ l
h ɑ n d i s ɑ k ɑ n	h ɑ n d i s ɑ k ɑ n
z i n t͡s ɑ r ɑ j ɔ ʁ	z i n t͡s ɑ r ɑ j ɔ ʁ
ɑ m ɾ ɑ p ə n d u m	ɑ m ɾ ɑ p ə n d u m
s ɑ ɾ d ɔ s t ɑ j n	s ɑ ɾ d ɔ s t ɑ j n
l ɑ j n ɑ t ɑ ɾ ɑ t͡s	l ɑ j n ɑ t ɑ ɾ ɑ t͡s
ʃ ɑ h ɑ ɡ ɔ ɾ t͡s ɛ l	ʃ ɑ h ɑ ɡ ɔ ɾ t͡s ɛ l
ɑ n t i t ɑ v ɾ ɔ s	ɑ n t i t ɑ v ɾ ɔ s
pʰ ɑ s t ɑ h ɑ v ɑ kʰ	pʰ ɑ s t ɑ h ɑ v ɑ kʰ
ɑ r ɛ f t ɾ ɑ j i n	ɑ r ɛ f t ɾ ɑ j i n
d ɛ v ɑ n ɑ ɡ ɑ ɾ i	d ɛ v ɑ n ɑ ɡ ɑ ɾ i
n ɛ s t ɔ ɾ ɑ k ɑ n	n ɛ s t ɔ ɾ ɑ k ɑ n
ɑ n ɾ ɑ d ɑ r n ɑ l	ɑ n ɾ ɑ d ɑ r n ɑ l
b ɑ ɾ b ɑ r ɑ j i n	b ɑ ɾ b ɑ r ɑ j i n
j ɛ s ɑ s i ɾ ɑ k ɑ n	j ɛ s ɑ s i ɾ ɑ k ɑ n
j ɛ v ɾ ɑ s j ɑ k ɑ n	j ɛ v ɾ ɑ s j ɑ k ɑ n
h ə ɾ ɑ p ɑ ɾ ɑ k ɛ l	h ə ɾ ɑ p ɑ ɾ ɑ k ɛ l
ɑ d ə ɾ b ɛ d͡ʒ ɑ n t͡sʰ i	ɑ d ə ɾ b ɛ d͡ʒ ɑ n t͡sʰ i
d͡z ɛ r n ɑ ɡ ə n d ɑ k	d͡z ɛ r n ɑ ɡ ə n d ɑ k
ɡ ə ɾ ɑ k ɑ n ɑ ɡ ɛ t	ɡ ə ɾ ɑ k ɑ n ɑ ɡ ɛ t
h ə n ɑ z ɑ n d v ɛ l	h ə n ɑ z ɑ n d v ɛ l
m i j ɑ s ɛ r ɑ k ɑ n	m i j ɑ s ɛ r ɑ k ɑ n
j ɛ ɾ k b ɑ j ɔ ɾ ɛ n	j ɛ ɾ k b ɑ j ɔ ɾ ɛ n
j ɛ χ p ɑ j ɾ ɑ k ɑ n	j ɛ χ p ɑ j ɾ ɑ k ɑ n
n ə ʃ ɑ n ɑ k ɑ l i t͡sʰ	n ə ʃ ɑ n ɑ k ɑ l i t͡sʰ
m i j ɑ ʒ ɑ m ɑ n ɑ k	m i j ɑ ʒ ɑ m ɑ n ɑ k
j ɛ ɾ ɛ v ɑ k ɑ j ɛ l	j ɛ ɾ ɛ v ɑ k ɑ j ɛ l
h ɑ ŋ ɡ ə s t ɑ n ɑ l	h ɑ ŋ ɡ ə s t ɑ n ɑ l
ə s t ɔ ɾ ɡ ɛ t n j ɑ	ə s t ɔ ɾ ɡ ɛ t n j ɑ
ɡ ə l χ ɑ p ə t u j t	ɡ ə l χ ɑ p ə t u j t
tʰ ə v ɑ b ɑ n ɑ k ɑ n	tʰ ə v ɑ b ɑ n ɑ k ɑ n
h ə ɾ ɑ m ɑ n ɑ t ɑ ɾ	h ə ɾ ɑ m ɑ n ɑ t ɑ ɾ
j ɛ ɾ ɑ z ɡ ɑ v ɔ ɾ s	j ɛ ɾ ɑ z ɡ ɑ v ɔ ɾ s
ɑ t ə ɾ p ɑ t ɑ k ɑ n	ɑ t ə ɾ p ɑ t ɑ k ɑ n
