h u m kʰ	h u m kʰ
ɡ u ʃ p	ɡ u ʃ p
tʰ u ɾ m	tʰ u ɾ m
v ɑ nː ɑ	v ɑ nː ɑ
ɑ r t u	ɑ r t u
u ɾ ɑ χ	u ɾ ɑ χ
n u j n	n u j n
m ɛ <<unk>> ɑ	m ɛ kʰ kʰ ɑ
z u j kʰ	z u j kʰ
h u j z	h u j z
tʰ u j n	tʰ u j n
m u t kʰ	m u t kʰ
k ɑ t u	k ɑ t u
m u ɾ t͡ʃ	m u ɾ t͡ʃ
ɛ ɾ k u	ɛ ɾ k u
s ɔ d͡ʒ u	s ɔ d͡ʒ u
ɔ kʰ u t	ɔ kʰ u t
n i <<unk>> ɑ	n i <unk> ɑ
m j u s	m j u s
t u j ʒ	t u j ʒ
t ɑ b u	t ɑ b u
k u r kʰ	k u r kʰ
s ɔ u s	s ɔ u s
k u j ɾ	k u j ɾ
pʰ u n d͡ʒ	pʰ u n d͡ʒ
t͡ʃ j u ʁ	t͡ʃ j u ʁ
b ɑ nː ɑ	b ɑ nː ɑ
h ɑ t u	h ɑ t u
ɛ kʰ u t͡sʰ	ɛ kʰ u t͡sʰ
t͡s ɑ χ u	t͡s ɑ χ u
χ u m b	χ u m b
b u j n	b u j n
b ɑ kʰ u	b ɑ kʰ u
b u j l	b u j l
r u m b	r u m b
u r ɛ l	u r ɛ l
t͡s u ŋ k	t͡s u ŋ k
kʰ u t͡ʃʰ ɑ	kʰ u t͡ʃʰ ɑ
kʰ u ɾ m	kʰ u ɾ m
d u n t͡ʃʰ	d u n t͡ʃʰ
u n ɛ m	u n ɛ m
h u j s	h u j s
u s t i	u s t i
ɡ u n d	ɡ u n d
u ɾ h ɑ	u ɾ h ɑ
ɑ p u ɾ	ɑ p u ɾ
s u ʃ i	s u ʃ i
l j u n	l j u n
kʰ u ŋ kʰ	kʰ u ŋ kʰ
tʰ u χ tʰ	tʰ u χ tʰ
t u l ɑ	t u l ɑ
p u ɾ i	p u ɾ i
h ɑ s u	h ɑ s u
u ɾ u	u ɾ u
ɡ u j n	ɡ u j n
u ʁ ɛ ʁ	u ʁ ɛ ʁ
kʰ ɛ r u	kʰ ɛ r u
tʰ u l ɑ	tʰ u l ɑ
f u n t	f u n t
u ɾ i ʃ	u ɾ i ʃ
ɑ m u ɾ	ɑ m u ɾ
t͡s u j l	t͡s u j l
ɑ n u tʰ	ɑ n u tʰ
ɑ j s u	ɑ j s u
l u ɾ tʰ	l u ɾ tʰ
k u j t	k u j t
h u d ɑ	h u d ɑ
s u m ɔ	s u m ɔ
d͡ʒ u ɾ ə	d͡ʒ u ɾ ə
s ɛ u l	s ɛ u l
ʃ u n t͡ʃʰ	ʃ u n t͡ʃʰ
d j u ɾ	d j u ɾ
b u j ɾ	b u j ɾ
d͡z j u n	d͡z j u n
j u ɑ n	j u ɑ n
u ɾ f ɑ	u ɾ f ɑ
u ʒ ɛ ʁ	u ʒ ɛ ʁ
l u j t͡s	l u j t͡s
h u n d͡z	h u n d͡z
b j u ɾ	b j u ɾ
ɾ ɑ <<unk>> i	ɾ ɑ <unk> i
p ɛ ɾ u	p ɛ ɾ u
χ u ɾ t͡sʰ	χ u ɾ t͡sʰ
ɑ k u tʰ	ɑ k u tʰ
m u ɾ t͡sʰ	m u ɾ t͡sʰ
d u ɾ s	d u ɾ s
i n t͡ʃʰ u	i n t͡ʃʰ u
ɑ ʃ u ʁ	ɑ ʃ u ʁ
tʰ u χ s	tʰ u χ s
tʰ u ɾ kʰ	tʰ u ɾ kʰ
k u j s	k u j s
ɡ u ɾ z	ɡ u ɾ z
d u kʰ s	d u kʰ s
kʰ u ɾ d	kʰ u ɾ d
n u ɾ pʰ	n u ɾ pʰ
h ɔ ɾ u	h ɔ ɾ u
m u χ t	m u χ t
s u ɾ t͡ʃ	s u ɾ t͡ʃ
tʰ u j l	tʰ u j l
l u s ɔ	l u s ɔ
u z ɛ l	u z ɛ l
l u j s	l u j s
u t ɛ l	u t ɛ l
k u ʃ t	k u ʃ t
d u j l	d u j l
u n ɑ b	u n ɑ b
h u j n	h u j n
l u ɾ d͡ʒ	l u ɾ d͡ʒ
b u ɾ tʰ	b u ɾ tʰ
ʃ u ʃ ɑ	ʃ u ʃ ɑ
m ɔ ɾ u	m ɔ ɾ u
u r h ɑ	u r h ɑ
t u ŋ k	t u ŋ k
s ɔ u l	s ɔ u l
b ɛ ɾː i	b ɛ ɾ ɾ i
ɑ t͡s u χ	ɑ t͡s u χ
m ɛ ʁ u	m ɛ ʁ u
ɡ j u ʁ	ɡ j u ʁ
ʃ u k ɑ	ʃ u k ɑ
h ɛ r u	h ɛ r u
u ɾ ɑ l	u ɾ ɑ l
h j u ɾ	h j u ɾ
t͡sʰ u j t͡sʰ	t͡sʰ u j t͡sʰ
v j u n	v j u n
s j u n	s j u n
b u j s	b u j s
h u j l	h u j l
ʃ u ɾ tʰ	ʃ u ɾ tʰ
ʃ u ʃ i	ʃ u ʃ i
kʰ u ɾ d͡z	kʰ u ɾ d͡z
ɡ j u t	ɡ j u t
z u s p	z u s p
b u ɾ ɡ	b u ɾ ɡ
l u m ɑ	l u m ɑ
t u ɾ kʰ	t u ɾ kʰ
t͡sʰ u ɾ t	t͡sʰ u ɾ t
tʰ u tʰ kʰ	tʰ u tʰ kʰ
u n ɑ k	u n ɑ k
s u j n	s u j n
m u n d͡ʒ	m u n d͡ʒ
u ɾ ɑ n	u ɾ ɑ n
kʰ u l ɑ	kʰ u l ɑ
v ɛ ɾ kʰ	v ɛ ɾ kʰ
pʰ ɔ ɾ t͡sʰ	pʰ ɔ ɾ t͡sʰ
t ɑ n ə	t ɑ n ə
h ɔ m s	h ɔ m s
ʃ ɑ ɾ kʰ	ʃ ɑ ɾ kʰ
ɑ l ɔ t͡ʃ	ɑ l ɔ t͡ʃ
ɑ ɾ pʰ i	ɑ ɾ pʰ i
ɑ t ɑ m	ɑ t ɑ m
ɑ r i kʰ	ɑ r i kʰ
tʰ i kʰ ɑ	tʰ i kʰ ɑ
z ɑ ɾ k	z ɑ ɾ k
h ɛ t ɔ	h ɛ t ɔ
h ɑ χ tʰ	h ɑ χ tʰ
l i m ɑ	l i m ɑ
ɛ s ɔ ɾ	ɛ s ɔ ɾ
k ɑ m ɑ	k ɑ m ɑ
v ɑ s kʰ	v ɑ s kʰ
pʰ ɑ j t	pʰ ɑ j t
d ɑ t͡ʃʰ ɑ	d ɑ t͡ʃʰ ɑ
s ɑ j l	s ɑ j l
ɔ tʰ ɛ l	ɔ tʰ ɛ l
ɛ tʰ ɑ l	ɛ tʰ ɑ l
b ɑ ŋ k	b ɑ ŋ k
tʰ ɛ m ɑ	tʰ ɛ m ɑ
m ɑ v i	m ɑ v i
ʃ ɑ n tʰ	ʃ ɑ n tʰ
ɑ m ɑ r	ɑ m ɑ r
ɔ n i k	ɔ n i k
ʃ ɔ kʰ i	ʃ ɔ kʰ i
pʰ ɛ s ɑ	pʰ ɛ s ɑ
k ɑ ɾ tʰ	k ɑ ɾ tʰ
ɡ ɑ n ɑ	ɡ ɑ n ɑ
ɑ k ɔ s	ɑ k ɔ s
p ɔ m p	p ɔ m p
l ɑ ɾ i	l ɑ ɾ i
k ɑ r ɛ	k ɑ r ɛ
s ɑ ʁ m	s ɑ ʁ m
n ɑ n i	n ɑ n i
ɑ t͡s ɛ l	ɑ t͡s ɛ l
h ɛ ɾ tʰ	h ɛ ɾ tʰ
t͡sʰ ɑ j ɡ	t͡sʰ ɑ j ɡ
k ɑ ɾ kʰ	k ɑ ɾ kʰ
m ɑ ɾ z	m ɑ ɾ z
ɑ ʁ i t͡ʃ	ɑ ʁ i t͡ʃ
ɑ r n ɔ	ɑ r n ɔ
ɑ n ɛ ɾ	ɑ n ɛ ɾ
b ɛ r n	b ɛ r n
k ə t͡s u	k ə t͡s u
ɑ s v i	ɑ s v i
ɑ ɾ ɑ m	ɑ ɾ ɑ m
ɑ ʁ i kʰ	ɑ ʁ i kʰ
ɑ t ɛ n	ɑ t ɛ n
v ɑ ɾ k	v ɑ ɾ k
ɔ s l ɑ	ɔ s l ɑ
v ɑ n ɔ	v ɑ n ɔ
b ɑ χ t	b ɑ χ t
k ɑ ɾ t	k ɑ ɾ t
l ɑ m p	l ɑ m p
t͡ʃʰ ɔ ɾ s	t͡ʃʰ ɔ ɾ s
t͡sʰ ɑ t k	t͡sʰ ɑ t k
b ɑ j t͡sʰ	b ɑ j t͡sʰ
k ɔ χ kʰ	k ɔ χ kʰ
t ɑ ɾ i	t ɑ ɾ i
t͡ʃ i ʃ t	t͡ʃ i ʃ t
k ɑ z m	k ɑ z m
h ɑ n d	h ɑ n d
t ɛ s kʰ	t ɛ s kʰ
h ɑ ʁ b	h ɑ ʁ b
s ɑ n d	s ɑ n d
h ɔ ɾ d	h ɔ ɾ d
s i ɾ t	s i ɾ t
z ɑ ɾ tʰ	z ɑ ɾ tʰ
ɡ ɔ ɾ ʃ	ɡ ɔ ɾ ʃ
ɑ b ɑ s	ɑ b ɑ s
v ɛ ɾ t͡ʃʰ	v ɛ ɾ t͡ʃʰ
k ɛ n t	k ɛ n t
ɑ l ɔ ɛ	ɑ l ɔ ɛ
ɔ f i s	ɔ f i s
h ɑ ɾ tʰ	h ɑ ɾ tʰ
h ɑ ʃ t	h ɑ ʃ t
h ɑ v ɑ	h ɑ v ɑ
m ɑ j ɾ	m ɑ j ɾ
ʁ ɑ ɾ s	ʁ ɑ ɾ s
b ɑ n t	b ɑ n t
s ɛ ɾ t	s ɛ ɾ t
t ɔ h m	t ɔ h m
m ɑ ɾ i	m ɑ ɾ i
tʰ ɑ ŋ k	tʰ ɑ ŋ k
r i t͡sʰ ɑ	r i t͡sʰ ɑ
p ɑ p ɑ	p ɑ p ɑ
ɑ t ɛ l	ɑ t ɛ l
h ɑ j t	h ɑ j t
b ɑ t͡sʰ i	b ɑ t͡sʰ i
m ɑ ɾ t	m ɑ ɾ t
i ŋ ɡ ɑ	i ŋ ɡ ɑ
ɑ ɾ ɑ ʁ	ɑ ɾ ɑ ʁ
ɡ ɛ ʁ m	ɡ ɛ ʁ m
ɛ m i n	ɛ m i n
χ ɑ n d	χ ɑ n d
pʰ ɔ s t	pʰ ɔ s t
k i n ɔ	k i n ɔ
z ɑ ŋ ɡ	z ɑ ŋ ɡ
χ ɛ n tʰ	χ ɛ n tʰ
t͡s ɑ χ s	t͡s ɑ χ s
l i kʰ ə	l i kʰ ə
s ɔ t͡ʃ i	s ɔ t͡ʃ i
k ɛ χ t͡s	k ɛ χ t͡s
t ɛ ʁ i	t ɛ ʁ i
m ɛ ɾ d͡z	m ɛ ɾ d͡z
ɑ n ɔ tʰ	ɑ n ɔ tʰ
ɑ t͡s ɛ ɾ	ɑ t͡s ɛ ɾ
χ i χ t͡ʃ	χ i χ t͡ʃ
m ɛ ʁ m	m ɛ ʁ m
i v ɑ n	i v ɑ n
k ɑ f ɛ	k ɑ f ɛ
ʃ ɑ m b	ʃ ɑ m b
ɑ d ɑ m	ɑ d ɑ m
ɑ ɾ ɑ ɾ	ɑ ɾ ɑ ɾ
ɔ t͡s ɛ l	ɔ t͡s ɛ l
v ɑ ʃ t	v ɑ ʃ t
l ɑ n t͡ʃʰ	l ɑ n t͡ʃʰ
l ɑ v ɑ	l ɑ v ɑ
t͡ʃʰ i l i	t͡ʃʰ i l i
s ɛ ɾ b	s ɛ ɾ b
p ɑ ɾ z	p ɑ ɾ z
v i ɾ kʰ	v i ɾ kʰ
tʰ ɛ ɾ i	tʰ ɛ ɾ i
p ɑ p i	p ɑ p i
b ɑ ɾ i	b ɑ ɾ i
d ɑ ʒ ɛ	d ɑ ʒ ɛ
ɑ m ɔ tʰ	ɑ m ɔ tʰ
ɡ ɔ f kʰ	ɡ ɔ f kʰ
l ɑ n d͡ʒ	l ɑ n d͡ʒ
l ɔ t ɔ	l ɔ t ɔ
l ɑ j n	l ɑ j n
v ɑ ʁ n	v ɑ ʁ n
b l ɔ ɡ	b ə l ɔ ɡ
ɑ m ɛ n	ɑ m ɛ n
v i ʃ t	v i ʃ t
ɑ ɾ ɔ t	ɑ ɾ ɔ t
ɔ ʒ i t	ɔ ʒ i t
ə n ɛ l	ə n ɛ l
k ɛ ɾ p	k ɛ ɾ p
k i ɾ kʰ	k i ɾ kʰ
χ ɑ l i	χ ɑ l i
ɡ i n d	ɡ i n d
t ɑ t i	t ɑ t i
ɔ ɾ ɑ n	ɔ ɾ ɑ n
tʰ ɑ v ɑ	tʰ ɑ v ɑ
v i kʰ i	v i kʰ i
b i ɾ t	b i ɾ t
tʰ ɛ b ɛ	tʰ ɛ b ɛ
d ɛ p kʰ	d ɛ p kʰ
t͡ʃ ɛ χ kʰ	t͡ʃ ɛ χ kʰ
z ɛ ŋ kʰ	z ɛ ŋ kʰ
kʰ ɑ t͡sʰ i	kʰ ɑ t͡sʰ i
d͡ʒ ɑ ŋ kʰ	d͡ʒ ɑ ŋ kʰ
d i ɾ kʰ	d i ɾ kʰ
b ɔ χ k	b ɔ χ k
ʒ ɑ ŋ ɡ	ʒ ɑ ŋ ɡ
p ɑ ɾ s	p ɑ ɾ s
p i χ t͡s	p i χ t͡s
t v ɛ ɾ	t v ɛ ɾ
h ɑ s t	h ɑ s t
m i ʃ t	m i ʃ t
s ɔ s i	s ɔ s i
m ɔ d ɑ	m ɔ d ɑ
z ɛ f s	z ɛ f s
ɑ ʃ ɔ t	ɑ ʃ ɔ t
k i t ɔ	k i t ɔ
d ɛ m kʰ	d ɛ m kʰ
ɡ i ɾ kʰ	ɡ i ɾ kʰ
t ɛ n d	t ɛ n d
ɑ ʒ ɑ n	ɑ ʒ ɑ n
pʰ i t͡ʃʰ χ	pʰ i t͡ʃʰ χ
r i ŋ ɡ	r i ŋ ɡ
ɑ s ɑ t͡s	ɑ s ɑ t͡s
ɑ v ɑ ɾ	ɑ v ɑ ɾ
ɑ l i kʰ	ɑ l i kʰ
h ɑ n i	h ɑ n i
t ɑ s ə	t ɑ s ə
b ɑ ɾ k	b ɑ ɾ k
m ɔ ɾ i	m ɔ ɾ i
kʰ i m kʰ	kʰ i m kʰ
f ɛ j s	f ɛ j s
v ɑ l s	v ɑ l s
v i ʃ i	v i ʃ i
h ɛ ʃ t	h ɛ ʃ t
ɑ ɾ kʰ ɑ	ɑ ɾ kʰ ɑ
ɑ n ɔ kʰ	ɑ n ɔ kʰ
ɑ z ɑ t	ɑ z ɑ t
ə n t͡s ɑ	ə n t͡s ɑ
z ɔ ɾ kʰ	z ɔ ɾ kʰ
kʰ ɑ χ t͡sʰ	kʰ ɑ χ t͡sʰ
k i l ɔ	k i l ɔ
k ɑ n t͡ʃʰ	k ɑ n t͡ʃʰ
kʰ ɛ l ɛ	kʰ ɛ l ɛ
m ɛ ŋ kʰ	m ɛ ŋ kʰ
b ɔ ʃ ɑ	b ɔ ʃ ɑ
k ɔ ŋ kʰ	k ɔ ŋ kʰ
b ɑ k ɔ	b ɑ k ɔ
ɑ h ɛ ʁ	ɑ h ɛ ʁ
h i m kʰ	h i m kʰ
ʃ ɛ ʁ d͡ʒ	ʃ ɛ ʁ d͡ʒ
kʰ ɑ ɾ t	kʰ ɑ ɾ t
t͡s ɑ j ɾ	t͡s ɑ j ɾ
z ɔ j ɑ	z ɔ j ɑ
v ɑ h ɛ	v ɑ h ɛ
ɔ ɾ ɔ kʰ	ɔ ɾ ɔ kʰ
ɡ j ɔ z	ɡ j ɔ z
m ɑ ʃ k	m ɑ ʃ k
pʰ ɔ t͡sʰ χ	pʰ ɔ t͡sʰ χ
h ɑ f kʰ	h ɑ f kʰ
v ɑ ɾ ʒ	v ɑ ɾ ʒ
v ɑ j ɾ	v ɑ j ɾ
l v ɔ v	l v ɔ v
ɡ ɛ ʁ d͡z	ɡ ɛ ʁ d͡z
m ɑ ɾ k	m ɑ ɾ k
i m i d͡ʒ	i m i d͡ʒ
ɛ ɾ i k	ɛ ɾ i k
b ɑ z ɑ	b ɑ z ɑ
b ɛ ɾ tʰ	b ɛ ɾ tʰ
m i tʰ ɛ	m i tʰ ɛ
v ɑ ɾ kʰ	v ɑ ɾ kʰ
i ɾ ɛ kʰ	i ɾ ɛ kʰ
ɑ j ɡ i	ɑ j ɡ i
k ɔ ɾ t	k ɔ ɾ t
l ɑ χ t	l ɑ χ t
h ɑ ɾ s	h ɑ ɾ s
n ɛ ɾ s	n ɛ ɾ s
ɡ ɔ t i	ɡ ɔ t i
χ ɑ r ə	χ ɑ r ə
kʰ ɑ ɔ s	kʰ ɑ ɔ s
h i m ɑ	h i m ɑ
ɡ ɑ ŋ ɡ	ɡ ɑ ŋ ɡ
p ɑ ɾ k	p ɑ ɾ k
k ɛ χ t	k ɛ χ t
k ɑ j i	k ɑ j i
d͡ʒ ɛ ɾ m	d͡ʒ ɛ ɾ m
kʰ ɑ j l	kʰ ɑ j l
m ɛ χ k	m ɛ χ k
i l i k	i l i k
ɑ l ɑ n	ɑ l ɑ n
kʰ ɑ n i	kʰ ɑ n i
f ɛ j kʰ	f ɛ j kʰ
s ɑ r ɑ	s ɑ r ɑ
m ɑ l i	m ɑ l i
t ɔ ɡ ɔ	t ɔ ɡ ɔ
pʰ ɔ ʃ i	pʰ ɔ ʃ i
χ ɔ ɾ tʰ	χ ɔ ɾ tʰ
r i ɡ ɑ	r i ɡ ɑ
t ɑ ɾ ɑ	t ɑ ɾ ɑ
z ɛ ɾ t͡s	z ɛ ɾ t͡s
k ɑ ʃ i	k ɑ ʃ i
t͡ʃ ɑ n t͡ʃ	t͡ʃ ɑ n t͡ʃ
r ɑ s ɑ	r ɑ s ɑ
m ɔ ʃ i	m ɔ ʃ i
ɡ i n d͡z	ɡ i n d͡z
ɑ ɾ ɑ t	ɑ ɾ ɑ t
l ɔ b i	l ɔ b i
v i k i	v i k i
ɡ ɑ χ tʰ	ɡ ɑ χ tʰ
ʒ ɑ n i	ʒ ɑ n i
ɑ ɡ ɑ tʰ	ɑ ɡ ɑ tʰ
h ɑ ɾ t͡sʰ	h ɑ ɾ t͡sʰ
ʃ i v ɑ	ʃ i v ɑ
m i t kʰ	m i t kʰ
m ɑ kʰ s	m ɑ kʰ s
ɡ ɔ n ɛ	ɡ ɔ n ɛ
kʰ i ɔ s	kʰ i ɔ s
h ɑ t͡sʰ i	h ɑ t͡sʰ i
ɡ ɔ ɾ ɡ	ɡ ɔ ɾ ɡ
h ɑ p k	h ɑ p k
d ɔ h ɑ	d ɔ h ɑ
s ɛ r i	s ɛ r i
m ɑ ɾ tʰ	m ɑ ɾ tʰ
ɑ n ɑ k	ɑ n ɑ k
v ɑ ŋ kʰ	v ɑ ŋ kʰ
s ɑ ɾ kʰ	s ɑ ɾ kʰ
b ɔ kʰ s	b ɔ kʰ s
ɔ t͡ʃ ɑ r	ɔ t͡ʃ ɑ r
t͡sʰ i ŋ k	t͡sʰ i ŋ k
ɡ ɔ ɾ t͡s	ɡ ɔ ɾ t͡s
h ɑ m ɑ	h ɑ m ɑ
ɑ r ɑ k	ɑ r ɑ k
m ɛ ɾ k	m ɛ ɾ k
l i n d	l i n d
ɑ v ɑ n	ɑ v ɑ n
ɔ s ɛ tʰ	ɔ s ɛ tʰ
d͡z i ɑ h	d͡z i ɑ h
ɡ j ɔ r	ɡ j ɔ r
h ɔ ɾ s	h ɔ ɾ s
d ɑ ʃ t	d ɑ ʃ t
ɑ m ɑ n	ɑ m ɑ n
r i s k	r i s k
k r i s	k r i s
n ɑ n ɑ	n ɑ n ɑ
v ɑ j kʰ	v ɑ j kʰ
ɡ ɔ ɾ t	ɡ ɔ ɾ t
ɑ v ɑ t	ɑ v ɑ t
ɑ b ɛ l	ɑ b ɛ l
z ɑ ɾ m	z ɑ ɾ m
b ɑ d͡ʒ i	b ɑ d͡ʒ i
ʃ ə n ɛ ɾ	ʃ ə n ɛ ɾ
n ɛ ɡ ə ɾ	n ɛ ɡ ə ɾ
tʰ ə ɾ ɛ v	tʰ ə ɾ ɛ v
kʰ ə n ɑ ɾ	kʰ ə n ɑ ɾ
j ɛ ɾ ɑ z	j ɛ ɾ ɑ z
t͡s ə n ɛ l	t͡s ə n ɛ l
h ə z ɔ ɾ	h ə z ɔ ɾ
n ɑ j ɛ v	n ɑ j ɛ v
d ɑ ʃ ə n	d ɑ ʃ ə n
pʰ ə n tʰ i	pʰ ə n tʰ i
t ə k ɑ ɾ	t ə k ɑ ɾ
v ɔ l ɔ r	v ɔ l ɔ r
h ɑ m ə ɾ	h ɑ m ə ɾ
j ɛ k ɔ ʁ	j ɛ k ɔ ʁ
v ɔ ɾ ɑ k	v ɔ ɾ ɑ k
k ə t ɑ k	k ə t ɑ k
kʰ ə t͡sʰ ɛ l	kʰ ə t͡sʰ ɛ l
l ə kʰ ɛ l	l ə kʰ ɛ l
kʰ ə ʃ ɛ l	kʰ ə ʃ ɛ l
k ə n i k	k ə n i k
t͡ʃ ə k ɛ l	t͡ʃ ə k ɛ l
j ɛ t i n	j ɛ t i n
ʁ ə ɾ i m	ʁ ə ɾ i m
pʰ ə t ɑ t͡s	pʰ ə t ɑ t͡s
k ə r i v	k ə r i v
k ə n i kʰ	k ə n i kʰ
χ ə pʰ ɛ l	χ ə pʰ ɛ l
j ɛ m i ʃ	j ɛ m i ʃ
k ə kʰ ɛ l	k ə kʰ ɛ l
n ə v ɛ ɾ	n ə v ɛ ɾ
kʰ ə s ɛ l	kʰ ə s ɛ l
ə s tʰ ɑ pʰ	ə s tʰ ɑ pʰ
i ŋ kʰ ə n	i ŋ kʰ ə n
d ɑ r ə n	d ɑ r ə n
ɡ ə l ɑ n	ɡ ə l ɑ n
j ɛ r ɑ l	j ɛ r ɑ l
t͡s ə l ɛ l	t͡s ə l ɛ l
d͡z ə kʰ ɛ l	d͡z ə kʰ ɛ l
ɑ ɾ k ə ʁ	ɑ ɾ k ə ʁ
s ə ɾ ɛ l	s ə ɾ ɛ l
χ ə r ɔ v	χ ə r ɔ v
χ ə m ɛ l	χ ə m ɛ l
χ ə n ɑ m	χ ə n ɑ m
ʒ ə l ɑ t	ʒ ə l ɑ t
t ə p i t͡ʃʰ	t ə p i t͡ʃʰ
χ ə t i ʁ	χ ə t i ʁ
χ ə tʰ ɑ n	χ ə tʰ ɑ n
ə ʃ t ɑ b	ə ʃ t ɑ b
ɑ s t ə ʁ	ɑ s t ə ʁ
k ə ʁ z i	k ə ʁ z i
j ɛ tʰ ɛ ɾ	j ɛ tʰ ɛ ɾ
f ə ɾ i z	f ə ɾ i z
h i m ə n	h i m ə n
n ə v ɑ ɡ	n ə v ɑ ɡ
ə s t ɛ p	ə s t ɛ p
b ə ɾ ɛ t	b ə ɾ ɛ t
ʃ ə pʰ ɛ l	ʃ ə pʰ ɛ l
pʰ ə ʃ ɑ t	pʰ ə ʃ ɑ t
pʰ ə t ɛ l	pʰ ə t ɛ l
tʰ ə kʰ ɛ l	tʰ ə kʰ ɛ l
m ɛ t ə ɾ	m ɛ t ə ɾ
v ɔ s k ɛ	v ɔ s k ɛ
t͡s ə n ɔ t	t͡s ə n ɔ t
z ə t ɛ l	z ə t ɛ l
χ ə ɾ ɑ m	χ ə ɾ ɑ m
v ɔ ɾ ɔ t	v ɔ ɾ ɔ t
ʁ ə p t i	ʁ ə p t i
t ə h ɑ t͡ʃ	t ə h ɑ t͡ʃ
n ə ɾ ɑ n	n ə ɾ ɑ n
h ə ɾ ɛ l	h ə ɾ ɛ l
t ɛ t ə ɾ	t ɛ t ə ɾ
t͡ʃʰ ə v ɛ l	t͡ʃʰ ə v ɛ l
v ɔ s ɔ χ	v ɔ s ɔ χ
t͡s ə ɾ ɑ ɾ	t͡s ə ɾ ɑ ɾ
ɡ ə ɾ i p	ɡ ə ɾ i p
p ə n ɑ k	p ə n ɑ k
j ɛ ɾ kʰ i	j ɛ ɾ kʰ i
l i t ə ɾ	l i t ə ɾ
m ə tʰ ɔ m	m ə tʰ ɔ m
v ə t i t	v ə t i t
s ə ʁ ɔ t͡sʰ	s ə ʁ ɔ t͡sʰ
v ə tʰ ɑ ɾ	v ə tʰ ɑ ɾ
t ə h ɑ s	t ə h ɑ s
h ə ɾ ɑ t͡ʃʰ	h ə ɾ ɑ t͡ʃʰ
k ə t͡ʃ ɑ t	k ə t͡ʃ ɑ t
χ ə m ɔ ɾ	χ ə m ɔ ɾ
ɡ ə t͡s i k	ɡ ə t͡s i k
l i kʰ ə n	l i kʰ ə n
h ə s k ɑ	h ə s k ɑ
d ə ʒ ɑ ɾ	d ə ʒ ɑ ɾ
t͡s ə l i k	t͡s ə l i k
j ɛ ʁ j ɑ	j ɛ ʁ j ɑ
k ə ɾ j ɑ	k ə ɾ j ɑ
j ɛ ɾ ɑ k	j ɛ ɾ ɑ k
b ə d͡ʒ i d͡ʒ	b ə d͡ʒ i d͡ʒ
ɡ ə ɾ i t͡ʃʰ	ɡ ə ɾ i t͡ʃʰ
j ɛ ɑ h ə k ə	j ɛ ɑ h ə k ə
j ɛ ɑ t ə m ə	j ɛ ɑ t ə m ə
ɑ ɑ ɡ ə χ ə	ɑ ɑ ɡ ə χ ə
v ɔ s k ə ɾ	v ɔ s k ə ɾ
ɑ ɑ p ə v ə	ɑ ɑ p ə v ə
l ə k t i	l ə k t i
pʰ ə l ɑ f	pʰ ə l ɑ f
t͡sʰ ɑ t͡s ə ɾ	t͡sʰ ɑ t͡s ə ɾ
m ə ʁ ɔ n	m ə ʁ ɔ n
χ ɑ tʰ ə ɾ	χ ɑ tʰ ə ɾ
kʰ ə s ɑ k	kʰ ə s ɑ k
t ɑ kʰ ə ɾ	t ɑ kʰ ə ɾ
ə ʃ t ɑ p	ə ʃ t ɑ p
t͡s ə t͡s ɑ k	t͡s ə t͡s ɑ k
m ə tʰ ɑ ɾ	m ə tʰ ɑ ɾ
m ə χ ɔ t͡sʰ	m ə χ ɔ t͡sʰ
h ə ɾ ɛ s	h ə ɾ ɛ s
ə z ɡ ɑ l	ə z ɡ ɑ l
j ɛ t ɛ v	j ɛ t ɛ v
l ə v ɑ l	l ə v ɑ l
v ə ɾ ɑ t͡sʰ	v ə ɾ ɑ t͡sʰ
pʰ ɑ z ə l	pʰ ɑ z ə l
m ə ʁ ɛ ʁ	m ə ʁ ɛ ʁ
t͡s ɑ ʁ ə ɾ	t͡s ɑ ʁ ə ɾ
χ ə z ɛ l	χ ə z ɛ l
v ɔ z n i	v ɔ z n i
ɡ ə n ɛ l	ɡ ə n ɛ l
s ə t ɛ l	s ə t ɛ l
ə z ɡ ɔ n	ə z ɡ ɔ n
pʰ ɔ kʰ ə ɾ	pʰ ɔ kʰ ə ɾ
n ə ʃ ɑ n	n ə ʃ ɑ n
k ə ɾ ɛ l	k ə ɾ ɛ l
ɡ ə d ɑ k	ɡ ə d ɑ k
j ɛ ɾ ɛ kʰ	j ɛ ɾ ɛ kʰ
v ə r ɑ m	v ə r ɑ m
k ə tʰ ɛ l	k ə tʰ ɛ l
tʰ ə ɾ i kʰ	tʰ ə ɾ i kʰ
tʰ ə χ k i	tʰ ə χ k i
ɑ z d ə ɾ	ɑ z d ə ɾ
h ə n ɑ ɾ	h ə n ɑ ɾ
k ə ɡ ɑ n	k ə ɡ ɑ n
m ə t i k	m ə t i k
k ə t ɔ ɾ	k ə t ɔ ɾ
v ə ɾ ɑ n	v ə ɾ ɑ n
kʰ ə tʰ ɔ t͡sʰ	kʰ ə tʰ ɔ t͡sʰ
j ɛ ɾ ɛ k	j ɛ ɾ ɛ k
ʃ ə r ɛ l	ʃ ə r ɛ l
n ə v ɑ z	n ə v ɑ z
m i j ɑ k	m i j ɑ k
k ə l ɔ ɾ	k ə l ɔ ɾ
d͡z ə m ɛ r	d͡z ə m ɛ r
j ɛ l ɑ k	j ɛ l ɑ k
m ə n ɑ kʰ	m ə n ɑ kʰ
t ə ɡ ɛ t	t ə ɡ ɛ t
j ɛ ɾ ɛ t͡sʰ	j ɛ ɾ ɛ t͡sʰ
l ə s ɛ l	l ə s ɛ l
v ɑ t͡ʃʰ ɛ	v ɑ t͡ʃʰ ɛ
k ɑ ɾ s	k ɑ ɾ s
m ɛ ɾ i	m ɛ ɾ i
ɑ f t ɔ	ɑ f t ɔ
k i v i	k i v i
ɑ ɾ ɑ t͡s	ɑ ɾ ɑ t͡s
m ɑ ɾ s	m ɑ ɾ s
ɡ ɑ n d͡z	ɡ ɑ n d͡z
i n t͡ʃʰ kʰ	i n t͡ʃʰ kʰ
t ɔ ɾ f	t ɔ ɾ f
d ɛ χ t͡sʰ	d ɛ χ t͡sʰ
h ɔ s kʰ	h ɔ s kʰ
ɑ p ɛ ɾ	ɑ p ɛ ɾ
ɑ ɾ ɑ ɡ	ɑ ɾ ɑ ɡ
ɛ l ɛ n	ɛ l ɛ n
ɔ m s k	ɔ m s k
ɡ ɑ ɾ i	ɡ ɑ ɾ i
pʰ ɑ j l	pʰ ɑ j l
ɑ v i ʃ	ɑ v i ʃ
ɡ ɑ ɾ ʃ	ɡ ɑ ɾ ʃ
ɡ ə n ɑ t͡ʃ	ɡ ə n ɑ t͡ʃ
ɡ ə ɾ ɑ z	ɡ ə ɾ ɑ z
χ ə m ɑ t͡s	χ ə m ɑ t͡s
m ə tʰ ɑ m	m ə tʰ ɑ m
d i j ɑ k	d i j ɑ k
p ə t ɛ ɾ	p ə t ɛ ɾ
χ ə p i p	χ ə p i p
l ɑ kʰ ɑ	l ɑ kʰ ɑ
n ɑ t ɔ	n ɑ t ɔ
d͡z i ɾ kʰ	d͡z i ɾ kʰ
k ɑ ɾ ɔ	k ɑ ɾ ɔ
χ ɛ l kʰ	χ ɛ l kʰ
n i s t	n i s t
l i n t͡sʰ	l i n t͡sʰ
h ɔ v ɔ	h ɔ v ɔ
p ɛ t kʰ	p ɛ t kʰ
ɑ tʰ ɔ r	ɑ tʰ ɔ r
ɑ p ɑ t	ɑ p ɑ t
ɑ b ɾ ɑ	ɑ b ɾ ɑ
ɑ n ɛ l	ɑ n ɛ l
χ ɔ ɾ ʃ	χ ɔ ɾ ʃ
ɡ ɑ j l	ɡ ɑ j l
l ɛ ɾ k	l ɛ ɾ k
i ɾ ɑ n	i ɾ ɑ n
ɔ m ɑ ɾ	ɔ m ɑ ɾ
m ɑ m ɑ	m ɑ m ɑ
h ɛ s t	h ɛ s t
pʰ i t͡ʃ i	pʰ i t͡ʃ i
ɔ m ɑ n	ɔ m ɑ n
ɔ j i n	ɔ j i n
pʰ ɑ s t	pʰ ɑ s t
tʰ ɑ ɾ m	tʰ ɑ ɾ m
i ɾ ɑ kʰ	i ɾ ɑ kʰ
ɑ s j ɑ	ɑ s j ɑ
χ ɔ s kʰ	χ ɔ s kʰ
v ɑ ŋ k	v ɑ ŋ k
χ i n d	χ i n d
b ɛ ɾ kʰ	b ɛ ɾ kʰ
kʰ ɛ n i	kʰ ɛ n i
k i ɾ t͡ʃ	k i ɾ t͡ʃ
k ɔ ʁ m	k ɔ ʁ m
d ɛ p i	d ɛ p i
n ɛ ɾ v	n ɛ ɾ v
s ɑ ɾ d	s ɑ ɾ d
d ɑ ɾ t͡sʰ	d ɑ ɾ t͡sʰ
m i ɾ kʰ	m i ɾ kʰ
k ɔ ɡ i	k ɔ ɡ i
d͡ʒ ə v ɑ l	d͡ʒ ə v ɑ l
ɑ r ɑ t	ɑ r ɑ t
n ɔ t͡ʃ i	n ɔ t͡ʃ i
m ɛ ɾ v	m ɛ ɾ v
t͡ʃ ɑ ɾ p	t͡ʃ ɑ ɾ p
k ɑ j t͡s	k ɑ j t͡s
h ɑ j t͡sʰ	h ɑ j t͡sʰ
t͡sʰ ɑ n t͡sʰ	t͡sʰ ɑ n t͡sʰ
h ɑ t͡ʃ ɔ	h ɑ t͡ʃ ɔ
ɡ ə ɾ ɑ m	ɡ ə ɾ ɑ m
m ə h ɛ ɾ	m ə h ɛ ɾ
ɡ ə tʰ ɑ l	ɡ ə tʰ ɑ l
b ə t ɛ l	b ə t ɛ l
v ɔ ɾ ɔ m	v ɔ ɾ ɔ m
m ə s ɔ t	m ə s ɔ t
k ə tʰ ɔ t	k ə tʰ ɔ t
ʃ ə kʰ ɛ ʁ	ʃ ə kʰ ɛ ʁ
b ə l ɔ k	b ə l ɔ k
v ə r ɑ z	v ə r ɑ z
m ə ʃ ɑ k	m ə ʃ ɑ k
v ɑ ɡ ə ɾ	v ɑ ɡ ə ɾ
d ə p i ɾ	d ə p i ɾ
tʰ ə ɾ ɑ ʃ	tʰ ə ɾ ɑ ʃ
pʰ ə t͡ʃʰ ɑ k	pʰ ə t͡ʃʰ ɑ k
h ɑ v ə ɾ	h ɑ v ə ɾ
ɡ ə ɾ ɔ ʁ	ɡ ə ɾ ɔ ʁ
t͡ʃ ə t͡ʃʰ ɑ l	t͡ʃ ə t͡ʃʰ ɑ l
z ə ɾ ɑ h	z ə ɾ ɑ h
p ə t͡ʃ ɛ ʁ	p ə t͡ʃ ɛ ʁ
v ə t͡ʃ ɑ ɾ	v ə t͡ʃ ɑ ɾ
t͡ʃ ə ɾ ɑ kʰ	t͡ʃ ə ɾ ɑ kʰ
j ɛ m ɛ n	j ɛ m ɛ n
j ɛ ʁ ɛ kʰ	j ɛ ʁ ɛ kʰ
s ə ɾ ɑ h	s ə ɾ ɑ h
j ɛ ʁ ɑ t͡s	j ɛ ʁ ɑ t͡s
ʃ ə χ tʰ ɑ	ʃ ə χ tʰ ɑ
χ ə t͡sʰ ɑ n	χ ə t͡sʰ ɑ n
j ɛ ʁ ɛ ɡ	j ɛ ʁ ɛ ɡ
k ə t͡sʰ ɛ l	k ə t͡sʰ ɛ l
m ə k ɑ n	m ə k ɑ n
k ə z ɑ k	k ə z ɑ k
r i j ɔ n	r i j ɔ n
ʃ ə v ɛ d	ʃ ə v ɛ d
n ə ʃ ɛ l	n ə ʃ ɛ l
k ə l ɑ pʰ	k ə l ɑ pʰ
t ə n ɑ k	t ə n ɑ k
d ə h ɔ l	d ə h ɔ l
s ɑ r ə n	s ɑ r ə n
ɑ j ʒ ə m	ɑ j ʒ ə m
s ɑ n ə ɾ	s ɑ n ə ɾ
χ ə t͡sʰ i k	χ ə t͡sʰ i k
v ə h ɑ t	v ə h ɑ t
m ɑ n ə ɾ	m ɑ n ə ɾ
j ɛ ʁ i ɾ	j ɛ ʁ i ɾ
l ə t͡s ɛ l	l ə t͡s ɛ l
ə s t i n	ə s t i n
tʰ ɛ j ɛ v	tʰ ɛ j ɛ v
χ ɑ r ə n	χ ɑ r ə n
p ə l ɔ ɾ	p ə l ɔ ɾ
s ə v i n	s ə v i n
t͡s ə ʁ ɔ t	t͡s ə ʁ ɔ t
t͡sʰ ə ɾ ɛ l	t͡sʰ ə ɾ ɛ l
h ə ɾ ɑ t	h ə ɾ ɑ t
p ə s ɑ k	p ə s ɑ k
t͡s ə t͡s ɛ l	t͡s ə t͡s ɛ l
l ə ʁ i m	l ə ʁ i m
j ɛ v ɾ ɔ	j ɛ v ɾ ɔ
n ə m ɑ n	n ə m ɑ n
k i j ɛ v	k i j ɛ v
kʰ ə n ɑ t͡s	kʰ ə n ɑ t͡s
v ɔ s k i	v ɔ s k i
m ə ʁ ɛ l	m ə ʁ ɛ l
t͡ʃʰ ə b ɛ ɾ	t͡ʃʰ ə b ɛ ɾ
ɡ ə ɾ ɔ h	ɡ ə ɾ ɔ h
t͡s ə χ ɑ t͡s	t͡s ə χ ɑ t͡s
χ ɑ t͡ʃʰ ɔ	χ ɑ t͡ʃʰ ɔ
m ɑ χ ə ɾ	m ɑ χ ə ɾ
kʰ ə n ɛ l	kʰ ə n ɛ l
b ə l i tʰ	b ə l i tʰ
t͡s ə χ ɔ ʁ	t͡s ə χ ɔ ʁ
m ə n ɑ l	m ə n ɑ l
m ɛ ʁ ə ɾ	m ɛ ʁ ə ɾ
ɑ ŋ ɡ ə ʁ	ɑ ŋ ɡ ə ʁ
v ə ɾ ɛ ʒ	v ə ɾ ɛ ʒ
s u ɾ	s u ɾ
u ɾ t͡sʰ	u ɾ t͡sʰ
h u ɾ	h u ɾ
ʁ u ʃ	ʁ u ʃ
d͡z u k	d͡z u k
l u r	l u r
ʃ u kʰ	ʃ u kʰ
t u ɾ	t u ɾ
t ɑ ɾː	t ɑ ɾ
t u n	t u n
b u tʰ	b u tʰ
h u m	h u m
j u ɾ	j u ɾ
b u kʰ	b u kʰ
s u t	s u t
h u ʃ	h u ʃ
u t i	u t i
d͡ʒ u ɾ	d͡ʒ u ɾ
χ u pʰ	χ u pʰ
l u ɾ	l u ɾ
t͡sʰ u p	t͡sʰ u p
kʰ u n	kʰ u n
tʰ u kʰ	tʰ u kʰ
u n d	u n d
pʰ u tʰ	pʰ u tʰ
u ʁ i	u ʁ i
pʰ u t͡ʃʰ	pʰ u t͡ʃʰ
m u n	m u n
t͡s u χ	t͡s u χ
b u h	b u h
l u t͡s	l u t͡s
r u s	r u s
ɑ r u	ɑ r u
pʰ u l	pʰ u l
pʰ u kʰ	pʰ u kʰ
t u z	t u z
u f ɑ	u f ɑ
ɑ nː ɑ	ɑ nː ɑ
k u tʰ	k u tʰ
d u n	d u n
k u ɾ	k u ɾ
b u χ	b u χ
d u χ	d u χ
k u t͡sʰ	k u t͡sʰ
u m p	u m p
s u kʰ	s u kʰ
u χ t	u χ t
t u pʰ	t u pʰ
h u r	h u r
d u r	d u r
k u r	k u r
n u ʃ	n u ʃ
b u r	b u r
s u s	s u s
k u t	k u t
b u n	b u n
d u ɾ	d u ɾ
m u kʰ	m u kʰ
k ɑ nː	k ɑ nː
tʰ u χ	tʰ u χ
tʰ u tʰ	tʰ u tʰ
tʰ u z	tʰ u z
t͡sʰ u l	t͡sʰ u l
ɛ <<unk>> ɛ	ɛ <unk> ɛ
ɡ u n	ɡ u n
k u l	k u l
z u t	z u t
t u t	t u t
ɑ t͡s u	ɑ t͡s u
pʰ u r	pʰ u r
m u ɾ	m u ɾ
tʰ u l	tʰ u l
ɑ ʁ u	ɑ ʁ u
u χ t	u χ t
k u z	k u z
b u d	b u d
v u ʃ	v u ʃ
t͡s u r	t͡s u r
u r i	u r i
tʰ u ɾ	tʰ u ɾ
j u ʁ	j u ʁ
pʰ u ʃ	pʰ u ʃ
d u kʰ	d u kʰ
d͡z u n	d͡z u n
z u ɾ	z u ɾ
n i ɾ h	n i ɾ h
χ u tʰ	χ u tʰ
f i nː	f i nː
s u ʁ	s u ʁ
b u ɡ	b u ɡ
kʰ u ɾ	kʰ u ɾ
ɑ <<unk>> ɑ	ɑ <unk> ɑ
ʃ u t	ʃ u t
r u b	r u b
ʃ u n	ʃ u n
ɑ ɾ u	ɑ ɾ u
u ʃ kʰ	u ʃ kʰ
ʒ ɑ n t	ʒ ɑ n t
b ɑ ɾ t͡sʰ	b ɑ ɾ t͡sʰ
ɑ r ɑ t͡ʃʰ	ɑ r ɑ t͡ʃʰ
h ɔ kʰ i	h ɔ kʰ i
h ɔ r i	h ɔ r i
h ɑ ɾ k	h ɑ ɾ k
d͡z ɛ r kʰ	d͡z ɛ r kʰ
r ɑ j ɑ	r ɑ j ɑ
h ɑ s k	h ɑ s k
ɔ h ɑ n	ɔ h ɑ n
t ɑ ʃ t	t ɑ ʃ t
ɑ z ɔ t	ɑ z ɔ t
n ɑ f tʰ	n ɑ f tʰ
d͡ʒ ɑ ɾ tʰ	d͡ʒ ɑ ɾ tʰ
m ɑ kʰ i	m ɑ kʰ i
l ɔ ɾ d͡z	l ɔ ɾ d͡z
ɛ m i ɾ	ɛ m i ɾ
i n t͡ʃʰ i	i n t͡ʃʰ i
ɑ v ɛ t	ɑ v ɛ t
s ɛ ɾ m	s ɛ ɾ m
t͡ʃʰ i ʁ d͡ʒ	t͡ʃʰ i ʁ d͡ʒ
v ɑ ʁ ə	v ɑ ʁ ə
k i ɾ tʰ	k i ɾ tʰ
d ɔ n i	d ɔ n i
r ɛ ɑ l	r ɛ ɑ l
ɑ ʁ ɑ l	ɑ ʁ ɑ l
ʁ u m	ʁ u m
kʰ ɛ r i	kʰ ɛ r i
ɡ ɑ z ɑ	ɡ ɑ z ɑ
h ɑ j k	h ɑ j k
n ɑ ɾ ɛ	n ɑ ɾ ɛ
ɛ ɾ ɛ s	ɛ ɾ ɛ s
ɑ r ɑ t͡s	ɑ r ɑ t͡s
ɑ pʰ s ɛ	ɑ pʰ s ɛ
ɔ ʁ ɑ k	ɔ ʁ ɑ k
ɡ i ɾ k	ɡ i ɾ k
ɑ χ ɔ r	ɑ χ ɔ r
m ɑ n ɛ	m ɑ n ɛ
ɑ n t͡sʰ kʰ	ɑ n t͡sʰ kʰ
t ɔ m s	t ɔ m s
s ɛ kʰ s	s ɛ kʰ s
ʃ ɛ ɾ t	ʃ ɛ ɾ t
b i n t	b i n t
p ɑ ɾ t	p ɑ ɾ t
h ɛ t kʰ	h ɛ t kʰ
ɑ s ɛ ʁ	ɑ s ɛ ʁ
b ɾ ɔ m	b ɾ ɔ m
s i ɾ ɔ	s i ɾ ɔ
l i ɔ n	l i ɔ n
ɑ n t i	ɑ n t i
v i z ɑ	v i z ɑ
ɡ i n i	ɡ i n i
p i t i	p i t i
ɑ v ɛ l	ɑ v ɛ l
ɑ r i tʰ	ɑ r i tʰ
ɑ ʁ ɛ ʁ	ɑ ʁ ɛ ʁ
ɑ s ɛ l	ɑ s ɛ l
f i l m	f i l m
h ɑ j kʰ	h ɑ j kʰ
z ɛ χ t͡ʃʰ	z ɛ χ t͡ʃʰ
m ɛ χ kʰ	m ɛ χ kʰ
h ɑ ɾ d	h ɑ ɾ tʰ
h ɔ kʰ s	h ɔ kʰ s
h i ŋ ɡ	h i ŋ ɡ
ɑ j ɾ i	ɑ j ɾ i
d͡z ɑ j n	d͡z ɑ j n
h ɛ ɾ kʰ	h ɛ ɾ kʰ
h ə l u	h ə l u
ɑ ʁ ɛ k	ɑ ʁ ɛ k
tʰ ɛ ʁ i	tʰ ɛ ʁ i
p ɛ ɾ t͡ʃ	p ɛ ɾ t͡ʃ
i ɾ ɑ ɾ	i ɾ ɑ ɾ
t͡ʃ ɔ ɾ t	t͡ʃ ɔ ɾ t
k ɑ ŋ kʰ	k ɑ ŋ kʰ
s ɑ n d͡z	s ɑ n d͡z
b ɑ z ɛ	b ɑ z ɛ
s ɔ n ɑ	s ɔ n ɑ
ɡ j ɔ l	ɡ j ɔ l
j ɔ ɡ ɑ	j ɔ ɡ ɑ
ɑ ɾ ɑ t͡sʰ	ɑ ɾ ɑ t͡sʰ
ʃ ɛ ʃ t	ʃ ɛ ʃ t
n ɑ ɾ t	n ɑ ɾ t
t͡sʰ ɑ ŋ k	t͡sʰ ɑ ŋ k
m ɔ ɾ tʰ	m ɔ ɾ tʰ
s i n d͡z	s i n d͡z
t ɑ n d͡z	t ɑ n d͡z
h ɑ j ɾ	h ɑ j ɾ
s ɑ r ə	s ɑ r ə
h ɔ ɾ tʰ	h ɔ ɾ tʰ
ʃ ɛ ʁ b	ʃ ɛ ʁ b
tʰ ɛ ɾ tʰ	tʰ ɛ ɾ tʰ
ɑ k ɑ n	ɑ k ɑ n
h ɑ ŋ ɡ	h ɑ ŋ ɡ
ɑ m i s	ɑ m i s
l ɔ r i	l ɔ r i
v ɑ ɾ t͡sʰ	v ɑ ɾ t͡sʰ
ɛ d ɔ	ɛ d ɔ
l i kʰ	l i kʰ
t͡ʃʰ ɔ ɾ	t͡ʃʰ ɔ ɾ
p ɛ s	p ɛ s
d͡z ɛ v	d͡z ɛ v
tʰ ɛ kʰ	tʰ ɛ kʰ
kʰ ɑ v	kʰ ɑ v
s ɑ r	s ɑ r
h ɑ t	h ɑ t
m ɑ ɾ	m ɑ ɾ
t ɑ ɾ	t ɑ ɾ
χ ɑ d	χ ɑ d
s ɔ v	s ɔ v
tʰ i v	tʰ i v
d ɛ ɾ	d ɛ ɾ
v ɑ t	v ɑ t
s ɛ m	s ɛ m
tʰ ɛ ɾ	tʰ ɛ ɾ
v ɛ h	v ɛ h
ɑ ɾ ɑ	ɑ ɾ ɑ
n i ʃ	n i ʃ
v ɑ j	v ɑ j
m ɑ k	m ɑ k
ɑ ɾ ɛ	ɑ ɾ ɛ
t͡s ɛ t͡s	t͡s ɛ t͡s
t͡s ɑ χ	t͡s ɑ χ
n ɛ ɾ	n ɛ ɾ
k ɛ s	k ɛ s
ɡ ɑ h	ɡ ɑ h
d ɔ ʁ	d ɔ ʁ
s ɛ χ	s ɛ χ
h ɔ d	h ɔ d
j ɛ n	j ɛ n
ɑ b ɔ	ɑ b ɔ
ɡ ɔ m	ɡ ɔ m
t͡s ɔ r	t͡s ɔ r
kʰ ɔ ʁ	kʰ ɔ ʁ
ɑ χ t	ɑ χ t
i n d͡z	i n d͡z
χ ɔ t͡sʰ	χ ɔ t͡sʰ
m ɔ r	m ɔ r
l ɔ k	l ɔ k
z ɔ d	z ɔ d
d ɛ m	d ɛ m
h ɔ t	h ɔ t
t͡ʃ ɔ n	t͡ʃ ɔ n
m ɛ z	m ɛ z
χ ɛ tʰ	χ ɛ tʰ
ɑ n d	ɑ n d
ʃ ɛ f	ʃ ɛ f
h ɑ b	h ɑ b
m ɑ m	m ɑ m
ɛ ɾ ɛ	ɛ ɾ ɛ
ɑ j l	ɑ j l
z ɔ ɾ	z ɔ ɾ
tʰ ɛ j	tʰ ɛ j
ɡ ɔ ʁ	ɡ ɔ ʁ
t͡ʃʰ ɔ pʰ	t͡ʃʰ ɔ pʰ
k i t͡sʰ	k i t͡sʰ
n ɔ j	n ɔ j
t͡sʰ i n	t͡sʰ i n
z ɑ r	z ɑ r
kʰ ɑ kʰ	kʰ ɑ kʰ
s ɑ ʁ	s ɑ ʁ
t ɑ k	t ɑ k
t͡s ɛ ɾ	t͡s ɛ ɾ
ɑ ɑ i	ɑ ɑ i
m ɛ t͡s	m ɛ t͡s
s ɛ tʰ	s ɛ tʰ
m ɛ ɡ	m ɛ ɡ
t ɑ s	t ɑ s
pʰ ɔ ʁ	pʰ ɔ ʁ
i b ɔ	i b ɔ
tʰ ɑ t͡sʰ	tʰ ɑ t͡sʰ
b ɑ h	b ɑ h
b ɑ l	b ɑ l
ʃ ɛ ʁ	ʃ ɛ ʁ
tʰ ɑ s	tʰ ɑ s
l ɑ v	l ɑ v
t͡ʃ ɔ χ	t͡ʃ ɔ χ
d͡z ɛ n	d͡z ɛ n
n ɑ χ	n ɑ χ
r ɛ pʰ	r ɛ pʰ
b ɛ r	b ɛ r
kʰ ɑ ɾ	kʰ ɑ ɾ
s ɑ n	s ɑ n
ɑ ɾ k	ɑ ɾ k
m ɛ t͡ʃʰ	m ɛ t͡ʃʰ
t͡ʃ ɑ j	t͡ʃ ɑ j
ɑ n t͡sʰ	ɑ n t͡sʰ
v i n	v i n
k ɑ tʰ	k ɑ tʰ
s ɛ ɡ	s ɛ ɡ
h ɔ ɾ	h ɔ ɾ
j ɑ ʃ	j ɑ ʃ
tʰ ɔ ʁ	tʰ ɔ ʁ
k i ɾ	k i ɾ
z ɛ χ	z ɛ χ
ʃ ɑ l	ʃ ɑ l
ɑ χ t	ɑ χ t
i n t͡ʃʰ	i n t͡ʃʰ
h ɛ ɡ	h ɛ ɡ
k ɑ ʁ	k ɑ ʁ
ɑ j t͡s	ɑ j t͡s
ɑ ɾ m	ɑ ɾ m
t͡s i t	t͡s i t
k ɛ n	k ɛ n
t ɑ kʰ	t ɑ kʰ
f ɛ n	f ɛ n
ɡ ɑ m	ɡ ɑ m
ɑ j t͡sʰ	ɑ j t͡sʰ
b i l	b i l
p ɑ t͡ʃʰ	p ɑ t͡ʃʰ
d ɑ s	d ɑ s
pʰ i ʁ	pʰ i ʁ
t͡sʰ ɑ χ	t͡sʰ ɑ χ
t ɔ ʁ	t ɔ ʁ
l ɑ t͡sʰ	l ɑ t͡sʰ
v i z	v i z
ɡ i ɾ	ɡ i ɾ
d͡ʒ i m	d͡ʒ i m
i n ə	i n ə
s i n	s i n
t ɛ v	t ɛ v
f ɔ n	f ɔ n
s ɛ r	s ɛ r
d͡ʒ ɛ b	d͡ʒ ɛ b
s ɔ χ	s ɔ χ
kʰ ɔ r	kʰ ɔ r
ɡ ɑ d͡ʒ	ɡ ɑ d͡ʒ
m ɔ ɾ	m ɔ ɾ
t͡ʃʰ ɑ n	t͡ʃʰ ɑ n
ʃ ɛ m	ʃ ɛ m
t ɑ p	t ɑ p
p ɑ n	p ɑ n
k i n	k i n
d͡z ɑ r	d͡z ɑ r
h ɑ tʰ	h ɑ tʰ
d i kʰ	d i kʰ
b ɑ v	b ɑ v
m i s	m i s
h ɛ ɾ	h ɛ ɾ
n ɔ ɾ	n ɔ ɾ
v ɛ p	v ɛ p
h ɔ p	h ɔ p
l ɔ d͡z	l ɔ d͡z
l ɔ ʃ	l ɔ ʃ
h ɑ v	h ɑ v
s ɛ p	s ɛ p
kʰ ɑ d͡ʒ	kʰ ɑ d͡ʒ
l ɔ kʰ	l ɔ kʰ
u ʃ	u ʃ
t͡ʃʰ u	t͡ʃʰ u
u ɾ	u ɾ
u tʰ	u tʰ
h u	h u
u ʒ	u ʒ
n u	n u
b u	b u
d͡z u	d͡z u
u s	u s
ɑ <<unk>>	ɑ <unk>
l u	l u
d u	d u
b ɔ ʁ	b ɔ ʁ
kʰ i tʰ	kʰ i tʰ
h ɑ s	h ɑ s
t͡ʃ i kʰ	t͡ʃ i kʰ
l ɑ ɾ	l ɑ ɾ
s ɑ l	s ɑ l
b ɑ ɾ	b ɑ ɾ
z ɔ h	z ɔ h
t͡s ɑ r	t͡s ɑ r
t͡ʃʰ ɑ ʁ	t͡ʃʰ ɑ ʁ
m ɛ ɾ	m ɛ ɾ
h ɔ kʰ	h ɔ kʰ
l ɛ r	l ɛ r
pʰ ɔ χ	pʰ ɔ χ
ɡ ɔ kʰ	ɡ ɔ kʰ
h ɔ n	h ɔ n
t͡sʰ ɑ ɾ	t͡sʰ ɑ ɾ
k ɔ ʁ	k ɔ ʁ
χ ɔ t	χ ɔ t
m ɑ ʁ	m ɑ ʁ
ɑ l t	ɑ l t
χ ɔ z	χ ɔ z
ɡ ɔ l	ɡ ɔ l
z ɔ r	z ɔ r
k ɔ t͡ʃʰ	k ɔ t͡ʃʰ
t͡s ɑ k	t͡s ɑ k
ɑ ʁ i	ɑ ʁ i
ɡ ɑ r	ɡ ɑ r
k ɑ v	k ɑ v
t͡s ɔ t͡sʰ	t͡s ɔ t͡sʰ
n ɑ n	n ɑ n
t͡ʃʰ ɑ pʰ	t͡ʃʰ ɑ pʰ
t ɛ ɾ	t ɛ ɾ
d ɛ v	d ɛ v
tʰ i z	tʰ i z
ɡ ɛ n	ɡ ɛ n
v ɛ t͡ʃ	v ɛ t͡ʃ
t͡ʃʰ i tʰ	t͡ʃʰ i tʰ
l ɛ p	l ɛ p
t͡s i t͡s	t͡s i t͡s
b ɑ k	b ɑ k
ʒ ɑ m	ʒ ɑ m
χ ɔ t͡ʃʰ	χ ɔ t͡ʃʰ
χ ɑ ʁ	χ ɑ ʁ
k i p	k i p
b ɑ χ	b ɑ χ
v ɛ v	v ɛ v
d ɑ t	d ɑ t
kʰ ɛ z	kʰ ɛ z
d͡ʒ i n	d͡ʒ i n
h i n	h i n
s ɑ tʰ	s ɑ tʰ
χ ɑ k	χ ɑ k
ɡ ɛ ɾ	ɡ ɛ ɾ
tʰ ɛ ʒ	tʰ ɛ ʒ
d͡z ɑ ɾ	d͡z ɑ ɾ
m i t	m i t
tʰ ɑ i	tʰ ɑ i
p ɑ k	p ɑ k
tʰ ɛ pʰ	tʰ ɛ pʰ
b ɔ t͡sʰ	b ɔ t͡sʰ
l ɛ h	l ɛ h
l ɔ χ	l ɔ χ
t ɑ t	t ɑ t
l ɛ k	l ɛ k
ɑ b ɑ	ɑ b ɑ
k ɑ ɾ	k ɑ ɾ
t͡ʃ ɑ kʰ	t͡ʃ ɑ kʰ
ɡ ɛ d͡ʒ	ɡ ɛ d͡ʒ
kʰ ɑ ʃ	kʰ ɑ ʃ
ɑ ɡ ɑ	ɑ ɡ ɑ
t͡sʰ ɑ v	t͡sʰ ɑ v
d͡ʒ ɔ k	d͡ʒ ɔ k
ɡ ɑ l	ɡ ɑ l
ʃ i v	ʃ i v
d ɛ r	d ɛ r
ɑ p ɑ	ɑ p ɑ
kʰ ɔ s	kʰ ɔ s
kʰ ɛ n	kʰ ɛ n
t͡ʃʰ ɑ ɾ	t͡ʃʰ ɑ ɾ
p ɑ kʰ	p ɑ kʰ
h ɑ h	h ɑ h
m ɑ h	m ɑ h
m ɔ ɡ	m ɔ ɡ
m ɑ z	m ɑ z
m ɛ n	m ɛ n
t͡sʰ i t͡sʰ	t͡sʰ i t͡sʰ
t ɔ tʰ	t ɔ tʰ
ʃ ɔ ɾ	ʃ ɔ ɾ
ʃ ɔ ʁ	ʃ ɔ ʁ
t i kʰ	t i kʰ
ɑ j b	ɑ j b
ʃ ɛ k	ʃ ɛ k
p ɑ s	p ɑ s
p ɔ t͡ʃʰ	p ɔ t͡ʃʰ
h ɑ t͡ʃ	h ɑ t͡ʃ
ʃ ɑ h	ʃ ɑ h
k ɔ v	k ɔ v
d ɛ ʁ	d ɛ ʁ
tʰ ɔ r	tʰ ɔ r
k ɑ l	k ɑ l
