v ɔ ʁ n ɑ ʃ ɑ ɾ	v ɔ ʁ n ɑ ʃ ɑ ɾ
χ ɑ ɾ χ ə l ɛ l	χ ɑ ɾ χ ə l ɛ l
tʰ ə v ɑ ɾ k ɛ l	tʰ ə v ɑ ɾ k ɛ l
h ə ɾ ɑ v ɛ ɾ kʰ	h ə ɾ ɑ v ɛ ɾ kʰ
s ə χ ɑ l v ɛ l	s ə χ ɑ l v ɛ l
m ə ʃ t ɑ p ɛ s	m ə ʃ t ɑ p ɛ s
j ɛ ɾ ɛ v ɛ l i	j ɛ ɾ ɛ v ɛ l i
tʰ ə tʰ v ɑ t͡s i n	tʰ ə tʰ v ɑ t͡s i n
ə s t ɑ m ɔ kʰ s	ə s t ɑ m ɔ kʰ s
ɡ ə l χ ɑ v ɔ ɾ	ɡ ə l χ ɑ v ɔ ɾ
v ɔ z n ɑ χ ɔ t	v ɔ z n ɑ χ ɔ t
j ɛ n i t͡ʃʰ ɛ ɾ i	j ɛ n i t͡ʃʰ ɛ ɾ i
d͡z ɛ r ə n p ɑ h	d͡z ɛ r ə n p ɑ h
s ə ɾ pʰ ɑ z ɑ n	s ə ɾ pʰ ɑ z ɑ n
ə s p ɑ n v ɛ l	ə s p ɑ n v ɛ l
tʰ ə b i l i s i	tʰ ə b i l i s i
p ɑ t ə ʒ v ɛ l	p ɑ t ə ʒ v ɛ l
ɡ ɑ pʰ ɾ i j ɛ l	ɡ ɑ pʰ ɾ i j ɛ l
h ɑ j k ɑ z ə n	h ɑ j k ɑ z ə n
ə s t ɔ t͡s ɑ n i	ə s t ɔ t͡s ɑ n i
m ə n ɑ t͡sʰ j ɑ l	m ə n ɑ t͡sʰ j ɑ l
ʃ ɑ t ə ɾ v ɑ n	ʃ ɑ t ə ɾ v ɑ n
ɑ p ə s p ɾ ɛ l	ɑ p ə s p ɾ ɛ l
ə s t ɛ p ʁ i n	ə s t ɛ p ʁ i n
n ə ʃ ɑ n v ɑ t͡s	n ə ʃ ɑ n v ɑ t͡s
t͡ʃ ə ʃ m ɑ ɾ i t	t͡ʃ ə ʃ m ɑ ɾ i t
ɑ k ə n tʰ ɑ ɾ tʰ	ɑ k ə n tʰ ɑ ɾ tʰ
j ɛ ʁ ɛ ɡ n j ɑ	j ɛ ʁ ɛ ɡ n j ɑ
v ə ɾ tʰ ɑ n ɛ s	v ə ɾ tʰ ɑ n ɛ s
v ɔ ɾ p ɛ s z i	v ɔ ɾ p ɛ s z i
v ə ɾ tʰ ɔ v ɛ l	v ə ɾ tʰ ɔ v ɛ l
j ɛ k b ɑ t ɑ n	j ɛ k b ɑ t ɑ n
h ɑ kʰ t͡sʰ ə n ɛ l	h ɑ kʰ t͡sʰ ə n ɛ l
v ə n ɑ s v ɛ l	v ə n ɑ s v ɛ l
tʰ ɑ kʰ t͡sʰ ə n ɛ l	tʰ ɑ kʰ t͡sʰ ə n ɛ l
m ɾ m ə n d͡ʒ ɑ l	m ə ɾ m ə n d͡ʒ ɑ l
v ə t͡ʃ r ɑ k ɑ n	v ə t͡ʃ r ɑ k ɑ n
t͡ʃ ə kʰ n ɑ ʒ ɑ m	t͡ʃ ə kʰ n ɑ ʒ ɑ m
j ɛ ɾ pʰ ɛ m n i	j ɛ ɾ pʰ ɛ m n i
v ə t ɑ ŋ ɡ ɛ l	v ə t ɑ ŋ ɡ ɛ l
h i j ɑ n ɑ l i	h i j ɑ n ɑ l i
χ ə t͡ʃ ɑ ŋ k ɑ ɾ	χ ə t͡ʃ ɑ ŋ k ɑ ɾ
ɑ k ə n h ɑ j t	ɑ k ə n h ɑ j t
v ɔ ɾ ɔ v ɑ j n	v ɔ ɾ ɔ v ɑ j n
ə s pʰ ɔ pʰ v ɛ l	ə s pʰ ɔ pʰ v ɛ l
v ɔ ɾ ɔ ʃ ɑ k i	v ɔ ɾ ɔ ʃ ɑ k i
k ɔ ɾ ə n t͡ʃʰ ɛ l	k ɔ ɾ ə n t͡ʃʰ ɛ l
h ə ɾ ɛ t ɑ n i	h ə ɾ ɛ t ɑ n i
n ə ʃ m ɑ ɾ ɛ l	n ə ʃ m ɑ ɾ ɛ l
j ɛ ɾ ɑ z ɑ ŋ kʰ	j ɛ ɾ ɑ z ɑ ŋ kʰ
d͡ʒ ə ɾ ɑ m b ɑ ɾ	d͡ʒ ə ɾ ɑ m b ɑ ɾ
j ɛ d ɛ s ɑ t͡sʰ i	j ɛ d ɛ s ɑ t͡sʰ i
ɑ j s i ŋ kʰ ə n	ɑ j s i ŋ kʰ ə n
ɑ χ ɑ l t͡sʰ ə χ ɑ	ɑ χ ɑ l t͡sʰ ə χ ɑ
ə z b ɔ s ɑ ŋ kʰ	ə z b ɔ s ɑ ŋ kʰ
j ɛ ɾ kʰ ɛ t͡sʰ i k	j ɛ ɾ kʰ ɛ t͡sʰ i k
m i j ɑ j n ɑ k	m i j ɑ j n ɑ k
j ɛ ɾ ɑ ʒ i ʃ t	j ɛ ɾ ɑ ʒ i ʃ t
n ə ɾ pʰ ɑ n t͡sʰ kʰ	n ə ɾ pʰ ɑ n t͡sʰ kʰ
l ə v ɑ t͡sʰ v ɛ l	l ə v ɑ t͡sʰ v ɛ l
ə s t ɑ m b ɑ k	ə s t ɑ m b ɑ k
ɡ ə l χ ɑ t ɛ l	ɡ ə l χ ɑ t ɛ l
ʒ ə χ t ɑ k ɑ n	ʒ ə χ t ɑ k ɑ n
h ə ɾ ɑ z d ɑ n	h ə ɾ ɑ z d ɑ n
ɡ ə n d ɑ p ɛ t	ɡ ə n d ɑ p ɛ t
p ə t k ɑ kʰ ɑ ɾ	p ə t k ɑ kʰ ɑ ɾ
s ə ɾ t͡ʃ ɑ ɾ ɑ ɾ	s ə ɾ t͡ʃ ɑ ɾ ɑ ɾ
s ə ɾ t͡ʃ ɑ ʁ ɑ t͡sʰ	s ə ɾ t͡ʃ ɑ ʁ ɑ t͡sʰ
ʃ ə ɾ d͡ʒ ɑ n ɑ k	ʃ ə ɾ d͡ʒ ɑ n ɑ k
d͡ʒ ə ɾ h ɛ ʁ ɛ ʁ	d͡ʒ ə ɾ h ɛ ʁ ɛ ʁ
j ɛ ɾ ɑ χ t i kʰ	j ɛ ɾ ɑ χ t i kʰ
χ ɑ pʰ n ə v ɛ l	χ ɑ pʰ n ə v ɛ l
d ə r n ɑ p ɑ n	d ə r n ɑ p ɑ n
t ə ʁ ɑ m ɑ ɾ tʰ	t ə ʁ ɑ m ɑ ɾ tʰ
h ə ɾ j ɑ k ɑ n	h ə ɾ j ɑ k ɑ n
v ɑ ɾ k ɛ ɾ i	v ɑ ɾ k ɛ ɾ i
ɑ ɾ t͡sʰ ɑ k ɛ l	ɑ ɾ t͡sʰ ɑ k ɛ l
b ɑ ɾ i ʃ ɛ l	b ɑ ɾ i ʃ ɛ l
m ɑ l ɑ d ɛ t͡sʰ	m ɑ l ɑ d ɛ t͡sʰ
ɑ v ɑ n d ɛ l	ɑ v ɑ n d ɛ l
ʃ ɑ h ɑ v ɛ t	ʃ ɑ h ɑ v ɛ t
z ɛ t ɛ ʁ ɛ l	z ɛ t ɛ ʁ ɛ l
ɔ t ɑ ɾ ɔ t i	ɔ t ɑ ɾ ɔ t i
k ɑ t ɑ ʁ ɛ l	k ɑ t ɑ ʁ ɛ l
t ɾ ɑ k t ɔ ɾ	t ɾ ɑ k t ɔ ɾ
z ɔ ɾ ɑ v ɑ ɾ	z ɔ ɾ ɑ v ɑ ɾ
pʰ ɑ s t ɑ t͡sʰ i	pʰ ɑ s t ɑ t͡sʰ i
ɛ ɾ z ə ɾ u m	ɛ ɾ z ə ɾ u m
ʃ ɑ m i ɾ ɑ m	ʃ ɑ m i ɾ ɑ m
ɑ v ɛ t t͡ʃʰ ɛ kʰ	ɑ v ɛ t t͡ʃʰ ɛ kʰ
v ɑ j ɛ l ɛ l	v ɑ j ɛ l ɛ l
χ ɔ h ɑ n ɔ t͡sʰ	χ ɔ h ɑ n ɔ t͡sʰ
h ɑ r ɑ t͡ʃʰ ɛ l	h ɑ r ɑ t͡ʃʰ ɛ l
ɔ ɾ ɛ ŋ kʰ ɔ v	ɔ ɾ ɛ ŋ kʰ ɔ v
m ɑ kʰ ɑ r ɛ l	m ɑ kʰ ɑ r ɛ l
ɡ ɔ l ɔ ɾ ʃ i	ɡ ɔ l ɔ ɾ ʃ i
t͡s i t͡s ɑ ʁ ɑ l	t͡s i t͡s ɑ ʁ ɑ l
ɡ ɑ ɾ ɛ ɡ i n	ɡ ɑ ɾ ɛ ɡ i n
n ɛ ɾ ɡ ɑ χ tʰ	n ɛ ɾ ɡ ɑ χ tʰ
χ ə n d͡ʒ u j kʰ	χ ə n d͡ʒ u j kʰ
ɡ ɔ j ɑ n ɑ l	ɡ ɔ j ɑ n ɑ l
k ɑ ɾ ɑ m ɛ l	k ɑ ɾ ɑ m ɛ l
k ɑ l k ɑ tʰ ɑ	k ɑ l k ɑ tʰ ɑ
m ɛ t͡s ɑ p ɛ s	m ɛ t͡s ɑ p ɛ s
v ɔ l ɔ ɾ u n	v ɔ l ɔ ɾ u n
m ɑ h ɑ b ɛ ɾ	m ɑ h ɑ b ɛ ɾ
j ɛ ɾ k j u ʁ	j ɛ ɾ k j u ʁ
s ɔ ʁ ɔ m ɔ n	s ɔ ʁ ɔ m ɔ n
b ɑ r ɑ ɾ ɑ n	b ɑ r ɑ ɾ ɑ n
t͡s ɑ r ɑ j ɛ l	t͡s ɑ r ɑ j ɛ l
v ɛ n ɛ t i k	v ɛ n ɛ t i k
t ɛ s ɑ k ɑ n	t ɛ s ɑ k ɑ n
tʰ ɑ l ɑ n t͡ʃʰ i	tʰ ɑ l ɑ n t͡ʃʰ i
d͡ʒ ɑ n ɑ s ɛ ɾ	d͡ʒ ɑ n ɑ s ɛ ɾ
h ɔ j ɑ ʃ ɛ n	h ɔ j ɑ ʃ ɛ n
d ə ʒ ɡ u j n	d ə ʒ ɡ u j n
s i t͡sʰ i l j ɑ	s i t͡sʰ i l j ɑ
d ɛ t ɾ ɔ j t	d ɛ t ɾ ɔ j t
n ɑ χ ɑ t͡ʃ ɑ ʃ	n ɑ χ ɑ t͡ʃ ɑ ʃ
v ɑ t͡ʃʰ ɑ ɡ ɑ n	v ɑ t͡ʃʰ ɑ ɡ ɑ n
n ɛ t ɑ d͡z i kʰ	n ɛ t ɑ d͡z i kʰ
k ɔ l ɛ ɡ j ɑ	k ɔ l ɛ ɡ j ɑ
t͡ʃʰ ɑ pʰ ɑ h ɑ s	t͡ʃʰ ɑ pʰ ɑ h ɑ s
ɔ ɾ ɑ k ɑ ɾ kʰ	ɔ ɾ ɑ k ɑ ɾ kʰ
m ɑ j ɔ n ɛ z	m ɑ j ɔ n ɛ z
n ə v ɑ t͡ʃ u m	n ə v ɑ t͡ʃ u m
s i ɾ ɑ v ɛ p	s i ɾ ɑ v ɛ p
k ə r ɑ t u k	k ə r ɑ t u k
kʰ ɑ ɾ ɔ z i t͡ʃʰ	kʰ ɑ ɾ ɔ z i t͡ʃʰ
p ɔ z i t i v	p ɔ z i t i v
v ɑ ɾ tʰ ɛ n i	v ɑ ɾ tʰ ɛ n i
ɑ r k ɑ χ ɛ l	ɑ r k ɑ χ ɛ l
k ɑ ɾ ɔ t ɛ l	k ɑ ɾ ɔ t ɛ l
u s t i j ɛ v	u s t i j ɛ v
j ɛ ɾ k u ŋ kʰ	j ɛ ɾ k u ŋ kʰ
d͡z ɛ v ɑ t͡ʃʰ ɑ pʰ	d͡z ɛ v ɑ t͡ʃʰ ɑ pʰ
t͡ʃʰ ɛ χ ɛ ɾ ɛ n	t͡ʃʰ ɛ χ ɛ ɾ ɛ n
ɑ v ɑ ɾ t ɛ l	ɑ v ɑ ɾ t ɛ l
i v ɑ n ɔ v ɔ	i v ɑ n ɔ v ɔ
ɑ l m ɑ n ɑ χ	ɑ l m ɑ n ɑ χ
h ɛ ʁ i n ɑ k	h ɛ ʁ i n ɑ k
v ə t ɑ ɾ u m	v ə t ɑ ɾ u m
s i ɾ ɑ h ɑ ɾ	s i ɾ ɑ h ɑ ɾ
ɑ r ɑ n d͡z i n	ɑ r ɑ n d͡z i n
b ɑ t͡sʰ ɑ r ɛ l	b ɑ t͡sʰ ɑ r ɛ l
ɑ ʃ χ ɑ b ɑ d	ɑ ʃ χ ɑ b ɑ d
k ɑ ɾ ɛ n ɑ l	k ɑ ɾ ɛ n ɑ l
ɑ ŋ k ɑ n ɔ n	ɑ ŋ k ɑ n ɔ n
t ɑ ʃ kʰ ɛ n d	t ɑ ʃ kʰ ɛ n d
j ɑ s ɑ m ɑ n	j ɑ s ɑ m ɑ n
b ɔ l ɔ ɾ ɑ k	b ɔ l ɔ ɾ ɑ k
k ɑ ʁ ɑ p ɑ ɾ	k ɑ ʁ ɑ p ɑ ɾ
kʰ ɛ m b ɾ i d͡ʒ	kʰ ɛ m b ɾ i d͡ʒ
ɡ ɔ ɾ ɔ v ɛ l	ɡ ɔ ɾ ɔ v ɛ l
ɑ χ t ɔ t ɛ l	ɑ χ t ɔ t ɛ l
b ɑ t͡sʰ ɔ tʰ j ɑ	b ɑ t͡sʰ ɔ tʰ j ɑ
t͡sʰ ɑ ɾ ɑ k ɑ n	t͡sʰ ɑ ɾ ɑ k ɑ n
d ɑ ʃ t ɛ ɾ i	d ɑ ʃ t ɛ ɾ i
d ɑ ʃ t ɛ ɾ n	d ɑ ʃ t ɛ ɾ n
d͡ʒ ɑ ɾ kʰ ɑ n d	d͡ʒ ɑ ɾ kʰ ɑ n d
tʰ ə tʰ v ɑ s ɛ ɾ	tʰ ə tʰ v ɑ s ɛ ɾ
p ɑ t ə ɾ v ɑ k	p ɑ t ə ɾ v ɑ k
j ɛ k ɛ ʁ ɛ t͡sʰ i	j ɛ k ɛ ʁ ɛ t͡sʰ i
ɡ ə n d ɑ d͡z ɛ v	ɡ ə n d ɑ d͡z ɛ v
v ɔ ɾ tʰ ɛ s ɛ ɾ	v ɔ ɾ tʰ ɛ s ɛ ɾ
t͡ʃ ə kʰ n ɑ v ɔ ɾ	t͡ʃ ə kʰ n ɑ v ɔ ɾ
pʰ ə ɾ k ɑ ɡ i n	pʰ ə ɾ k ɑ ɡ i n
h ə ɾ t͡ʃ v ɑ ŋ kʰ	h ə ɾ t͡ʃ v ɑ ŋ kʰ
v ɔ s k ɛ z ɔ t͡s	v ɔ s k ɛ z ɔ t͡s
b ɑ l ɑ j ɑ n	b ɑ l ɑ j ɑ n
b ə n ɑ k v ɛ l	b ə n ɑ k v ɛ l
t͡s ə ɾ ɑ ɡ ɾ ɛ l	t͡s ə ɾ ɑ ɡ ɾ ɛ l
h ɑ n d͡z i n ə s	h ɑ n d͡z i n ə s
j ɛ ɾ ɛ kʰ k i n	j ɛ ɾ ɛ kʰ k i n
v ə ɾ ɑ s t ɑ n	v ə ɾ ɑ s t ɑ n
ɡ ə n h ɑ t ɛ l	ɡ ə n h ɑ t ɛ l
ɑ ɾ j ɑ k ɑ n	ɑ ɾ j ɑ k ɑ n
ɑ n s ɑ s ɑ n	ɑ n s ɑ s ɑ n
p ɑ t͡sʰ j ɛ n t	p ɑ t͡sʰ j ɛ n t
h ɑ m ɔ z ɛ l	h ɑ m ɔ z ɛ l
ɡ ɑ v ɑ z ɑ n	ɡ ɑ v ɑ z ɑ n
t ɛ χ n i k ɑ	t ɛ χ n i k ɑ
ɑ ʁ b ɑ m ɑ n	ɑ ʁ b ɑ m ɑ n
pʰ ɑ s t v ɛ l	pʰ ɑ s t v ɛ l
m ɛ t͡s ɑ v ɔ ɾ	m ɛ t͡s ɑ v ɔ ɾ
h ɑ m ɑ l i ɾ	h ɑ m ɑ l i ɾ
k ɔ n t ɾ ɔ l	k ɔ n t ɾ ɔ l
p l ɛ ɾ ɔ m ɑ	p l ɛ ɾ ɔ m ɑ
ɑ s j ɑ k ɑ n	ɑ s j ɑ k ɑ n
t ɾ ɔ m b ɔ n	t ɾ ɔ m b ɔ n
ɑ n ɛ ɾ d͡z ɑ kʰ	ɑ n ɛ ɾ d͡z ɑ kʰ
ɡ ɔ ʁ ɑ n ɑ l	ɡ ɔ ʁ ɑ n ɑ l
n ɛ ɡ ɑ t i v	n ɛ ɡ ɑ t i v
l ɑ v ɑ n ɑ l	l ɑ v ɑ n ɑ l
ɡ ɛ l ɑ ɾ ɑ n	ɡ ɛ l ɑ ɾ ɑ n
ɑ t͡s ɑ n t͡sʰ ɛ l	ɑ t͡s ɑ n t͡sʰ ɛ l
d ɑ tʰ ɑ ɾ ɛ l	d ɑ tʰ ɑ ɾ ɛ l
n ɛ ʁ ɑ n ɑ l	n ɛ ʁ ɑ n ɑ l
ɑ p ɑ ɾ ɑ ŋ kʰ	ɑ p ɑ ɾ ɑ ŋ kʰ
r ɑ h v i ɾ ɑ	r ɑ h v i ɾ ɑ
kʰ ə nː ɑ d ɑ t	kʰ ə nː ɑ d ɑ t
m ɑ ɾ ɑ tʰ ɔ n	m ɑ ɾ ɑ tʰ ɔ n
ɑ ɾ kʰ ɛ l ɔ t͡sʰ	ɑ ɾ kʰ ɛ l ɔ t͡sʰ
k i n ɑ b ɑ ɾ	k i n ɑ b ɑ ɾ
ʃ ɑ ɡ ɑ n ɑ k	ʃ ɑ ɡ ɑ n ɑ k
h ɔ m ɑ n i ʃ	h ɔ m ɑ n i ʃ
n ə v i ɾ u m	n ə v i ɾ u m
h ɛ tʰ ɑ n ɔ s	h ɛ tʰ ɑ n ɔ s
m ɔ t ɛ n ɑ l	m ɔ t ɛ n ɑ l
h ɑ s ɑ ɾ ɑ k	h ɑ s ɑ ɾ ɑ k
t͡ʃ ɑ ɾ ɑ h ɑ t	t͡ʃ ɑ ɾ ɑ h ɑ t
d i m ɑ v ɔ ɾ ɛ l	d i m ɑ v ɔ ɾ ɛ l
p ɑ t v ɑ ɾ ʒ ɑ n	p ɑ t v ɑ ɾ ʒ ɑ n
v ɛ ɾ ɑ kʰ ə nː i t͡ʃʰ	v ɛ ɾ ɑ kʰ ə nː i t͡ʃʰ
ɑ v ɛ s t ɛ ɾ ɛ n	ɑ v ɛ s t ɛ ɾ ɛ n
tʰ ɑ l i ʃ ɛ ɾ ɛ n	tʰ ɑ l i ʃ ɛ ɾ ɛ n
ɡ i ʃ ɛ ɾ ɑ j i n	ɡ i ʃ ɛ ɾ ɑ j i n
tʰ ɑ tʰ ɛ ɾ ɑ k ɑ n	tʰ ɑ tʰ ɛ ɾ ɑ k ɑ n
j ɔ tʰ n ɛ ɾ j ɑ k	j ɔ tʰ n ɛ ɾ j ɑ k
z ɑ ɾ tʰ ɑ ɾ ɑ ŋ kʰ	z ɑ ɾ tʰ ɑ ɾ ɑ ŋ kʰ
ɛ s t ɔ n ɑ k ɑ n	ɛ s t ɔ n ɑ k ɑ n
h ɛ t ɛ v ɑ b ɑ ɾ	h ɛ t ɛ v ɑ b ɑ ɾ
p ɑ t ɑ r ɑ kʰ ɑ ʁ	p ɑ t ɑ r ɑ kʰ ɑ ʁ
m ɑ s n ɑ k t͡sʰ ɛ l	m ɑ s n ɑ k t͡sʰ ɛ l
n ɑ m ɑ k ɑ n i ʃ	n ɑ m ɑ k ɑ n i ʃ
ɑ r ɑ t͡ʃʰ ɑ ɾ k ɛ l	ɑ r ɑ t͡ʃʰ ɑ ɾ k ɛ l
h ɛ ɾ ɔ s ɑ k ɑ n	h ɛ ɾ ɔ s ɑ k ɑ n
h ɑ v ɑ t ɑ ɾ i m	h ɑ v ɑ t ɑ ɾ i m
k ɑ t ɛ ɡ ɔ ɾ j ɑ	k ɑ t ɛ ɡ ɔ ɾ j ɑ
ɑ r ɑ t͡ʃʰ n ɑ j i n	ɑ r ɑ t͡ʃʰ n ɑ j i n
m ɑ j ɾ ɑ s p ɑ n	m ɑ j ɾ ɑ s p ɑ n
k ɔ m p ɔ n ɛ n t	k ɔ m p ɔ n ɛ n t
t ɛ χ n ɔ p ɑ ɾ k	t ɛ χ n ɔ p ɑ ɾ k
m ɛ n ɑ k ɑ t ɑ ɾ	m ɛ n ɑ k ɑ t ɑ ɾ
j ɛ ɾ k ɑ tʰ u ʁ i	j ɛ ɾ k ɑ tʰ u ʁ i
h ɑ z ɑ ɾ ɑ p ɛ t	h ɑ z ɑ ɾ ɑ p ɛ t
k i s ɑ t ɑ b ɑ t	k i s ɑ t ɑ b ɑ t
h ɛ t͡s ɛ l ɑ z ɔ ɾ	h ɛ t͡s ɛ l ɑ z ɔ ɾ
z ɑ ɾ m ɑ t͡sʰ n ɛ l	z ɑ ɾ m ɑ t͡sʰ n ɛ l
v ɑ t͡ʃ ɑ r ɑ k ɑ n	v ɑ t͡ʃ ɑ r ɑ k ɑ n
kʰ ɾ i s t ɔ n j ɑ	kʰ ɾ i s t ɔ n j ɑ
t ɑ d͡ʒ i k s t ɑ n	t ɑ d͡ʒ i k s t ɑ n
ɡ ɔ ɾ t͡s n ɑ k ɑ n	ɡ ɔ ɾ t͡s n ɑ k ɑ n
ɛ k ɔ n ɔ m i k ɑ	ɛ k ɔ n ɔ m i k ɑ
h ɑ j tʰ ɑ j tʰ ɛ l	h ɑ j tʰ ɑ j tʰ ɛ l
ɛ s k ɑ l ɑ t͡sʰ j ɑ	ɛ s k ɑ l ɑ t͡sʰ j ɑ
t͡s ɑ pʰ ɑ h ɑ ɾ ɛ l	t͡s ɑ pʰ ɑ h ɑ ɾ ɛ l
ɡ ɾ i kʰ ɔ ɾ j ɑ n	ɡ ɾ i kʰ ɔ ɾ j ɑ n
t͡ʃ ɑ p ɔ n ɛ ɾ ɛ n	t͡ʃ ɑ p ɔ n ɛ ɾ ɛ n
i r ɑ t͡sʰ i ɔ n ɑ l	i r ɑ t͡sʰ i ɔ n ɑ l
ɡ ə n ɑ t͡sʰ u t͡sʰ ɑ k	ɡ ə n ɑ t͡sʰ u t͡sʰ ɑ k
ɑ n t͡sʰ ɔ ʁ ɑ k ɑ n	ɑ n t͡sʰ ɔ ʁ ɑ k ɑ n
k ɔ n t ɛ j n ɛ ɾ	k ɔ n t ɛ j n ɛ ɾ
k ə l ɔ ɾ ɑ v u n	k ə l ɔ ɾ ɑ v u n
ɑ ɾ kʰ ɑ j ɑ k ɑ n	ɑ ɾ kʰ ɑ j ɑ k ɑ n
tʰ ɑ ɾ χ ɑ n j ɑ n	tʰ ɑ ɾ χ ɑ n j ɑ n
χ ɑ b ɑ ɾ ɔ f s k	χ ɑ b ɑ ɾ ɔ f s k
ɑ z d ɑ ɾ ɑ ɾ ɛ l	ɑ z d ɑ ɾ ɑ ɾ ɛ l
ɑ ɾ ɑ m ɑ n j ɑ k	ɑ ɾ ɑ m ɑ n j ɑ k
i ŋ kʰ n ɑ s p ɑ n	i ŋ kʰ n ɑ s p ɑ n
ʃ ɑ χ m ɑ t i s t	ʃ ɑ χ m ɑ t i s t
b ɛ s tʰ s ɛ l ɛ ɾ	b ɛ s tʰ s ɛ l ɛ ɾ
h ɑ r ɑ t͡ʃʰ ɑ k i t͡sʰ	h ɑ r ɑ t͡ʃʰ ɑ k i t͡sʰ
kʰ ɑ ʁ ɑ kʰ ɑ p ɛ t	kʰ ɑ ʁ ɑ kʰ ɑ p ɛ t
b ɛ v ɛ r ɑ j i n	b ɛ v ɛ r ɑ j i n
ɑ t ɑ m n ɑ j i n	ɑ t ɑ m n ɑ j i n
ɑ r ɔ χ t͡ʃʰ ɑ ɾ ɑ n	ɑ r ɔ χ t͡ʃʰ ɑ ɾ ɑ n
b ɔ χ ɑ t ɛ ɾ ɛ v	b ɔ χ ɑ t ɛ ɾ ɛ v
h ɑ j ɾ ɛ n j ɑ t͡sʰ	h ɑ j ɾ ɛ n j ɑ t͡sʰ
v ɑ ʁ ɔ ɾ tʰ j ɑ n	v ɑ ʁ ɔ ɾ tʰ j ɑ n
ɑ r ɔ χ t͡ʃʰ ɑ n ɑ l	ɑ r ɔ χ t͡ʃʰ ɑ n ɑ l
ɡ ɛ ɾ d ɑ s t ɑ n	ɡ ɛ ɾ d ɑ s t ɑ n
h ɑ j h ɔ j ɑ ŋ kʰ	h ɑ j h ɔ j ɑ ŋ kʰ
b ɑ z m ɛ ɾ ɑ ŋ ɡ	b ɑ z m ɛ ɾ ɑ ŋ ɡ
v ɛ n ɛ t i k t͡sʰ i	v ɛ n ɛ t i k t͡sʰ i
ɑ m ɛ ɾ i k ɑ t͡sʰ i	ɑ m ɛ ɾ i k ɑ t͡sʰ i
h ɑ s t͡sʰ ɛ ɑ t ɛ ɾ	h ɑ s t͡sʰ ɛ ɑ t ɛ ɾ
t ɛ ʁ ɑ t͡ʃ ɑ ɾ ɑ k	t ɛ ʁ ɑ t͡ʃ ɑ ɾ ɑ k
k ɑ n ɑ t͡ʃʰ ɑ p ɑ t	k ɑ n ɑ t͡ʃʰ ɑ p ɑ t
ɑ ɾ t ɑ s ɔ v ɔ ɾ	ɑ ɾ t ɑ s ɔ v ɔ ɾ
t͡s ɑ χ k ɑ z ɑ ɾ tʰ	t͡s ɑ χ k ɑ z ɑ ɾ tʰ
p ɑ t v ɑ s t ɛ l	p ɑ t v ɑ s t ɛ l
ʁ ɛ k ɑ v ɑ ɾ ɛ l	ʁ ɛ k ɑ v ɑ ɾ ɛ l
ɑ v ɛ t i s j ɑ n	ɑ v ɛ t i s j ɑ n
ɑ ɾ ɑ ɡ ɑ ʃ ɑ ɾ ʒ	ɑ ɾ ɑ ɡ ɑ ʃ ɑ ɾ ʒ
n ɛ ɾ s i s j ɑ n	n ɛ ɾ s i s j ɑ n
ə n t ɑ n ɛ k ɑ n	ə n t ɑ n ɛ k ɑ n
ɑ ŋ k ɑ ʃ k ɑ n d	ɑ ŋ k ɑ ʃ k ɑ n d
h ɔ ʁ d ɔ ʁ d ɛ l	h ɔ ʁ d ɔ ʁ d ɛ l
ɑ p ɛ n i n j ɑ n	ɑ p ɛ n i n j ɑ n
ɑ χ kʰ ɑ t n ɛ ɾ ə	ɑ χ kʰ ɑ t n ɛ ɾ ə
t ɑ k n u v ə ɾ ɑ	t ɑ k n u v ə ɾ ɑ
ɑ kʰ s ɔ ɾ ɑ k ɑ n	ɑ kʰ s ɔ ɾ ɑ k ɑ n
p ɛ ɾ m ɑ n ɛ n t	p ɛ ɾ m ɑ n ɛ n t
h ɑ ɾ ɑ k ɑ t ɑ ɾ	h ɑ ɾ ɑ k ɑ t ɑ ɾ
k ɑ ʃ k ɑ n d ɛ l	k ɑ ʃ k ɑ n d ɛ l
d͡z ɛ v ɑ n ə m u ʃ	d͡z ɛ v ɑ n ə m u ʃ
h ɔ l ɑ n d ɑ t͡sʰ i	h ɔ l ɑ n d ɑ t͡sʰ i
k ɔ m p ɛ t ɛ n t	k ɔ m p ɛ t ɛ n t
p ɾ ɔ k l ɛ t j ɛ	p ɾ ɔ k l ɛ t j ɛ
ɡ ɑ ŋ ɡ ɾ ɑ h ɛ ɾ	ɡ ɑ ŋ ɡ ɾ ɑ h ɛ ɾ
ɑ ɾ ɛ v ɛ l j ɑ n	ɑ ɾ ɛ v ɛ l j ɑ n
ɑ s ɔ ɾ ɛ s t ɑ n	ɑ s ɔ ɾ ɛ s t ɑ n
m i h ɾ ɑ n j ɑ n	m i h ɾ ɑ n j ɑ n
ɑ ʁ ɑ n d ɑ v ɔ ɾ	ɑ ʁ ɑ n d ɑ v ɔ ɾ
k ɑ ɾ t͡s ɾ ɑ t i p	k ɑ ɾ t͡s ɾ ɑ t i p
ɑ v ɛ l ɑ t͡sʰ n ɛ l	ɑ v ɛ l ɑ t͡sʰ n ɛ l
k ɔ n f ɛ ɾ ɑ n s	k ɔ n f ɛ ɾ ɑ n s
k i l i k j ɑ t͡sʰ i	k i l i k j ɑ t͡sʰ i
p ɑ t k ɑ r ɛ l i	p ɑ t k ɑ r ɛ l i
ə s k u m b ɾ j ɑ	ə s k u m b ɾ j ɑ
h i m n ɑ h ɑ ɾ t͡sʰ	h i m n ɑ h ɑ ɾ t͡sʰ
d͡ʒ ə ɾ ɑ χ ɔ z u k	d͡ʒ ə ɾ ɑ χ ɔ z u k
ɑ n m i t͡ʃʰ ɑ k ɑ n	ɑ n m i t͡ʃʰ ɑ k ɑ n
kʰ ɑ ʁ ɑ kʰ ɑ v ɑ ɾ	kʰ ɑ ʁ ɑ kʰ ɑ v ɑ ɾ
ɡ i t ɑ k t͡sʰ v ɛ l	ɡ i t ɑ k t͡sʰ v ɛ l
l ɑ t i ʃ ɛ ɾ ɛ n	l ɑ t i ʃ ɛ ɾ ɛ n
d͡z ɛ v ɑ v ɔ ɾ ɛ l	d͡z ɛ v ɑ v ɔ ɾ ɛ l
h ɑ v ɑ n ɑ k ɑ n	h ɑ v ɑ n ɑ k ɑ n
ʃ ə n ɔ ɾ ɑ v ɔ ɾ	ʃ ə n ɔ ɾ ɑ v ɔ ɾ
i r l ɑ n d ɑ t͡sʰ i	i r l ɑ n d ɑ t͡sʰ i
v ɑ ʃ i ŋ ɡ t ɔ n	v ɑ ʃ i ŋ ɡ t ɔ n
v ɑ ŋ k ɑ ɾ k ɛ l	v ɑ ŋ k ɑ ɾ k ɛ l
t͡ʃ ɔ r ɔ m ɑ χ ɔ s	t͡ʃ ɔ r ɔ m ɑ χ ɔ s
k ɑ n ɑ d ɑ k ɑ n	k ɑ n ɑ d ɑ k ɑ n
m ɑ d ɾ i d j ɑ n	m ɑ d ɾ i d j ɑ n
h ɑ ɾ s ɑ n j ɑ t͡sʰ	h ɑ ɾ s ɑ n j ɑ t͡sʰ
p ɑ ɾ t ɑ t ɔ m s	p ɑ ɾ t ɑ t ɔ m s
h ɑ v ɑ kʰ ɑ k ɑ n	h ɑ v ɑ kʰ ɑ k ɑ n
d i v ɑ n ɑ ɡ ɛ t	d i v ɑ n ɑ ɡ ɛ t
p ɔ r ɔ t ɑ χ ɔ s	p ɔ r ɔ t ɑ χ ɔ s
b ɑ m b ɑ s ɑ ŋ kʰ	b ɑ m b ɑ s ɑ ŋ kʰ
pʰ ɔ χ ɑ n ɑ k ɛ l	pʰ ɔ χ ɑ n ɑ k ɛ l
n ɑ χ ɑ n d͡z k ɔ t	n ɑ χ ɑ n d͡z k ɔ t
tʰ ɑ ɾ kʰ m ɑ n ɛ l	tʰ ɑ ɾ kʰ m ɑ n ɛ l
tʰ ɑ ɡ ɑ v ɑ ɾ ɑ k	tʰ ɑ ɡ ɑ v ɑ ɾ ɑ k
t͡ʃ ɑ k ɑ t ɑ ɡ i ɾ	t͡ʃ ɑ k ɑ t ɑ ɡ i ɾ
t͡ʃʰ ɑ pʰ ɔ ɾ ɔ ʃ i t͡ʃʰ	t͡ʃʰ ɑ pʰ ɔ ɾ ɔ ʃ i t͡ʃʰ
ɑ r ɛ ɾ ɛ s v ɛ l	ɑ r ɛ ɾ ɛ s v ɛ l
s ɔ v ɛ t ɑ k ɑ n	s ɔ v ɛ t ɑ k ɑ n
t ɑ r ɑ t ɛ s ɑ k	t ɑ r ɑ t ɛ s ɑ k
v ɛ l i ŋ ɡ t ɔ n	v ɛ l i ŋ ɡ t ɔ n
ɑ ʃ χ ɑ t ɑ s ɛ ɾ	ɑ ʃ χ ɑ t ɑ s ɛ ɾ
z i n ɑ d ɑ tʰ ɑ ɾ	z i n ɑ d ɑ tʰ ɑ ɾ
ɔ l i ɡ ɑ ɾ χ j ɑ	ɔ l i ɡ ɑ ɾ χ j ɑ
h ɑ t ɑ p ə t u ʁ	h ɑ t ɑ p ə t u ʁ
tʰ ɑ tʰ ɑ ɾ ɛ ɾ ɛ n	tʰ ɑ tʰ ɑ ɾ ɛ ɾ ɛ n
t ɛ s ɑ n j u tʰ	t ɛ s ɑ n j u tʰ
m ɑ n d͡ʒ u ɾ j ɑ	m ɑ n d͡ʒ u ɾ j ɑ
ɑ ɾ ɑ m <<unk>> ɾ ɛ n	ɑ ɾ ɑ m ɛ ɾ ɛ n
h j u p ɑ t ɔ s	h j u p ɑ t ɔ s
ə ŋ k u z ɛ n i	ə ŋ k u z ɛ n i
k ɑ t m ɑ n d u	k ɑ t m ɑ n d u
tʰ ɔ ʃ ɑ k ɑ r u	tʰ ɔ ʃ ɑ k ɑ r u
ɡ ɑ j l ɑ d͡z u k	ɡ ɑ j l ɑ d͡z u k
tʰ ɑ kʰ tʰ ɑ kʰ u ɾ	tʰ ɑ kʰ tʰ ɑ kʰ u ɾ
kʰ u j ɾ ɑ k ɑ n	kʰ u j ɾ ɑ k ɑ n
h ɑ s t ɑ t u n	h ɑ s t ɑ t u n
m ɔ ɾ ɑ kʰ u j ɾ	m ɔ ɾ ɑ kʰ u j ɾ
kʰ ə nː ɑ ɾ k u m	kʰ ə nː ɑ ɾ k u m
b u k ɔ v i n ɑ	b u k ɔ v i n ɑ
ɑ ɾ ɛ v m u t kʰ	ɑ ɾ ɛ v m u t kʰ
h ɛ ɾ ɔ s u h i	h ɛ ɾ ɔ s u h i
n ɛ ɾ χ u ʒ ɛ l	n ɛ ɾ χ u ʒ ɛ l
s ɑ ɾ s ɑ pʰ u m	s ɑ ɾ s ɑ pʰ u m
ɑ n d͡z n ɑ n u n	ɑ n d͡z n ɑ n u n
m ɑ n tʰ ɑ p u ɾ	m ɑ n tʰ ɑ p u ɾ
χ ə l u tʰ j u n	χ ə l u tʰ j u n
p ɑ t m u t͡ʃ ɑ n	p ɑ t m u t͡ʃ ɑ n
ɡ i t ɑ k t͡sʰ u m	ɡ i t ɑ k t͡sʰ u m
h ɑ v ɑ kʰ ɑ t͡s u	h ɑ v ɑ kʰ ɑ t͡s u
l ə r u tʰ j u n	l ə r u tʰ j u n
p i t ɑ n ɑ t͡sʰ u	p i t ɑ n ɑ t͡sʰ u
u ʁ ɛ ʁ ɑ j i n	u ʁ ɛ ʁ ɑ j i n
ɑ ɾ t ɑ s u ŋ kʰ	ɑ ɾ t ɑ s u ŋ kʰ
h u l i s j ɑ n	h u l i s j ɑ n
k ɔ m u n i z m	k ɔ m u n i z m
ʒ ɑ n t ɑ pʰ u ʃ	ʒ ɑ n t ɑ pʰ u ʃ
h ɑ n d i p u m	h ɑ n d i p u m
ʒ ɑ m ɑ t͡sʰ u j t͡sʰ	ʒ ɑ m ɑ t͡sʰ u j t͡sʰ
ɑ h ɑ b ɛ k u m	ɑ h ɑ b ɛ k u m
ɑ ʁ d͡ʒ ɑ m u ʁ d͡ʒ	ɑ ʁ d͡ʒ ɑ m u ʁ d͡ʒ
ɑ r k ɑ j t͡s u m	ɑ r k ɑ j t͡s u m
ɡ ɔ ɾ ʃ ɑ v u n	ɡ ɔ ɾ ʃ ɑ v u n
ɑ p ɑ t͡sʰ u t͡sʰ ɛ l	ɑ p ɑ t͡sʰ u t͡sʰ ɛ l
ə n tʰ u n ɛ l i	ə n tʰ u n ɛ l i
h ɑ m ɛ m u ŋ kʰ	h ɑ m ɛ m u ŋ kʰ
χ ə t u tʰ j u n	χ ə t u tʰ j u n
h ɑ m pʰ u ɾ ɛ l	h ɑ m pʰ u ɾ ɛ l
p ɔ p u l i z m	p ɔ p u l i z m
r u s ɑ s t ɑ n	r u s ɑ s t ɑ n
t ɑ ɾ k ɛ t u m	t ɑ ɾ k ɛ t u m
v ɑ ɾ ɑ kʰ u j ɾ	v ɑ ɾ ɑ kʰ u j ɾ
χ ɑ ʁ ɑ tʰ u χ tʰ	χ ɑ ʁ ɑ tʰ u χ tʰ
t͡s ɑ n t͡s ɑ ʁ u t	t͡s ɑ n t͡s ɑ ʁ u t
u ɾ ɑ χ ɑ k i t͡sʰ	u ɾ ɑ χ ɑ k i t͡sʰ
ɡ ə tʰ u tʰ j u n	ɡ ə tʰ u tʰ j u n
ɡ ɑ j l ɑ ʃ u n	ɡ ɑ j l ɑ ʃ u n
k ɑ p t ɑ v u n	k ɑ p t ɑ v u n
ɑ r ɛ ɾ ɛ s u m	ɑ r ɛ ɾ ɛ s u m
d j u ɾ ɑ tʰ ɛ kʰ	d j u ɾ ɑ tʰ ɛ kʰ
i d͡ʒ ɛ v ɑ n u m	i d͡ʒ ɛ v ɑ n u m
d͡z ɑ n d͡z ɾ u j tʰ	d͡z ɑ n d͡z ɾ u j tʰ
m ɑ kʰ s ɑ t u n	m ɑ kʰ s ɑ t u n
z ɔ ɾ ɑ χ u m b	z ɔ ɾ ɑ χ u m b
l ɑ m p u ʃ k ɑ	l ɑ m p u ʃ k ɑ
ɑ n t ɛ ɾ u n t͡ʃʰ	ɑ n t ɛ ɾ u n t͡ʃʰ
ɑ ɡ u t͡sʰ ɑ n ɛ l	ɑ ɡ u t͡sʰ ɑ n ɛ l
ə n tʰ ɑ t͡sʰ kʰ u m	ə n tʰ ɑ t͡sʰ kʰ u m
ɑ ɾ ʃ ɑ l u j s	ɑ ɾ ʃ ɑ l u j s
t͡sʰ ɛ ɾ ɛ k u j tʰ	t͡sʰ ɛ ɾ ɛ k u j tʰ
d ə ɾ u tʰ j u n	d ə ɾ u tʰ j u n
h j u ɾ ɛ ɾ i d	h j u ɾ ɛ ɾ i d
t ɑ ɾ ɑ k u j s	t ɑ ɾ ɑ k u j s
b u ɾ ɑ s t ɑ n	b u ɾ ɑ s t ɑ n
k ɑ ɾ ɛ k t͡sʰ ɑ ŋ kʰ	k ɑ ɾ ɛ k t͡sʰ ɑ ŋ kʰ
d i v ɛ ɾ s j ɔ n	d i v ɛ ɾ s j ɔ n
ɛ f tʰ ɑ n ɑ z j ɑ	ɛ f tʰ ɑ n ɑ z j ɑ
ɑ ɾ t ɑ d ɾ ɑ ŋ kʰ	ɑ ɾ t ɑ d ɾ ɑ ŋ kʰ
ɑ n p ɑ t ɾ ɑ s t	ɑ n p ɑ t ɾ ɑ s t
s ɔ v ɔ ɾ ɑ b ɑ ɾ	s ɔ v ɔ ɾ ɑ b ɑ ɾ
ɔ ʒ ɑ n d ɑ k ɛ l	ɔ ʒ ɑ n d ɑ k ɛ l
ɑ n h ɑ χ tʰ ɛ l i	ɑ n h ɑ χ tʰ ɛ l i
ɡ ɑ z ɑ n ɑ n ɔ t͡sʰ	ɡ ɑ z ɑ n ɑ n ɔ t͡sʰ
m ɛ n ɑ ʃ ə n ɔ ɾ	m ɛ n ɑ ʃ ə n ɔ ɾ
l ɔ k ɔ m ɔ t i v	l ɔ k ɔ m ɔ t i v
tʰ ɑ ŋ k ɑ ɾ ʒ ɛ kʰ	tʰ ɑ ŋ k ɑ ɾ ʒ ɛ kʰ
t͡ʃʰ ɔ ɾ kʰ ɔ t ɑ n i	t͡ʃʰ ɔ ɾ kʰ ɔ t ɑ n i
z ɔ ɾ ɑ h ɑ v ɑ kʰ	z ɔ ɾ ɑ h ɑ v ɑ kʰ
m ɑ ʁ ɑ d ɑ n ɔ s	m ɑ ʁ ɑ d ɑ n ɔ s
m ɑ ɾ z ɑ d ɑ ʃ t	m ɑ ɾ z ɑ d ɑ ʃ t
m ɛ kʰ s i k ɑ t͡sʰ i	m ɛ kʰ s i k ɑ t͡sʰ i
t ɑ ɾ ɑ t ɛ s ɑ k	t ɑ ɾ ɑ t ɛ s ɑ k
ɑ n h ɛ ɾ kʰ ɛ l i	ɑ n h ɛ ɾ kʰ ɛ l i
h ɑ m ɑ k ɾ ɛ l i	h ɑ m ɑ k ɾ ɛ l i
ɑ r ɔ χ t͡ʃʰ ɑ ɾ ɑ ɾ	ɑ r ɔ χ t͡ʃʰ ɑ ɾ ɑ ɾ
t ɑ s n ɑ m j ɑ k	t ɑ s n ɑ m j ɑ k
ɑ k n ɑ t͡s ɑ l i t͡sʰ	ɑ k n ɑ t͡s ɑ l i t͡sʰ
b ɑ ɾ t͡sʰ i tʰ ɔ ʁ i	b ɑ ɾ t͡sʰ i tʰ ɔ ʁ i
m ɑ n ɑ n d j ɑ n	m ɑ n ɑ n d j ɑ n
ə s t ɔ ɾ ɑ t͡sʰ u m	ə s t ɔ ɾ ɑ t͡sʰ u m
h ɔ χ ɔ ɾ t ɑ ŋ kʰ	h ɔ χ ɔ ɾ t ɑ ŋ kʰ
i s p ɑ n ɑ k ɑ n	i s p ɑ n ɑ k ɑ n
b ɑ r ɑ p ɑ ʃ ɑ ɾ	b ɑ r ɑ p ɑ ʃ ɑ ɾ
t i b ɛ tʰ ɛ ɾ ɛ n	t i b ɛ tʰ ɛ ɾ ɛ n
h ɑ s ɑ ɾ ɑ k ɑ t͡s	h ɑ s ɑ ɾ ɑ k ɑ t͡s
tʰ ɔ v m ɑ s j ɑ n	tʰ ɔ v m ɑ s j ɑ n
ɑ p ɑ ɾ ɑ n d͡ʒ ɑ n	ɑ p ɑ ɾ ɑ n d͡ʒ ɑ n
ə n d l ɑ j n ɛ l	ə n tʰ l ɑ j n ɛ l
ə ŋ k ɛ ɾ u h i	ə ŋ k ɛ ɾ u h i
m ɑ n u k j ɑ n	m ɑ n u k j ɑ n
ɡ j u t ɑ ɾ ɑ ɾ	ɡ j u t ɑ ɾ ɑ ɾ
h u n i s j ɑ n	h u n i s j ɑ n
h ɑ ɾ s n ɑ t͡sʰ u	h ɑ ɾ s n ɑ t͡sʰ u
χ ɑ t͡ʃʰ m ɛ ɾ u k	χ ɑ t͡ʃʰ m ɛ ɾ u k
m ɛ t͡s ɑ ɡ u j n	m ɛ t͡s ɑ ɡ u j n
m ɑ ɾ u kʰ j ɑ n	m ɑ ɾ u kʰ j ɑ n
h ɑ v ɑ kʰ u j tʰ	h ɑ v ɑ kʰ u j tʰ
h j u ɾ ɛ ɾ i t͡sʰ	h j u ɾ ɛ ɾ i t͡sʰ
m u ɾ ɑ d j ɑ n	m u ɾ ɑ d j ɑ n
h ə ʁ u tʰ j u n	h ə ʁ u tʰ j u n
h j u ɾ ɛ ɾ i n	h j u ɾ ɛ ɾ i n
i n s t i t u t	i n s t i t u t
kʰ ɑ v u tʰ j ɑ n	kʰ ɑ v u tʰ j ɑ n
ɑ t ɾ ɑ ɡ u j n	ɑ t ɾ ɑ ɡ u j n
r u m i n ɑ t͡sʰ i	r u m i n ɑ t͡sʰ i
ə n d͡z ɑ r j u t͡s	ə n d͡z ɑ r j u t͡s
ɛ l ɛ m ɛ n t ɑ ɾ	ɛ l ɛ m ɛ n t ɑ ɾ
h ɑ r ɑ t͡ʃʰ ɑ l i ɾ	h ɑ r ɑ t͡ʃʰ ɑ l i ɾ
l ə ɾ ɑ t͡sʰ u t͡sʰ i t͡ʃʰ	l ə ɾ ɑ t͡sʰ u t͡sʰ i t͡ʃʰ
ɡ ɛ v ɔ ɾ kʰ j ɑ n	ɡ ɛ v ɔ ɾ kʰ j ɑ n
b u d ɑ p ɛ ʃ t	b u d ɑ p ɛ ʃ t
h u s ɑ d ɾ ɛ l	h u s ɑ d ɾ ɛ l
b u l ʁ ɑ ɾ j ɑ	b u l ʁ ɑ ɾ j ɑ
d ɑ ʃ t ɛ ɾ u m	d ɑ ʃ t ɛ ɾ u m
ɔ ɾ ɡ ɑ n ɑ k ɑ n	ɔ ɾ ɡ ɑ n ɑ k ɑ n
ʒ ɔ ʁ ɔ v u ɾ tʰ	ʒ ɔ ʁ ɔ v u ɾ tʰ
pʰ j u n i k j ɑ	pʰ j u n i k j ɑ
s ɑ k ɑ ɾ k u m	s ɑ k ɑ ɾ k u m
t͡sʰ u t͡sʰ ɑ d ɾ ɛ l	t͡sʰ u t͡sʰ ɑ d ɾ ɛ l
b ə n u tʰ j u n	b ə n u tʰ j u n
s ɑ ɾ u m j ɑ n	s ɑ ɾ u m j ɑ n
h u ŋ ɡ ɑ ɾ j ɑ	h u ŋ ɡ ɑ ɾ j ɑ
n ɑ χ ɑ t ɛ s ɛ l	n ɑ χ ɑ t ɛ s ɛ l
ɑ r ɑ kʰ ɛ l j ɑ n	ɑ r ɑ kʰ ɛ l j ɑ n
f i l i p i n t͡sʰ i	f i l i p i n t͡sʰ i
m ɔ t i v ɑ t͡sʰ j ɑ	m ɔ t i v ɑ t͡sʰ j ɑ
h ɑ m ɑ k ɾ ɑ ŋ kʰ	h ɑ m ɑ k ɾ ɑ ŋ kʰ
p ɛ t ɾ ɔ s j ɑ n	p ɛ t ɾ ɔ s j ɑ n
tʰ ɑ t ɛ ɾ ɑ k ɑ n	tʰ ɑ t ɛ ɾ ɑ k ɑ n
u ŋ k ə n d ɾ ɛ l	u ŋ k ə n d ɾ ɛ l
h ɛ r ɑ d i t ɑ k	h ɛ r ɑ d i t ɑ k
ɑ s ɔ t͡sʰ j ɑ t͡sʰ j ɑ	ɑ s ɔ t͡sʰ j ɑ t͡sʰ j ɑ
tʰ ɑ ɾ m ɑ t͡sʰ n ɛ l	tʰ ɑ ɾ m ɑ t͡sʰ n ɛ l
ɑ p ɛ ɾ d͡ʒ ɑ n i k	ɑ p ɛ ɾ d͡ʒ ɑ n i k
v ɔ l ɡ ɔ ɡ ɾ ɑ d	v ɔ l ɡ ɔ ɡ ɾ ɑ d
ɑ m ɛ ɾ i k j ɑ n	ɑ m ɛ ɾ i k j ɑ n
ɑ s t ʁ ɑ k ɛ ɾ p	ɑ s t ʁ ɑ k ɛ ɾ p
ɑ m b ɑ s t ɑ ŋ kʰ	ɑ m b ɑ s t ɑ ŋ kʰ
b ɑ ɾ b ɑ n d͡ʒ ɛ l	b ɑ ɾ b ɑ n d͡ʒ ɛ l
ɡ ɑ s p ɑ ɾ j ɑ n	ɡ ɑ s p ɑ ɾ j ɑ n
ɑ n h ɑ ŋ ɡ i s t	ɑ n h ɑ ŋ ɡ i s t
χ ɑ v ɑ ɾ ɑ s ɛ ɾ	χ ɑ v ɑ ɾ ɑ s ɛ ɾ
t ɛ kʰ ɛ ɾ ɑ k i n	t ɛ kʰ ɛ ɾ ɑ k i n
v ɛ ɾ t͡ʃʰ n ɑ k ɑ n	v ɛ ɾ t͡ʃʰ n ɑ k ɑ n
m j ɑ s n ɑ b ɑ ɾ	m i j ɑ s n ɑ b ɑ ɾ
ɡ ɔ ɾ t͡s ə n tʰ ɑ t͡sʰ	ɡ ɔ ɾ t͡s ə n tʰ ɑ t͡sʰ
k ɑ ɾ m ɾ ɑ n ɑ l	k ɑ ɾ m ɾ ɑ n ɑ l
m ɑ t ɑ k ɑ ɾ ɑ ɾ	m ɑ t ɑ k ɑ ɾ ɑ ɾ
p ɑ r l ɑ m ɛ n t	p ɑ r l ɑ m ɛ n t
b i z n ɛ s m ɛ n	b i z n ɛ s m ɛ n
h i m n ɑ d ɾ ɑ m	h i m n ɑ d ɾ ɑ m
ɑ m ɛ ɾ i k ɑ j i	ɑ m ɛ ɾ i k ɑ j i
h ɑ s k ɑ n ɑ l i	h ɑ s k ɑ n ɑ l i
d ɛ k t ɛ m b ɛ ɾ	d ɛ k t ɛ m b ɛ ɾ
s ɛ m ɛ ɾ d͡ʒ j ɑ n	s ɛ m ɛ ɾ d͡ʒ j ɑ n
ɑ s p ɛ t ɑ k ɑ n	ɑ s p ɛ t ɑ k ɑ n
p ɑ ɾ s k ɑ h ɑ j	p ɑ ɾ s k ɑ h ɑ j
ɑ χ ɑ l kʰ ɑ l ɑ kʰ	ɑ χ ɑ l kʰ ɑ l ɑ kʰ
z ə ɾ u t͡sʰ ɑ ɾ ɑ n	z ə ɾ u t͡sʰ ɑ ɾ ɑ n
χ ɑ pʰ ɛ p ɑ t i ɾ	χ ɑ pʰ ɛ p ɑ t i ɾ
ɑ r ɑ v ɔ t j ɑ n	ɑ r ɑ v ɔ t j ɑ n
pʰ ɑ j t pʰ ɔ ɾ i k	pʰ ɑ j t pʰ ɔ ɾ i k
ɑ f s t ɾ ɑ l j ɑ	ɑ f s t ɾ ɑ l j ɑ
z ɔ h ɑ s ɛ ʁ ɑ n	z ɔ h ɑ s ɛ ʁ ɑ n
kʰ ɑ ʁ ɑ kʰ ɑ ɡ ɛ t	kʰ ɑ ʁ ɑ kʰ ɑ ɡ ɛ t
b ɑ l ɑ l ɑ j k ɑ	b ɑ l ɑ l ɑ j k ɑ
p ɔ d ɡ ɔ ɾ i t͡sʰ ɑ	p ɔ d ɡ ɔ ɾ i t͡sʰ ɑ
ɑ b ɔ n ɛ m ɛ n t	ɑ b ɔ n ɛ m ɛ n t
ʒ ɑ m k ɔ t͡ʃʰ j ɑ n	ʒ ɑ m k ɔ t͡ʃʰ j ɑ n
f i n l ɑ n d j ɑ	f i n l ɑ n d j ɑ
m ɑ ɾ m n ɑ k ɑ n	m ɑ ɾ m n ɑ k ɑ n
m ɔ f s i s j ɑ n	m ɔ f s i s j ɑ n
pʰ ɔ kʰ ɾ ɑ t͡sʰ n ɛ l	pʰ ɔ kʰ ɾ ɑ t͡sʰ n ɛ l
d͡z i tʰ ɑ p ə t u ʁ	d͡z i tʰ ɑ p ə t u ʁ
ɡ ɑ χ t n ɑ b ɑ r	ɡ ɑ χ t n ɑ b ɑ r
kʰ ə nː ɑ d ɑ t ɛ l	kʰ ə nː ɑ d ɑ t ɛ l
tʰ ɑ m i l ɛ ɾ ɛ n	tʰ ɑ m i l ɛ ɾ ɛ n
kʰ ɑ n ɑ k ɑ k ɑ n	kʰ ɑ n ɑ k ɑ k ɑ n
p ɑ ɾ s k ɑ k ɑ n	p ɑ ɾ s k ɑ k ɑ n
m i t͡ʃʰ n ɑ b ɛ ɾ tʰ	m i t͡ʃʰ n ɑ b ɛ ɾ tʰ
n ɑ v ɑ k ɑ t i kʰ	n ɑ v ɑ k ɑ t i kʰ
s ɔ v ɔ ɾ ɑ k ɑ n	s ɔ v ɔ ɾ ɑ k ɑ n
v j ɛ t n ɑ m t͡sʰ i	v j ɛ t n ɑ m t͡sʰ i
t ɛ ʁ ɛ k ɑ n ɑ l	t ɛ ʁ ɛ k ɑ n ɑ l
h ɑ m ə ŋ k n ɛ l	h ɑ m ə ŋ k n ɛ l
ə s p i t ɑ k u t͡sʰ	ə s p i t ɑ k u t͡sʰ
ɑ χ t ɔ ɾ ɔ ʃ ɛ l	ɑ χ t ɔ ɾ ɔ ʃ ɛ l
b ɛ ɾ ɑ n ɑ j i n	b ɛ ɾ ɑ n ɑ j i n
n ɛ ɾ b ɛ r n ɛ l	n ɛ ɾ b ɛ r n ɛ l
kʰ ɑ χ t͡sʰ ɾ ɑ h ɑ m	kʰ ɑ χ t͡sʰ ɾ ɑ h ɑ m
k ɔ f k ɑ s j ɑ n	k ɔ f k ɑ s j ɑ n
kʰ ɑ ʁ ɑ kʰ ɑ k ɑ n	kʰ ɑ ʁ ɑ kʰ ɑ k ɑ n
h ɛ t ɑ z ɔ t ɔ ʁ	h ɛ t ɑ z ɔ t ɔ ʁ
s ɛ ʁ ɑ n ɑ p ɛ t	s ɛ ʁ ɑ n ɑ p ɛ t
j ɛ ɾ u s ɑ ʁ ɛ m	j ɛ ɾ u s ɑ ʁ ɛ m
ɑ pʰ χ ɑ z ɛ ɾ ɛ n	ɑ pʰ χ ɑ z ɛ ɾ ɛ n
ɑ n ɔ ɾ ɔ ʃ ɛ l i	ɑ n ɔ ɾ ɔ ʃ ɛ l i
v i kʰ i p ɛ d j ɑ	v i kʰ i p ɛ d j ɑ
j ɛ r ɑ ŋ k j u n	j ɛ r ɑ ŋ k j u n
ɑ n h ɛ t ɑ n ɑ l	ɑ n h ɛ t ɑ n ɑ l
d ɑ v ɑ t͡ʃ ɑ n ɛ l	d ɑ v ɑ t͡ʃ ɑ n ɛ l
p i ɾ ɛ n ɛ j ɑ n	p i ɾ ɛ n ɛ j ɑ n
m ɑ t n ɑ h ɛ t kʰ	m ɑ t n ɑ h ɛ t kʰ
b ɑ ɾ ɔ j ɑ k ɑ n	b ɑ ɾ ɔ j ɑ k ɑ n
ə z ɡ ɑ t͡sʰ m u ŋ kʰ	ə z ɡ ɑ t͡sʰ m u ŋ kʰ
ɑ r ɛ v ɑ ŋ ɡ ɛ l	ɑ r ɛ v ɑ ŋ ɡ ɛ l
ɔ s m ɑ n ɑ k ɑ n	ɔ s m ɑ n ɑ k ɑ n
b ɑ ŋ ɡ l ɑ d ɛ ʃ	b ɑ ŋ ɡ l ɑ d ɛ ʃ
n ɛ ɾ k ɑ p ə n ɑ k	n ɛ ɾ k ɑ p ə n ɑ k
d ə p ɾ ɔ t͡sʰ ɑ k ɑ n	d ə p ɾ ɔ t͡sʰ ɑ k ɑ n
ə s t ɛ pʰ ɑ n j ɑ n	ə s t ɛ pʰ ɑ n j ɑ n
ɡ ɔ ɾ t͡s ɛ l ɑ v ɔ t͡ʃ	ɡ ɔ ɾ t͡s ɛ l ɑ v ɔ t͡ʃ
tʰ ə χ tʰ ɑ p ɑ n ɑ k	tʰ ə χ tʰ ɑ p ɑ n ɑ k
v ɔ kʰ ɛ ʃ ə n t͡ʃʰ u m	v ɔ kʰ ɛ ʃ ə n t͡ʃʰ u m
m ɑ t n ɑ n ə ʃ ɛ l	m ɑ t n ɑ n ə ʃ ɛ l
