tʰ ɑ l i b ɑ n	tʰ ɑ l i b ɑ n
b ɑ r u j tʰ	b ɑ r u j tʰ
ɑ p u l j ɑ	ɑ p u l j ɑ
n ɛ p t u n	n ɛ p t u n
k ɑ ɾ k u t	k ɑ ɾ k u t
ɡ u ɾ ɡ ɛ n	ɡ u ɾ ɡ ɛ n
v ɛ ɾ m u t	v ɛ ɾ m u t
k ɑ h u j kʰ	k ɑ h u j kʰ
t u ɑ l ɛ t	t u ɑ l ɛ t
m ə ɾ m u n d͡ʒ	m ə ɾ m u n d͡ʒ
pʰ ɑ r ɑ h ɛ ʁ	pʰ ɑ r ɑ h ɛ ʁ
m i t͡ʃʰ ɑ n t͡sʰ kʰ	m i t͡ʃʰ ɑ n t͡sʰ kʰ
ɑ v j ɑ t͡sʰ j ɑ	ɑ v j ɑ t͡sʰ j ɑ
t͡ʃʰ ɔ ɾ ɑ tʰ ɑ n	t͡ʃʰ ɔ ɾ ɑ tʰ ɑ n
l ɔ ɡ ɑ ɾ ɑ n	l ɔ ɡ ɑ ɾ ɑ n
h ɔ j ɑ k ɑ p	h ɔ j ɑ k ɑ p
χ ɑ t͡ʃʰ ɑ k i ɾ	χ ɑ t͡ʃʰ ɑ k i ɾ
k ɔ n ɑ k ɑ n	k ɔ n ɑ k ɑ n
h ɑ j k j ɑ n	h ɑ j k j ɑ n
p ɑ t ɾ ɑ s t	p ɑ t ɾ ɑ s t
χ ɔ t ɑ k ɛ ɾ	χ ɔ t ɑ k ɛ ɾ
ə s t u ɡ ɛ l	ə s t u ɡ ɛ l
h ɑ pʰ ɑ pʰ ɛ l	h ɑ pʰ ɑ pʰ ɛ l
ɑ ʃ χ ɑ t ɔ ʁ	ɑ ʃ χ ɑ t ɔ ʁ
pʰ i ɾ u z ɑ	pʰ i ɾ u z ɑ
m ɑ kʰ ɾ u m	m ɑ kʰ ɾ u m
tʰ i k u ŋ kʰ	tʰ i k u ŋ kʰ
k ɑ p u j t	k ɑ p u j t
ɡ ɑ ŋ ɡ u ɾ	ɡ ɑ ŋ ɡ u ɾ
ɑ n pʰ u j tʰ	ɑ n pʰ u j tʰ
j u ɾ ɔ v i	j u ɾ ɔ v i
k ɛ t t͡ʃʰ u p	k ɛ t t͡ʃʰ u p
k ɑ nː ɑ d ɑ	k ɑ nː ɑ d ɑ
ɑ ŋ k j u n	ɑ ŋ k j u n
t͡ʃ ɛ χ kʰ u m	t͡ʃ ɛ χ kʰ u m
z ɛ j tʰ u n	z ɛ j tʰ u n
m i t ɑ nː i	m i t ɑ nː i
χ ɑ ɾ u j k	χ ɑ ɾ u j k
d͡ʒ u l h ɑ k	d͡ʒ u l h ɑ k
tʰ ɑ ɾ χ u n	tʰ ɑ ɾ χ u n
l u s i n ɛ	l u s i n ɛ
h u n v ɑ ɾ	h u n v ɑ ɾ
h ɛ t u j kʰ	h ɛ t u j kʰ
k ɔ ɾ p u s	k ɔ ɾ p u s
h j u tʰ ɛ ʁ	h j u tʰ ɛ ʁ
ɑ p ɾ u s t	ɑ p ɾ u s t
u ʃ ɑ n ɑ l	u ʃ ɑ n ɑ l
b ɛ j ɾ u tʰ	b ɛ j ɾ u tʰ
m ɑ s ɛ ɾ u	m ɑ s ɛ ɾ u
m ɑ k u j k	m ɑ k u j k
tʰ ɑ kʰ u s t	tʰ ɑ kʰ u s t
χ ɔ s t u m	χ ɔ s t u m
h ɔ n s j u	h ɔ n s j u
j ɔ ɾ u b ɑ	j ɔ ɾ u b ɑ
h ɑ ɾ u s t	h ɑ ɾ u s t
d u ɾ ɡ ɑ ɾ	d u ɾ ɡ ɑ ɾ
h ɑ t͡ʃ u j kʰ	h ɑ t͡ʃ u j kʰ
h j u ɾ i t͡sʰ	h j u ɾ i t͡sʰ
u ʁː ɑ k i	u ʁː ɑ k i
b u ɾ u m	b u ɾ u m
u ʃ u n t͡sʰ	u ʃ u n t͡sʰ
l u t͡s u m	l u t͡s u m
s u χ u m	s u χ u m
kʰ u d͡ʒ u d͡ʒ	kʰ u d͡ʒ u d͡ʒ
p u t͡ʃ u ɾ	p u t͡ʃ u ɾ
n ɑ u ɾ u	n ɑ u ɾ u
tʰ u tʰ u n	tʰ u tʰ u n
h u m u s	h u m u s
u l u ŋ kʰ	u l u ŋ kʰ
χ u t u t	χ u t u t
ɡ u ʒ u m	ɡ u ʒ u m
t u t u z	t u t u z
u r u t͡sʰ kʰ	u r u t͡sʰ kʰ
m u ɾ u kʰ	m u ɾ u kʰ
χ u t͡ʃ u t͡ʃ	χ u t͡ʃ u t͡ʃ
m u ɾ h ɑ k	m u ɾ h ɑ k
b u ʒ u m	b u ʒ u m
d u d u k	d u d u k
u n ɛ n ɑ l	u n ɛ n ɑ l
d͡ʒ i b u tʰ i	d͡ʒ i b u tʰ i
m ɑ <<unk>> ɛ ɔ s	m ɑ <unk> ɛ ɔ s
ɡ u ɡ ɑ ɾ kʰ	ɡ u ɡ ɑ ɾ kʰ
kʰ j ɔ m u ɾ	kʰ j ɔ m u ɾ
d͡ʒ ɛ ɾ m u k	d͡ʒ ɛ ɾ m u k
u t ɛ l i kʰ	u t ɛ l i kʰ
m ɑ h ɑ t͡sʰ u	m ɑ h ɑ t͡sʰ u
ɡ ɔ ʁ u n i	ɡ ɔ ʁ u n i
d u ʃ m ɑ n	d u ʃ m ɑ n
k ɔ ɾ j u n	k ɔ ɾ j u n
u s ɑ n ɔ ʁ	u s ɑ n ɔ ʁ
ɡ ɑ l u s t	ɡ ɑ l u s t
b ɾ u n ɛ j	b ɾ u n ɛ j
ɡ ɔ ɾ t͡s u m	ɡ ɔ ɾ t͡s u m
h ɑ j u h i	h ɑ j u h i
t ɛ ɾ u n i	t ɛ ɾ u n i
b u ɾ ɡ ɛ ɾ	b u ɾ ɡ ɛ ɾ
h ɛ ɾ kʰ u m	h ɛ ɾ kʰ u m
ʃ ɑ u ɾ m ɑ	ʃ ɑ u ɾ m ɑ
ʒ u ʒ k ɑ l	ʒ u ʒ k ɑ l
b ɑ j ʁ u ʃ	b ɑ j ʁ u ʃ
ʃ ɑ ɾ ʒ u n	ʃ ɑ ɾ ʒ u n
tʰ ɑ l m u d	tʰ ɑ l m u d
s ɑ t u ɾ n	s ɑ t u ɾ n
p ɑ ɾ u j ɾ	p ɑ ɾ u j ɾ
ʃ ɑ m p u n	ʃ ɑ m p u n
ɑ ʁ j u s ɛ	ɑ ʁ j u s ɛ
ɑ b ɛ ʁ u k	ɑ b ɛ ʁ u k
ɑ h ɑ z d u	ɑ h ɑ z d u
k ɑ m u ɾ d͡ʒ	k ɑ m u ɾ d͡ʒ
ʃ ɑ ɾ ʒ u m	ʃ ɑ ɾ ʒ u m
ɡ ɔ ɾ t͡s u n	ɡ ɔ ɾ t͡s u n
d ɑ m b u l	d ɑ m b u l
k ɑ pʰ u j ɾ	k ɑ pʰ u j ɾ
tʰ ɑ j f u n	tʰ ɑ j f u n
pʰ j u n i k	pʰ j u n i k
t i ɾ ɑ t͡sʰ u	t i ɾ ɑ t͡sʰ u
ɑ ɾ t͡sʰ u ŋ kʰ	ɑ ɾ t͡sʰ u ŋ kʰ
h ɛ lː ɑ d ɑ	h ɛ l ɑ d ɑ
ɑ χ p j u ɾ	ɑ χ p j u ɾ
s u l tʰ ɑ n	s u l tʰ ɑ n
u s ɑ n ɛ l	u s ɑ n ɛ l
s u t͡ʃʰ ɑ v ɑ	s u t͡ʃʰ ɑ v ɑ
tʰ u ɾ i n d͡ʒ	tʰ u ɾ i n d͡ʒ
z ɛ k u j t͡sʰ	z ɛ k u j t͡sʰ
d͡z u l ɑ t͡s ɔ	d͡z u l ɑ t͡s ɔ
d ɑ s ɑ t u	d ɑ s ɑ t u
m ɑ ɾ ɔ <<unk>> ɔ	m ɑ ɾ ɔ k ɔ
pʰ ɑ s t u m	pʰ ɑ s t u m
h j u ɾ i n	h j u ɾ i n
s j u n i kʰ	s j u n i kʰ
ɑ r ɑ kʰ u m	ɑ r ɑ kʰ u m
ɑ ɾ kʰ u n i	ɑ ɾ kʰ u n i
ɡ ɛ ʁ d͡ʒ u k	ɡ ɛ ʁ d͡ʒ u k
h ɑ ɾ b u χ	h ɑ ɾ pʰ u χ
d͡ʒ u ŋ ɡ l i	d͡ʒ u ŋ ɡ l i
ɑ ŋ k u ʃ t	ɑ ŋ k u ʃ t
h ɑ ɾ t͡sʰ u m	h ɑ ɾ t͡sʰ u m
h u d z ɔ n	h u d z ɔ n
ɑ ʃ χ u j ʒ	ɑ ʃ χ u j ʒ
f j u ɾ ɛ ɾ	f j u ɾ ɛ ɾ
k ɔ ɾ u s t	k ɔ ɾ u s t
ɑ nː ə k u n	ɑ nː ə k u n
d i m ɑ n ɑ l	d i m ɑ n ɑ l
s u ɾ ɑ m i	s u ɾ ɑ m i
z ɑ j ɾ u t͡sʰ	z ɑ j ɾ u t͡sʰ
ɑ n ɔ kʰ u t	ɑ n ɔ kʰ u t
s j u n ɑ k	s j u n ɑ k
ɑ m u s i n	ɑ m u s i n
t͡s ɛ ɾ u j tʰ	t͡s ɛ ɾ u j tʰ
z ɑ ɾ u h i	z ɑ ɾ u h i
χ u m h ɑ ɾ	χ u m h ɑ ɾ
b ɑ χ j u n	b ɑ χ j u n
n u k l ɔ n	n u k l ɔ n
h ɔ ɾ tʰ u k	h ɔ ɾ tʰ u k
p i t u j kʰ	p i t u j kʰ
p ɑ t ʒ u m	p ɑ t ʒ u m
t u ɡ ɑ ŋ kʰ	t u ɡ ɑ ŋ kʰ
s ɑ r u j t͡sʰ	s ɑ r u j t͡sʰ
d ɑ t ɑ v ɔ ɾ	d ɑ t ɑ v ɔ ɾ
m i j ɑ t͡sʰ u m	m i j ɑ t͡sʰ u m
s ɑ j l ɔ ɾ tʰ	s ɑ j l ɔ ɾ tʰ
ʃ ɑ h ɛ k ɑ n	ʃ ɑ h ɛ k ɑ n
kʰ ə ɾ m u h i	kʰ ə ɾ m u h i
h ɑ p ɑ ʁ ɛ l	h ɑ p ɑ ʁ ɛ l
t͡s ɑ χ s v ɛ l	t͡s ɑ χ s v ɛ l
ə ʁ d͡z ɑ k ɑ n	ə ʁ d͡z ɑ k ɑ n
ɡ ɑ l i l j ɑ	ɡ ɑ l i l j ɑ
h ɛ r ɑ ɡ i ɾ	h ɛ r ɑ ɡ i ɾ
d͡ʒ ɑ t ɑ ɡ ɔ v	d͡ʒ ɑ t ɑ ɡ ɔ v
h ɑ m ɑ t ɛ ʁ	h ɑ m ɑ t ɛ ʁ
h ɔ ʃ ɔ t ɛ l	h ɔ ʃ ɔ t ɛ l
ɔ ɡ ɔ s t ɔ s	ɔ ɡ ɔ s t ɔ s
n ɑ v ɑ s t i	n ɑ v ɑ s t i
z ɑ ɾ m ɑ ŋ kʰ	z ɑ ɾ m ɑ ŋ kʰ
d ɛ ɾ ɑ s ɑ n	d ɛ ɾ ɑ s ɑ n
n ɑ h ɑ t ɑ k	n ɑ h ɑ t ɑ k
p ɑ p ɑ k ɑ n	p ɑ p ɑ k ɑ n
l i b ɑ n ɑ n	l i b ɑ n ɑ n
ɡ ɔ j ɑ k ɑ n	ɡ ɔ j ɑ k ɑ n
k ɑ ɾ m ɾ ɛ l	k ɑ ɾ m ɾ ɛ l
k ɑ t͡sʰ ɑ ɾ ɑ n	k ɑ t͡sʰ ɑ ɾ ɑ n
k ɑ l i n i n	k ɑ l i n i n
ɑ ʃ ɑ k ɛ ɾ t	ɑ ʃ ɑ k ɛ ɾ t
ʃ i n v ɑ t͡s kʰ	ʃ i n v ɑ t͡s kʰ
p ə t ʁ ɑ t u	p ə t ʁ ɑ t u
t͡s ɑ v ɑ l ɛ l	t͡s ɑ v ɑ l ɛ l
b ɛ ɔ f t j ɑ	b ɛ ɔ f t j ɑ
l ɑ d͡ʒ v ɑ ɾ tʰ	l ɑ d͡ʒ v ɑ ɾ tʰ
h ɛ ɾ kʰ v ɛ l	h ɛ ɾ kʰ v ɛ l
l i b ɛ ɾ j ɑ	l i b ɛ ɾ j ɑ
p ɑ t ɑ ɾ ɑ kʰ	p ɑ t ɑ ɾ ɑ kʰ
ʒ ɑ m ɑ n ɑ k	ʒ ɑ m ɑ n ɑ k
s ɑ l ɔ n i k	s ɑ l ɔ n i k
ɡ ɔ ɾ t͡s ɑ ɾ kʰ	ɡ ɔ ɾ t͡s ɑ ɾ kʰ
d ɑ d͡ʒ v ɑ t͡s kʰ	d ɑ d͡ʒ v ɑ t͡s kʰ
h ɔ kʰ n ɑ k i	h ɔ kʰ n ɑ k i
h ɑ j ɛ ɾ ɛ n	h ɑ j ɛ ɾ ɛ n
ə n d ɛ ʁ ɛ n	ə n d ɛ ʁ ɛ n
t͡ʃ ɔ t͡ʃ ɑ n ɑ k	t͡ʃ ɔ t͡ʃ ɑ n ɑ k
h ɑ ŋ k ɑ ɾ t͡s	h ɑ ŋ k ɑ ɾ t͡s
p ɛ ɾ t͡ʃ ɑ ŋ kʰ	p ɛ ɾ t͡ʃ ɑ ŋ kʰ
p ɑ t ɑ h ɑ ɾ	p ɑ t ɑ h ɑ ɾ
t͡ʃ ɑ ʃ ɑ ɾ ɑ n	t͡ʃ ɑ ʃ ɑ ɾ ɑ n
ɑ ʁ ɛ ɾ s ɛ l	ɑ ʁ ɛ ɾ s ɛ l
ɑ p t ɑ k ɛ l	ɑ p t ɑ k ɛ l
d͡z ɛ r n ɑ ɾ k	d͡z ɛ r n ɑ ɾ k
h ɑ p ɑ l ɑ s	h ɑ p ɑ l ɑ s
h ɔ ŋ k ɔ ŋ ɡ	h ɔ ŋ k ɔ ŋ ɡ
ɑ r ɑ kʰ i n i	ɑ r ɑ kʰ i n i
pʰ ɔ χ ɑ r ɛ l	pʰ ɔ χ ɑ r ɛ l
ə s t ɑ t u s	ə s t ɑ t u s
ɑ ʒ d ɑ h ɑ k	ɑ ʒ d ɑ h ɑ k
k ɛ s ɾ ɑ j ɾ	k ɛ s ɾ ɑ j ɾ
h ɑ ɾ ɛ v ɑ n	h ɑ ɾ ɛ v ɑ n
k ə t͡s ɔ χ u ɾ	k ə t͡s ɔ χ u ɾ
ɑ m ɛ n ɑ j n	ɑ m ɛ n ɑ j n
b ɑ b ɛ l ɔ n	b ɑ b ɛ l ɔ n
ɑ ɾ ɑ m ɑ z d	ɑ ɾ ɑ m ɑ z d
t ɑ ʁ l j ɑ n	t ɑ ʁ l j ɑ n
ə m p ɛ l i kʰ	ə m p ɛ l i kʰ
s ɛ kʰ s i z m	s ɛ kʰ s i z m
m ɔ l d ɔ v ɑ	m ɔ l d ɔ v ɑ
pʰ ɑ n d͡ʒ ɑ ɾ ɑ	pʰ ɑ n d͡ʒ ɑ ɾ ɑ
ɑ v ɛ l ɔ ɾ tʰ	ɑ v ɛ l ɔ ɾ tʰ
ɑ ɾ m ɑ v i ɾ	ɑ ɾ m ɑ v i ɾ
m i l i t͡sʰ j ɑ	m i l i t͡sʰ j ɑ
i ɾ ɑ n j ɑ n	i ɾ ɑ n j ɑ n
k ɑ pʰ ɑ ɾ i t͡ʃʰ	k ɑ pʰ ɑ ɾ i t͡ʃʰ
k ɔ ʁ b ɑ t͡sʰ i	k ɔ ʁ b ɑ t͡sʰ i
ɑ ɾ ɑ m j ɑ n	ɑ ɾ ɑ m j ɑ n
pʰ ɑ k ɑ ɡ i t͡s	pʰ ɑ k ɑ ɡ i t͡s
kʰ ɑ m ɑ n t͡ʃʰ ɑ	kʰ ɑ m ɑ n t͡ʃʰ ɑ
ɔ kʰ n ɑ k ɑ n	ɔ kʰ n ɑ k ɑ n
k ɛ n t k ɔ m	k ɛ n t k ɔ m
ɑ kʰ s ɔ ɾ ɛ l	ɑ kʰ s ɔ ɾ ɛ l
ɑ n ɑ z n i v	ɑ n ɑ z n i v
k ɑ ɾ ɛ l j ɑ	k ɑ ɾ ɛ l j ɑ
t͡ʃʰ ɑ ɾ ɑ n ɑ l	t͡ʃʰ ɑ ɾ ɑ n ɑ l
ɑ χ t͡ʃ ɑ t ɛ l	ɑ χ t͡ʃ ɑ t ɛ l
m ɛ t͡s ɑ ɾ ɛ l	m ɛ t͡s ɑ ɾ ɛ l
ɔ kʰ t ɑ t ɛ ɾ	ɔ kʰ t ɑ t ɛ ɾ
ɑ r ɑ t͡ʃʰ ɑ ɾ k	ɑ r ɑ t͡ʃʰ ɑ ɾ k
z ɑ kʰ ɑ ɾ j ɑ	z ɑ kʰ ɑ ɾ j ɑ
k ɑ m ɑ v ɔ ɾ	k ɑ m ɑ v ɔ ɾ
ɑ j ɡ ɛ p ɑ n	ɑ j ɡ ɛ p ɑ n
t͡ʃʰ ɛ χ ɑ k ɑ n	t͡ʃʰ ɛ χ ɑ k ɑ n
b ɔ t͡sʰ ɛ ʁ ɛ n	b ɔ t͡sʰ ɛ ʁ ɛ n
b ɑ v ɑ ɾ ɑ ɾ	b ɑ v ɑ ɾ ɑ ɾ
χ ɛ tʰ ɑ k ɑ n	χ ɛ tʰ ɑ k ɑ n
b ɑ v ɑ k ɑ n	b ɑ v ɑ k ɑ n
m i z ɔ ɾ ɑ m	m i z ɔ ɾ ɑ m
ɡ ɑ χ t n i kʰ	ɡ ɑ χ t n i kʰ
d ɑ ɾ t͡sʰ v ɔ ɾ	d ɑ ɾ t͡sʰ v ɔ ɾ
s ɑ ɾ k ɑ z m	s ɑ ɾ k ɑ z m
b ɔ l ɔ n j ɑ	b ɔ l ɔ n j ɑ
ɑ l b ɑ n j ɑ	ɑ l b ɑ n j ɑ
h ɑ n d͡z n ɛ l	h ɑ n d͡z n ɛ l
t͡ʃʰ ɑ ɾ ɑ m i t	t͡ʃʰ ɑ ɾ ɑ m i t
tʰ ɔ f t͡ʃʰ ɑ ŋ kʰ	tʰ ɔ f t͡ʃʰ ɑ ŋ kʰ
kʰ ɑ χ t͡sʰ k ɛ ʁ	kʰ ɑ χ t͡sʰ k ɛ ʁ
h ɑ m ɑ d ɑ n	h ɑ m ɑ d ɑ n
k ɛ s ɑ ɾ j ɑ	k ɛ s ɑ ɾ j ɑ
p ɑ ɾ t͡s ɑ ŋ kʰ	p ɑ ɾ t͡s ɑ ŋ kʰ
b ɔ l i v j ɑ	b ɔ l i v j ɑ
d ɑ ɾ t͡sʰ j ɑ l	d ɑ ɾ t͡sʰ j ɑ l
ɡ ɛ ʁ ɛ t͡sʰ i k	ɡ ɛ ʁ ɛ t͡sʰ i k
χ ɑ pʰ ɑ n ɛ l	χ ɑ pʰ ɑ n ɛ l
ɑ nː ə p ɑ s t	ɑ nː ə p ɑ s t
ɑ n d͡ʒ ɑ t ɛ l	ɑ n d͡ʒ ɑ t ɛ l
ʃ ɔ k ɔ l ɑ d	ʃ ɔ k ɔ l ɑ d
ɡ i t ɛ n ɑ l	ɡ i t ɛ n ɑ l
m ɛ t͡s ɑ ʃ ɛ n	m ɛ t͡s ɑ ʃ ɛ n
b ɑ n ɑ v ɛ t͡ʃ	b ɑ n ɑ v ɛ t͡ʃ
t͡ʃ ɑ χ ɑ ɾ ɑ k	t͡ʃ ɑ χ ɑ ɾ ɑ k
n ɛ j t ɾ ɑ l	n ɛ j t ɾ ɑ l
s ɑ n d ʁ ɑ k	s ɑ n d ʁ ɑ k
t ɑ p ɑ k ɛ l	t ɑ p ɑ k ɛ l
t͡ʃ ɑ p ɔ n j ɑ	t͡ʃ ɑ p ɔ n j ɑ
p ɑ ɾ ɑ p ɛ l	p ɑ ɾ ɑ p ɛ l
b ɑ b ɑ j ɑ n	b ɑ b ɑ j ɑ n
ʃ ɔ kʰ ɛ n ɑ v	ʃ ɔ kʰ ɛ n ɑ v
m ɔ l ɑ χ ɑ ʁ	m ɔ l ɑ χ ɑ ʁ
k ɑ l v ɑ t͡s kʰ	k ɑ l v ɑ t͡s kʰ
pʰ ɑ ɾ i χ ɑ n	pʰ ɑ ɾ i χ ɑ n
ɡ ɛ ʁ ɑ ɡ ɛ t	ɡ ɛ ʁ ɑ ɡ ɛ t
ɑ n d ɑ tʰ ɑ ɾ	ɑ n d ɑ tʰ ɑ ɾ
k ɑ j ɑ ɾ ɑ n	k ɑ j ɑ ɾ ɑ n
s ɑ s ɑ n ɛ l	s ɑ s ɑ n ɛ l
l i s ɑ b ɔ n	l i s ɑ b ɔ n
h ɑ j t n ɛ l	h ɑ j t n ɛ l
m ə kʰ ɛ t͡sʰ u m	m ə kʰ ɛ t͡sʰ u m
l ɑ tʰ ɑ kʰ j ɑ	l ɑ tʰ ɑ kʰ j ɑ
i t ɑ l ɑ t͡sʰ i	i t ɑ l ɑ t͡sʰ i
d ɑ j l ɑ j l	d ɑ j l ɑ j l
v ɑ r ɛ l i kʰ	v ɑ r ɛ l i kʰ
h ɔ ɾ ɔ v ɛ l	h ɔ ɾ ɔ v ɛ l
χ ɑ ʁ ɑ m ɔ l	χ ɑ ʁ ɑ m ɔ l
m ə ɾ t͡ʃʰ j u n	m ə ɾ t͡ʃʰ j u n
ɑ t͡ʃ ɛ t͡sʰ n ɛ l	ɑ t͡ʃ ɛ t͡sʰ n ɛ l
l u s ə ŋ k ɑ	l u s ə ŋ k ɑ
m i kʰ ɑ j ɛ l	m i kʰ ɑ j ɛ l
d͡ʒ ɑ k ɑ ɾ t ɑ	d͡ʒ ɑ k ɑ ɾ t ɑ
m i t͡ʃʰ ɑ k ɛ t	m i t͡ʃʰ ɑ k ɛ t
χ ɑ ʁ ɑ t͡sʰ ɔ ʁ	χ ɑ ʁ ɑ t͡sʰ ɔ ʁ
χ ɑ t͡s ɑ n ɛ l	χ ɑ t͡s ɑ n ɛ l
ɑ ɾ ɡ i ʃ t i	ɑ ɾ ɡ i ʃ t i
ɑ χ t ɑ b ɑ n	ɑ χ t ɑ b ɑ n
h ə ɾ ɑ b u χ	h ə ɾ ɑ b u χ
l i m ɔ n ɑ d	l i m ɔ n ɑ d
d i m ɑ χ ɑ ʁ	d i m ɑ χ ɑ ʁ
m i t͡ʃʰ ɑ d i ɾ	m i t͡ʃʰ ɑ d i ɾ
h ɑ ɾ ɔ j ɑ n	h ɑ ɾ ɔ j ɑ n
l ɑ j p t͡sʰ i ɡ	l ɑ j p t͡sʰ i ɡ
h ɑ n d b ɔ l	h ɑ n d b ɔ l
t͡s ɑ r ɑ j ɔ ʁ	t͡s ɑ r ɑ j ɔ ʁ
ə s t u d j ɑ	ə s t u d j ɑ
s ə ŋ ɡ u j ɾ	s ə ŋ ɡ u j ɾ
n ɑ χ ɑ t ɛ l	n ɑ χ ɑ t ɛ l
ɡ ɾ i ɡ ɔ ɾ i	ɡ ɾ i kʰ ɔ ɾ i
d ɑ ʃ t ɛ ɾ ə	d ɑ ʃ t ɛ ɾ ə
m ɑ k ɛ ɾ ɛ s	m ɑ k ɛ ɾ ɛ s
m i l j ɑ ɾ d	m i l j ɑ ɾ tʰ
ə s pʰ j u r kʰ	ə s pʰ j u r kʰ
d ɑ s ɑ k ɑ n	d ɑ s ɑ k ɑ n
z ɔ ɾ ɑ v ɔ ɾ	z ɔ ɾ ɑ v ɔ ɾ
ɑ ɾ ɔ n j ɑ n	ɑ ɾ ɔ n j ɑ n
n ɑ h ɑ p ɛ t	n ɑ h ɑ p ɛ t
t ɑ p ɑ l ɛ l	t ɑ p ɑ l ɛ l
p ɑ t ɾ ɑ ŋ kʰ	p ɑ t ɾ ɑ ŋ kʰ
m ɑ χ tʰ ɑ ŋ kʰ	m ɑ χ tʰ ɑ ŋ kʰ
ʃ ə n ɔ ɾ i v	ʃ ə n ɔ ɾ i v
n ɛ ɾ kʰ i n i	n ɛ ɾ kʰ i n i
k ɑ ɾ ɑ p ɛ t	k ɑ ɾ ɑ p ɛ t
ɑ m s ɛ k ɑ n	ɑ m s ɛ k ɑ n
b ɑ ɾ ɛ k ɑ m	b ɑ ɾ ɛ k ɑ m
b ɑ ɾ i k ɑ d	b ɑ ɾ i k ɑ d
s ɑ m ɑ ɾ j ɑ	s ɑ m ɑ ɾ j ɑ
b ɑ ʒ ɑ n ɛ l	b ɑ ʒ ɑ n ɛ l
s ɛ n d v i t͡ʃʰ	s ɛ n d v i t͡ʃʰ
kʰ ɑ ɾ ɛ ʁ ɛ n	kʰ ɑ ɾ ɛ ʁ ɛ n
ʃ ɑ χ m ɑ t i	ʃ ɑ χ m ɑ t i
ʒ ɑ n t ɑ χ t	ʒ ɑ n t ɑ χ t
ɑ z d ɑ ɾ ɑ ɾ	ɑ z d ɑ ɾ ɑ ɾ
n ɑ l b ɑ n d	n ɑ l b ɑ n d
p ɑ h ɑ ɾ ɑ n	p ɑ h ɑ ɾ ɑ n
h ɛ ʁ ɛ ʁ ɛ l	h ɛ ʁ ɛ ʁ ɛ l
m ɑ ɾ kʰ ɑ ɾ ɛ	m ɑ ɾ kʰ ɑ ɾ ɛ
s ɑ m ɔ s ɑ t	s ɑ m ɔ s ɑ t
l ɛ h ɛ ɾ ɛ n	l ɛ h ɛ ɾ ɛ n
ɛ n ɛ ɾ ɡ j ɑ	ɛ n ɛ ɾ ɡ j ɑ
h ɔ ʁ d ɔ ʁ d	h ɔ ʁ d ɔ ʁ d
ɑ t͡ʃ ɑ r j ɑ n	ɑ t͡ʃ ɑ r j ɑ n
b ɔ z ɑ v ɑ kʰ	b ɔ z ɑ v ɑ kʰ
kʰ ɑ ʃ m i ɾ i	kʰ ɑ ʃ m i ɾ i
n ɑ j v ɑ t͡s kʰ	n ɑ j v ɑ t͡s kʰ
s ɔ v ɑ m ɑ h	s ɔ v ɑ m ɑ h
tʰ ə ɾ kʰ u h i	tʰ ə ɾ kʰ u h i
b ɑ v ɑ ɾ j ɑ	b ɑ v ɑ ɾ j ɑ
l ɛ ɡ i t i m	l ɛ ɡ i t i m
n ɛ ɾ kʰ n ɑ k	n ɛ ɾ kʰ n ɑ k
kʰ ɛ r ɔ ɾ tʰ i	kʰ ɛ r ɔ ɾ tʰ i
t͡sʰ ɑ n t͡sʰ ɛ n i	t͡sʰ ɑ n t͡sʰ ɛ n i
ʁ ɑ ɾ ɑ v ɑ ʃ	ʁ ɑ ɾ ɑ v ɑ ʃ
t͡ʃʰ i n ɑ ɾ ɛ n	t͡ʃʰ i n ɑ ɾ ɛ n
ɑ m ɑ t͡ʃʰ k ɔ t	ɑ m ɑ t͡ʃʰ k ɔ t
χ ɔ j ɑ n ɑ l	χ ɔ j ɑ n ɑ l
s i ɡ ɑ ɾ ɛ t	s i ɡ ɑ ɾ ɛ t
t ɑ s n i n ə	t ɑ s n i n ə
p ɛ t ɑ k ɑ n	p ɛ t ɑ k ɑ n
v ɛ ɾ ɑ h ɑ s	v ɛ ɾ ɑ h ɑ s
k ɑ χ ɑ ʁ ɑ n	k ɑ χ ɑ ʁ ɑ n
m i k ɔ j ɑ n	m i k ɔ j ɑ n
ɑ ɾ χ ɑ j i n	ɑ ɾ χ ɑ j i n
ɑ χ p ɑ n ɔ t͡sʰ	ɑ χ p ɑ n ɔ t͡sʰ
s ɑ l m ɑ s t	s ɑ l m ɑ s t
pʰ ɑ χ t͡sʰ n ɛ l	pʰ ɑ χ t͡sʰ n ɛ l
t ɑ tʰ ɛ v i k	t ɑ tʰ ɛ v i k
v ɑ ɾ v ɑ r ɑ	v ɑ ɾ v ɑ r ɑ
ɑ ɾ t ɑ ʃ ɛ s	ɑ ɾ t ɑ ʃ ɛ s
s ɑ d ɾ ɑ ŋ kʰ	s ɑ d ɾ ɑ ŋ kʰ
ɑ m s ɑ k ɑ n	ɑ m s ɑ k ɑ n
h ɑ k ɑ r ɑ k	h ɑ k ɑ r ɑ k
ɑ n v ɑ n ɛ l	ɑ n v ɑ n ɛ l
h ɔ ʁ ɛ ʁ ɛ n	h ɔ ʁ ɛ ʁ ɛ n
ɡ i t ɑ k ɑ n	ɡ i t ɑ k ɑ n
l ɔ ʁ ɑ n ɑ l	l ɔ ʁ ɑ n ɑ l
k ɾ ɛ ɑ t i v	k ɾ ɛ ɑ t i v
p ɔ l i m ɛ ɾ	p ɔ l i m ɛ ɾ
d i l i d͡ʒ ɑ n	d i l i d͡ʒ ɑ n
n i k ɔ s i ɑ	n i k ɔ s i ɑ
kʰ ə n ɑ m u k	kʰ ə n ɑ m u k
m ɑ ɡ ɑ d ɑ n	m ɑ ɡ ɑ d ɑ n
h ɑ m ɑ ɾ j ɑ	h ɑ m ɑ ɾ j ɑ
ə ŋ k ɛ t͡sʰ i k	ə ŋ k ɛ t͡sʰ i k
v ɛ ɾ ɑ n ɑ l	v ɛ ɾ ɑ n ɑ l
m i n t͡ʃʰ d ɛ r	m i n t͡ʃʰ d ɛ r
ɑ r ɑ t͡ʃʰ i k ɑ	ɑ r ɑ t͡ʃʰ i k ɑ
i n d i j u m	i n d i j u m
v ɔ χ t͡ʃʰ u j n	v ɔ χ t͡ʃʰ u j n
ɑ k ɑ n d͡ʒ ɔ ʁ	ɑ k ɑ n d͡ʒ ɔ ʁ
s ɑ tʰ ɛ n i k	s ɑ tʰ ɛ n i k
m ɑ n ɑ n ɛ χ	m ɑ n ɑ n ɛ χ
s ɛ p ɑ ɡ i ɾ	s ɛ p ɑ ɡ i ɾ
t͡ʃ ɔ t͡ʃ ɑ tʰ ɔ r	t͡ʃ ɔ t͡ʃ ɑ tʰ ɔ r
m ɛ t͡s ɑ b ɑ n	m ɛ t͡s ɑ b ɑ n
h ɑ l ɑ t͡s ɛ l	h ɑ l ɑ t͡s ɛ l
ɔ ʒ ɑ n d ɑ k	ɔ ʒ ɑ n d ɑ k
n ɑ v ɑ p ɛ t	n ɑ v ɑ p ɛ t
ɑ pʰ χ ɑ z j ɑ	ɑ pʰ χ ɑ z j ɑ
b ɛ ŋ ɡ ɑ l i	b ɛ ŋ ɡ ɑ l i
b ɑ d͡ʒ ɑ n ɑ ʁ	b ɑ d͡ʒ ɑ n ɑ ʁ
d͡ʒ ə ɾ i m u r	d͡ʒ ə ɾ i m u r
d ɑ f tʰ j ɑ n	d ɑ f tʰ j ɑ n
k l ɛ ɾ m ɔ n	k l ɛ ɾ m ɔ n
ɡ ɑ l i j u m	ɡ ɑ l i j u m
j ɛ r ɑ t͡sʰ u m	j ɛ r ɑ t͡sʰ u m
ɑ r ɑ kʰ j ɑ l	ɑ r ɑ kʰ j ɑ l
b ɑ r ɡ i ɾ kʰ	b ɑ r ɡ i ɾ kʰ
t͡ʃʰ ɛ m p j ɔ n	t͡ʃʰ ɛ m p j ɔ n
h ɛ r ɑ v ɔ ɾ	h ɛ r ɑ v ɔ ɾ
n ə ɾ ɑ n u m	n ə ɾ ɑ n u m
k ɑ j ɑ t͡sʰ ɑ t͡s	k ɑ j ɑ t͡sʰ ɑ t͡s
pʰ ɛ ɾ i χ ɑ n	pʰ ɛ ɾ i χ ɑ n
ɑ l k ɔ h ɔ l	ɑ l k ɔ h ɔ l
v ɑ n d ɛ j ɑ	v ɑ n d ɛ j ɑ
d͡ʒ ə ɾ ɑ ʁ ɑ t͡sʰ	d͡ʒ ə ɾ ɑ ʁ ɑ t͡sʰ
l ə ɾ ɑ h ɔ s	l ə ɾ ɑ h ɔ s
d͡z ə m r ɑ n ə	d͡z ə m r ɑ n ə
j ɛ ɾ ɛ m j ɑ	j ɛ ɾ ɛ m j ɑ
b ə n ɔ ɾ ɔ ʃ	b ə n ɔ ɾ ɔ ʃ
s ə χ ɾ ɑ ŋ kʰ	s ə χ ɾ ɑ ŋ kʰ
j ɛ ʁ ɛ v n i	j ɛ ʁ ɛ v n i
p ə ɾ t͡s n ɛ l	p ə ɾ t͡s n ɛ l
χ ə tʰ ɑ n ɛ l	χ ə tʰ ɑ n ɛ l
z ə z v ɛ l i	z ə z v ɛ l i
t͡ʃʰ ə s i ɾ ɑ t͡s	t͡ʃʰ ə s i ɾ ɑ t͡s
s ə l ɑ v ɔ n	s ə l ɑ v ɔ n
v ɔ ɾ tʰ j ɑ k	v ɔ ɾ tʰ j ɑ k
ɡ ə kʰ v ɑ ŋ kʰ	ɡ ə kʰ v ɑ ŋ kʰ
kʰ ə ɾ t i ŋ kʰ	kʰ ə ɾ t i ŋ kʰ
d i j ɑ b ɛ t	d i j ɑ b ɛ t
m ə t ɑ h ɔ ɡ	m ə t ɑ h ɔ ɡ
j ɛ ɾ k ɑ tʰ ɛ	j ɛ ɾ k ɑ tʰ ɛ
ə s t ɛ pʰ ɑ n	ə s t ɛ pʰ ɑ n
ə s p i t ɑ k	ə s p i t ɑ k
b ə l ɔ ɡ ɛ ɾ	b ə l ɔ ɡ ɛ ɾ
n ə v i ɾ ɑ k	n ə v i ɾ ɑ k
t ə n ɑ j i n	t ə n ɑ j i n
b ə ʁ ɑ v ɛ l	b ə ʁ ɑ v ɛ l
d͡z ə k n ɔ ɾ s	d͡z ə k n ɔ ɾ s
t ə n pʰ ɛ s ɑ	t ə n pʰ ɛ s ɑ
ə s p ɑ r ɔ ʁ	ə s p ɑ r ɔ ʁ
j ɛ ɾ ɛ v ɑ n	j ɛ ɾ ɛ v ɑ n
χ ə n ɑ m ɛ l	χ ə n ɑ m ɛ l
j ɛ ɾ ɛ ɾ ɑ l	j ɛ ɾ ɛ ɾ ɑ l
v ɑ h ɑ ɡ ə n	v ɑ h ɑ ɡ ə n
kʰ ə t͡s n ɑ ŋ kʰ	kʰ ə t͡s n ɑ ŋ kʰ
ə s t͡sʰ ɛ n ɑ ɾ	ə s t͡sʰ ɛ n ɑ ɾ
pʰ ə t͡ʃʰ ɑ t͡sʰ ɑ t͡s	pʰ ə t͡ʃʰ ɑ t͡sʰ ɑ t͡s
v ɔ ɾ ɔ n ɛ l	v ɔ ɾ ɔ n ɛ l
ə s p ɑ s ɛ l	ə s p ɑ s ɛ l
v ə ɾ i p ɑ k	v ə ɾ i p ɑ k
pʰ ə t͡ʃʰ ɑ n ɑ l	pʰ ə t͡ʃʰ ɑ n ɑ l
ə s p ɑ n ɑ χ	ə s p ɑ n ɑ χ
h ə n ɑ t͡sʰ ɑ t͡s	h ə n ɑ t͡sʰ ɑ t͡s
d͡ʒ ə ʁ ɑ j i n	d͡ʒ ə ʁ ɑ j i n
j ɛ v ɡ ɛ n i	j ɛ v ɡ ɛ n i
s ə ɾ t͡ʃ ɛ n i	s ə ɾ t͡ʃ ɛ n i
ɡ ə ɾ ɑ r ɛ l	ɡ ə ɾ ɑ r ɛ l
ɡ ə ɾ ɑ pʰ ɑ ɾ	ɡ ə ɾ ɑ pʰ ɑ ɾ
ɑ ʁ m ə k ɛ l	ɑ ʁ m ə k ɛ l
v ɔ χ ɛ ɾ i m	v ɔ χ ɛ ɾ i m
d ɛ r ɛ v ə s	d ɛ r ɛ v ə s
ɑ r ɑ j ʒ ə m	ɑ r ɑ j ʒ ə m
ɑ r d͡z ɛ r ə n	ɑ r d͡z ɛ r ə n
v ə t͡ʃ ɑ ɾ ɛ l	v ə t͡ʃ ɑ ɾ ɛ l
ʃ ə ɾ d͡ʒ v ɛ l	ʃ ə ɾ d͡ʒ v ɛ l
d͡z i j ɑ b ɔ r	d͡z i j ɑ b ɔ r
ɑ n h i m ə n	ɑ n h i m ə n
d͡ʒ ə ɾ ɑ j i n	d͡ʒ ə ɾ ɑ j i n
ə s p ɑ n ɛ l	ə s p ɑ n ɛ l
t͡ʃʰ ə ɡ i t ɛ m	t͡ʃʰ ə ɡ i t ɛ m
kʰ ə nː ə v ɛ l	kʰ ə nː ə v ɛ l
ə ʃ p i l k ɑ	ə ʃ p i l k ɑ
v ɔ ɾ ɔ t ɑ n	v ɔ ɾ ɔ t ɑ n
k ə ɾ t s ɛ ɾ	k ə ɾ t s ɛ ɾ
m ə t ɑ d i ɾ	m ə t ɑ d i ɾ
m ə t ɑ t͡s ɛ l	m ə t ɑ t͡s ɛ l
d͡ʒ ə ɾ ɑ n t͡sʰ kʰ	d͡ʒ ə ɾ ɑ n t͡sʰ kʰ
m ə s ɑ k ɛ ɾ	m ə s ɑ k ɛ ɾ
j ɛ ɾ pʰ ɛ m ə n	j ɛ ɾ pʰ ɛ m ə n
tʰ ə m b ə l i k	tʰ ə m b ə l i k
pʰ ə ɾ pʰ ə ɾ ɛ l	pʰ ə ɾ pʰ ə ɾ ɛ l
kʰ ə ɾ kʰ ə ɾ ɛ l	kʰ ə ɾ kʰ ɾ ɛ l
v ə ɾ ɑ j ɛ ɾ tʰ	v ə ɾ ɑ ɛ ɾ tʰ
m ə k ə ɾ t i t͡ʃʰ	m ə k ə ɾ t i t͡ʃʰ
t ə ʒ v ə ʒ ɑ l	t ə ʒ v ə ʒ ɑ l
m ə tʰ ə n ʃ ɑ ʁ	m ə tʰ ə n ʃ ɑ ʁ
b ə ʒ ə ʃ k ɛ l	b ə ʒ ə ʃ k ɛ l
b ɔ k ɔ t ə n	b ɔ k ɔ t ə n
v ɔ ɡ ɔ ɾ ɛ l	v ɔ ɡ ɔ ɾ ɛ l
kʰ ə ɾ ɛ ʁ ɑ n	kʰ ə ɾ ɛ ʁ ɑ n
pʰ ə ɾ k ɑ ŋ kʰ	pʰ ə ɾ k ɑ ŋ kʰ
ɑ j l ɛ v ə s	ɑ j l ɛ v ə s
j ɛ pʰ ɛ s ɔ s	j ɛ pʰ ɛ s ɔ s
kʰ ə ɾ t n ɛ l	kʰ ə ɾ t n ɛ l
n ə p ɑ t ɑ k	n ə p ɑ t ɑ k
tʰ ə m pʰ ə l i k	tʰ ə m pʰ ə l i k
k ə r k ə r ɑ l	k ə r k ə r ɑ l
t͡ʃ ə r t͡ʃ ə r ɑ l	t͡ʃ ə r t͡ʃ ə r ɑ l
ɡ ə t n ə v ɛ l	ɡ ə t n ə v ɛ l
m ə k ə ɾ t ɛ l	m ə k ə ɾ t ɛ l
ʃ ə ʃ ə n d͡ʒ ɑ l	ʃ ə ʃ ə n d͡ʒ ɑ l
z ə m ə r n i t	z ə m ə r n i t
v ə r ə n d ɛ l	v ə r ə n d ɛ l
χ ə n d͡ʒ ə l ɔ z	χ ə n d͡ʒ ə l ɔ z
b ə l ə ŋ ɡ ɑ z	b ə l ə ŋ ɡ ɑ z
t͡ʃ ə t v ə t ɑ l	t͡ʃ ə t v ə t ɑ l
ʃ ə p ə ɾ t ɛ l	ʃ ə p ə ɾ t ɛ l
d ə r ə n pʰ ɑ k	d ə r ə n pʰ ɑ k
tʰ ə tʰ χ ə m ɔ ɾ	tʰ ə tʰ χ ə m ɔ ɾ
ɑ n h ə n ɑ ɾ	ɑ n h ə n ɑ ɾ
j ɛ ɾ tʰ v ɛ l	j ɛ ɾ tʰ v ɛ l
tʰ ə ʃ n ɑ m i	tʰ ə ʃ n ɑ m i
m ə ɾ t͡sʰ ɔ ɾ tʰ	m ə ɾ t͡sʰ ɔ ɾ tʰ
l ə ɾ d͡ʒ m i t	l ə ɾ d͡ʒ m i t
k ə ɾ t͡s k ɑ l	k ə ɾ t͡s k ɑ l
ə s t ɑ n ɑ l	ə s t ɑ n ɑ l
t ə ɾ ɑ k ɑ n	t ə ɾ ɑ k ɑ n
b ə n ɑ ɡ i ɾ	b ə n ɑ ɡ i ɾ
j ɛ ɾ ɛ v ɑ l	j ɛ ɾ ɛ v ɑ l
ə s t ɑ t͡sʰ ɔ ʁ	ə s t ɑ t͡sʰ ɔ ʁ
ə s k ɑ n ɛ ɾ	ə s k ɑ n ɛ ɾ
h i j ɑ n ɑ l	h i j ɑ n ɑ l
j ɛ χ p ɑ j ɾ	j ɛ χ p ɑ j ɾ
ə ʃ t ɑ p ɛ l	ə ʃ t ɑ p ɛ l
l ə l k ɑ ŋ kʰ	l ə l k ɑ ŋ kʰ
m i j ɑ t ɛ ʁ	m i j ɑ t ɛ ʁ
pʰ ə n t ɾ ɛ l	pʰ ə n t ɾ ɛ l
v ɔ ɾ s ɔ ɾ tʰ	v ɔ ɾ s ɔ ɾ tʰ
ə s k ɛ s ɑ ɾ	ə s k ɛ s ɑ ɾ
pʰ ə ʃ ɾ ɑ ŋ kʰ	pʰ ə ʃ ɾ ɑ ŋ kʰ
d i j ɑ ɾ ɑ n	d i j ɑ ɾ ɑ n
ə s pʰ ɔ pʰ ɛ l	ə s pʰ ɔ pʰ ɛ l
h ɑ ʁ ɑ ɡ ə s	h ɑ ʁ ɑ ɡ ə s
j ɛ ɾ v ɑ n d	j ɛ ɾ v ɑ n d
l ə v ɑ t͡sʰ kʰ i	l ə v ɑ t͡sʰ kʰ i
ɑ n b ə n ɑ k	ɑ n b ə n ɑ k
v ə k ɑ j ɛ l	v ə k ɑ j ɛ l
h ə ɾ t͡ʃ v ɛ l	h ə ɾ t͡ʃ v ɛ l
j ɛ ɾ i v ɑ ɾ	j ɛ ɾ i v ɑ ɾ
v ɔ ɾ ɔ ʃ ɛ l	v ɔ ɾ ɔ ʃ ɛ l
l ə kʰ ɑ v ɛ ɾ	l ə kʰ ɑ v ɛ ɾ
ɑ t ə ɾ t͡ʃ ɑ n	ɑ t ə ɾ t͡ʃ ɑ n
d͡z ɑ j n ɛ ʁ	d͡z ɑ j n ɛ ʁ
h ɑ ʃ v i t͡ʃʰ	h ɑ ʃ v i t͡ʃʰ
ɑ v ɛ t i kʰ	ɑ v ɛ t i kʰ
k ə n u ŋ kʰ	k ə n u ŋ kʰ
ɑ n tʰ ɛ ɾ i	ɑ n tʰ ɛ ɾ i
s ə n d u k	s ə n d u k
ɑ m b ɔ χ t͡ʃʰ	ɑ m b ɔ χ t͡ʃʰ
n ɑ χ t͡ʃ i ɾ	n ɑ χ t͡ʃ i ɾ
t ɑ ɡ n ɑ p	t ɑ ɡ n ɑ p
ɔ s ɛ tʰ j ɑ	ɔ s ɛ tʰ j ɑ
d i p v ɑ t͡s	d i p v ɑ t͡s
h ɑ ɾ i s ɑ	h ɑ ɾ i s ɑ
h ɑ ɾ k ɑ v	h ɑ ɾ k ɑ v
p ɑ kʰ n ɛ l	p ɑ kʰ n ɛ l
ɡ ɛ ɾ m ɑ k	ɡ ɛ ɾ m ɑ k
tʰ ɑ v ɾ i z	tʰ ɑ v ɾ i z
k ɑ n χ i k	k ɑ n χ i k
ɑ n ɑ h i t	ɑ n ɑ h i t
m ə t ɑ r u	m ə t ɑ r u
d ɔ t͡sʰ ɛ n t	d ɔ t͡sʰ ɛ n t
p ɑ ɾ ɑ ɡ ɑ	p ɑ ɾ ɑ ɡ ɑ
tʰ ɔ r n i k	tʰ ɔ r n i k
b ɔ ɾ ɛ n i	b ɔ ɾ ɛ n i
i t ɑ l j ɑ	i t ɑ l j ɑ
ɡ ɑ ŋ ɡ ɛ s	ɡ ɑ ŋ ɡ ɛ s
ɑ ɾ tʰ j ɔ kʰ	ɑ ɾ tʰ j ɔ kʰ
tʰ ɑ ɾ tʰ ɛ l	tʰ ɑ ɾ tʰ ɛ l
ɑ n χ ɛ l kʰ	ɑ n χ ɛ l kʰ
ɡ ɔ ɾ t͡s ɔ n	ɡ ɔ ɾ t͡s ɔ n
s ɑ d ɾ i t͡ʃʰ	s ɑ d ɾ i t͡ʃʰ
s ɑ m ɑ ɾ ɑ	s ɑ m ɑ ɾ ɑ
m ɑ n j ɑ k	m ɑ n j ɑ k
ɑ ɾ t ɑ kʰ ɔ	ɑ ɾ t ɑ kʰ ɔ
n ə ʒ u j kʰ	n ə ʒ u j kʰ
ɛ f ɛ n d i	ɛ f ɛ n d i
k ɑ ɾ m i ɾ	k ɑ ɾ m i ɾ
ɑ ɾ t͡s ɑ tʰ i	ɑ ɾ t͡s ɑ tʰ i
ɡ ɔ v ɑ z d	ɡ ɔ v ɑ z d
ɑ j t͡s j ɑ m	ɑ j t͡s j ɑ m
ɡ ɾ ɔ z n i	ɡ ɾ ɔ z n i
m ɑ ɾ kʰ ɑ ɾ	m ɑ ɾ kʰ ɑ ɾ
ɑ n v ɑ n i	ɑ n v ɑ n i
d i p l ɔ m	d i p l ɔ m
ʃ ɛ ʃ t ɛ l	ʃ ɛ ʃ t ɛ l
v ɑ j ɾ ɑ ɡ	v ɑ j ɾ ɑ ɡ
ɡ ɑ j ɑ n ɑ	ɡ ɑ j ɑ n ɑ
pʰ ɑ ɾ tʰ ɑ m	pʰ ɑ ɾ tʰ ɑ m
l ə ɾ ɑ t u	l ə ɾ ɑ t u
χ ɑ χ t ɛ l	χ ɑ χ t ɛ l
ɑ ŋ k j ɑ l	ɑ ŋ k j ɑ l
v ɑ z ɡ ɛ n	v ɑ z ɡ ɛ n
b ɑ r ɑ d i	b ɑ r ɑ d i
k ɔ b ɑ l t	k ɔ b ɑ l t
p ɔ ʁ ɔ t ɑ	p ɔ ʁ ɔ t ɑ
t ɑ ɾ v ɛ l	t ɑ ɾ v ɛ l
s ɛ ɾ ɡ ɛ j	s ɛ ɾ ɡ ɛ j
ɡ ɛ t n i t͡sʰ	ɡ ɛ t n i t͡sʰ
d ɑ ʃ t i t͡sʰ	d ɑ ʃ t i t͡sʰ
ə n t ɑ n i	ə n t ɑ n i
m ɔ ʃ ɛ n i	m ɔ ʃ ɛ n i
ɔ ɾ j ɔ ɾ tʰ	ɔ ɾ j ɔ ɾ tʰ
p ɑ t r ɛ l	p ɑ t r ɛ l
b ɔ ɾ b ɔ s	b ɔ ɾ b ɔ s
t͡ʃʰ i n ɑ ɾ i	t͡ʃʰ i n ɑ ɾ i
ɑ j d t ɛ ʁ	ɑ j d t ɛ ʁ
p ɑ t j ɑ n	p ɑ t j ɑ n
h ɑ d ɾ ɔ n	h ɑ d ɾ ɔ n
b ɑ z ɑ l t	b ɑ z ɑ l t
z i n v ɑ t͡s	z i n v ɑ t͡s
p ɑ ʃ t ɛ l	p ɑ ʃ t ɛ l
ɑ tʰ ɛ i s t	ɑ tʰ ɛ i s t
h ɑ ɾ ɑ m i	h ɑ ɾ ɑ m i
kʰ ɑ j l ɛ l	kʰ ɑ j l ɛ l
k ɔ χ kʰ i s	k ɔ χ kʰ i s
k ɑ ɾ ɛ l i	k ɑ ɾ ɛ l i
b ɑ ɾ s ɛ ʁ	b ɑ ɾ s ɛ ʁ
k ɑ p ɑ ɾ t͡ʃ	k ɑ p ɑ ɾ t͡ʃ
n ɑ z ɑ n i	n ɑ z ɑ n i
m ɑ ɾ k i z	m ɑ ɾ k i z
s m ɛ ɡ m ɑ	s m ɛ ɡ m ɑ
t ɑ ɾ t ɑ m	t ɑ ɾ t ɑ m
s ɑ n ɾ ɛ l	s ɑ n ɾ ɛ l
ɑ p i k ɑ ɾ	ɑ p i k ɑ ɾ
t͡sʰ ɛ j l ɔ n	t͡sʰ ɛ j l ɔ n
tʰ ɔ ɾ ɡ ɔ m	tʰ ɔ ɾ ɡ ɔ m
t͡s ɑ n ɾ ɔ t͡sʰ	t͡s ɑ n ɾ ɔ t͡sʰ
r i t͡ʃʰ ɑ ɾ d	r i t͡ʃʰ ɑ ɾ d
p ɑ h ɑ n d͡ʒ	p ɑ h ɑ n d͡ʒ
ɡ j ɔ z ɑ l	ɡ j ɔ z ɑ l
ɑ r ɑ kʰ ɛ l	ɑ r ɑ kʰ ɛ l
m ɔ ɾ tʰ ɛ l	m ɔ ɾ tʰ ɛ l
d ɛ ɾ b ɑ j	d ɛ ɾ b ɑ j
ɡ ɑ ɾ ʃ ɛ l	ɡ ɑ ɾ ʃ ɛ l
ʃ ɑ ɾ ʒ i t͡ʃʰ	ʃ ɑ ɾ ʒ i t͡ʃʰ
p ɑ t ɑ n d	p ɑ t ɑ n d
h i ɾ ɑ v i	h i ɾ ɑ v i
s ɑ ɾ d ɛ ɾ	s ɑ ɾ d ɛ ɾ
χ ɑ ɾ i s χ	χ ɑ ɾ i s χ
h ɔ f s ɛ pʰ	h ɔ f s ɛ pʰ
m ɑ ɾ z i t͡ʃʰ	m ɑ ɾ z i t͡ʃʰ
h ɑ v ɛ ɾ ʒ	h ɑ v ɛ ɾ ʒ
k ɛ ɾ ɑ l ɑ	k ɛ ɾ ɑ l ɑ
m ɑ j k ɔ p	m ɑ j k ɔ p
χ ɑ n d͡z ɛ l	χ ɑ n d͡z ɛ l
p i n d ɔ s	p i n d ɔ s
ɡ ɑ ŋ ɡ ɑ t	ɡ ɑ ŋ ɡ ɑ t
m ɔ f s ɛ s	m ɔ f s ɛ s
m ɑ ɡ n i s	m ɑ ɡ n i s
ɡ ɑ v ɾ i l	ɡ ɑ v ɾ i l
t i ɡ ɾ ɑ n	t i ɡ ɾ ɑ n
t͡ʃ i z v i t	t͡ʃ i z v i t
ɑ n ɑ m ɔ kʰ	ɑ n ɑ m ɔ kʰ
t͡ʃ ɑ χ ɾ ɛ l	t͡ʃ ɑ χ ɾ ɛ l
p ɑ t v ɛ ɾ	p ɑ t v ɛ ɾ
t͡s ɑ ɾ ɑ v i	t͡s ɑ ɾ ɑ v i
l i ɔ v i n	l i ɔ v i n
b ɑ n v ɔ ɾ	b ɑ n v ɔ ɾ
k ɑ j t͡s ɑ k	k ɑ j t͡s ɑ k
t ɑ ɾ s ɔ n	t ɑ ɾ s ɔ n
tʰ ɑ k ɑ ɾ d	tʰ ɑ k ɑ ɾ d
p ɑ ɾ t ɛ z	p ɑ ɾ t ɛ z
r ɑ z m i k	r ɑ z m i k
k ɔ ɾ t͡s ɑ n	k ɔ ɾ t͡s ɑ n
d͡ʒ ɛ ɾ m ɔ t͡sʰ	d͡ʒ ɛ ɾ m ɔ t͡sʰ
f i z i k ɑ	f i z i k ɑ
ɑ ɾ ɑ ɾ ɛ l	ɑ ɾ ɑ ɾ ɛ l
h ɑ v ɑ t kʰ	h ɑ v ɑ t kʰ
h ɑ j ɛ t͡sʰ i	h ɑ j ɛ t͡sʰ i
pʰ i pʰ ɛ ɾ tʰ	pʰ i pʰ ɛ ɾ tʰ
b ɑ j d ɛ n	b ɑ j d ɛ n
v ɑ t͡ʃ ɑ r kʰ	v ɑ t͡ʃ ɑ r kʰ
t ɑ ɾ ɛ n t	t ɑ ɾ ɛ n t
v ɑ ɾ ɔ ɾ tʰ	v ɑ ɾ ɔ ɾ tʰ
ɑ p ɑ v ɛ n	ɑ p ɑ v ɛ n
ɡ ɑ χ t n i	ɡ ɑ χ t n i
ɑ ʃ k ɑ ɾ ɑ	ɑ ʃ k ɑ ɾ ɑ
k ɑ ɾ k i n	k ɑ ɾ k i n
h ɑ n d ɛ s	h ɑ n d ɛ s
k ə ɾ u ŋ k	k ə ɾ u ŋ k
χ ɑ j tʰ ɔ t͡sʰ	χ ɑ j tʰ ɔ t͡sʰ
ɡ ɑ m i ɾ kʰ	ɡ ɑ m i ɾ kʰ
b ɑ ʁ n i kʰ	b ɑ ʁ n i kʰ
ɔ ɾ i n ɑ k	ɔ ɾ i n ɑ k
ɑ n d͡z ɾ ɛ v	ɑ n d͡z ɾ ɛ v
m ɑ ɾ t i k	m ɑ ɾ t i k
v ɑ ɾ j ɑ ɡ	v ɑ ɾ j ɑ ɡ
b ɑ d ɑ ɾ ɑ	b ɑ d ɑ ɾ ɑ
ʃ ɑ χ m ɑ t	ʃ ɑ χ m ɑ t
t ɛ s n ɛ l	t ɛ s n ɛ l
ʃ ə ɾ d͡ʒ u m	ʃ ə ɾ d͡ʒ u m
n ɑ t͡sʰ i s t	n ɑ t͡sʰ i s t
d͡z ɑ χ l i k	d͡z ɑ χ l i k
t ɑ v ɾ ɔ s	t ɑ v ɾ ɔ s
t͡s ɑ χ k j ɑ	t͡s ɑ χ k j ɑ
ɡ ɔ ɾ t͡s ɔ ʁ	ɡ ɔ ɾ t͡s ɔ ʁ
tʰ ɑ m ɑ d ɑ	tʰ ɑ m ɑ d ɑ
k ɑ p v ɑ t͡s	k ɑ p v ɑ t͡s
p ɑ ɾ kʰ ɛ v	p ɑ ɾ kʰ ɛ v
m ɔ n ɑ k ɔ	m ɔ n ɑ k ɔ
n ɑ χ k i n	n ɑ χ k i n
d ɑ ʃ t i n	d ɑ ʃ t i n
k ɑ χ v ɛ l	k ɑ χ v ɛ l
k ə r u ŋ k	k ə r u ŋ k
d ɑ ʃ i ŋ kʰ	d ɑ ʃ i ŋ kʰ
z ɔ h v ɛ l	z ɔ h v ɛ l
kʰ i m j ɔ n	kʰ i m j ɔ n
h ɔ v ɑ n i	h ɔ v ɑ n i
s ɑ n t i m	s ɑ n t i m
h ɛ ɾ kʰ ɛ l	h ɛ ɾ kʰ ɛ l
p ɾ ɔ t͡sʰ ɛ s	p ɾ ɔ t͡sʰ ɛ s
h ɑ n v ɛ l	h ɑ n v ɛ l
t͡ʃ ɛ ɾ m ɑ k	t͡ʃ ɛ ɾ m ɑ k
χ ɛ l ɑ t͡sʰ i	χ ɛ l ɑ t͡sʰ i
