կ ա ր ե լ	կ ա ր ե լ
ա ր դ ե ն	ա ր դ ե ն
թ ա լ ա ն	թ ա լ ա ն
հ ե ր ի ք	հ ե ր ի ք
չ ա մ ա ն	չ ա մ ա ն
վ ա հ ա գ	վ ա հ ա գ
շ ա ք ա ր	շ ա ք ա ր
բ ա ն ե լ	բ ա ն ե լ
ճ ա շ ե լ	ճ ա շ ե լ
կ ա ր ա գ	կ ա ր ա գ
շ ա ր ե լ	շ ա ր ե լ
շ ո ր ժ ա	շ ո ր ժ ա
բ ո ր ա ն	բ ո ր ա ն
տ ռ ո ւ զ	տ ռ ո ւ զ
ի ս պ ա ռ	ի ս պ ա ռ
կ ա ր ե ն	կ ա ր ե ն
թ ա թ ա ր	թ ա թ ա ր
ա պ ր ի լ	ա պ ր ի լ
բ ա ղ չ ա	բ ա ղ չ ա
ց ա վ ա լ	ց ա վ ա լ
թ ա հ ա թ	թ ա հ ա թ
թ ա ռ ե լ	թ ա ռ ե լ
վ ա ր ա զ	վ ա ր ա զ
զ ա վ ա կ	զ ա վ ա կ
դ ի պ ա կ	դ ի պ ա կ
ք ս ո ւ ք	ք ս ո ւ ք
ա ծ ե լ ի	ա ծ ե լ ի
օ ր ի ս ա	օ ր ի ս ա
շ ա պ ի կ	շ ա պ ի կ
ա ռ ո ղ ջ	ա ռ ո ղ ջ
մ ի թ ա մ	մ ի թ ա մ
ք ա շ ե լ	ք ա շ ե լ
մ ա շ ի կ	մ ա շ ի կ
խ ա ղ ո ղ	խ ա ղ ո ղ
շ ա պ ո ւ հ	շ ա պ ո ւ հ
դ ո ղ ա լ	դ ո ղ ա լ
տ ա ր ի ք	տ ա ր ի ք
ա ն դ ր ի	ա ն դ ր ի
ծ ա ղ ի կ	ծ ա ղ ի կ
ա ռ ի ն ջ	ա ռ ի ն ջ
ի շ խ ա ն	ի շ խ ա ն
է ր ե խ ա	է ր ե խ ա
ն ի կ ի ա	ն ի կ ի ա
ք ա վ ե լ	ք ա վ ե լ
ն ի ն ջ ա	ն ի ն ջ ա
մ ի տ ո ւ մ	մ ի տ ո ւ մ
հ ո ւ բ ե յ	հ ո ւ բ ե յ
բ յ ո ւ ջ ե	բ յ ո ւ ջ ե
ա ն դ ո ր ր	ա ն դ ո ր ր
ո ւ ղ ե ր ձ	ո ւ ղ ե ր ձ
գ ի ր ո ւ կ	գ ի ր ո ւ կ
մ ա ծ ո ւ ն	մ ա ծ ո ւ ն
ա մ ո ւ ր ի	ա մ ո ւ ր ի
ց ո ւ ց ա կ	ց ո ւ ց ա կ
ա ր բ ո ւ ն	ա ր բ ո ւ ն
ա ն շ ո ւ ք	ա ն շ ո ւ ք
խ ո ւ զ ե լ	խ ո ւ զ ե լ
շ ո ւ շ մ ա	շ ո ւ շ մ ա
մ ա ս ո ւ ր	մ ա ս ո ւ ր
մ ո ւ ր ա լ	մ ո ւ ր ա լ
ս ո ւ դ ա ն	ս ո ւ դ ա ն
ծ ե ր ո ւ կ	ծ ե ր ո ւ կ
վ ի ր ո ւ ս	վ ի ր ո ւ ս
շ ի ն ծ ո ւ	շ ի ն ծ ո ւ
ռ ո ւ բ ե ն	ռ ո ւ բ ե ն
կ ո ւ ր ս կ	կ ո ւ ր ս կ
ա ր դ ո ւ կ	ա ր դ ո ւ կ
ք ո ւ ռ ա թ	ք ո ւ ռ ա թ
փ ե տ ո ւ ր	փ ե տ ո ւ ր
ս ի ր ո ւ ն	ս ի ր ո ւ ն
ս ո ւ զ ե լ	ս ո ւ զ ե լ
ղ ո ւ ր ա ն	ղ ո ւ ր ա ն
ա ն ո ւ ր ջ	ա ն ո ւ ր ջ
հ օ գ ո ւ տ	հ օ գ ո ւ տ
գ ո ւ պ ա ր	գ ո ւ պ ա ր
տ ա վ ո ւ շ	տ ա վ ո ւ շ
ո ւ ս ն ո ց	ո ւ ս ն ո ց
ք ա բ ո ւ լ	ք ա բ ո ւ լ
զ ի ջ ո ւ մ	զ ի ջ ո ւ մ
ա ռ յ ո ւ ծ	ա ռ յ ո ւ ծ
հ ո ւ շ ե ր	հ ո ւ շ ե ր
լ ո ւ ս ա ն	լ ո ւ ս ա ն
հ ի ս ո ւ ս	հ ի ս ո ւ ս
հ ե թ ո ւ մ	հ ե թ ո ւ մ
շ ո ւ շ ա ն	շ ո ւ շ ա ն
հ յ ո ւ ր ը	հ յ ո ւ ր ը
խ ո ւ ր մ ա	խ ո ւ ր մ ա
ա ն կ ո ւ մ	ա ն կ ո ւ մ
հ յ ո ւ ր ի	հ յ ո ւ ր ի
ա ն հ ո ւ ն	ա ն հ ո ւ ն
հ ա ղ թ ո ւ	հ ա ղ թ ո ւ
մ ա տ ո ւ ռ	մ ա տ ո ւ ռ
մ ո ւ ր ա դ	մ ո ւ ր ա դ
լ ո խ ո ւ մ	լ ո խ ո ւ մ
ո ւ ր բ ա թ	ո ւ ր բ ա թ
ճ ա հ ո ւ կ	ճ ա հ ո ւ կ
թ ա թ ո ւ լ	թ ա թ ո ւ լ
լ ի ո ւ լ ի	լ ի ո ւ լ ի
թ ո ւ ն ե լ	թ ո ւ ն ե լ
բ ե ղ ո ւ ն	բ ե ղ ո ւ ն
լ ո ւ թ ե ր	լ ո ւ թ ե ր
ա յ տ ո ւ ց	ա յ տ ո ւ ց
լ ե ց ո ւ ն	լ ե ց ո ւ ն
վ ա դ ո ւ ց	վ ա դ ո ւ ց
մ ո ր ո ւ ք	մ ո ր ո ւ ք
բ ա թ ո ւ մ	բ ա թ ո ւ մ
ո ւ ժ գ ի ն	ո ւ ժ գ ի ն
լ ո ւ ծ ի չ	լ ո ւ ծ ի չ
դ յ ո ւ յ մ	դ յ ո ւ յ մ
խ ո ն ա ր հ	խ ո ն ա ր հ
վ ա տ թ ա ր	վ ա տ թ ա ր
ա ր թ ո ւ ր	ա ր թ ո ւ ր
տ ո ւ ժ ե լ	տ ո ւ ժ ե լ
ն ո ւ բ ա ր	ն ո ւ բ ա ր
հ ո ւ զ ե լ	հ ո ւ զ ե լ
կ ո ւ զ ի կ	կ ո ւ զ ի կ
խ ո ս ո ւ ն	խ ո ս ո ւ ն
ս ո ւ տ ա կ	ս ո ւ տ ա կ
լ ո ւ ր ե ր	լ ո ւ ր ե ր
բ ե ր ո ւ մ	բ ե ր ո ւ մ
մ ա մ ո ւ լ	մ ա մ ո ւ լ
ծ ա գ ո ւ մ	ծ ա գ ո ւ մ
կ ա պ ո ւ տ	կ ա պ ո ւ տ
ո ւ զ բ ե կ	ո ւ զ բ ե կ
ա լ ո ւ ց ք	ա լ ո ւ ց ք
մ ա ք ո ւ ր	մ ա ք ո ւ ր
մ ո ւ ղ ա մ	մ ո ւ ղ ա մ
ս ո վ ա ծ	ս ո վ ա ծ
ա ղ յ ո ւ ս	ա ղ յ ո ւ ս
հ ե ղ ո ւ կ	հ ե ղ ո ւ կ
ս ի ր ո ւ մ	ս ի ր ո ւ մ
բ ա զ ո ւ մ	բ ա զ ո ւ մ
կ ա ն ո ւ խ	կ ա ն ո ւ խ
թ ե կ ո ւ զ	թ ե կ ո ւ զ
լ ո ր տ ո ւ	լ ո ր տ ո ւ
կ ո չ ո ւ մ	կ ո չ ո ւ մ
տ ե լ ո ւ ր	տ ե լ ո ւ ր
կ ո ւ ր ծ ք	կ ո ւ ր ծ ք
ս ի գ ա ր	ս ի գ ա ր
բ ե ւ ե ռ	բ ե ւ ե ռ
բ ա ժ ա կ	բ ա ժ ա կ
ա ր ձ ա ն	ա ր ձ ա ն
ա ն տ ա ռ	ա ն տ ա ռ
յ ա լ թ ա	յ ա լ թ ա
յ ա ս ա խ	յ ա ս ա խ
մ ե դ ա լ	մ ե դ ա լ
հ ո տ ա ղ	հ ո տ ա ղ
օ ա զ ի ս	օ ա զ ի ս
խ ա բ ե լ	խ ա փ ե լ
ա գ ռ ա վ	ա գ ռ ա վ
ա ն մ ի տ	ա ն մ ի տ
հ ա պ ա ղ	հ ա պ ա ղ
պ ա տ ի կ	պ ա տ ի կ
ա ր շ ա վ	ա ր շ ա վ
ա դ ա ն ա	ա դ ա ն ա
ա ն ջ ա տ	ա ն ջ ա տ
փ ա ռ ո ք	փ ա ռ ո ք
խ ի զ ա խ	խ ի զ ա խ
մ ա յ կ ա	մ ա յ կ ա
զ ա ր ե հ	զ ա ր ե հ
հ ի ջ ա զ	հ ի ջ ա զ
օ ր ե ն ք	օ ր ե ն ք
կ ե ս օ ր	կ ե ս օ ր
տ ա ր ե ց	տ ա ր ե ց
ղ ա զ ա ր	ղ ա զ ա ր
վ ա ս ա կ	վ ա ս ա կ
տ ո կ ա լ	տ ո կ ա լ
դ ա ր ա ն	դ ա ր ա ն
կ ա պ ի կ	կ ա պ ի կ
հ ե տ ի ն	հ ե տ ի ն
հ ո գ ո ց	հ ո գ ո ց
կ ա թ ի լ	կ ա թ ի լ
պ ա ր ա պ	պ ա ր ա պ
չ ո ք ե լ	չ ո ք ե լ
պ ր ա յ ա	պ ր ա յ ա
ա զ ն ի վ	ա զ ն ի վ
բ ա ր դ ի	բ ա ր դ ի
դ ա ր ա կ	դ ա ր ա կ
ծ ա վ ա լ	ծ ա վ ա լ
օ գ ն ե լ	օ գ ն ե լ
վ ե զ ի ր	վ ե զ ի ր
գ ա զ ա ն	գ ա զ ա ն
կ ի տ ե լ	կ ի տ ե լ
ա ն հ ա տ	ա ն հ ա տ
բ ի բ ա ր	բ ի բ ա ր
ա ն գ ի ր	ա ն գ ի ր
խ ո ս ա լ	խ ո ս ա լ
պ ա կ ա ս	պ ա կ ա ս
ց ա ն ե լ	ց ա ն ե լ
մ ա յ ե լ	մ ա յ ե լ
թ ա լ ի շ	թ ա լ ի շ
մ ա ս ո ն	մ ա ս ո ն
ս ո ր գ ո	ս ո ր գ ո
կ ա յ ի ն	կ ա յ ի ն
ս ի ս ե ռ	ս ի ս ե ռ
ծ ե ծ ե լ	ծ ե ծ ե լ
ճ ա գ ա ր	ճ ա գ ա ր
կ ա ն ա չ	կ ա ն ա չ
մ ր ր ի կ	մ ր ր ի կ
գ ա վ ի թ	գ ա վ ի թ
ի ն ե ր տ	ի ն ե ր տ
ս ե ւ ա ն	ս ե ւ ա ն
ա յ ր ե լ	ա յ ր ե լ
ն ա յ ա ծ	ն ա յ ա ծ
ա ս պ ե տ	ա ս պ ե տ
վ ա գ ո ն	վ ա գ ո ն
խ ե թ ե լ	խ ե թ ե լ
շ ա լ ա կ	շ ա լ ա կ
հ ո կ ե յ	հ ո կ ե յ
մ ա ր ք ս	մ ա ր ք ս
տ ո կ ո ս	տ ո կ ո ս
ծ ա ն ո թ	ծ ա ն ո թ
գ ե ղ ո ն	գ ե ղ ո ն
ա ղ ա ս ի	ա ղ ա ս ի
շ ե ր ե փ	շ ե ր ե փ
կ ա ր ո ղ	կ ա ր ո ղ
ջ ա լ ա լ	ջ ա լ ա լ
զ ի ն ե լ	զ ի ն ե լ
բ ա ր ա կ	բ ա ր ա կ
պ տ ո ւ ղ	պ տ ո ւ ղ
մ ա յ ի ս	մ ա յ ի ս
ծ ի ր ա ն	ծ ի ր ա ն
հ ա զ ի վ	հ ա զ ի վ
ա պ տ ա կ	ա պ տ ա կ
ա ռ կ ա խ	ա ռ կ ա խ
ջ ա հ ե լ	ջ ա հ ե լ
խ ա չ ի կ	խ ա չ ի կ
վ ա ս ի լ	վ ա ս ի լ
տ ո ր ո ն	տ ո ր ո ն
պ ա շ ա ր	պ ա շ ա ր
տ ա բ ա տ	տ ա բ ա տ
խ ա թ ե ր	խ ա թ ե ր
գ ի ր ք ն	գ ի ր ք ն
ա ն բ ի ծ	ա ն բ ի ծ
ա մ բ ո խ	ա մ բ ո խ
ճ ա հ ի ճ	ճ ա հ ի ճ
թ ո ր ի ծ	թ ո ր ի ծ
ա բ ե ղ ա	ա բ ե ղ ա
ա ղ ք ա տ	ա ղ ք ա տ
զ ո ր ե ղ	զ ո ր ե ղ
շ փ ո ւ մ	շ փ ո ւ մ
կ ո ւ պ ր	կ ո ւ պ ր
ա ն գ ա մ	ա ն գ ա մ
հ ա կ ո բ	հ ա կ ո բ
ծ ղ ո ւ կ	ծ ղ ո ւ կ
գ ի ր ք ը	գ ի ր ք ը
օ ր յ ո լ	օ ր յ ո լ
ա դ ո ն ց	ա դ ո ն ց
մ ե զ ա ր	մ ե զ ա ր
կ ա ր ա ս	կ ա ր ա ս
ճ ա ղ ա տ	ճ ա ղ ա տ
վ ա ր ա կ	վ ա ր ա կ
կ ա պ ա ն	կ ա պ ա ն
պ ա լ ա տ	պ ա լ ա տ
ա բ խ ա զ	ա բ խ ա զ
ն ի հ ա ր	ն ի հ ա ր
ն ի ն վ ե	ն ի ն վ ե
պ ո ռ ո տ	պ ո ռ ո տ
օ հ ա յ ո	օ հ ա յ ո
ռ ե գ բ ի	ռ ե գ բ ի
դ ա հ ի ճ	դ ա հ ի ճ
ն ե խ ե լ	ն ե խ ե լ
ս ե ղ ա ն	ս ե ղ ա ն
զ ա տ ե լ	զ ա տ ե լ
թ ե ք ե լ	թ ե ք ե լ
կ լ ի մ ա	կ լ ի մ ա
մ ի ն ե տ	մ ի ն ե տ
գ ո ռ ո զ	գ ո ռ ո զ
խ ո ռ ո չ	խ ո ռ ո չ
դ ա ջ ե լ	դ ա ջ ե լ
ֆ ի զ ի կ	ֆ ի զ ի կ
գ ո ր ծ ի	գ ո ր ծ ի
կ ի ս ե լ	կ ի ս ե լ
ա ր ծ վ ի	ա ր ծ վ ի
տ ա վ ա ր	տ ա վ ա ր
ա ր գ ո ն	ա ր գ ո ն
լ ո լ ի կ	լ ո լ ի կ
տ ե ս ի լ	տ ե ս ի լ
լ ո զ ա ն	լ ո զ ա ն
ծ ա մ ո ն	ծ ա մ ո ն
ք ա բ ա բ	ք ա բ ա բ
դ ա շ տ ի	դ ա շ տ ի
ը մ պ ե լ	ը մ պ ե լ
մ ի լ ա ն	մ ի լ ա ն
լ ո ղ ա կ	լ ո ղ ա կ
հ ե ն ա ն	հ ե ն ա ն
ռ ա ղ ա մ	ռ ա ղ ա մ
ռ ո ճ ի կ	ռ ո ճ ի կ
գ ո հ ա ր	գ ո հ ա ր
կ ա վ ի ճ	կ ա վ ի ճ
թ ա փ ո ր	թ ա փ ո ր
ռ ա դ ի ո	ռ ա դ ի ո
շ ա մ ա մ	շ ա մ ա մ
պ ո լ կ ա	պ ո լ կ ա
դ ի տ ա կ	դ ի տ ա կ
ա մ ր ո ց	ա մ ր ո ց
ք ա ղ ա ք	ք ա ղ ա ք
ն ե ր ք ո	ն ե ր ք ո
ք յ ո լ ն	ք յ ո լ ն
հ ե ղ ե լ	հ ե ղ ե լ
շ ի տ ա կ	շ ի տ ա կ
ռ ո մ ա ն	ռ ո մ ա ն
թ ե ն ի ս	թ ե ն ի ս
գ ե տ ա փ	գ ե տ ա փ
ա կ ա ն ի	ա կ ա ն ի
հ ա յ լ ի	հ ա յ լ ի
ճ ո ր ո խ	ճ ո ր ո խ
ս ո ղ ա լ	ս ո ղ ա լ
ս ա ր ա յ	ս ա ր ա յ
ա ն ճ ա ր	ա ն ճ ա ր
ճ ո ռ ո մ	ճ ո ռ ո մ
բ ո լ ո ր	բ ո լ ո ր
ա տ յ ա ն	ա տ յ ա ն
տ ի բ ե թ	տ ի բ ե թ
գ ա վ ո տ	գ ա վ ո տ
վ ա յ ե լ	վ ա յ ե լ
կ ա զ ա ն	կ ա զ ա ն
վ ա վ ե ր	վ ա վ ե ր
ա փ ս ո ս	ա փ ս ո ս
ո ս կ ո ւ	ո ս կ ո ւ
ս ա ռ ե լ	ս ա ռ ե լ
մ ե շ ո կ	մ ե շ ո կ
ն ո ր ո գ	ն ո ր ո գ
զ ա ն գ ի	զ ա ն գ ի
կ ա ր ի ք	կ ա ր ի ք
ի տ ա լ ա ց ի	ի տ ա լ ա ց ի
ս ն գ ո ւ յ ր	ս ն գ ո ւ յ ր
լ ի մ ո ն ա դ	լ ի մ ո ն ա դ
գ ր ի գ ո ր ի	գ ր ի գ ո ր ի
դ ա շ տ ե ր ը	դ ա շ տ ե ր ը
մ ա կ ե ր ե ս	մ ա կ ե ր ե ս
մ ի լ ի ա ր դ	մ ի լ ի ա ր դ
ս փ յ ո ւ ռ ք	ս փ յ ո ւ ռ ք
դ ա ս ա կ ա ն	դ ա ս ա կ ա ն
զ ո ր ա վ ո ր	զ ո ր ա վ ո ր
մ ի ք ա յ ե լ	մ ի ք ա յ ե լ
ս տ ո ւ դ ի ա	ս տ ո ւ դ ի ա
դ ա յ լ ա յ լ	դ ա յ լ ա յ լ
վ ա ռ ե լ ի ք	վ ա ռ ե լ ի ք
հ ո ր ո վ ե լ	հ ո ր ո վ ե լ
խ ա ղ ա մ ո լ	խ ա ղ ա մ ո լ
մ ր ջ յ ո ւ ն	մ ր ջ յ ո ւ ն
ա ճ ե ց ն ե լ	ա ճ ե ց ն ե լ
լ ո ւ ս ն կ ա	լ ո ւ ս ն կ ա
լ ա թ ա ք ի ա	լ ա թ ա ք ի ա
ջ ա կ ա ր տ ա	ջ ա կ ա ր տ ա
օ ժ ա ն դ ա կ	օ ժ ա ն դ ա կ
ա ռ ա ջ ի կ ա	ա ռ ա ջ ի կ ա
ի ն դ ի ո ւ մ	ի ն դ ի ո ւ մ
ո ղ ջ ո ւ յ ն	ո ղ ջ ո ւ յ ն
ա կ ա ն ջ օ ղ	ա կ ա ն ջ օ ղ
ս ա թ ե ն ի կ	ս ա թ ե ն ի կ
հ ա մ ա ր յ ա	հ ա մ ա ր յ ա
ս ե պ ա գ ի ր	ս ե պ ա գ ի ր
ճ ո ճ ա թ ո ռ	ճ ո ճ ա թ ո ռ
մ ե ծ ա բ ա ն	մ ե ծ ա բ ա ն
հ ա լ ա ծ ե լ	հ ա լ ա ծ ե լ
մ ի ջ ա կ ե տ	մ ի ջ ա կ ե տ
ն ա վ ա պ ե տ	ն ա վ ա պ ե տ
գ ի տ ա կ ա ն	գ ի տ ա կ ա ն
տ ա թ ե ւ ի կ	տ ա թ ե ւ ի կ
դ ի մ ա խ ա ղ	դ ի մ ա խ ա ղ
մ ի ջ ա դ ի ր	մ ի ջ ա դ ի ր
հ ա ր ո յ ա ն	հ ա ր ո յ ա ն
լ ա յ պ ց ի գ	լ ա յ պ ց ի գ
հ ա ն դ բ ո լ	հ ա ն դ բ ո լ
ծ ա ռ ա յ ո ղ	ծ ա ռ ա յ ո ղ
ա ր ո ն յ ա ն	ա ր ո ն յ ա ն
ն ա լ բ ա ն դ	ն ա լ բ ա ն դ
բ ա ր ե կ ա մ	բ ա ր ե կ ա մ
ն ա հ ա պ ե տ	ն ա հ ա պ ե տ
տ ա պ ա լ ե լ	տ ա պ ա լ ե լ
պ ա տ ր ա ն ք	պ ա տ ր ա ն ք
մ ա ղ թ ա ն ք	մ ա ղ թ ա ն ք
շ ն ո ր հ ի վ	շ ն ո ր հ ի վ
ն ե ր ք ի ն ի	ն ե ր ք ի ն ի
կ ա ր ա պ ե տ	կ ա ր ա պ ե տ
ա մ ս ե կ ա ն	ա մ ս ե կ ա ն
պ ա հ ա ր ա ն	պ ա հ ա ր ա ն
բ ա ր ի կ ա դ	բ ա ր ի կ ա դ
ս ա մ ա ր ի ա	ս ա մ ա ր ի ա
բ ա ժ ա ն ե լ	բ ա ժ ա ն ե լ
ս ե ն դ վ ի չ	ս ե ն դ վ ի չ
ք ա ր ե ղ ե ն	ք ա ր ե ղ ե ն
շ ա խ մ ա տ ի	շ ա խ մ ա տ ի
ս ա ն դ ղ ա կ	ս ա ն դ ղ ա կ
ժ ա ն տ ա խ տ	ժ ա ն տ ա խ տ
խ ո ղ ո վ ա կ	խ ո ղ ո վ ա կ
ն ա յ վ ա ծ ք	ն ա յ վ ա ծ ք
խ ա ղ ա ց ո ղ	խ ա ղ ա ց ո ղ
խ ա ծ ա ն ե լ	խ ա ծ ա ն ե լ
ա ր գ ի շ տ ի	ա ր գ ի շ տ ի
ա խ տ ա բ ա ն	ա խ տ ա բ ա ն
հ ր ա բ ո ւ խ	հ ր ա բ ո ւ խ
ն ա խ ա տ ե լ	ն ա խ ա տ ե լ
բ ա վ ա ր ի ա	բ ա վ ա ր ի ա
թ ր ք ո ւ հ ի	թ ր ք ո ւ հ ի
ս ո վ ա մ ա հ	ս ո վ ա մ ա հ
մ ի ն չ դ ե ռ	մ ի ն չ դ ե ռ
ք ա շ մ ի ր ի	ք ա շ մ ի ր ի
բ ո զ ա վ ա գ	բ ո զ ա վ ա գ
ա ճ ա ռ յ ա ն	ա ճ ա ռ յ ա ն
հ ո ղ դ ո ղ դ	հ ո ղ դ ո ղ դ
է ն ե ր գ ի ա	է ն ե ր գ ի ա
լ ե հ ե ր ե ն	լ ե հ ե ր ե ն
ս ա մ ո ս ա տ	ս ա մ ո ս ա տ
մ ա ր գ ա ր ե	մ ա ր գ ա ր ե
հ ե ղ ե ղ ե լ	հ ե ղ ե ղ ե լ
ա զ դ ա ր ա ր	ա զ դ ա ր ա ր
պ ե ր ճ ա ն ք	պ ե ր ճ ա ն ք
ս ա լ ո ն ի կ	ս ա լ ո ն ի կ
ճ ա շ ա ր ա ն	ճ ա շ ա ր ա ն
ա ղ ե ր ս ե լ	ա ղ ե ր ս ե լ
ա պ տ ա կ ե լ	ա պ տ ա կ ե լ
ձ ե ռ ն ա ր կ	ձ ե ռ ն ա ր կ
հ ա պ ա լ ա ս	հ ա պ ա լ ա ս
հ ո ն կ ո ն գ	հ ո ն կ ո ն գ
ա ռ ա ք ի ն ի	ա ռ ա ք ի ն ի
վ ա ր վ ա ռ ա	վ ա ր վ ա ռ ա
հ ա ն կ ա ր ծ	հ ա ն կ ա ր ծ
ա ր տ ա շ ե ս	ա ր տ ա շ ե ս
ս ա դ ր ա ն ք	ս ա դ ր ա ն ք
ա մ ս ա կ ա ն	ա մ ս ա կ ա ն
հ ա կ ա ռ ա կ	հ ա կ ա ռ ա կ
ա ն վ ա ն ե լ	ա ն վ ա ն ե լ
հ ո ղ ե ղ ե ն	հ ո ղ ե ղ ե ն
փ ա խ ց ն ե լ	փ ա խ ց ն ե լ
լ ո ղ ա ն ա լ	լ ո ղ ա ն ա լ
կ ր ե ա տ ի վ	կ ր ե ա տ ի վ
կ ե ս ր ա յ ր	կ ե ս ր ա յ ր
փ ա ն ջ ա ր ա	փ ա ն ջ ա ր ա
մ ո լ դ ո վ ա	մ ո լ դ ո վ ա
ս ե ք ս ի զ մ	ս ե ք ս ի զ մ
ը մ պ ե լ ի ք	ը մ պ ե լ ի ք
տ ա ղ լ յ ա ն	տ ա ղ լ յ ա ն
ա ր ա մ ա զ դ	ա ր ա մ ա զ դ
բ ա բ ե լ ո ն	բ ա բ ե լ ո ն
ա մ ե ն ա յ ն	ա մ ե ն ա յ ն
կ ծ ո խ ո ւ ր	կ ծ ո խ ո ւ ր
հ ա ր ե ւ ա ն	հ ա ր ե ւ ա ն
պ ո լ ի մ ե ր	պ ո լ ի մ ե ր
ա ժ դ ա հ ա կ	ա ժ դ ա հ ա կ
ս տ ա տ ո ւ ս	ս տ ա տ ո ւ ս
պ ա տ ա հ ա ր	պ ա տ ա հ ա ր
գ ո ր ծ ա ր ք	գ ո ր ծ ա ր ք
դ ա ջ վ ա ծ ք	դ ա ջ վ ա ծ ք
հ ո գ ն ա կ ի	հ ո գ ն ա կ ի
հ ա յ ե ր ե ն	հ ա յ ե ր ե ն
ը ն դ ե ղ ե ն	ը ն դ ե ղ ե ն
ճ ո ճ ա ն ա կ	ճ ո ճ ա ն ա կ
բ ա ռ գ ի ր ք	բ ա ռ գ ի ր ք
ս ա լ մ ա ս տ	ս ա լ մ ա ս տ
ա բ խ ա զ ի ա	ա բ խ ա զ ի ա
մ ա ն ա ն ե խ	մ ա ն ա ն ե խ
ջ ր ի մ ո ւ ռ	ջ ր ի մ ո ւ ռ
դ ա վ թ յ ա ն	դ ա վ թ յ ա ն
կ լ ե ր մ ո ն	կ լ ե ր մ ո ն
գ ա լ ի ո ւ մ	գ ա լ ի ո ւ մ
ե ռ ա ց ո ւ մ	ե ռ ա ց ո ւ մ
ա ռ ա ք յ ա լ	ա ռ ա ք յ ա լ
ա լ կ ո հ ո լ	ա լ կ ո հ ո լ
ա ղ բ ա ն ո ց	ա ղ բ ա ն ո ց
չ ե մ պ ի ո ն	չ է մ պ ի ո ն
հ ե ռ ա վ ո ր	հ ե ռ ա վ ո ր
ն ր ա ն ո ւ մ	ն ր ա ն ո ւ մ
կ ա յ ա ց ա ծ	կ ա յ ա ց ա ծ
փ ե ր ի խ ա ն	փ ե ր ի խ ա ն
բ ե ն գ ա լ ի	բ ե ն գ ա լ ի
բ ա ջ ա ն ա ղ	բ ա ջ ա ն ա ղ
ը ն կ ե ց ի կ	ը ն կ ե ց ի կ
վ ե ր ա ն ա լ	վ ե ր ա ն ա լ
չ ի ն ա ր ե ն	չ ի ն ա ր ե ն
դ ի լ ի ջ ա ն	դ ի լ ի ջ ա ն
ն ի կ ո ս ի ա	ն ի կ ո ս ի ա
ք ն ա մ ո ւ կ	ք ն ա մ ո ւ կ
մ ա գ ա դ ա ն	մ ա գ ա դ ա ն
տ ա ս ն ի ն ը	տ ա ս ն ի ն ը
ն ե ր ք ն ա կ	ն ե ր ք ն ա կ
ք ե ռ ո ր դ ի	ք ե ռ ո ր դ ի
ց ա ն ց ե ն ի	ց ա ն ց ե ն ի
ղ ա ր ա վ ա շ	ղ ա ր ա վ ա շ
ա յ ց ե լ ե լ	ա յ ց ե լ ե լ
ա մ ա չ կ ո տ	ա մ ա չ կ ո տ
խ ո յ ա ն ա լ	խ ո յ ա ն ա լ
ս ի գ ա ր ե տ	ս ի գ ա ր ե տ
լ ե գ ի տ ի մ	լ ե գ ի տ ի մ
պ ե տ ա կ ա ն	պ ե տ ա կ ա ն
վ ե ր ա հ ա ս	վ ե ր ա հ ա ս
կ ա խ ա ղ ա ն	կ ա խ ա ղ ա ն
մ ի կ ո յ ա ն	մ ի կ ո յ ա ն
ա ր խ ա յ ի ն	ա ր խ ա յ ի ն
ե ղ ե ւ ն ի	ե ղ ե ւ ն ի
ե ր կ ա թ ե	ե ր կ ա թ ե
մ տ ա հ ո գ	մ տ ա հ ո գ
դ ի ա բ ե տ	դ ի ա բ ե տ
վ ա ն դ ե ա	վ ա ն դ ե ա
ջ ր ա ղ ա ց	ջ ր ա ղ ա ց
լ ր ա հ ո ս	լ ր ա հ ո ս
ձ մ ռ ա ն ը	ձ մ ռ ա ն ը
ե ր ե մ ի ա	ե ր ե մ ի ա
բ ն ո ր ո շ	բ ն ո ր ո շ
ս խ ր ա ն ք	ս խ ր ա ն ք
ս տ ե փ ա ն	ս տ ե փ ա ն
պ ր ծ ն ե լ	պ ր ծ ն ե լ
խ թ ա ն ե լ	խ թ ա ն ե լ
զ զ վ ե լ ի	զ զ վ ե լ ի
չ ս ի ր ա ծ	չ ս ի ր ա ծ
ս լ ա վ ո ն	ս լ ա վ ո ն
ո ր դ յ ա կ	ո ր դ յ ա կ
գ գ վ ա ն ք	գ գ վ ա ն ք
ք ր տ ի ն ք	ք ր տ ի ն ք
ա ռ ա յ ժ մ	ա ռ ա յ ժ մ
խ ն ա մ ե լ	խ ն ա մ ե լ
բ ն ա գ ի ր	բ ն ա գ ի ր
տ ր ա կ ա ն	տ ր ա կ ա ն
ս տ ա ն ա լ	ս տ ա ն ա լ
կ ր ծ կ ա լ	կ ր ծ կ ա լ
լ ր ջ մ ի տ	լ ր ջ մ ի տ
մ ր ց ո ր դ	մ ր ց ո ր դ
թ շ ն ա մ ի	թ շ ն ա մ ի
փ ն տ ր ե լ	փ ն տ ր ե լ
վ ա հ ա գ ն	վ ա հ ա գ ն
ե ր ե ր ա լ	ե ր ե ր ա լ
ջ ր ա ն ց ք	ջ ր ա ն ց ք
ե ր ե ւ ա ն	ե ր ե ւ ա ն
ս պ ա ռ ո ղ	ս պ ա ռ ո ղ
տ ն փ ե ս ա	տ ն փ ե ս ա
ձ կ ն ո ր ս	ձ կ ն ո ր ս
բ ղ ա վ ե լ	բ ղ ա վ ե լ
տ ն ա յ ի ն	տ ն ա յ ի ն
ն վ ի ր ա կ	ն վ ի ր ա կ
բ լ ո գ ե ր	բ լ ո գ ե ր
ս պ ի տ ա կ	ս պ ի տ ա կ
դ ե ռ ե ւ ս	դ ե ռ ե ւ ս
փ չ ա ն ա լ	փ չ ա ն ա լ
ս պ ա ն ա խ	ս պ ա ն ա խ
հ ն ա ց ա ծ	հ ն ա ց ա ծ
ք ծ ն ա ն ք	ք ծ ն ա ն ք
ե վ գ ե ն ի	ե ւ գ ե ն ի
ս ր ճ ե ն ի	ս ր ճ ե ն ի
գ ր ա ռ ե լ	գ ր ա ռ ե լ
գ ր ա բ ա ր	գ ր ա բ ա ր
ա ղ մ կ ե լ	ա ղ մ կ ե լ
ո խ ե ր ի մ	ո խ ե ր ի մ
վ ր ի պ ա կ	վ ր ի պ ա կ
ա ն հ ն ա ր	ա ն հ ն ա ր
ե վ ր ո պ ա	ե ւ ր ո պ ա
խ ր տ ն ե լ	խ ր տ ն ե լ
հ ն ո տ ի ք	հ ն ո տ ի ք
ա վ գ ի ա ս	ա վ գ ի ա ս
ս պ ա ն ի ա	ս պ ա ն ի ա
ք թ ա ծ ա կ	ք թ ա ծ ա կ
ծ ր ա գ ի ր	ծ ր ա գ ի ր
ե ր կ չ ո տ	ե ր կ չ ո տ
ա ն հ ի մ ն	ա ն հ ի մ ն
մ տ ա ծ ե լ	մ տ ա ծ ե լ
մ տ ա դ ի ր	մ տ ա դ ի ր
կ ր տ ս ե ր	կ ր տ ս ե ր
ո ր ո տ ա ն	ո ր ո տ ա ն
շ պ ի լ կ ա	շ պ ի լ կ ա
ք ն ն վ ե լ	ք ն ն վ ե լ
չ գ ի տ ե մ	չ գ ի տ ե մ
ս պ ա ն ե լ	ս պ ա ն ե լ
ջ ր ա յ ի ն	ջ ր ա յ ի ն
ե ր ե ւ ա լ	ե ր ե ւ ա լ
ձ ի ա բ ո ռ	ձ ի ա բ ո ռ
շ ր ջ վ ե լ	շ ր ջ վ ե լ
վ ճ ա ր ե լ	վ ճ ա ր ե լ
ա ռ ձ ե ռ ն	ա ռ ձ ե ռ ն
ջ ղ ա յ ի ն	ջ ղ ա յ ի ն
ս ց ե ն ա ր	ս ց ե ն ա ր
փ չ ա ց ա ծ	փ չ ա ց ա ծ
ո ր ո ն ե լ	ո ր ո ն ե լ
ս պ ա ս ե լ	ս պ ա ս ե լ
ի ն ժ ե ն ե ր	ի ն ժ ե ն ե ր
ֆ ա ր ե ր ե ն	ֆ ա ր ե ր ե ն
կ ա լ ի ո ւ մ	կ ա լ ի ո ւ մ
մ ա ր տ յ ա ն	մ ա ր տ յ ա ն
մ ե տ ա ք ս ե	մ ե տ ա ք ս ե
գ ա ն գ ր ո ց	գ ա ն գ ր ո ց
պ ա տ ա հ ե լ	պ ա տ ա հ ե լ
ա ն ա ս տ ա ս	ա ն ա ս տ ա ս
պ ո մ ի դ ո ր	պ ո մ ի դ ո ր
ք լ ի ն թ ո ն	ք լ ի ն թ ո ն
կ ո կ տ ե յ լ	կ ո կ տ ե յ լ
ց ա ն կ ա լ ի	ց ա ն կ ա լ ի
ա շ խ ա տ ո ղ	ա շ խ ա տ ո ղ
հ ա փ ա փ ե լ	հ ա փ ա փ ե լ
ս տ ո ւ գ ե լ	ս տ ո ւ գ ե լ
խ ո տ ա կ ե ր	խ ո տ ա կ ե ր
պ ա տ ր ա ս տ	պ ա տ ր ա ս տ
հ ա յ կ յ ա ն	հ ա յ կ յ ա ն
կ ո ն ա կ ա ն	կ ո ն ա կ ա ն
խ ա չ ա կ ի ր	խ ա չ ա կ ի ր
հ ո յ ա կ ա պ	հ ո յ ա կ ա պ
կ ա ր ա ո կ ե	կ ա ր ա ո կ ե
մ ա կ ա ր ո ն	մ ա կ ա ր ո ն
ա ր ե ւ ե լ ք	ա ր ե ւ ե լ ք
թ ա ղ ա պ ե տ	թ ա ղ ա պ ե տ
մ ո գ ո ն ե լ	մ ո գ ո ն ե լ
ա ր գ ե լ ա կ	ա ր գ ե լ ա կ
ղ ա ր ա բ ա ղ	ղ ա ր ա բ ա ղ
ս կ ե ս ո ւ ր	ս կ ե ս ո ւ ր
ա պ ա թ ա ր ց	ա պ ա թ ա ր ց
փ ո ղ ա տ ե ր	փ ո ղ ա տ ե ր
փ ո խ ա ր ե ն	փ ո խ ա ր ե ն
լ ո գ ա ր ա ն	լ ո գ ա ր ա ն
խ ե լ ա խ ո ս	խ ե լ ա խ ո ս
տ ա ր ա ծ ե լ	տ ա ր ա ծ ե լ
ա ջ ա կ ց ե լ	ա ջ ա կ ց ե լ
գ ի լ ո յ ա ն	գ ի լ ո յ ա ն
ս ա ն կ ց ի ա	ս ա ն կ ց ի ա
ա ր տ ա ք ի ն	ա ր տ ա ք ի ն
մ ո ն ի տ ո ր	մ ո ն ի տ ո ր
ա մ փ ո փ ե լ	ա մ փ ո փ ե լ
ծ ա ն ր ո ր դ	ծ ա ն ր ո ր դ
ս կ ե ս ա ր	ս կ ե ս ա ր
ե ր ի վ ա ր	ե ր ի վ ա ր
հ ր ճ վ ե լ	հ ր ճ վ ե լ
վ կ ա յ ե լ	վ կ ա յ ե լ
ա ն բ ն ա կ	ա ն բ ն ա կ
լ վ ա ց ք ի	լ վ ա ց ք ի
ե ր վ ա ն դ	ե ր վ ա ն դ
հ ա ղ ա գ ս	հ ա ղ ա գ ս
ս փ ո փ ե լ	ս փ ո փ ե լ
դ ի ա ր ա ն	դ ի ա ր ա ն
փ շ ր ա ն ք	փ շ ր ա ն ք
ո ր ո շ ե լ	ո ր ո շ ե լ
ո ր ս ո ր դ	ո ր ս ո ր դ
ե ր դ վ ե լ	ե ր դ վ ե լ
մ ի ա տ ե ղ	մ ի ա տ ե ղ
լ լ կ ա ն ք	լ լ կ ա ն ք
շ տ ա պ ե լ	շ տ ա պ ե լ
ե ղ բ ա յ ր	ե ղ բ ա յ ր
հ ի ա ն ա լ	հ ի ա ն ա լ
ս կ ա ն ե ր	ս կ ա ն ե ր
ս տ ա ց ո ղ	ս տ ա ց ո ղ
բ ո կ ո տ ն	բ ո կ ո տ ն
չ ո ր ա թ ա ն	չ ո ր ա թ ա ն
ա վ ի ա ց ի ա	ա վ ի ա ց ի ա
մ ի ջ ա ն ց ք	մ ի ջ ա ն ց ք
փ ա ռ ա հ ե ղ	փ ա ռ ա հ ե ղ
մ ր մ ո ւ ն ջ	մ ր մ ո ւ ն ջ
թ ա լ ի բ ա ն	թ ա լ ի բ ա ն
լ ի բ ր ե տ ո	լ ի բ ր ե տ ո
դ ա տ ա խ ա զ	դ ա տ ա խ ա զ
մ ս ա կ ե ր	մ ս ա կ ե ր
ա վ ե լ ո ր դ	ա վ ե լ ո ր դ
ո գ ո ր ե լ	ո գ ո ր ե լ
ք ր ե ղ ա ն	ք ր ե ղ ա ն
փ ր կ ա ն ք	փ ր կ ա ն ք
ա յ լ ե ւ ս	ա յ լ ե ւ ս
ե փ ե ս ո ս	ե փ ե ս ո ս
ք ր տ ն ե լ	ք ր տ ն ե լ
ն պ ա տ ա կ	ն պ ա տ ա կ
ա տ ր ճ ա ն	ա տ ր ճ ա ն
լ ք ա վ ե ր	լ ք ա վ ե ր
զ ա ն գ վ ա ծ	զ ա ն գ վ ա ծ
ա շ ո տ յ ա ն	ա շ ո տ յ ա ն
մ ե ր օ ր յ ա	մ ե ր օ ր յ ա
բ ո տ ո շ ա ն	բ ո տ ո շ ա ն
հ ա մ ա խ ո հ	հ ա մ ա խ ո հ
ծ ո վ ա հ ե ն	ծ ո վ ա հ ե ն
փ ա ս վ ո ր դ	փ ա ս վ ո ր դ
կ ա շ ա ռ ե լ	կ ա շ ա ռ ե լ
մ ա լ ա ր ի ա	մ ա լ ա ր ի ա
տ ա ռ ա պ ե լ	տ ա ռ ա պ ե լ
ա ն վ ա դ ո ղ	ա ն վ ա դ ո ղ
պ ր ի ն տ ե ր	պ ր ի ն տ ե ր
ք չ փ ո ր ե լ	ք չ փ ո ր ե լ
դ ե դ լ ա յ ն	դ ե դ լ ա յ ն
ս ո վ ո ր ե լ	ս ո վ ո ր ե լ
ի ն ձ ա ն ո վ	ի ն ձ ա ն ո վ
տ ո ն ո յ ա ն	տ ո ն ո յ ա ն
ը ն թ ա ծ ի ր	ը ն թ ա ծ ի ր
ա ն ե կ դ ո տ	ա ն ե կ դ ո տ
է ք ս պ ե ր տ	է ք ս պ ե ր տ
մ ի լ ա ն ց ի	մ ի լ ա ն ց ի
ն ո ր ա ծ ի ն	ն ո ր ա ծ ի ն
հ ե տ ա ն ց ք	հ ե տ ա ն ց ք
զ մ ր ո ւ խ տ	զ մ ր ո ւ խ տ
ա խ ո ր ժ ա կ	ա խ ո ր ժ ա կ
հ ա ն դ ա ր տ	հ ա ն դ ա ր տ
օ գ տ ա կ ա ր	օ գ տ ա կ ա ր
գ ի տ ա կ ի ց	գ ի տ ա կ ի ց
մ ե ծ ա ր գ ո	մ ե ծ ա ր գ ո
վ ե ր ց ն ե լ	վ ե ր ց ն ե լ
ը ն տ ր յ ա լ	ը ն տ ր յ ա լ
լ ի մ ա ս ո լ	լ ի մ ա ս ո լ
կ ա տ ա կ ե լ	կ ա տ ա կ ե լ
ս ա լ ա ք ա ր	ս ա լ ա ք ա ր
հ ա ր ա զ ա տ	հ ա ր ա զ ա տ
հ ա մ ա ր ե լ	հ ա մ ա ր ե լ
ո ղ կ ո ւ յ զ	ո ղ կ ո ւ յ զ
խ ո ց ո տ ե լ	խ ո ց ո տ ե լ
ա մ ս ա գ ի ր	ա մ ս ա գ ի ր
կ ա պ ի տ ա ն	կ ա պ ի տ ա ն
վ ի ե տ ն ա մ	վ ի ե տ ն ա մ
դ ա դ ա ր ա ծ	դ ա դ ա ր ա ծ
ք ր դ ե ր ե ն	ք ր դ ե ր ե ն
դ ե ր կ ո մ ս	դ ե ր կ ո մ ս
ա բ ա ջ յ ա ն	ա բ ա ջ յ ա ն
փ ա ռ ա մ ո լ	փ ա ռ ա մ ո լ
պ ի ս ի դ ի ա	պ ի ս ի դ ի ա
բ ա ն ա վ ո ր	բ ա ն ա վ ո ր
բ ե ս ե դ կ ա	բ ի ս ե դ կ ա
ա ր ժ ե ն ա լ	ա ր ժ ե ն ա լ
ա ն շ շ ո ւ կ	ա ն շ շ ո ւ կ
վ ա ճ ա ռ ե լ	վ ա ճ ա ռ ե լ
մ ա հ ա ն ա լ	մ ա հ ա ն ա լ
թ ա ր գ մ ա ն	թ ա ր գ մ ա ն
մ ո լ ո ր ա կ	մ ո լ ո ր ա կ
փ ա ռ ա ս ե ր	փ ա ռ ա ս ե ր
բ ա ն ա կ ա ն	բ ա ն ա կ ա ն
խ ա ղ ա լ ի ք	խ ա ղ ա լ ի ք
