ն ա խ ա պ ա յ մ ա ն	ն ա խ ա պ ա յ մ ա ն
բ ա ր ձ ր ա ց ն ե լ	բ ա ր ձ ր ա ց ն ե լ
բ ո ղ ո ք ա ր կ ե լ	բ ո ղ ո ք ա ր կ ե լ
հ ա ն դ ի մ ա ն ե լ	հ ա ն դ ի մ ա ն ե լ
ս ո ց ի ա լ ա կ ա ն	ս ո ց ի ա լ ա կ ա ն
խ ո ր ա թ ա փ ա ն ց	խ ո ր ա թ ա փ ա ն ց
հ ա մ բ ա վ ա վ ո ր	հ ա մ բ ա վ ա վ ո ր
ա բ ե ղ ա յ ա կ ա ն	ա բ ե ղ ա յ ա կ ա ն
ա ն տ ի ց ի կ լ ո ն	ա ն տ ի ց ի կ լ ո ն
մ տ ա հ ղ ա ց ո ւ մ	մ տ ա հ ղ ա ց ո ւ մ
լ ա ն ջ ա պ ա ն ա կ	լ ա ն ջ ա պ ա ն ա կ
խ ռ ո վ ո ւ թ յ ո ւ ն	խ ռ ո վ ո ւ թ յ ո ւ ն
պ ա շ տ ո ն ա վ ո ր	պ ա շ տ ո ն ա վ ո ր
տ ա ղ ա ն դ ա վ ո ր	տ ա ղ ա ն դ ա վ ո ր
հ ի վ ա ն դ ա ն ա լ	հ ի վ ա ն դ ա ն ա լ
հ ի վ ա ն դ ա գ ի ն	հ ի վ ա ն դ ա գ ի ն
բ ր ի տ ա ն ա կ ա ն	բ ր ի տ ա ն ա կ ա ն
հ ա ր կ ա հ ա վ ա ք	հ ա ր կ ա հ ա վ ա ք
խ ո ր ե զ մ ե ր ե ն	խ ո ր ե զ մ ե ր ե ն
բ ա ց ա տ ր ա կ ա ն	բ ա ց ա տ ր ա կ ա ն
ս ա հ մ ա ն ա կ ա ն	ս ա հ մ ա ն ա կ ա ն
ա գ ո ւ ց ա հ ա ն ե լ	ա գ ո ւ ց ա հ ա ն ե լ
կ ա ր ե կ ց ա բ ա ր	կ ա ր ե կ ց ա բ ա ր
ա տ ա ղ ձ ա գ ո ր ծ	ա տ ա ղ ձ ա գ ո ր ծ
կ ա պ ի տ ա լ ի զ մ	կ ա պ ի տ ա լ ի զ մ
ա ն բ ո վ ա ն դ ա կ	ա ն բ ո վ ա ն դ ա կ
կ ո մ պ ո զ ի տ ո ր	կ ո մ պ ո զ ի տ ո ր
թ ե թ ե ւ ա շ ա ր ժ	թ ե թ ե ւ ա շ ա ր ժ
հ ա ս տ ա տ ա կ ա մ	հ ա ս տ ա տ ա կ ա մ
վ ե ն ե տ ի կ յ ա ն	վ ե ն ե տ ի կ յ ա ն
խ ո շ ո ր ա ց ո ւ յ ց	խ ո շ ո ր ա ց ո ւ յ ց
ա ն ա ս ն ա բ ո ւ յ ժ	ա ն ա ս ն ա բ ո ւ յ ժ
զ գ ո ն ո ւ թ յ ո ւ ն	զ գ ո ն ո ւ թ յ ո ւ ն
գ յ ո ւ ր ջ ի ն յ ա ն	գ յ ո ւ ր ջ ի ն յ ա ն
հ ա ր ց ա զ ր ո ւ յ ց	հ ա ր ց ա զ ր ո ւ յ ց
զ ա ն գ ա կ ա տ ո ւ ն	զ ա ն գ ա կ ա տ ո ւ ն
պ ա տ կ ե ր ա ց ո ւ մ	պ ա տ կ ե ր ա ց ո ւ մ
ճ ա ն ա պ ա ր հ ո ր դ	ճ ա ն ա պ ա ր հ ո ր դ
փ ո ր թ ո ւ գ ա լ ի ա	փ ո ր թ ո ւ գ ա լ ի ա
ֆ ա կ ո ւ լ տ ա տ ի վ	ֆ ա կ ո ւ լ տ ա տ ի վ
ն ե ր կ ա յ ա ց ո ւ մ	ն ե ր կ ա յ ա ց ո ւ մ
հ յ ո ւ ս ի ս ա յ ի ն	հ յ ո ւ ս ի ս ա յ ի ն
ա տ ա մ ն ա բ ո ւ յ ժ	ա տ ա մ ն ա բ ո ւ յ ժ
ա շ ա կ ե ր տ ո ւ հ ի	ա շ ա կ ե ր տ ո ւ հ ի
հ ա ն ձ ն ա խ ո ւ մ բ	հ ա ն ձ ն ա խ ո ւ մ բ
ս ա ր ս ա փ ա զ դ ո ւ	ս ա ր ս ա փ ա զ դ ո ւ
ց ո ւ ց ա դ ր ա կ ա ն	ց ո ւ ց ա դ ր ա կ ա ն
վ կ ա յ ո ւ թ յ ո ւ ն	վ կ ա յ ո ւ թ յ ո ւ ն
կ ո ղ մ ն ա ց ո ւ յ ց	կ ո ղ մ ն ա ց ո ւ յ ց
վ հ ա տ ո ւ թ յ ո ւ ն	վ հ ա տ ո ւ թ յ ո ւ ն
հ ա ր ց ա ք ն ն ո ւ մ	հ ա ր ց ա ք ն ն ո ւ մ
հ ա յ տ ա ր ա ր ո ւ մ	հ ա յ տ ա ր ա ր ո ւ մ
հ ա ն ր ա խ ա ն ո ւ թ	հ ա ն ր ա խ ա ն ո ւ թ
գ ե ղ ա ր ք ո ւ ն ի ք	գ ե ղ ա ր ք ո ւ ն ի ք
ռ ո ւ ս ա ս տ ա ն ց ի	ռ ո ւ ս ա ս տ ա ն ց ի
բ յ ո ւ ջ ե տ ա յ ի ն	բ յ ո ւ ջ ե տ ա յ ի ն
շ ա հ ա գ ո ր ծ ո ւ մ	շ ա հ ա գ ո ր ծ ո ւ մ
շ ն ո ր հ ա վ ո ր ե լ	շ ն ո ր հ ա վ ո ր ե լ
տ ի կ ն ի կ ա յ ի ն	տ ի կ ն ի կ ա յ ի ն
փ ո խ հ ա տ ո ւ ց ե լ	փ ո խ հ ա տ ո ւ ց ե լ
դ ի ր ք ո ր ո շ ո ւ մ	դ ի ր ք ո ր ո շ ո ւ մ
ո ւ կ ր ա ի ն ա կ ա ն	ո ւ կ ր ա ի ն ա կ ա ն
բ ո ւ լ ղ ա ր ե ր ե ն	բ ո ւ լ ղ ա ր ե ր ե ն
ս ա ր ք ա վ ո ր ո ւ մ	ս ա ր գ ա վ ո ր ո ւ մ
ո ւ կ ր ա ի ն ե ր ե ն	ո ւ կ ր ա ի ն ե ր ե ն
վ ե ր լ ո ւ ծ ա կ ա ն	վ ե ր լ ո ւ ծ ա կ ա ն
լ յ ո ւ դ ո վ ի կ ո ս	լ յ ո ւ դ ո վ ի կ ո ս
շ ր ջ ա զ գ ե ս տ	շ ր ջ ա զ գ ե ս տ
բ ռ ն ա բ ա ր ե լ	բ ռ ն ա բ ա ր ե լ
զ ի ն ա մ թ ե ր ք	զ ի ն ա մ թ ե ր ք
ե ն թ ա ր կ վ ե լ	ե ն թ ա ր կ վ ե լ
դ ի ա ր բ ե ք ի ր	դ ի ա ր բ ե ք ի ր
մ ի ա վ ո ր վ ե լ	մ ի ա վ ո ր վ ե լ
ե զ ր ա փ ա կ ե լ	ե զ ր ա փ ա կ ե լ
գ ն ա հ ա տ ե լ ի	գ ն ա հ ա տ ե լ ի
բ ե ն զ ա ս ղ ո ց	բ ե ն զ ա ս ղ ո ց
տ պ ա վ ո ր վ ա ծ	տ պ ա վ ո ր վ ա ծ
շ ք ա հ ա ն դ ե ս	շ ք ա հ ա ն դ ե ս
ե ն թ ա դ ր ե լ ի	ե ն թ ա դ ր ե լ ի
ո ր դ ե գ ր ո ւ մ	ո ր դ ե գ ր ո ւ մ
ա կ ն ա խ ն ձ ո ր	ա կ ն ա խ ն ձ ո ր
ն պ ա ս տ ա վ ո ր	ն պ ա ս տ ա վ ո ր
բ ն ա պ ա տ կ ե ր	բ ն ա պ ա տ կ ե ր
ս ց ե ն ա ր ի ս տ	ս ց ե ն ա ր ի ս տ
ե ր ա խ ա յ ր ի ք	ե ր ա խ ա յ ր ի ք
ս պ ա ս ա ր կ ի չ	ս պ ա ս ա ր կ ի չ
է ն ֆ ի ա ջ յ ա ն	է ն ֆ ի ա ջ յ ա ն
ե ր թ ե ւ ե կ ե լ	ե ր թ ե ւ ե կ ե լ
գ ր ա ն տ ա կ ե ր	գ ր ա ն տ ա կ ե ր
ջ ր ա ծ ն ա յ ի ն	ջ ր ա ծ ն ա յ ի ն
ն ռ ն ա կ ա ն ե տ	ն ռ ն ա կ ա ն ե տ
շ փ ո թ ե ց ն ե լ	շ փ ո թ ե ց ն ե լ
ե վ ր ա տ ե ս ի լ	ե ւ ր ա տ ե ս ի լ
ե ր կ վ ո ր յ ա կ	ե ր կ վ ո ր յ ա կ
ս ր բ ա ն ա յ ի ն	ս ր բ ա ն ա յ ի ն
տ ղ ա մ ա ր դ ի կ	տ ղ ա մ ա ր դ ի կ
մ ա ն ր է ա բ ա ն	մ ա ն ր է ա բ ա ն
շ ր ջ ա հ ա յ ա ց	շ ր ջ ա հ ա յ ա ց
զ բ ա ղ ե ց ն ե լ	զ բ ա ղ ե ց ն ե լ
լ ե ռ ն ա գ ն ա ց	լ ե ռ ն ա գ ն ա ց
ա պ ս տ ա մ բ ե լ	ա պ ս տ ա մ բ ե լ
կ ա ն ա չ ա զ ա ր դ	կ ա ն ա չ ա զ ա ր դ
ե ր ի տ ա ս ա ր դ	ե ր ի տ ա ս ա ր դ
ե ղ բ ո ր ո ր դ ի	ե ղ բ ո ր ո ր դ ի
ս ն ա ն կ ա ն ա լ	ս ն ա ն կ ա ն ա լ
ս տ ր ա տ ե գ ի ա	ս տ ր ա տ ե գ ի ա
հ պ ա ր տ ա ն ա լ	հ պ ա ր տ ա ն ա լ
ե ր կ բ ա յ ե լ ի	ե ր կ բ ա յ ե լ ի
ե ր կ ա թ ե ղ ե ն	ե ր կ ա թ ե ղ ե ն
խ ո ր հ ր դ ա վ ո ր	խ ո ր հ ր դ ա վ ո ր
տ ա ր ա դ ր ա մ ի	տ ա ր ա դ ր ա մ ի
ս ն ա ն կ ա ց ո ւ մ	ս ն ա ն կ ա ց ո ւ մ
պ ա յ մ ա ն ա կ ա ն	պ ա յ մ ա ն ա կ ա ն
ս ա ռ ն ա մ ա ն ի ք	ս ա ռ ն ա մ ա ն ի ք
ա վ տ ո մ ե ք ե ն ա	ա վ տ ո մ ե ք ե ն ա
հ ա ն ր ա հ ա վ ա ք	հ ա ն ր ա հ ա վ ա ք
ճ ր ա գ ա լ ո ւ յ ց	ճ ր ա գ ա լ ո ւ յ ց
հ ո ւ ս ա լ ք վ ա ծ	հ ո ւ ս ա լ ք վ ա ծ
տ ն տ ե ս ա կ ա ն	տ ն տ ե ս ա կ ա ն
ե ն թ ա կ ա յ ա ն	ե ն թ ա կ ա յ ա ն
ա ր ա գ ա ծ ո տ ն	ա ր ա գ ա ծ ո տ ն
տ ր ա ն ս պ ո ր տ	տ ր ա ն ս պ ո ր տ
ո գ ե ւ ո ր վ ե լ	ո գ ե ւ ո ր վ ե լ
ծ լ ա ր ձ ա կ ե լ	ծ լ ա ր ձ ա կ ե լ
ե ռ ա բ ա ր բ ա ռ	ե ռ ա բ ա ր բ ա ռ
ս պ ա ռ ն ա լ ի ք	ս պ ա ռ ն ա լ ի ք
վ տ ա ն գ ա վ ո ր	վ տ ա ն գ ա վ ո ր
պ ո ռ ն կ ա ն ո ց	պ ո ռ ն կ ա ն ո ց
ե ր կ ր ա շ ա ր ժ	ե ր կ ր ա շ ա ր ժ
ա ս պ ն ջ ա կ ա ն	ա ս պ ն ջ ա կ ա ն
ե ր գ ի ծ ա բ ա ն	ե ր գ ի ծ ա բ ա ն
շ ր ջ ա փ ա կ ե լ	շ ր ջ ա փ ա կ ե լ
մ ի ա վ ո ր վ ա ծ	մ ի ա վ ո ր վ ա ծ
ե բ ր ա յ ե ր ե ն	ե բ ր ա յ ե ր ե ն
խ ր ո խ տ ա գ ի ն	խ ր ո խ տ ա գ ի ն
գ ո ր ծ ե լ ա ո ճ	գ ո ր ծ ե լ ա ո ճ
ս տ ե փ ա ն յ ա ն	ս տ ե փ ա ն յ ա ն
դ պ ր ո ց ա կ ա ն	դ պ ր ո ց ա կ ա ն
ն ե ր կ ա պ ն ա կ	ն ե ր կ ա պ ն ա կ
ս պ ա ս ա ր կ ե լ	ս պ ա ս ա ր կ ե լ
թ մ ր ա մ ի ջ ո ց	թ մ ր ա մ ի ջ ո ց
մ ա ն ր ա մ ա ս ն	մ ա ն ր ա մ ա ս ն
ե ր ե ս ն ա մ յ ա	ե ր ե ս ն ա մ յ ա
թ ղ թ ա պ ա ն ա կ	թ ղ թ ա պ ա ն ա կ
ս տ ա վ ր ո պ ո լ	ս տ ա վ ր ո պ ո լ
շ ա ր ժ ա ն կ ա ր	շ ա ր ժ ա ն կ ա ր
ե ր ա խ տ ա մ ո ռ	ե ր ա խ տ ա մ ո ռ
գ ր ա դ ա ր ձ ե լ	գ ր ա դ ա ր ձ ե լ
դ ր ս ե ւ ո ր ե լ	դ ր ս ե ւ ո ր ե լ
գ ր ա տ ա խ տ ա կ	գ ր ա տ ա խ տ ա կ
ս տ ո ր ա ց վ ե լ	ս տ ո ր ա ց վ ե լ
ս պ ա ն դ ա ն ո ց	ս պ ա ն դ ա ն ո ց
ո գ ե շ ն չ ո ւ մ	ո գ ե շ ն չ ո ւ մ
մ ա տ ն ա ն շ ե լ	մ ա տ ն ա ն շ ե լ
հ ռ չ ա կ ա վ ո ր	հ ռ չ ա կ ա վ ո ր
մ տ ա դ ր վ ե լ	մ տ ա դ ր վ ե լ
ղ ր ղ զ ս տ ա ն	ղ ր ղ զ ս տ ա ն
ո գ ե շ ն չ ե լ	ո գ ե շ ն չ ե լ
դ ր ա մ ա ր կ ղ	դ ր ա մ ա ր կ ղ
ղ ր ղ զ ա կ ա ն	ղ ր ղ զ ա կ ա ն
պ տ տ ա հ ո ղ մ	պ տ տ ա հ ո ղ մ
ղ պ տ ի ա կ ա ն	ղ պ տ ի ա կ ա ն
ս ն ն կ ա ն ա լ	ս ն ն կ ա ն ա լ
ե ր կ մ տ ա ն ք	ե ր կ մ տ ա ն ք
ս ր ն ք ա մ ի ս	ս ր ն ք ա մ ի ս
ձ ն ա գ ն դ ի կ	ձ ն ա գ ն դ ի կ
չ ք ս ե ի ն ք	չ ք ս ե ի ն ք
հ ն դ կ ա ս տ ա ն	հ ն դ կ ա ս տ ա ն
ե ր կ ր պ ա գ ո ւ	ե ր կ ր պ ա գ ո ւ
հ ե տ ա ք ր ք ի ր	հ ե տ ա ք ր ք ի ր
գ ա յ թ ա կ ղ ե լ	գ ա յ թ ա կ ղ ե լ
ա ֆ ղ ա ն ս տ ա ն	ա ֆ ղ ա ն ս տ ա ն
ս տ ո ր ա գ ր ե լ	ս տ ո ր ա գ ր ե լ
ե վ ր ո պ ա կ ա ն	ե վ ր ո պ ա կ ա ն
դ ա ր ա շ ր ջ ա ն	դ ա ր ա շ ր ջ ա ն
ե ր կ ա ր ա մ յ ա	ե ր կ ա ր ա մ յ ա
գ ր ա մ ե ք ե ն ա	գ ր ա մ ե ք ե ն ա
ե պ ի ս կ ո պ ո ս	ե պ ի ս կ ո պ ո ս
ո ղ ո ր մ ա ծ ի կ	ո ղ ո ր մ ա ծ ի կ
կ ո ճ ա պ ղ պ ե ղ	կ ո ճ ա պ ղ պ ե ղ
խ ր ո խ տ ա բ ա ր	խ ր ո խ տ ա բ ա ր
ե զ ր ա փ ա կ ի չ	ե զ ր ա փ ա կ ի չ
տ պ ա վ ո ր վ ե լ	տ պ ա վ ո ր վ ե լ
գ ր ա ս ե ն յ ա կ	գ ր ա ս ե ն յ ա կ
ֆ ր ա ն ս ի ա կ ա ն	ֆ ր ա ն ս ի ա կ ա ն
ա ն վ ճ ռ ա կ ա ն	ա ն վ ճ ռ ա կ ա ն
ե լ ի զ ա վ ե տ ա	ե լ ի զ ա վ ե տ ա
ո չ ն չ ա ց ո ւ մ	ո չ ն չ ա ց ո ւ մ
մ խ ի թ ա ր յ ա ն	մ խ ի թ ա ր յ ա ն
գ ր պ ա ն ա հ ա տ	գ ր պ ա ն ա հ ա տ
մ ա ր զ ա ս ր ա հ	մ ա ր զ ա ս ր ա հ
զ վ ա ր ճ ա ն ա լ	զ վ ա ր ճ ա ն ա լ
զ ս պ ա շ ա պ ի կ	զ ս պ ա շ ա պ ի կ
հ ս կ ա յ ա կ ա ն	հ ս կ ա յ ա կ ա ն
շ ր ջ ա ն ա գ ի ծ	շ ր ջ ա ն ա գ ի ծ
ս տ ե ղ ն ա շ ա ր	ս տ ե ղ ն ա շ ա ր
մ տ ա հ ո գ վ ե լ	մ տ ա հ ո գ վ ե լ
ե ռ ա ն դ ա գ ի ն	ե ռ ա ն դ ա գ ի ն
վ հ ա տ ե ց ն ո ղ	վ հ ա տ ե ց ն ո ղ
ե ղ ե գ ն ա ձ ո ր	ե ղ ե գ ն ա ձ ո ր
մ ա ր գ ա ր յ ա ն ց	մ ա ր գ ա ր յ ա ն ց
հ ա զ ա ր ա մ յ ա կ	հ ա զ ա ր ա մ յ ա կ
ռ ա խ մ ա ն ի ն ո վ	ռ ա խ մ ա ն ի ն ո վ
հ ա զ ա ր ե ր ո ր դ	հ ա զ ա ր ե ր ո ր դ
հ ա ղ ո ր դ ա վ ա ր	հ ա ղ ո ր դ ա վ ա ր
ա ր ձ ա ն ա գ ր ե լ	ա ր ձ ա ն ա գ ր ե լ
ք ա ր տ ե զ ա գ ի ր	ք ա ր տ ե զ ա գ ի ր
ն ա ց ի ս տ ա կ ա ն	ն ա ց ի ս տ ա կ ա ն
խ ր ա խ ո ւ ս ա ն ք	խ ր ա խ ո ւ ս ա ն ք
կ ե ն դ ա ն ա վ ե տ	կ ե ն դ ա ն ա վ ե տ
հ ա շ վ ե ք ն ն ի չ	հ ա շ վ ե ք ն ն ի չ
ա ռ ո ղ ջ ա ց ն ե լ	ա ռ ո ղ ջ ա ց ն ե լ
ա ս տ վ ա ծ ա բ ա ն	ա ս տ վ ա ծ ա բ ա ն
դ ա տ ա պ ա ր տ ե լ	դ ա տ ա պ ա ր տ ե լ
ա ն ձ ր ե ւ ա ն ո ց	ա ն ձ ր ե ւ ա ն ո ց
ռ ե կ ո ր դ ա յ ի ն	ռ ե կ ո ր դ ա յ ի ն
ա շ խ ա տ ա կ ա զ մ	ա շ խ ա տ ա կ ա զ մ
դ ի ս ե ր տ ա ց ի ա	դ ի ս ե ր տ ա ց ի ա
պ ա շ տ ո ն ա կ ի ց	պ ա շ տ ո ն ա կ ի ց
փ ո ս տ ա ն ջ յ ա ն	փ ո ս տ ա ն ջ յ ա ն
ա ն հ ա ս ա ն ե լ ի	ա ն հ ա ս ա ն ե լ ի
հ ի մ ն ա վ ո ր ե լ	հ ի մ ն ա վ ո ր ե լ
պ ա տ կ ե ր ա հ ա ն	պ ա տ կ ե ր ա հ ա ն
ե ր թ ո ւ ղ ա յ ի ն	ե ր թ ո ւ ղ ա յ ի ն
մ ա թ ե մ ա տ ի կ ա	մ ա թ ե մ ա տ ի կ ա
վ ա խ ճ ա ն ա կ ա ն	վ ա խ ճ ա ն ա կ ա ն
մ ե ծ ա հ ա ն դ ե ս	մ ե ծ ա հ ա ն դ ե ս
լ ա բ ի ր ի ն թ ո ս	լ ա բ ի ր ի ն թ ո ս
գ ի տ ա կ ց ո ր ե ն	գ ի տ ա կ ց ո ր ե ն
ռ ա զ մ ա կ ա յ ա ն	ռ ա զ մ ա կ ա յ ա ն
հ ա յ ե ց ա կ ա ր գ	հ ա յ ե ց ա կ ա ր գ
գ ե ր մ ա ն ի ա յ ի	գ ե ր մ ա ն ի ա յ ի
ք ա ղ ա ք ա վ ա ր ի	ք ա ղ ա ք ա վ ա ր ի
բ ա զ մ ա ծ ա ղ ի կ	բ ա զ մ ա ծ ա ղ ի կ
ս ո ց ի ո լ ո գ ի ա	ս ո ց ի ո լ ո գ ի ա
բ ի ր մ ի ն գ հ ե մ	բ ի ր մ ի ն գ հ ե մ
ա ր ձ ա գ ա ն ք ե լ	ա ր ձ ա գ ա ն ք ե լ
ա ն վ ա ս ա յ լ ա կ	ա ն վ ա ս ա յ լ ա կ
ճ ա կ ա տ ա մ ա ր տ	ճ ա կ ա տ ա մ ա ր տ
հ ո լ ա ն դ ա կ ա ն	հ ո լ ա ն դ ա կ ա ն
ճ ե պ ա զ ր ո ւ յ ց	ճ ե պ ա զ ր ո ւ յ ց
ե ր կ ո ւ շ ա բ թ ի	ե ր կ ո ւ շ ա բ թ ի
կ ե ն դ ա ն ա ն ա լ	կ ե ն դ ա ն ա ն ա լ
ն ո ր վ ե գ ա կ ա ն	ն ո ր վ ե գ ա կ ա ն
գ ի տ ա կ ց ա բ ա ր	գ ի տ ա կ ց ա բ ա ր
ո ղ ջ ա գ ո ւ ր ե լ	ո ղ ջ ա գ ո ւ ր ե լ
պ ա ր ս կ ա ս տ ա ն	պ ա ր ս կ ա ս տ ա ն
դ ր ա մ ա պ ա ն ա կ	դ ր ա մ ա պ ա ն ա կ
ը ն թ ա ց ա կ ա ր գ	ը ն թ ա ց ա կ ա ր գ
փ ա յ տ ա կ ա ր ա ն	փ ա յ տ ա կ ա ր ա ն
վ ա ր ք ա կ ա ն ո ն	վ ա ր ք ա կ ա ն ո ն
կ ա ն գ ն ե ց ն ե լ	կ ա ն գ ն ե ց ն ե լ
պ ր ո պ ա գ ա ն դ ա	պ ր ո պ ա գ ա ն դ ա
ա պ ա հ ո վ ա ն ա լ	ա պ ա հ ո վ ա ն ա լ
պ ա յ մ ա ն ա վ ո ր	պ ա յ մ ա ն ա վ ո ր
լ ի բ ե ր ա լ ի զ մ	լ ի բ ե ր ա լ ի զ մ
փ ո խ ն ա խ ա գ ա հ	փ ո խ ն ա խ ա գ ա հ
զ ա վ ե շ տ ա կ ա ն	զ ա վ ե շ տ ա կ ա ն
հ ա յ տ ա ր ա ր ե լ	հ ա յ տ ա ր ա ր ե լ
ե ր կ ա ր ա վ ո ւ ն	ե ր կ ա ր ա վ ո ւ ն
շ ի զ ո ֆ ր ե ն ի ա	շ ի զ ո ֆ ր ե ն ի ա
մ ի ա ն ձ ն ո ւ հ ի	մ ի ա ն ձ ն ո ւ հ ի
տ ի ե զ ե ր ա ն ա վ	տ ի ե զ ե ր ա ն ա վ
ս ո ղ ո մ ո ն յ ա ն	ս ո ղ ո մ ո ն յ ա ն
խ ո ր հ ր դ ա ր ա ն	խ ո ր հ ր դ ա ր ա ն
տ ա ռ ա դ ա ր ձ ե լ	տ ա ռ ա դ ա ր ձ ե լ
ս տ ո ւ գ ա թ ե ր թ	ս տ ո ւ գ ա թ ե ր թ
փ ո ր ձ ա ր կ վ ե լ	փ ո ր ձ ա ր կ վ ե լ
պ ա տ ճ ե ն ա հ ա ն	պ ա տ ճ ե ն ա հ ա ն
պ ա հ լ ա վ ե ր ե ն	պ ա հ լ ա վ ե ր ե ն
խ ո չ ը ն դ ո տ ե լ	խ ո չ ը ն դ ո տ ե լ
է պ ի կ ե ն տ ր ո ն	է պ ի կ ե ն տ ր ո ն
ծ ի ծ ա ղ ա շ ա ր ժ	ծ ի ծ ա ղ ա շ ա ր ժ
փ ա ր թ ա մ ա ն ա լ	փ ա ր թ ա մ ա ն ա լ
հ ա մ ա կ ա ր գ ո ղ	հ ա մ ա կ ա ր գ ո ղ
հ ա մ ա ձ ա յ ն ե լ	հ ա մ ա ձ ա յ ն ե լ
ք ա ջ ա լ ե ր ա ն ք	ք ա ջ ա լ ե ր ա ն ք
ֆ ի ն լ ա ն դ ա ց ի	ֆ ի ն լ ա ն դ ա ց ի
ա ռ հ ա վ ա տ չ յ ա	ա ռ հ ա վ ա տ չ յ ա
պ ա շ տ ո ն ա կ ա ն	պ ա շ տ ո ն ա կ ա ն
զ ի ն վ ո ր ա կ ա ն	զ ի ն վ ո ր ա կ ա ն
ն ա հ ա պ ե տ յ ա ն	ն ա հ ա պ ե տ յ ա ն
է լ ե կ տ ր ա կ ա ն	է լ ե կ տ ր ա կ ա ն
վ ե ր ջ ն ա վ ա ր տ	վ ե ր ջ ն ա վ ա ր տ
ա լ ե մ ա ն ե ր ե ն	ա լ ե մ ա ն ե ր ե ն
մ ի լ ի ց ի ո ն ե ր	մ ի լ ի ց ի ո ն ե ր
վ ե ր ջ ա ն ա լ ի ք	վ ե ր ջ ա ն ա լ ի ք
պ ա տ ր ա ս տ վ ե լ	պ ա տ ր ա ս տ վ ե լ
ա պ ր ա ն ք ա գ ի ր	ա պ ր ա ն ք ա գ ի ր
ֆ լ ա մ ա ն դ ա ց ի	ֆ լ ա մ ա ն դ ա ց ի
ն ա վ ա տ ո ր մ ի ղ	ն ա վ ա տ ո ր մ ի ղ
մ ա ր դ ա հ ա մ ա ր	մ ա ր դ ա հ ա մ ա ր
բ ա ր ե կ ե ն դ ա ն	բ ա ր ե կ ե ն դ ա ն
ե ր թ ե ւ ե կ ո ւ մ	ե ր թ ե ւ ե կ ո ւ մ
ռ ա զ մ ա ճ ա կ ա տ	ռ ա զ մ ա ճ ա կ ա տ
խ ո ր հ ր դ ա կ ա ն	խ ո ր հ ր դ ա կ ա ն
ա ս տ վ ա ծ ե ղ ե ն	ա ս տ վ ա ծ ե ղ ե ն
հ ո լ ա ն դ ե ր ե ն	հ ո լ ա ն դ ե ր ե ն
հ ի ա ս թ ա փ ո ւ մ	հ ի ա ս թ ա փ ո ւ մ
վ ե ր ա զ գ ա յ ի ն	վ ե ր ա զ գ ա յ ի ն
կ ի ր ա կ ն օ ր յ ա	կ ի ր ա կ ն օ ր յ ա
հ ի վ ա ն դ ա ն ո ց	հ ի վ ա ն դ ա ն ո ց
ա ռ ա ջ ն ո ր դ ե լ	ա ռ ա ջ ն ո ր դ ե լ
ֆ ի լ ի պ ի ն յ ա ն	ֆ ի լ ի պ ի ն յ ա ն
փ ա կ ա ն ա գ ո ր ծ	փ ա կ ա ն ա գ ո ր ծ
ք ա ր ո զ ա ր շ ա վ	ք ա ր ո զ ա ր շ ա վ
հ ա ր ս ա ն ե կ ա ն	հ ա ր ս ա ն ե կ ա ն
մ ո ն տ ե ն ե գ ր ո	մ ո ն տ ե ն ե գ ր ո
հ ա ն դ ի ս ա վ ո ր	հ ա ն դ ի ս ա վ ո ր
հ ա ր ս ն ա ց ն ե լ	հ ա ր ս ն ա ց ն ե լ
մ ա թ ե ւ ո ս յ ա ն	մ ա թ ե ւ ո ս յ ա ն
ծ ա փ ա հ ա ր վ ե լ	ծ ա փ ա հ ա ր վ ե լ
ջ ր ի մ ո ւ ռ ն ե ր	ջ ր ի մ ո ւ ռ ն ե ր
ֆ ի ն ա ն ս ա կ ա ն	ֆ ի ն ա ն ս ա կ ա ն
դ ա դ ա ր ե ց վ ե լ	դ ա դ ա ր ե ց վ ե լ
ե ր կ յ ո ւ ղ ա լ ի	ե ր կ յ ո ւ ղ ա լ ի
հ ա մ ա կ ա ր գ ե լ	հ ա մ ա կ ա ր գ ե լ
ա ռ ն ե տ ա վ ա զ ք	ա ռ ն ե տ ա վ ա զ ք
լ ո թ ա ր ի ն գ ի ա	լ ո թ ա ր ի ն գ ի ա
շ ա ք ա ր ա ք լ ո ր	շ ա ք ա ր ա ք լ ո ր
ա ր վ ե ս տ ա գ ե տ	ա ր վ ե ս տ ա գ ե տ
վ ե ր ա դ ա ռ ն ա լ	վ ե ր ա դ ա ռ ն ա լ
ա դ ա մ ա ն դ վ ե լ	ա դ ա մ ա ն դ վ ե լ
հ ե ղ ա շ ր ջ ո ւ մ	հ ե ղ ա շ ր ջ ո ւ մ
դ ա տ ա ր կ ա մ ի տ	դ ա տ ա ր կ ա մ ի տ
ճ ա ր տ ա ր ա պ ե տ	ճ ա ր տ ա ր ա պ ե տ
պ ա ր թ ե ւ ս տ ա ն	պ ա ր թ ե ւ ս տ ա ն
լ վ ա ց ք ա տ ո ւ ն	լ վ ա ց ք ա տ ո ւ ն
մ ի ջ ա տ ա ս պ ա ն	մ ի ջ ա տ ա ս պ ա ն
ս ա հ մ ա ն ա փ ա կ	ս ա հ մ ա ն ա փ ա կ
մ ո լ ո ր ե ց ն ե լ	մ ո լ ո ր ե ց ն ե լ
ա ն ա գ ո ր ո ւ յ ն	ա ն ա գ ո ր ո ւ յ ն
ա կ ն ա ղ բ յ ո ւ ր	ա կ ն ա ղ բ յ ո ւ ր
ա պ ա ց ո ւ ց վ ե լ	ա պ ա ց ո ւ ց վ ե լ
ծ ա ղ կ ե փ ո ւ ն ջ	ծ ա ղ կ ե փ ո ւ ն ջ
փ ա ս թ ա թ ո ւ ղ թ	փ ա ս թ ա թ ո ւ ղ թ
խ ո ր հ ր դ ա տ ո ւ	խ ո ր հ ր դ ա տ ո ւ
ս ե ղ ա ն ա տ ո ւ ն	ս ե ղ ա ն ա տ ո ւ ն
մ ա ք ս ա տ ո ւ ր ք	մ ա ք ս ա տ ո ւ ր ք
ա շ խ ա ր հ ա յ ի ն	ա շ խ ա ր հ ա յ ի ն
թ ո ւ յ լ ա տ ր ե լ	թ ո ւ յ լ ա տ ր ե լ
գ ե ր ե վ ա ր ո ւ մ	գ ե ր ե վ ա ր ո ւ մ
դ ր ա մ ա տ ո ւ ր գ	դ ր ա մ ա տ ո ւ ր գ
ի ս լ ա մ ա ց ո ւ մ	ի ս լ ա մ ա ց ո ւ մ
ք ա ղ ց ր ա վ ո ւ ն	ք ա ղ ց ր ա վ ո ւ ն
ո ւ զ բ ե կ ս տ ա ն	ո ւ զ բ ե կ ս տ ա ն
մ ա ս ն ա ճ յ ո ւ ղ	մ ա ս ն ա ճ յ ո ւ ղ
վ ա վ ե ր ա ց ո ւ մ	վ ա վ ե ր ա ց ո ւ մ
գ ա ն գ ր ա ց ո ւ մ	գ ա ն գ ր ա ց ո ւ մ
ո ւ ր ա ր տ ա կ ա ն	ո ւ ր ա ր տ ա կ ա ն
հ ա մ ո զ մ ո ւ ն ք	հ ա մ ո զ մ ո ւ ն ք
ֆ ա մ ա գ ո ւ ս տ ա	ֆ ա մ ա գ ո ւ ս տ ա
կ յ ո ւ ր ե ղ յ ա ն	կ յ ո ւ ր ե ղ յ ա ն
ա ր տ ա հ ա ն ո ւ մ	ա ր տ ա հ ա ն ո ւ մ
գ ե ղ ե ց կ ո ւ հ ի	գ ե ղ ե ց կ ո ւ հ ի
թ ո ւ ն ա վ ո ր ե լ	թ ո ւ ն ա վ ո ր ե լ
թ յ ո ւ ր ի ն գ ի ա	թ յ ո ւ ր ի ն գ ի ա
ց ո ւ ց ա բ ե ր ե լ	ց ո ւ ց ա բ ե ր ե լ
կ ա ռ ա վ ա ր ո ւ մ	կ ա ռ ա վ ա ր ո ւ մ
ա ր ծ ր ո ւ ն յ ա ց	ա ր ծ ր ո ւ ն յ ա ց
գ ե ղ ա ր ք ո ւ ն ի	գ ե ղ ա ր ք ո ւ ն ի
թ ո ւ ն ե լ ա յ ի ն	թ ո ւ ն ե լ ա յ ի ն
փ ա ս տ ա թ ո ւ ղ թ	փ ա ս տ ա թ ո ւ ղ թ
ա ս տ վ ա ծ ո ւ հ ի	ա ս տ վ ա ծ ո ւ հ ի
ն ե ր բ ե ռ ն ո ւ մ	ն ե ր բ ե ռ ն ո ւ մ
տ ա ն տ ի ր ո ւ հ ի	տ ա ն տ ի ր ո ւ հ ի
պ ա շ տ ա մ ո ւ ն ք	պ ա շ տ ա մ ո ւ ն ք
ի լ լ ի ր ի ա կ ա ն	ի լ լ ի ր ի ա կ ա ն
դ ա վ ա ճ ա ն ո ւ մ	դ ա վ ա ճ ա ն ո ւ մ
ի ր ա ր ա ն ց ո ւ մ	ի ր ա ր ա ն ց ո ւ մ
հ ա ռ ա ջ ա ց ո ւ մ	հ ա ռ ա ջ ա ց ո ւ մ
ա մ ե ր ի կ ո ւ հ ի	ա մ ե ր ի կ ո ւ հ ի
ո ւ զ բ ե կ ե ր ե ն	ո ւ զ բ ե կ ե ր ե ն
դ ո ւ ր գ ա ր յ ա ն	դ ո ւ ր գ ա ր յ ա ն
հ ա ղ թ ա թ ո ւ ղ թ	հ ա ղ թ ա թ ո ւ ղ թ
ն ա խ ա տ ե ս ո ւ մ	ն ա խ ա տ ե ս ո ւ մ
լ ե ռ ն ա շ խ ա ր հ	լ ե ռ ն ա շ խ ա ր հ
կ ա ր մ ր ա վ ո ւ ն	կ ա ր մ ր ա վ ո ւ ն
հ ա ն դ ո ւ ր ժ ո ղ	հ ա ն դ ո ւ ր ժ ո ղ
ճ ա շ կ ե ր ո ւ յ թ	ճ ա շ կ ե ր ո ւ յ թ
ա շ խ ա ր հ ա մ ա ս	ա շ խ ա ր հ ա մ ա ս
տ խ ր ո ւ թ յ ո ւ ն	տ խ ր ո ւ թ յ ո ւ ն
ա ռ ա տ ո ւ թ յ ա ն	ա ռ ա տ ո ւ թ յ ա ն
ի ր ա վ ա զ ո ւ ր կ	ի ր ա վ ա զ ո ւ ր կ
ց ն ծ ո ւ թ յ ո ւ ն	ց ն ծ ո ւ թ յ ո ւ ն
կ ո ռ ո ւ պ ց ի ո ն	կ ո ռ ո ւ պ ց ի ո ն
ա հ ա զ ա ն գ ո ւ մ	ա հ ա զ ա ն գ ո ւ մ
պ ե տ ե ր բ ո ւ ր գ	պ ե տ ե ր բ ո ւ ր գ
մ ի ջ ո ց ա ռ ո ւ մ	մ ի ջ ո ց ա ռ ո ւ մ
հ ո ւ ս ա կ տ ո ւ ր	հ ո ւ ս ա կ տ ո ւ ր
զ ա ր հ ո ւ ր ե լ ի	զ ա ր հ ո ւ ր ե լ ի
ո ւ ն ի վ ե ր մ ա գ	ո ւ ն ի վ ե ր մ ա գ
կ ա ռ ո ւ ց ա ն ե լ	կ ա ռ ո ւ ց ա ն ե լ
ռ ո ւ ս տ ա մ յ ա ն	ռ ո ւ ս տ ա մ յ ա ն
ա ք ի լ լ ե ս յ ա ն	ա ք ի լ լ ե ս յ ա ն
ա ր տ ա ց ո լ ո ւ մ	ա ր տ ա ց ո լ ո ւ մ
ո ւ ր ա ր տ ե ր ե ն	ո ւ ր ա ր տ ե ր ե ն
փ ո ր ձ ա ր կ ո ւ մ	փ ո ր ձ ա ր կ ո ւ մ
տ ր ո լ ե յ բ ո ւ ս	տ ր ո լ ե յ բ ո ւ ս
ը ն տ ր ո ւ թ յ ո ւ ն	ը ն տ ր ո ւ թ յ ո ւ ն
դ ա շ ն ո ւ թ յ ո ւ ն	դ ա շ ն ո ւ թ յ ո ւ ն
ա ռ ա տ ո ւ թ յ ո ւ ն	ա ռ ա տ ո ւ թ յ ո ւ ն
ի ն ք ն ո ւ թ յ ո ւ ն	ի ն ք ն ո ւ թ յ ո ւ ն
պ ա ր տ ո ւ թ յ ո ւ ն	պ ա ր տ ո ւ թ յ ո ւ ն
ա ր ա գ ո ւ թ յ ո ւ ն	ա ր ա գ ո ւ թ յ ո ւ ն
կ ո մ ս ո ւ թ յ ո ւ ն	կ ո մ ս ո ւ թ յ ո ւ ն
բ ա ր կ ո ւ թ յ ո ւ ն	բ ա ր կ ո ւ թ յ ո ւ ն
բ ա ր դ ո ւ թ յ ո ւ ն	բ ա ր դ ո ւ թ յ ո ւ ն
ծ ա ն ր ո ւ թ յ ո ւ ն	ծ ա ն ր ո ւ թ յ ո ւ ն
մ ե ր կ ո ւ թ յ ո ւ ն	մ ե ր կ ո ւ թ յ ո ւ ն
մ ա ն կ ո ւ թ յ ո ւ ն	մ ա ն կ ո ւ թ յ ո ւ ն
յ ո ւ ր ա հ ա տ ո ւ կ	յ ո ւ ր ա հ ա տ ո ւ կ
հ ա ր թ ո ւ թ յ ո ւ ն	հ ա ր թ ո ւ թ յ ո ւ ն
հ ա վ ա ս ա ր ո ւ մ	հ ա վ ա ս ա ր ո ւ մ
թ ա ն ա ք ա ձ ո ւ կ	թ ա ն ա ք ա ձ ո ւ կ
ո ւ ր ա խ ա ց ն ե լ	ո ւ ր ա խ ա ց ն ե լ
հ ա տ կ ո ւ թ յ ո ւ ն	հ ա տ կ ո ւ թ յ ո ւ ն
ժ ո ւ ռ ն ա լ ի ս տ	ժ ո ւ ռ ն ա լ ի ս տ
ո ւ ն ա կ ո ւ թ յ ո ւ ն	ո ւ ն ա կ ո ւ թ յ ո ւ ն
ո ւ ր ա խ ո ւ թ յ ո ւ ն	ո ւ ր ա խ ո ւ թ յ ո ւ ն
ի ն ք ն ո ւ ր ո ւ յ ն	ի ն ք ն ո ւ ր ո ւ յ ն
ց ա ն կ ո ւ թ յ ո ւ ն	ց ա ն կ ո ւ թ յ ո ւ ն
փ ո ր ձ ո ւ թ յ ո ւ ն	փ ո ր ձ ո ւ թ յ ո ւ ն
ա զ ա տ ո ւ թ յ ո ւ ն	ա զ ա տ ո ւ թ յ ո ւ ն
բ ա զ մ ո ւ թ յ ո ւ ն	բ ա զ մ ո ւ թ յ ո ւ ն
յ ո թ ա ն ա ս ո ւ ն	յ ո թ ա ն ա ս ո ւ ն
ա գ ա հ ո ւ թ յ ո ւ ն	ա գ ա հ ո ւ թ յ ո ւ ն
հ ա ս տ ո ւ թ յ ո ւ ն	հ ա ս տ ո ւ թ յ ո ւ ն
մ ա տ ն ո ւ թ յ ո ւ ն	մ ա տ ն ո ւ թ յ ո ւ ն
պ ա տ մ ո ւ թ յ ո ւ ն	պ ա տ մ ո ւ թ յ ո ւ ն
ի ր ո ղ ո ւ թ յ ո ւ ն	ի ր ո ղ ո ւ թ յ ո ւ ն
ո ւ ռ ո ւ ց ք ա բ ա ն	ո ւ ռ ո ւ ց ք ա բ ա ն
ա տ ե լ ո ւ թ յ ո ւ ն	ա տ ե լ ո ւ թ յ ո ւ ն
ա ն դ ո ր ր ա գ ի ր	ա ն դ ո ր ր ա գ ի ր
փ ո խ ա ր ի ն ո ւ մ	փ ո խ ա ր ի ն ո ւ մ
ֆ ո ւ տ բ ո լ ի ս տ	ֆ ո ւ տ բ ո լ ի ս տ
գ ե ր մ ա ն ո ւ հ ի	գ ե ր մ ա ն ո ւ հ ի
կ ա ռ ո ւ ց վ ա ծ ք	կ ա ռ ո ւ ց վ ա ծ ք
ա շ խ ա ր հ ա բ ա ր	ա շ խ ա ր հ ա բ ա ր
հ ա մ բ ա ր ձ ո ւ մ	հ ա մ բ ա ր ձ ո ւ մ
