s z e r e z t e	s z e r e s z t e
v a d á s z o k	v a d á s z o k
n é h á n y a n	n é h á n y a n
s z a b a d s á g	s z a b a d s á g
ü g y f e l e k	ü g y f e l e k
k a p i t á n y	k a p i t á n y
e g y m á s b a	e g y m á s b a
s z o m b a t i	s z o m b a t i
e g y f a j t a	e g y f a j t a
s e m m i l y e n	s e m m i l y e n
n y e r e m é n y	n y e r e m é n y
s z á z a d t ó l	s z á z a d t ó l
b o c s á t j u k	b o c s á t j u k
m á s o d s z o r	m á s o d s z o r
s z o l g á l j a	s z o l g á l j a
s z á l l í t á s	s z á l l í t á s
i g y e k s z i k	i g y e k s z i k
f i g y e l e m	f i g y e l e m
m e n n y i v e l	m e n n y i v e l
s z a k s z e r ű	s z a k s z e r ű
e g y ü t t e s e	e g y ü t t e s e
a m e n n y i r e	a m e n n y i r e
v i s s z a t é r	v i s s z a t é r
s z é k h e l y ű	s z é k h e l y ű
t e l j e s e b b	t e l j e s e b b
h e l y s z í n i	h e l y s z í n i
e g y m á s s a l	e g y m á s s a l
b i z o t t s á g	b i z o t t s á g
s z e r e t t ü k	s z e r e t t ü k
k é s z í t e t t	k é s z í t e t t
j á t s z a n a k	j á t s z a n a k
r é s z e k e n	r é s z e k e n
m e g v e n n i	m e g v e n n i
k í v á n c s i	k í v á n c s i
h e l y e z é s	h e l y e z é s
d i c s é r t e	d i c s é r t e
f o r r á s o k	f o r r á s o k
k o c s i b a n	k o c s i b a n
k o r á b b a n	k o r á b b a n
m é t e r r ő l	m é t e r r ő l
f i n o m a b b	f i n o m a b b
e g y e s ü l t	e g y e s ü l t
n e g y e d i k	n e g y e d i k
k ö z ö s s é g	k ö z ö s s é g
o r s z á g ú t	o r s z á g ú t
s z á z a d i g	s z á z a d i g
t e v é k e n y	t e v é k e n y
a m e l y n é l	a m e l y n é l
m e l y e k e n	m e l y e k e n
e z e r s z e r	e z e r s z e r
s z e r e l é s	s z e r e l é s
k i t ű z ö t t	k i t ű z ö t t
k é n y e l e m	k é n y e l e m
m á s r é s z t	m á s r é s z t
t a n í t o t t	t a n í t o t t
h e l y b e l i	h e l y b e l i
z s i d ó s á g	z s i d ó s á g
p é l d á n y t	p é l d á n y t
i d ő k ö z i	i d ő k ö z i
t i p i k u s	t i p i k u s
i z r a e l i	i z r a e l i
m a g u k r a	m a g u k r a
r e m é l e m	r e m é l e m
r é s z e i t	r é s z e i t
f e l e s é g	f e l e s é g
h ó n a p o k	h ó n a p o k
t ö m e g e k	t ö m e g e k
e z e n t ú l	e z e n t ú l
j á r t u n k	j á r t u n k
l e v e l e t	l e v e l e t
n e h e z e n	n e h e z e n
é p í t é s i	é p í t é s i
e z e k t ő l	e z e k t ő l
a z o k t ó l	a z o k t ó l
k e r í t é s	k e r í t é s
b a r á t o m	b a r á t o m
o l v a s o m	o l v a s o m
h a t o d i k	h a t o d i k
h ó n a p r a	h ó n a p r a
o l d h a t ó	o l d h a t ó
s o p r o n i	s o p r o n i
a l a p l a p	a l a p l a p
p é n z b ő l	p é n z b ő l
n e v e l n i	n e v e l n i
h á b o r ú k	h á b o r ú k
t e r e p e n	t e r e p e n
t e l e f o n	t e l e f o n
n e v e l é s	n e v e l é s
b a r l a n g	b a r l a n g
s o r o z a t	s o r o z a t
l o g i k u s	l o g i k u s
i n d u l a t	i n d u l a t
u t a z n a k	u t a z n a k
e s e t l e g	e s e t l e g
i s m e r e d	i s m e r e d
k u l t ú r a	k u l t ú r a
m ű t e r m e	m ű t e r m e
p é n z b e n	p é n z b e n
m a g á b a n	m a g á b a n
t e l e p e s	t e l e p e s
a l f ö l d i	a l f ö l d i
k e r e s v e	k e r e s v e
m a r i s k a	m a r i s k a
n e v e z n i	n e v e z n i
h a v o n t a	h a v o n t a
s é r ü l é s	s é r ü l é s
u t a z á s i	u t a z á s i
l á b á r ó l	l á b á r ó l
f o r d u l ó	f o r d u l ó
m e g h í v ó	m e g h í v ó
z u h a t a g	z u h a t a g
ü t e m b e n	ü t e m b e n
k e d v e z ő	k e d v e z ő
t e t e m e s	t e t e m e s
n e v e z é s	n e v e z é s
v a l a k i k	v a l a k i k
á t a d á s a	á t a d á s a
t a r t a n i	t a r t a n i
c í m e d e t	c í m e d e t
é v t i z e d	é v t i z e d
h ó n a p o s	h ó n a p o s
i d ő k b e n	i d ő k b e n
e m e l e t i	e m e l e t i
t u r i s t a	t u r i s t a
e l e g á n s	e l e g á n s
l e v e s e k	l e v e s e k
p é n z é r t	p é n z é r t
k ö t e l e z	k ö t e l e z
k e r e s e m	k e r e s e m
é l e t b e n	é l e t b e n
t r é n i n g	t r é n i n g
t ö m e g e t	t ö m e g e t
e l ő a d á s	e l ő a d á s
v é d e l m i	v é d e l m i
b i z a l o m	b i z a l o m
m a r a d é k	m a r a d é k
k e r e t e k	k e r e t e k
m a k e d ó n	m a k e d ó n
e z e k b ő l	e z e k b ő l
b a r á t n ő	b a r á t n ő
l e h e t e k	l e h e t e k
h a r m i n c	h a r m i n c
j u l i s k a	j u l i s k a
ö t l e t e t	ö t l e t e t
m e g h a t ó	m e g h a t ó
m a g a z i n	m a g a z i n
v i h a r o k	v i h a r o k
h a r d v e r	h a r d v e r
p r o g r a m	p r o g r a m
v e t ü l e t	v e t ü l e t
t e e n d ő k	t e e n d ő k
h a j n a l i	h a j n a l i
h i t e l e k	h i t e l e k
a l b u m o n	a l b u m o n
e l ő k e l ő	e l ő k e l ő
e l m a r a d	e l m a r a d
n é m i l e g	n é m i l e g
t é m á v a l	t é m á v a l
t r ó p u s i	t r ó p u s i
k e v e r é k	k e v e r é k
r a j z o l ó	r a j z o l ó
s p o n t á n	s p o n t á n
f i l m r ő l	f i l m r ő l
k e r e k e s	k e r e k e s
h a t á r o n	h a t á r o n
t a n u l ó k	t a n u l ó k
h u m o r o s	h u m o r o s
t ü k r ö z i	t ü k r ö z i
k é t f e j ű	k é t f e j ű
t é v e d é s	t é v e d é s
f e l ü l e t	f e l ü l e t
h á t u l s ó	h á t u l s ó
a b l a k o t	a b l a k o t
f ó r u m o n	f ó r u m o n
é r t i t e k	é r t i t e k
é l e t r ő l	é l e t r ő l
h ú z ó d i k	h ú z ó d i k
v é d e l m e	v é d e l m e
k e r e s ő k	k e r e s ő k
t a s a k o k	t a s a k o k
v i r á g o t	v i r á g o t
d é m o n o k	d é m o n o k
k é r d é s t	k é r d é s t
h i t e l e s	h i t e l e s
t a r t a n á	t a r t a n á
e z r e d e s	e z r e d e s
é l e t k o r	é l e t k o r
o l d a l s ó	o l d a l s ó
ú j f a j t a	ú j f a j t a
k ö z p o n t	k ö z p o n t
h a g y n i a	h a g y n i a
i d ő p o n t	i d ő p o n t
b e j á r a t	b e j á r a t
k i d e r ü l	k i d e r ü l
h a t á s á t	h a t á s á t
k a p u k o n	k a p u k o n
v a l a h o l	v a l a h o l
h i v a t a l	h i v a t a l
z a m a t o s	z a m a t o s
e m l é k e k	e m l é k e k
v e z e t ő t	v e z e t ő t
é r d e k e s	é r d e k e s
n a p o n t a	n a p o n t a
f e j l ő d ő	f e j l ő d ő
t u d á s o k	t u d á s o k
t é m á h o z	t é m á h o z
v a l a m i t	v a l a m i t
t i t e k e t	t i t e k e t
t ö r t é n ő	t ö r t é n ő
k é p é b e n	k é p é b e n
e l a d á s i	e l a d á s i
é l n é n e k	é l n é n e k
v e l e n c e	v e l e n c e
k i h í v á s	k i h í v á s
p e r v e r z	p e r v e r z
h i b á s a n	h i b á s a n
k é r d e z ő	k é r d e z ő
o l d a l o n	o l d a l o n
s t í l u s a	s t í l u s a
m ó d o k a t	m ó d o k a t
l i g á b a n	l i g á b a n
k ö z ö l t e	k ö z ö l t e
v u l k á n i	v u l k á n i
v á l t o z ó	v á l t o z ó
f e j é b e n	f e j é b e n
v e t e r á n	v e t e r á n
n e v é h e z	n e v é h e z
m a g á h o z	m a g á h o z
f o g a k a t	f o g a k a t
c é l o k a t	c é l o k a t
h a l á l á t	h a l á l á t
é r t é k e k	é r t é k e k
i d e á l i s	i d e á l i s
k ö t e t e s	k ö t e t e s
é p í t e n i	é p í t e n i
b a j n o k i	b a j n o k i
k á r o k a t	k á r o k a t
b a l a t o n	b a l a t o n
á b r á z o l	á b r á z o l
t ö b b i e k	t ö b b i e k
p ó t o l n i	p ó t o l n i
f ó r u m o t	f ó r u m o t
f e j e z e t	f e j e z e t
v á l t a n á	v á l t a n á
m a j d a n i	m a j d a n i
f i z e t n i	f i z e t n i
a l k a l o m	a l k a l o m
é l e t h e z	é l e t h e z
k e r e s n i	k e r e s n i
v i l á g o n	v i l á g o n
n e v é b e n	n e v é b e n
n é z e t e k	n é z e t e k
k ü l s e j e	k ü l s e j e
b e l t é r i	b e l t é r i
e z á l t a l	e z á l t a l
f ó r u m o k	f ó r u m o k
m i s k o l c	m i s k o l c
z á r h a t ó	z á r h a t ó
o k t ó b e r	o k t ó b e r
m i n d e z t	m i n d e z t
e k ö z b e n	e k ö z b e n
k ö z e p e s	k ö z e p e s
e l v i l e g	e l v i l e g
d ö n t é s i	d ö n t é s i
b i z á n c i	b i z á n c i
b e r l i n i	b e r l i n i
a j á n d é k	a j á n d é k
é r t é k é t	é r t é k é t
k e z d ő d ő	k e z d ő d ő
a l k o h o l	a l k o h o l
e l t é v e d	e l t é v e d
b o r ú s a n	b o r ú s a n
m o s t a n i	m o s t a n i
k e r ü l n i	k e r ü l n i
á p o l á s i	á p o l á s i
í r á s b a n	í r á s b a n
e r e d e t ű	e r e d e t ű
t e r e m t ő	t e r e m t ő
o k o z n a k	o k o z n a k
m á s o k a t	m á s o k a t
f o g á s o k	f o g á s o k
v i d é k e n	v i d é k e n
a k a r u n k	a k a r u n k
h a t á r o z	h a t á r o z
k ö t e l e s	k ö t e l e s
t ö m e g e s	t ö m e g e s
b o g a r a k	b o g a r a k
d ö n t e n i	d ö n t e n i
k e r ü l e t	k e r ü l e t
p ó t l á s a	p ó t l á s a
m i n ő s ü l	m i n ő s ü l
é r e z t e m	é r e z t e m
f ü l e k r e	f ü l e k r e
k i l á t á s	k i l á t á s
v á r o s o k	v á r o s o k
e z e k n é l	e z e k n é l
t a r t o z ó	t a r t o z ó
k e r e s t e	k e r e s t e
a n é l k ü l	a n é l k ü l
j e l e n e t	j e l e n e t
n é m e t e k	n é m e t e k
m é r g e z ő	m é r g e z ő
l e v e l é t	l e v e l é t
e l e f á n t	e l e f á n t
k e z e l i k	k e z e l i k
a z o k b ó l	a z o k b ó l
e l t é r é s	e l t é r é s
á p o l t a k	á p o l t a k
p i l l a n a t	p i l l a n a t
c s a l á d f ő	c s a l á d f ő
k o n s z e r n	k o n s z e r n
k r i s z t u s	k r i s z t u s
t e h e t t é k	t e h e t t é k
v i l á g g a l	v i l á g g a l
n y a r a l á s	n y a r a l á s
a s z e r i n t	a s z e r i n t
a u s z t r á l	a u s z t r á l
h a t á s s a l	h a t á s s a l
f i d e s z e s	f i d e s z e s
t i s z t e l t	t i s z t e l t
e l k é s z ü l	e l k é s z ü l
s a r k a l l t	s a r k a l l t
s ö t é t e b b	s ö t é t e b b
k o r s z e r ű	k o r s z e r ű
u g y a n e z t	u g y a n e z t
v e z e t e t t	v e z e t e t t
t ö r v é n y t	t ö r v é n y t
s z ü l é s e k	s z ü l é s e k
s z a v a k o n	s z a v a k o n
n é z z é t e k	n é z z é t e k
c é l s z e r ű	c é l s z e r ű
m e g t e t t e	m e g t e t t e
s z e r i n t i	s z e r i n t i
s z o f t v e r	s z o f t v e r
e l l e n b e n	e l l e n b e n
h e l y e s e n	h e l y e s e n
s z á z a l é k	s z á z a l é k
é r z é k e n y	é r z é k e n y
e l n y o m ó k	e l n y o m ó k
b e s z é l e k	b e s z é l e k
o r s z á g o s	o r s z á g o s
f e l e l ő s	f e l e l ő s
é r v e l é s	é r v e l é s
i r o d á j a	i r o d á j a
m á s o l á s	m á s o l á s
p é l d á u l	p é l d á u l
k i a d o t t	k i a d o t t
k e m p i n g	k e m p i n g
e r d ő b e n	e r d ő b e n
b e t e g e k	b e t e g e k
m u t a t n i	m u t a t n i
p é n z t á r	p é n z t á r
k í n á l t a	k í n á l t a
k é r é s é t	k é r é s é t
a k a d á l y a	a k a d á l y a
h a l l g a t ó	h a l l g a t ó
s z e r v e z ő	s z e r v e z ő
k e r e s s ü k	k e r e s s ü k
f o l y o s ó n	f o l y o s ó n
s z e n t e l t	s z e n t e l t
i g e n c s a k	i g e n c s a k
h a l o t t a k	h a l o t t a k
é p í t m é n y	é p í t m é n y
z e n é s z e k	z e n é s z e k
v o n a t t a l	v o n a t t a l
t e l j e s e n	t e l j e s e n
j u s s a n a k	j u s s a n a k
s z e m e m r e	s z e m e m r e
t á m a s z o k	t á m a s z o k
m u z s i k á l	m u z s i k á l
k o m o l y a n	k o m o l y a n
s z e m é v e l	s z e m é v e l
k i r á l y o k	k i r á l y o k
k é s z í t i k	k é s z í t i k
a n y a g b a n	a n y a g b a n
p l e t y k á k	p l e t y k á k
i d ő s z a k i	i d ő s z a k i
c s o n g r á d	c s o n g r á d
h e l y e k e t	h e l y e k e t
m e r é s z e l	m e r é s z e l
k i r á l y n é	k i r á l y n é
e r k ö l c s i	e r k ö l c s i
v e h e t t e k	v e h e t t e k
h a s z n á l t	h a s z n á l t
e g y m á s r a	e g y m á s r a
k e v e s e b b	k e v e s e b b
e g y h á z a k	e g y h á z a k
t e l j e s ü l	t e l j e s ü l
t e t t e l e k	t e t t e l e k
v a l a h o g y	v a l a h o g y
e l v e s z t i	e l v e s z t i
o t t h o n o k	o t t h o n o k
s z e r e t i k	s z e r e t i k
t a r t o t t a	t a r t o t t a
s z á m o t o k	s z á m o t o k
b e t e g á g y	b e t e g á g y
k o n t r o l l	k o n t r o l l
n e h é z s é g	n e h é z s é g
f o r d í t j a	f o r d í t j a
b a l l é p é s	b a l l é p é s
s z e r e t e m	s z e r e t e m
b e n n e t e k	b e n n e t e k
m e l e g e b b	m e l e g e b b
l a k o s s á g	l a k o s s á g
c s a p o n g ó	c s a p o n g ó
e g é s z é r t	e g é s z é r t
t e h e t t e k	t e h e t t e k
h o m á l y o s	h o m á l y o s
l é n y e g e s	l é n y e g e s
a m e l y b e n	a m e l y b e n
s z a v a z á s	s z a v a z á s
r e m é l j ü k	r e m é l j ü k
o s z t h a t ó	o s z t h a t ó
j ó t é k o n y	j ó t é k o n y
v á l l a l n i	v á l l a l n i
f o g á s z a t	f o g á s z a t
n y o m a t é k	n y o m a t é k
k o c s i v a l	k o c s i v a l
é r d e k l i	é r d e k l i
m o s ó s z e r	m o s ó s z e r
f a s i s z t a	f a s i s z t a
n é z z e n e k	n é z z e n e k
ö s z t ö n ö k	ö s z t ö n ö k
f e l s z í n i	f e l s z í n i
s z e r e t e t	s z e r e t e t
f ő s z e r e p	f ő s z e r e p
i r á n y z a t	i r á n y z a t
s í p c s o n t	s í p c s o n t
t a n á c s o t	t a n á c s o t
a m e l y r ő l	a m e l y r ő l
v e r s e n y t	v e r s e n y t
s z a b a d n a	s z a b a d n a
l e g ú j a b b	l e g ú j a b b
t o l v a j t	t o l v a j t
a k a r n á m	a k a r n á m
m á s o d i k	m á s o d i k
m a g a s r a	m a g a s r a
t ö l t e n i	t ö l t e n i
r e n d b e n	r e n d b e n
s ö t é t e k	s ö t é t e k
t i t k á r a	t i t k á r a
t a r t h a t	t a r t h a t
d o l g o z ó	d o l g o z ó
h é t v é g e	h é t v é g e
m o t o r j a	m o t o r j a
k a t o n á k	k a t o n á k
k i v é t e l	k i v é t e l
j á t é k o s	j á t é k o s
d a r a b o t	d a r a b o t
e l v é t v e	e l v é t v e
p a r k o l ó	p a r k o l ó
a k a r n a k	a k a r n a k
n e v e k e t	n e v e k e t
l é p t ü n k	l é p t ü n k
k e v e s e t	k e v e s e t
m o n d a t a	m o n d a t a
v e z e t ő k	v e z e t ő k
m á s k é n t	m á s k é n t
o l d a l á n	o l d a l á n
ö t v e n e s	ö t v e n e s
a l a k u l t	a l a k u l t
k e z e l n i	k e z e l n i
a z o n b a n	a z o n b a n
m e g r á z ó	m e g r á z ó
h e t e k i g	h e t e k i g
m e g i j e d	m e g i j e d
b i r t o k a	b i r t o k a
k ö r é b e n	k ö r é b e n
m ó k á s a n	m ó k á s a n
k o r á b a n	k o r á b a n
é v e k h e z	é v e k h e z
t a n u l á s	t a n u l á s
m a g u k a t	m a g u k a t
k o n c e r t	k o n c e r t
m é r f ö l d	m é r f ö l d
i s m e r t e	i s m e r t e
h a m i s a n	h a m i s a n
h a j d a n i	h a j d a n i
k i s m a m a	k i s m a m a
t ő z s d e i	t ő z s d e i
z a v a r t a	z a v a r t a
h a t ó s á g	h a t ó s á g
m ű s o r o k	m ű s o r o k
h í r e k e t	h í r e k e t
c é l j a i t	c é l j a i t
k u t a t ó k	k u t a t ó k
e l s ő n e k	e l s ő n e k
j a v á b ó l	j a v á b ó l
o l v a s n i	o l v a s n i
b ő s é g e s	b ő s é g e s
h á b o r ú t	h á b o r ú t
c á f o l a t	c á f o l a t
d o b o z o s	d o b o z o s
t e r e m b e	t e r e m b e
j á t é k o k	j á t é k o k
h a s a d é k	h a s a d é k
b a r á z d a	b a r á z d a
f i l m b e n	f i l m b e n
v á r h a t ó	v á r h a t ó
u r u g u a y	u r u g u a y
e z e k n e k	e z e k n e k
h é t v é g i	h é t v é g i
i g é n y e i	i g é n y e i
f e l t á r t	f e l t á r t
j ö v ő b e n	j ö v ő b e n
k u t a t á s	k u t a t á s
ú j s á g o t	ú j s á g o t
ü t k ö z e t	ü t k ö z e t
k ü l d e n i	k ü l d e n i
i s m e r n i	i s m e r n i
m e d e n c e	m e d e n c e
d a r a b j a	d a r a b j a
m i k u l á s	m i k u l á s
h e g e d ű k	h e g e d ű k
k é t é v e s	k é t é v e s
b ú v á r o k	b ú v á r o k
s o k f é l e	s o k f é l e
k o n k r é t	k o n k r é t
m o r á l i s	m o r á l i s
l i s t á r a	l i s t á r a
i n t é z e t	i n t é z e t
t a r t a n a	t a r t a n a
o l v a s ó k	o l v a s ó k
s i k e r ü l	s i k e r ü l
b ű n ö z ő k	b ű n ö z ő k
ú t v o n a l	ú t v o n a l
k e z d ü n k	k e z d ü n k
n a p o k o n	n a p o k o n
h o r d o z ó	h o r d o z ó
j u p i t e r	j u p i t e r
k e z é b e n	k e z é b e n
o k t a t á s	o k t a t á s
b ú t o r o k	b ú t o r o k
a l a k j á t	a l a k j á t
n e v e z i k	n e v e z i k
k a b i n e t	k a b i n e t
á l d o z a t	á l d o z a t
k é p z é s e	k é p z é s e
t e s t v é r	t e s t v é r
o l d a l a k	o l d a l a k
k e z e l é s	k e z e l é s
i d e j é r e	i d e j é r e
k e r e t e t	k e r e t e t
ü z l e t e k	ü z l e t e k
a j á n l o m	a j á n l o m
e l v t á r s	e l v t á r s
k e d v e n c	k e d v e n c
i d ő b e l i	i d ő b e l i
v e z é r l ő	v e z é r l ő
s u l i b a n	s u l i b a n
é r d e k e l	é r d e k e l
a z o k n a k	a z o k n a k
é p ü l e t e	é p ü l e t e
r é t e g e k	r é t e g e k
f i g u r á t	f i g u r á t
k a p h a t ó	k a p h a t ó
b a r o m f i	b a r o m f i
k ö z é l e t	k ö z é l e t
j u g o s z l á v	j u g o s z l á v
s z ü l e t é s e	s z ü l e t é s e
h a n g o s a b b	h a n g o s a b b
k ö r n y é k e n	k ö r n y é k e n
k e r t é s z e t	k e r t é s z e t
v á l a s z o l ó	v á l a s z o l ó
c s i n t a l a n	c s i n t a l a n
j o b b o l d a l	j o b b o l d a l
s z á z a d b a n	s z á z a d b a n
s z a b á l y a i	s z a b á l y a i
k é r d é s s e l	k é r d é s s e l
g y e r m e k é t	g y e r m e k é t
é r i n t e t t e	é r i n t e t t e
b ö n g é s z ő k	b ö n g é s z ő k
n i n c s e n e k	n i n c s e n e k
e g y e t e m e s	e g y e t e m e s
l a g y m a t a g	l a g y m a t a g
e l f o g a d t a	e l f o g a d t a
i g a z s á g o t	i g a z s á g o t
k é r d e z e t t	k é r d e z e t t
s e b é s z e t i	s e b é s z e t i
m e g t u d t a m	m e g t u d t a m
n a g y b e t ű s	n a g y b e t ű s
s z e r i n t ü k	s z e r i n t ü k
e r ő t e l j e s	e r ő t e l j e s
e g y e n e s e k	e g y e n e s e k
c s e m p é z é s	c s e m p é z é s
s z a k é r t ő k	s z a k é r t ő k
k ö r n y é k é n	k ö r n y é k é n
g a r á z s b a n	g a r á z s b a n
v e s z t e s é g	v e s z t e s é g
n y o m t a t á s	n y o m t a t á s
k ö l t s é g e t	k ö l t s é g e t
i l l e t é k e s	i l l e t é k e s
d o l g o z o t t	d o l g o z o t t
i l l e t ő l e g	i l l e t ő l e g
s z o m b a t o n	s z o m b a t o n
k ö z p o n t j a	k ö z p o n t j a
s z e r z e t e s	s z e r z e t e s
i s z t a m b u l	i s z t a m b u l
k ö z e p e t t e	k ö z e p e t t e
a k a r a t t a l	a k a r a t t a l
r e g g e l i r e	r e g g e l i r e
e l l e n k e z ő	e l l e n k e z ő
h a s z n á l o m	h a s z n á l o m
l e g t ö b b e n	l e g t ö b b e n
n ö v é n y z e t	n ö v é n y z e t
l é p c s ő h á z	l é p c s ő h á z
m i n d e n n e l	m i n d e n n e l
a m e l y e k e n	a m e l y e k e n
e r d é s z e t i	e r d é s z e t i
k ö r ü l ö t t e	k ö r ü l ö t t e
t é r s é g g e l	t é r s é g g e l
á l l o m á s o k	á l l o m á s o k
m e l y e k b e n	m e l y e k b e n
e r ő f o r r á s	e r ő f o r r á s
f e l s z í n é n	f e l s z í n é n
s z á z a l é k a	s z á z a l é k a
e g y e s ü l é s	e g y e s ü l é s
h u s z o n h a t	h u s z o n h a t
g y e r m e k e t	g y e r m e k e t
a l k a t r é s z	a l k a t r é s z
j á r v á n y o k	j á r v á n y o k
s z e r e t n é k	s z e r e t n é k
k i t a r t o t t	k i t a r t o t t
k i t e r j e d t	k i t e r j e d t
m a c s k á k i g	m a c s k á k i g
n y o l c a d i k	n y o l c a d i k
f e j l e m é n y	f e j l e m é n y
c s e n d é l e t	c s e n d é l e t
f é n y k é p e k	f é n y k é p e k
s z e r e l m e s	s z e r e l m e s
t e r m é s z e t	t e r m é s z e t
m i n i s z t e r	m i n i s z t e r
s z á m o l t a k	s z á m o l t a k
a b s z t r a k t	a p s z t r a k t
l e n y ű g ö z ő	l e n y ű g ö z ő
b e n n ü n k e t	b e n n ü n k e t
e l l e n f e l e	e l l e n f e l e
á l l a p o t o s	á l l a p o t o s
s z e l e k t í v	s z e l e k t í v
h u l l á m z i k	h u l l á m z i k
p á l y á z a t i	p á l y á z a t i
m a g u n k k a l	m a g u n k k a l
e g y m á s b a n	e g y m á s b a n
e l é g e d e t t	e l é g e d e t t
v i z s g á l a t	v i z s g á l a t
ö n g y i l k o s	ö n g y i l k o s
m i n d e n ü t t	m i n d e n ü t t
s z e r k e z e t	s z e r k e z e t
m ö g ö t t ü n k	m ö g ö t t ü n k
á l l a p o t o t	á l l a p o t o t
v i z s g á l n i	v i z s g á l n i
c s ü t ö r t ö k	c s ü t ö r t ö k
f e s z t i v á l	f e s z t i v á l
f ü g g e t l e n	f ü g g e t l e n
h e l y e k n e k	h e l y e k n e k
k ö z l e m é n y	k ö z l e m é n y
k i r á l y s á g	k i r á l y s á g
c s i n á l h a t	c s i n á l h a t
k e r e s z t r e	k e r e s z t r e
f e l o s z t á s	f e l o s z t á s
k ö n y v t á r i	k ö n y v t á r i
c s e n d e s e n	c s e n d e s e n
t á r g y á b a n	t á r g y á b a n
h e l y e k r ő l	h e l y e k r ő l
n y u g d í j b a	n y u g d í j b a
f o l y t a t n i	f o l y t a t n i
s z e r v e z ő k	s z e r v e z ő k
k ö l c s ö n ö k	k ö l c s ö n ö k
b e s z é l g e t	b e s z é l g e t
m e g á l d o t t	m e g á l d o t t
f i g y e l m é t	f i g y e l m é t
e g y é b k é n t	e g y é b k é n t
m á s k é p p e n	m á s k é p p e n
n y e l v e t e k	n y e l v e t e k
g o n d o l j á k	g o n d o l j á k
s z á m í t a n i	s z á m í t a n i
j e l l e m z ő k	j e l l e m z ő k
s z á n d é k á t	s z á n d é k á t
m ű v é s z e t i	m ű v é s z e t i
o d a f i g y e l	o d a f i g y e l
s z a b a d n a k	s z a b a d n a k
h e l y z e t e k	h e l y z e t e k
k ö z ö s s é g i	k ö z ö s s é g i
i r á n y í t á s	i r á n y í t á s
k ö z t u d o t t	k ö z t u d o t t
t e k i n t é l y	t e k i n t é l y
á l l á s p o n t	á l l á s p o n t
b e m u t a t j a	b e m u t a t j a
s z ö v e g b e n	s z ö v e g b e n
k o r m á n y f ő	k o r m á n y f ő
t a n á c s h o z	t a n á c s h o z
e g y m á s n a k	e g y m á s n a k
m i n d e n n a p	m i n d e n n a p
s z a k r á l i s	s z a k r á l i s
v á l l a l t a m	v á l l a l t a m
s z e r e t n é m	s z e r e t n é m
m e c h a n i k a	m e c h a n i k a
s z ü n e t b e n	s z ü n e t b e n
v é l e m é n y t	v é l e m é n y t
k o r m á n y z ó	k o r m á n y z ó
é v f o r d u l ó	é v f o r d u l ó
t ö r v é n y e s	t ö r v é n y e s
m e l l é k l e t	m e l l é k l e t
s e m m i f é l e	s e m m i f é l e
s z o f t v e r t	s z o f t v e r t
t á m o g a t j a	t á m o g a t j a
t a r t o t t a m	t a r t o t t a m
e r k ö l c s ö s	e r k ö l c s ö s
k i s b o l y g ó	k i s b o l y g ó
h a s z n á l n i	h a s z n á l n i
m e g n y e r t e	m e g n y e r t e
b o r o n g ó s	b o r o n g ó s
ü z e n e t é t	ü z e n e t é t
r e k o r d o k	r e k o r d o k
h á b o r ú j a	h á b o r ú j a
g o n d o k a t	g o n d o k a t
f é l é v b e n	f é l é v b e n
é r k e z t e k	é r k e z t e k
j a v a s o l t	j a v a s o l t
t a r t a n á k	t a r t a n á k
v a l a m i r e	v a l a m i r e
k ö z e p é r e	k ö z e p é r e
ö n k é n t e s	ö n k é n t e s
s u g á r z á s	s u g á r z á s
f o r i n t r a	f o r i n t r a
s e g í t e n i	s e g í t e n i
v á l a s z t á s	v á l a s z t á s
s t r a n d o n	s t r a n d o n
m á s i k n a k	m á s i k n a k
m a r a d h a t	m a r a d h a t
i l l ú z i ó k	i l l ú z i ó k
k i f e j e z ő	k i f e j e z ő
t é r k é p e n	t é r k é p e n
c i n t e r e m	c i n t e r e m
l á z t a l a n	l á z t a l a n
k u t a t á s a	k u t a t á s a
m a g d o l n a	m a g d o l n a
j e l ö l t e k	j e l ö l t e k
k a p j a n a k	k a p j a n a k
p é n t e k e n	p é n t e k e n
t u r i s t á k	t u r i s t á k
ü g y n ö k s é g	ü g y n ö k s é g
j e g y z e t e k	j e g y z e t e k
m á s h o n n a n	m á s h o n n a n
s z á m o l n a k	s z á m o l n a k
l a k o s s á g i	l a k o s s á g i
h a l l g a t ó k	h a l l g a t ó k
t a t a b á n y a	t a t a b á n y a
s z á m í t h a t	s z á m í t h a t
m i n d e g y i k	m i n d e g y i k
v e r s e n y z ő	v e r s e n y z ő
f o r i n t t a l	f o r i n t t a l
t e c h n i k á t	t e c h n i k á t
t á r g y a k a t	t á r g y a k a t
t e l j e s í t ő	t e l j e s í t ő
s z i n t é z i s	s z i n t é z i s
h a n g s ú l y t	h a n g s ú l y t
c s a p a t n a k	c s a p a t n a k
k ö n y v e k e t	k ö n y v e k e t
r é s z ü n k r e	r é s z ü n k r e
m a g y a r s á g	m a g y a r s á g
i d é z e t t e l	i d é z e t t e l
r é s z l e t e s	r é s z l e t e s
c s o m ó p o n t	c s o m ó p o n t
e g y e n e s e n	e g y e n e s e n
t a n u l m á n y	t a n u l m á n y
s z á n d é k o t	s z á n d é k o t
r i t k á b b a n	r i t k á b b a n
l é p c s ő s o r	l é p c s ő s o r
k e g y e t l e n	k e g y e t l e n
k é s z í t é s e	k é s z í t é s e
j a v a s o l j a	j a v a s o l j a
i n d í t v á n y	i n d í t v á n y
m i n d k e t t ő	m i n d k e t t ő
v e r s e n y e n	v e r s e n y e n
e g y i p t o m i	e g y i p t o m i
l e l k é s z e k	l e l k é s z e k
r e n d s z e r t	r e n d s z e r t
s z í n p a d r a	s z í n p a d r a
s z e r e p l ő k	s z e r e p l ő k
é r v é n y b e n	é r v é n y b e n
e g y é n i l e g	e g y é n i l e g
b o n y o l u l t	b o n y o l u l t
b á r m e l y i k	b á r m e l y i k
m u n k a h e l y	m u n k a h e l y
l é t r e j ö t t	l é t r e j ö t t
h á t r á n y o s	h á t r á n y o s
