b i b l i a i	b i b l i a i
h a z a i a k	h a z a i a k
a m e r i k a i	a m e r i k a i
d o l g o z ó i	d o l g o z ó i
a n a l ó g i a	a n a l ó g i a
e n e r g i á k	e n e r g i á k
l a k ó i n a k	l a k ó i n a k
a r t é r i á s	a r t é r i á s
b a r á t a i m	b a r á t a i m
b i o l ó g u s	b i o l ó g u s
m á r c i u s i	m á r c i u s i
t e r m é k e i	t e r m é k e i
g r a f i k a i	g r a f i k a i
j u b i l e u m i	j u b i l e u m i
a l á í r á s t	a l á í r á s t
t e r h e i n k	t e r h e i n k
t e r á p i á s	t e r á p i á s
f r a n c i á k	f r a n c i á k
l i t u r g i a	l i t u r g i a
t a r t a n i a	t a r t a n i a
m i n i a t ű r	m i n i a t ű r
b e é r k e z ő	b e é r k e z ő
é r t e n i ü k	é r t e n i ü k
m e m ó r i á t	m e m ó r i á t
k o a l í c i ó	k o a l í c i ó
a t e i z m u s	a t e i z m u s
a k a d é m i a	a k a d é m i a
e l u t a s í t ó	e l u t a s í t ó
h e t e r o g é n	h e t e r o g é n
m e g l e p ő e n	m e g l e p ő e n
p i r u l á j u k	p i r u l á j u k
c i t r o m s a v	c i t r o m s a v
g a z d a g s á g	g a z d a g s á g
e l n ö k é v e l	e l n ö k é v e l
d i k t a t ú r a	d i k t a t ú r a
t u d á s u k a t	t u d á s u k a t
p r o j e k t e t	p r o j e k t e t
t á v o l s á g i	t á v o l s á g i
b u b o r é k o k	b u b o r é k o k
h a j n a l b a n	h a j n a l b a n
m e n e t r e n d	m e n e t r e n d
b e v é t e l e k	b e v é t e l e k
n ö v e l é s é t	n ö v e l é s é t
é r z é k e l é s	é r z é k e l é s
s o r o z a t o t	s o r o z a t o t
b a r á t n ő j e	b a r á t n ő j e
m o n i t o r o k	m o n i t o r o k
i d ő p o n t o k	i d ő p o n t o k
l a b d a r ú g ó	l a b d a r ú g ó
t e l e f o n o s	t e l e f o n o s
t e s t v é r e k	t e s t v é r e k
f ü r d ő r u h a	f ü r d ő r u h a
v i r t u á l i s	v i r t u á l i s
h o n l a p j á n	h o n l a p j á n
i g a z g a t ó k	i g a z g a t ó k
e l n ö k s é g i	e l n ö k s é g i
b e v e z e t é s	b e v e z e t é s
v e z e t ő n e k	v e z e t ő n e k
é r t e s í t é s	é r t e s í t é s
m á j u s á b a n	m á j u s á b a n
t a r t o z n a k	t a r t o z n a k
k é z i l a b d a	k é z i l a b d a
d o l g o z u n k	d o l g o z u n k
t a r t a l m á t	t a r t a l m á t
b a l e s e t e t	b a l e s e t e t
v á l t o z á s a	v á l t o z á s a
k ö z e p é t ő l	k ö z e p é t ő l
a m n e s z t i a	a m n e s z t i a
t é r s é g n e k	t é r s é g n e k
n o v e m b e r i	n o v e m b e r i
i s m e r ő s ö k	i s m e r ő s ö k
k o m b i n á l t	k o m b i n á l t
t e m p l o m o t	t e m p l o m o t
t i t k á r s á g	t i t k á r s á g
s i k e r e k e t	s i k e r e k e t
b o r s m e n t a	b o r s m e n t a
v i l á g v é g e	v i l á g v é g e
j ö v e d e l e m	j ö v e d e l e m
t e c h n i k a i	t e c h n i k a i
ö t v e n e d i k	ö t v e n e d i k
k i l á t á s o k	k i l á t á s o k
t e l e f o n o n	t e l e f o n o n
v á l o g a t á s	v á l o g a t á s
e l m o n d á s a	e l m o n d á s a
t e m e t ő b e n	t e m e t ő b e n
h á z t a r t á s	h á z t a r t á s
j ö v e d e l m e	j ö v e d e l m e
e l ő a d á s o k	e l ő a d á s o k
u t a s í t á s t	u t a s í t á s t
e l n e v e z é s	e l n e v e z é s
k ö z p o n t o k	k ö z p o n t o k
k o r r u p c i ó	k o r r u p c i ó
é r d e k l ő d ő	é r d e k l ő d ő
t á v o l o d i k	t á v o l o d i k
a r g e n t í n a	a r g e n t í n a
m e g h a l t a k	m e g h a l t a k
s z a k é r t ő i	s z a k é r t ő i
i d ő p o n t r a	i d ő p o n t r a
e l k ü l d e n i	e l k ü l d e n i
t a n í t á s o k	t a n í t á s o k
i z r a e l i t a	i z r a e l i t a
f e l ü l e t e t	f e l ü l e t e t
m u n k a t á r s	m u n k a t á r s
a l a p k a m a t	a l a p k a m a t
m a g u n k h o z	m a g u n k h o z
m é r s é k e l t	m é r s é k e l t
m e g m a r a d ó	m e g m a r a d ó
t á m a d á s o k	t á m a d á s o k
h i s z t é r i a	h i s z t é r i a
s e g í t e n e k	s e g í t e n e k
e r ő s í t é s e	e r ő s í t é s e
é l e t e m b e n	é l e t e m b e n
v á r o s á b a n	v á r o s á b a n
p o l g á r s á g	p o l g á r s á g
k o n z e r v á l	k o n z e r v á l
i s m e r t e t ő	i s m e r t e t ő
f o r g a l m a s	f o r g a l m a s
á t l a g o s a n	á t l a g o s a n
l á t h a t ó a n	l á t h a t ó a n
i n g a t l a n t	i n g a t l a n t
l e g u t o l s ó	l e g u t o l s ó
f e j l ő d é s e	f e j l ő d é s e
k a t o l i k u s	k a t o l i k u s
d e m o k r a t a	d e m o k r a t a
k ü l ö n b ö z ő	k ü l ö n b ö z ő
h a t á r o z a t	h a t á r o z a t
k a p a c i t á s	k a p a c i t á s
b a j n o k s á g	b a j n o k s á g
v a l a m i n e k	v a l a m i n e k
m e g j e l e n ő	m e g j e l e n ő
t ö r t é n t e k	t ö r t é n t e k
e l n ö k s é g e	e l n ö k s é g e
f e l t á r á s a	f e l t á r á s a
i s m e r e t e s	i s m e r e t e s
t a g j a k é n t	t a g j a k é n t
k ö z i s m e r t	k ö z i s m e r t
b e v e z e t n i	b e v e z e t n i
h i v a t a l o s	h i v a t a l o s
é r z é s e k e t	é r z é s e k e t
é r t é k e l é s	é r t é k e l é s
e l v t á r s a k	e l v t á r s a k
m o t o r o k o n	m o t o r o k o n
v o n a t k o z ó	v o n a t k o z ó
é v e z r e d e k	é v e z r e d e k
k í v á n a t o s	k í v á n a t o s
i d e n t i t á s	i d e n t i t á s
é v e z r e d e s	é v e z r e d e s
o l d a l a k o n	o l d a l a k o n
f e l e s é g e m	f e l e s é g e m
m e g é r t e n i	m e g é r t e n i
v á r a k o z á s	v á r a k o z á s
a j á n l h a t ó	a j á n l h a t ó
v á r o s h á z a	v á r o s h á z a
t i z e n é v e s	t i z e n é v e s
i s m e r e t e k	i s m e r e t e k
r e n d k í v ü l	r e n d k í v ü l
s z e r e p l ő i	s z e r e p l ő i
m a r i h u á n a	m a r i h u á n a
j á t é k o s o k	j á t é k o s o k
v é l e k e d i k	v é l e k e d i k
v á s á r l á s i	v á s á r l á s i
v á l t o z a t a	v á l t o z a t a
b u d a p e s t i	b u d a p e s t i
v í z i l a b d a	v i z i l a b d a
h á b o r ú b a n	h á b o r ú b a n
t e l e p ü l é s	t e l e p ü l é s
o k l e v e l e t	o k l e v e l e t
e l n ö k é n e k	e l n ö k é n e k
e m b e r i l e g	e m b e r i l e g
h a t á r i d ő k	h a t á r i d ő k
b ü n t e t é s t	b ü n t e t é s t
f á j d a l m a s	f á j d a l m a s
f o l y ó i r a t	f o l y ó i r a t
o p t i m i s t a	o p t i m i s t a
p r o b l é m á k	p r o b l é m á k
h á z i g a z d a	h á z i g a z d a
b e r n s t e i n	b e r n s t e i n
á l d o z a t u l	á l d o z a t u l
f ó r u m o k a t	f ó r u m o k a t
i s m e r e t e t	i s m e r e t e t
r ö v i d e s e n	r ö v i d e s e n
j á t é k o k a t	j á t é k o k a t
b i z t o n s á g	b i z t o n s á g
é l e t m ó d o t	é l e t m ó d o t
j e l e n l e g i	j e l e n l e g i
f a l e v e l e k	f a l e v e l e k
k o l l é g i u m	k o l l é g i u m
í g é r k e z i k	í g é r k e z i k
k e r e t é b e n	k e r e t é b e n
n ö v e k e d é s	n ö v e k e d é s
h a t á s o k a t	h a t á s o k a t
h á l ó z a t o n	h á l ó z a t o n
k ö v e t k e z ő	k ö v e t k e z ő
l e v e g ő b e n	l e v e g ő b e n
e l f o g a d n i	e l f o g a d n i
v é t e l é v e l	v é t e l é v e l
o k l e v e l e k	o k l e v e l e k
j e l e n l é v ő	j e l e n l é v ő
p r o g r a m r a	p r o g r a m r a
f e l v é t e l i	f e l v é t e l i
t a n u l á s r a	t a n u l á s r a
l i b e r á l i s	l i b e r á l i s
k o r l á t l a n	k o r l á t l a n
k ö z v e t l e n	k ö z v e t l e n
k e r ü l e t e k	k e r ü l e t e k
h a z á n k b a n	h a z á n k b a n
h o l l a n d i a	h o l l a n d i a
g o n d o l u n k	g o n d o l u n k
s o k o l d a l ú	s o k o l d a l ú
v á r h a t ó a n	v á r h a t ó a n
e m l é k e z é s	e m l é k e z é s
k o n c e r t e n	k o n c e r t e n
é v t i z e d e k	é v t i z e d e k
t e m p l o m o k	t e m p l o m o k
m i l l i o m o s	m i l l i o m o s
g a z d a s á g i	g a z d a s á g i
d o l g o z n a k	d o l g o z n a k
f o r d í t á s t	f o r d í t á s t
t a l á l k o z ó	t a l á l k o z ó
e l o l v a s n i	e l o l v a s n i
a j á n d é k o t	a j á n d é k o t
h á l ó z a t o k	h á l ó z a t o k
m ú z e u m b a n	m ú z e u m b a n
v i l á g o s a n	v i l á g o s a n
o p t i m á l i s	o p t i m á l i s
r o m a n t i k a	r o m a n t i k a
j a k o b i n u s	j a k o b i n u s
p é l d á t l a n	p é l d á t l a n
b ö r t ö n b ő l	b ö r t ö n b ő l
s z e x u á l i s	s z e x u á l i s
v a l a k i n e k	v a l a k i n e k
b e m u t a t n i	b e m u t a t n i
h a t á r i d ő t	h a t á r i d ő t
á l d o z a t o k	á l d o z a t o k
v a l ó j á b a n	v a l ó j á b a n
h ű t l e n s é g	h ű t l e n s é g
f e l k a v a r ó	f e l k a v a r ó
j ö v e d e l m i	j ö v e d e l m i
f a n a t i k u s	f a n a t i k u s
k ü l ö n b s é g	k ü l ö n b s é g
u r a l k o d ó k	u r a l k o d ó k
v i l á g h í r ű	v i l á g h í r ű
k e z e l h e t ő	k e z e l h e t ő
k i f i z e t n i	k i f i z e t n i
s z a v a i v a l	s z a v a i v a l
o l v a s h a t ó	o l v a s h a t ó
v a l ó s á g o s	v a l ó s á g o s
f o r d í t a n i	f o r d í t a n i
p r o g r a m o t	p r o g r a m o t
f e d é l z e t i	f e d é l z e t i
m i n d e n k o r	m i n d e n k o r
a l a k u l á s a	a l a k u l á s a
b e r u h á z á s	b e r u h á z á s
v é g e z e t ü l	v é g e z e t ü l
f e l b o n t á s	f e l b o n t á s
e l é g s é g e s	e l é g s é g e s
s ó g u n á t u s	s ó g u n á t u s
v e z e t é k e s	v e z e t é k e s
l e v e l e k e t	l e v e l e k e t
g o n d o l a t i	g o n d o l a t i
h ó f e h é r k e	h ó f e h é r k e
m é r f ö l d r e	m é r f ö l d r e
t a r t a l m a k	t a r t a l m a k
j a v a s o l t a	j a v a s o l t a
v a l a k i r ő l	v a l a k i r ő l
v e z e t é s é t	v e z e t é s é t
r ö g z í t e n i	r ö g z í t e n i
b e l v á r o s i	b e l v á r o s i
s p o r t o l ó k	s p o r t o l ó k
p o p u l i s t a	p o p u l i s t a
f e l v é t e l e	f e l v é t e l e
m a g u n k n a k	m a g u n k n a k
p r o j e k t e k	p r o j e k t e k
p r o g r a m o k	p r o g r a m o k
i n t e g r á l t	i n t e g r á l t
l á t o g a t á s	l á t o g a t á s
m i n d e n b e n	m i n d e n b e n
f o n t o s n a k	f o n t o s n a k
m o n e t á r i s	m o n e t á r i s
k é r d é s n e k	k é r d é s n e k
é r d e k é b e n	é r d e k é b e n
k e l e n f ö l d	k e l e n f ö l d
t i p i k u s a n	t i p i k u s a n
t á m o g a t á s	t á m o g a t á s
t á m o g a t n i	t á m o g a t n i
g o n d o l t a m	g o n d o l t a m
é r t é k e k e t	é r t é k e k e t
e h e t e t l e n	e h e t e t l e n
b e t ű m é r e t	b e t ű m é r e t
p é n z h i á n y	p é n z h i á n y
h i v a t a l o k	h i v a t a l o k
v á l t o z á s t	v á l t o z á s t
k ó r o k o z ó k	k ó r o k o z ó k
l é l e k t a n i	l é l e k t a n i
k o n c e r t e k	k o n c e r t e k
f e l v é t e l t	f e l v é t e l t
k u l t u r á l t	k u l t u r á l t
e l m o n d a n i	e l m o n d a n i
m o z g a l m a s	m o z g a l m a s
f o g l a l t a k	f o g l a l t a k
m o z g á s b a n	m o z g á s b a n
é r d e k e l n i	é r d e k e l n i
t a l á l h a t ó	t a l á l h a t ó
k i t e r j e d ő	k i t e r j e d ő
v a s á r n a p i	v a s á r n a p i
t e r v e z é s i	t e r v e z é s i
s t r u k t ú r a	s t r u k t ú r a
b á t o r s á g a	b á t o r s á g a
p r o g r a m b a	p r o g r a m b a
m i n d e n k i t	m i n d e n k i t
k ö z é r d e k ű	k ö z é r d e k ű
j a n u á r t ó l	j a n u á r t ó l
b e n n s z ü l ö t t	b e n n s z ü l ö t t
g y ó g y s z e r é s z	g y ó g y s z e r é s z
a l a p t e r ü l e t	a l a p t e r ü l e t
t a r t ó z k o d á s	t a r t ó z k o d á s
m e g a l a k u l á s	m e g a l a k u l á s
é p ü l e t e k b e n	é p ü l e t e k b e n
m i n ő s é g i l e g	m i n ő s é g i l e g
g a z d á l k o d á s	g a z d á l k o d á s
f e l t é t l e n ü l	f e l t é t l e n ü l
t a r t ó z k o d i k	t a r t ó z k o d i k
t e c h n o l ó g i a	t e c h n o l ó g i a
t u d a t l a n s á g	t u d a t l a n s á g
b i z t o n s á g á t	b i z t o n s á g á t
s p i r i t u á l i s	s p i r i t u á l i s
k é p v i s e l e t i	k é p v i s e l e t i
t u l a j d o n o s i	t u l a j d o n o s i
p a r a m é t e r e k	p a r a m é t e r e k
é r t é k e s í t é s	é r t é k e s í t é s
p r o b l é m á k a t	p r o b l é m á k a t
e l e k t r o n i k a	e l e k t r o n i k a
t e n g e r p a r t i	t e n g e r p a r t i
f e l t ü n t e t n i	f e l t ü n t e t n i
m á s o d p e r c i g	m á s o d p e r c i g
s z o v j e t u n i ó	s z o v j e t u n i ó
r a d i k á l i s a n	r a d i k á l i s a n
m e g f e l e l ő e n	m e g f e l e l ő e n
v e r h e t e t l e n	v e r h e t e t l e n
i g a z g a t ó s á g	i g a z g a t ó s á g
k ö v e t k e z ő e n	k ö v e t k e z ő e n
e p i l e p s z i á s	e p i l e p s z i á s
k i e g é s z í t é s	k i e g é s z í t é s
j o g s é r t é s e k	j o g s é r t é s e k
a n a l f a b é t á k	a n a l f a b é t á k
m e g o l d á s á r a	m e g o l d á s á r a
t e l e p ü l é s e n	t e l e p ü l é s e n
e l ő s e g í t é s e	e l ő s e g í t é s e
f o k o z a t o s a n	f o k o z a t o s a n
e l v é g e z h e t ő	e l v é g e z h e t ő
k o n z e r v a t í v	k o n z e r v a t í v
i n f o r m a t i k a	i n f o r m a t i k a
b i z t o s í t a n i	b i z t o s í t a n i
k ö z v e t l e n ü l	k ö z v e t l e n ü l
f e l a d a t o k a t	f e l a d a t o k a t
h ő m é r s é k l e t	h ő m é r s é k l e t
ó h a t a t l a n u l	ó h a t a t l a n u l
p r ó b á l k o z i k	p r ó b á l k o z i k
k o n c e n t r á l t	k o n c e n t r á l t
t e r ü l e t i l e g	t e r ü l e t i l e g
f o g l a l k o z á s	f o g l a l k o z á s
l e h e t ő s é g é t	l e h e t ő s é g é t
k é p t e l e n s é g	k é p t e l e n s é g
k ö z l e k e d é s i	k ö z l e k e d é s i
k i l o m é t e r e s	k i l o m é t e r e s
e l ő a d á s á b a n	e l ő a d á s á b a n
e m l é k e z t e t ő	e m l é k e z t e t ő
t u l a j d o n o s a	t u l a j d o n o s a
e l k ö v e t k e z ő	e l k ö v e t k e z ő
m e g r e n d e l é s	m e g r e n d e l é s
m i n d e n k i n e k	m i n d e n k i n e k
s z o c i á l i s a n	s z o c i á l i s a n
f i l m r e n d e z ő	f i l m r e n d e z ő
k u t a t ó m u n k a	k u t a t ó m u n k a
k i v é t e l é v e l	k i v é t e l é v e l
t e s t n e v e l é s	t e s t n e v e l é s
l e h e t ő s é g e t	l e h e t ő s é g e t
e l é g e d e t l e n	e l é g e d e t l e n
a j á n l a t k é r ő	a j á n l a t k é r ő
g o n d o s k o d n i	g o n d o s k o d n i
e s z k ö z e i v e l	e s z k ö z e i v e l
t u r i s z t i k a i	t u r i s z t i k a i
v á l t o z t a t n i	v á l t o z t a t n i
k ü z d e l e m b e n	k ü z d e l e m b e n
a j á n d é k o k a t	a j á n d é k o k a t
v á l t o z t a t á s	v á l t o z t a t á s
t e n g e r f e n é k	t e n g e r f e n é k
j ú n i u s á b a n	j ú n i u s á b a n
k é p v i s e l ő i	k é p v i s e l ő i
k é r d é s e i r e	k é r d é s e i r e
d e m o k r á c i a	d e m o k r á c i a
e v a n g é l i u m	e v a n g é l i u m
k i e m e l k e d ő	k i e m e l k e d ő
p r o b l é m á i t	p r o b l é m á i t
v e z e t ő i n e k	v e z e t ő i n e k
g a l é r i á b a n	g a l é r i á b a n
t e r ü l e t e i n	t e r ü l e t e i n
i n t e g r á c i ó	i n t e g r á c i ó
a u t o n ó m i á k	a u t o n ó m i á k
f ő i g a z g a t ó	f ő i g a z g a t ó
g e n e r á c i ó k	g e n e r á c i ó k
e l ő f i z e t ő i	e l ő f i z e t ő i
f i a t a l o k a t	f i a t a l o k a t
g e n e r á c i ó s	g e n e r á c i ó s
k u r a t ó r i u m	k u r a t ó r i u m
p i a c v e z e t ő	p i a c v e z e t ő
e x p e d í c i ó	e x p e d í c i ó
ö k o l ó g i a i	ö k o l ó g i a i
f ő i s k o l a i	f ő i s k o l a i
ö k o n ó m i a i	ö k o n ó m i a i
k a t e g ó r i á t	k a t e g ó r i á t
é p í t ő i p a r i	é p í t ő i p a r i
k o n z o r c i u m	k o n z o r c i u m
i d e i g l e n e s	i d e i g l e n e s
p o r t u g á l i a	p o r t u g á l i a
p r o g r a m j a i	p r o g r a m j a i
m á r c i u s b a n	m á r c i u s b a n
g i m n á z i u m i	g i m n á z i u m i
f i z i k a i l a g	f i z i k a i l a g
s z l o v á k i a i	s z l o v á k i a i
p o z í c i ó b a n	p o z í c i ó b a n
m o r a t ó r i u m	m o r a t ó r i u m
j ó i n d u l a t ú	j ó i n d u l a t ú
f o g l a l k o z i k	f o g l a l k o z i k
t á r s a d a l m a t	t á r s a d a l m a t
g o n d o s k o d i k	g o n d o s k o d i k
m e g j e l e n é s i	m e g j e l e n é s i
m i n d e n k i v e l	m i n d e n k i v e l
b i z t o n s á g o s	b i z t o n s á g o s
p o l i t i k u s o k	p o l i t i k u s o k
a s z t r o l ó g i a	a s z t r o l ó g i a
s e m l e g e s n e m	s e m l e g e s n e m
b e r u h á z á s o k	b e r u h á z á s o k
k ü l ö n b s é g e k	k ü l ö n b s é g e k
p r o g r a m o k a t	p r o g r a m o k a t
v o n a t k o z á s a	v o n a t k o z á s a
k ö z t á r s a s á g	k ö z t á r s a s á g
n e v e z e t e s e n	n e v e z e t e s e n
e s e t l e g e s e n	e s e t l e g e s e n
m e g j e l e n é s t	m e g j e l e n é s t
d i n a m i k u s a n	d i n a m i k u s a n
a l k a l m a s n a k	a l k a l m a s n a k
f o g a l m a i n k	f o g a l m a i n k
d e k l i n á c i ó	d e k l i n á c i ó
f o g l a l k o z n i	f o g l a l k o z n i
k i d o l g o z á s a	k i d o l g o z á s a
o r v o s o l h a t ó	o r v o s o l h a t ó
v e z e t ő j é n e k	v e z e t ő j é n e k
i s m e r e t e k e t	i s m e r e t e k e t
k é p v i s e l ő j e	k é p v i s e l ő j e
f e l e l ő s s é g e t	f e l e l ő s s é g e t
e l f o g a d h a t ó	e l f o g a d h a t ó
k i e g é s z í t ő k	k i e g é s z í t ő k
r e n d e l k e z é s	r e n d e l k e z é s
m e g f o g a l m a z	m e g f o g a l m a z
p r ó b á l k o z á s	p r ó b á l k o z á s
r e n d e l k e z ő k	r e n d e l k e z ő k
k é p v i s e l e t e	k é p v i s e l e t e
j ö v e n d ő b e l i	j ö v e n d ő b e l i
f e l e l ő s s é g r e	f e l e l ő s s é g r e
h a t é k o n y s á g a	h a t é k o n y s á g a
e l k ö t e l e z e t t	e l k ö t e l e z e t t
b e s z é l g e t é s t	b e s z é l g e t é s t
f e l h a s z n á l á s	f e l h a s z n á l á s
f o g v a t a r t o t t	f o g v a t a r t o t t
m e g b e s z é l é s t	m e g b e s z é l é s t
h i t e l k á r t y á t	h i t e l k á r t y á t
e g y e t e m i s t á k	e g y e t e m i s t á k
e n g e d é l y é v e l	e n g e d é l y é v e l
m a g y a r á z h a t ó	m a g y a r á z h a t ó
s z i g n i f i k á n s	s z i g n i f i k á n s
f é l t é k e n y s é g	f é l t é k e n y s é g
s z á m í t ó g é p e s	s z á m í t ó g é p e s
s z e m p o n t o k a t	s z e m p o n t o k a t
m a g y a r á z a t o t	m a g y a r á z a t o t
f e l e l ő s s é g é t	f e l e l ő s s é g é t
k e d v e z m é n y e k	k e d v e z m é n y e k
m u n k a s z ü n e t i	m u n k a s z ü n e t i
t a p a s z t a l t a m	t a p a s z t a l t a m
n y u g t a l a n s á g	n y u g t a l a n s á g
p s z i c h o l ó g i a	p s z i c h o l ó g i a
k i j e l e n t e t t e	k i j e l e n t e t t e
c s a t l a k o z á s i	c s a t l a k o z á s i
b i z o n y í t é k o k	b i z o n y í t é k o k
e l k ü l ö n í t e t t	e l k ü l ö n í t e t t
v e r s e n y k é p e s	v e r s e n y k é p e s
h o r v á t o r s z á g	h o r v á t o r s z á g
l a k o s s á g á n a k	l a k o s s á g á n a k
e r e d m é n y e s e n	e r e d m é n y e s e n
r e n d s z e r e k e t	r e n d s z e r e k e t
m u n k a c s o p o r t	m u n k a c s o p o r t
k ö s z ö n h e t ő e n	k ö s z ö n h e t ő e n
v a l ó s z í n ű l e g	v a l ó s z í n ű l e g
m o z g á s s é r ü l t	m o z g á s s é r ü l t
f a n t a s z t i k u s	f a n t a s z t i k u s
f e l t ü n t e t e t t	f e l t ü n t e t e t t
s z e r t a r t á s o k	s z e r t a r t á s o k
á t t e k i n t h e t ő	á t t e k i n t h e t ő
l e h e t e t l e n n é	l e h e t e t l e n n é
v i z s g á l a t á r a	v i z s g á l a t á r a
b e j e l e n t e t t e	b e j e l e n t e t t e
t ű r ő k é p e s s é g	t ű r ő k é p e s s é g
k i f e j e z e t t e n	k i f e j e z e t t e n
s t a t i s z t i k á k	s t a t i s z t i k á k
k ö l t s é g v e t é s	k ö l t s é g v e t é s
f e l k é s z ü l é s t	f e l k é s z ü l é s t
k o r m á n y p á r t i	k o r m á n y p á r t i
p r o b l é m á k k a l	p r o b l é m á k k a l
i l l e t é k t e l e n	i l l e t é k t e l e n
t e v é k e n y s é g e	t e v é k e n y s é g e
f e l h a s z n á l ó k	f e l h a s z n á l ó k
t i s z t e l e t é r e	t i s z t e l e t é r e
b e f o l y á s o l n i	b e f o l y á s o l n i
i d ő s z a k o k b a n	i d ő s z a k o k b a n
t i z e n e g y e d i k	t i z e n e g y e d i k
t a r t o m á n y b a n	t a r t o m á n y b a n
e r e d m é n y e k e t	e r e d m é n y e k e t
á l l a m t i t k á r a	á l l a m t i t k á r a
h o z z á j á r u l á s	h o z z á j á r u l á s
s z o l g á l t a t á s	s z o l g á l t a t á s
k i v á l a s z t a n i	k i v á l a s z t a n i
é b r e s z t ő ó r á k	é b r e s z t ő ó r á k
r e n d e l k e z i k	r e n d e l k e z i k
l e g i s m e r t e b b	l e g i s m e r t e b b
k ö r n y e z e t b e n	k ö r n y e z e t b e n
á l t a l á n o s a b b	á l t a l á n o s a b b
f o l y a m a t o s a n	f o l y a m a t o s a n
k ö z g a z d á s z o k	k ö z g a z d á s z o k
s z e r v e z e t ü n k	s z e r v e z e t ü n k
h i á n y o s s á g o k	h i á n y o s s á g o k
i n t é z m é n y b e n	i n t é z m é n y b e n
k o z m o p o l i t a	k o z m o p o l i t a
e v a n g é l i s t a	e v a n g é l i s t a
m e g v á l t o z i k	m e g v á l t o z i k
l e h e t ő s é g e k	l e h e t ő s é g e k
b e v e z e t é s é t	b e v e z e t é s é t
m e g j e l e n é s e	m e g j e l e n é s e
t a l á l k o z u n k	t a l á l k o z u n k
k í s é r e t é b e n	k í s é r e t é b e n
a l k o h o l i s t a	a l k o h o l i s t a
j ö v e d e l m e z ő	j ö v e d e l m e z ő
j a v a s l a t á r a	j a v a s l a t á r a
v i l á g h á b o r ú	v i l á g h á b o r ú
m e g j e l e n é s ű	m e g j e l e n é s ű
p o l i t i k á b a n	p o l i t i k á b a n
d e c e m b e r b e n	d e c e m b e r b e n
e l k é p z e l t e m	e l k é p z e l t e m
t á j é k o z t a t ó	t á j é k o z t a t ó
f u t ó t ű z k é n t	f u t ó t ű z k é n t
k ö z ö n s é g n e k	k ö z ö n s é g n e k
s z o l g á l a t á b a	s z o l g á l a t á b a
k e d v e z ő t l e n	k e d v e z ő t l e n
b e j e l e n t e n i	b e j e l e n t e n i
e m l é k e z e t e s	e m l é k e z e t e s
t u l a j d o n s á g	t u l a j d o n s á g
s o r o z a t o k a t	s o r o z a t o k a t
k é r d é s e k r ő l	k é r d é s e k r ő l
k ü l ö n b ö z n e k	k ü l ö n b ö z n e k
m e g a l a p o z o t t	m e g a l a p o z o t t
h á l ó z a t o k o n	h á l ó z a t o k o n
b e m u t a t á s r a	b e m u t a t á s r a
i n t é z k e d é s t	i n t é z k e d é s t
k e z e l é s é b e n	k e z e l é s é b e n
k a p c s o l a t a i	k a p c s o l a t a i
t e l e p ü l é s e k	t e l e p ü l é s e k
l o g i s z t i k a i	l o g i s z t i k a i
n ö v e k e d é s é t	n ö v e k e d é s é t
k i l e n c v e n e s	k i l e n c v e n e s
b e j e l e n t é s e	b e j e l e n t é s e
h a t á r o z a t o t	h a t á r o z a t o t
m ó d o s í t á s á t	m ó d o s í t á s á t
e l m é l e t i l e g	e l m é l e t i l e g
s z a k e m b e r e i	s z a k e m b e r e i
s z e x u a l i t á s	s z e x u a l i t á s
á p r i l i s á b a n	á p r i l i s á b a n
d e b r e c e n b e n	d e b r e c e n b e n
k i e g é s z í t v e	k i e g é s z í t v e
é r t e l m e t l e n	é r t e l m e t l e n
e l l e n ő r z é s e k	e l l e n ő r z é s e k
k a p c s o l ó d ó a n	k a p c s o l ó d ó a n
m é l t á n y t a l a n	m é l t á n y t a l a n
f ü g g ő l e g e s e n	f ü g g ő l e g e s e n
l e g f o n t o s a b b	l e g f o n t o s a b b
k i v á l a s z t á s a	k i v á l a s z t á s a
f e j l ő d é s n e k	f e j l ő d é s n e k
n o v e m b e r b e n	n o v e m b e r b e n
h e r c e g n ő n e k	h e r c e g n ő n e k
s z o c i a l i s t a	s z o c i a l i s t a
i d ő t a r t a m r a	i d ő t a r t a m r a
e l f e l e j t e n i	e l f e l e j t e n i
é v t i z e d e k i g	é v t i z e d e k i g
a u s z t r i á b a n	a u s z t r i á b a n
ü z e m e l t e t é s	ü z e m e l t e t é s
b e t e k i n t é s t	b e t e k i n t é s t
v á s á r o l h a t ó	v á s á r o l h a t ó
t á m o g a t á s o k	t á m o g a t á s o k
j e l e n t k e z n i	j e l e n t k e z n i
a l k a l m a z á s a	a l k a l m a z á s a
e v a n g é l i k u s	e v a n g é l i k u s
m e g h a t á r o z ó	m e g h a t á r o z ó
m e g l e p e t é s t	m e g l e p e t é s t
m i n i m á l i s a n	m i n i m á l i s a n
n é p s z a v a z á s	n é p s z a v a z á s
s e g í t s é g é r t	s e g í t s é g é r t
h a t é k o n y s á g	h a t é k o n y s á g
á l l a t o r v o s i	á l l a t o r v o s i
v á l a s z o l t a m	v á l a s z o l t a m
m i n d e g y i k ü k	m i n d e g y i k ü k
é r t é k t ő z s d e	é r t é k t ő z s d e
h u s z o n h á r o m	h u s z o n h á r o m
f e j l e s z t é s i	f e j l e s z t é s i
l e g h i d e g e b b	l e g h i d e g e b b
